date,category,title,content,reaction
2023-08-14 13:32:00,생활,"""싱그러운 풋귤로 무더위 이겨내세요"" 15일 제주 풋귤축제","  2023 제주감귤박람회 풋귤축제가 15일 제주시민복지타운 광장에서 열린다. 제주국제감귤박람회 조직위원회가 감귤박람회에 앞서 사전행사로 여는 이번 축제는 풋귤의 기능적 가치와 다양한 활용법을 홍보해 풋귤 소비를 촉진하고자 마련됐다. 축제에서는 풋귤청 담기 체험, 퓻굴놀이터, 풋귤마켓, 풋귤 제품 전시관 등이 운영된다. 퓻굴청 담기 체험은 오후 1∼4시 매시 정각마다 운영된다. 체험료 5천원은 행사장에서 납부하면 되며, 개인용 텀블러를 지참하면 무료로 풋귤에이드를 시음할 수 있다. 풋귤놀이터에는 가족이 함께 즐길 수 있는 풋귤 물풍선 게임, 풋귤 워터쇼, 풋내기 예술가 힐링아트 등이 열린다. 풋귤마켓에서는 친환경감귤연합회의 풋귤 직거래 장터, 농촌융복합사업 제품 판매·체험장, 제로웨이스트를 지향하는 올바른 농부장 등이 함께한다. 친환경 풋귤, 제주 농산물·가공품, 수공예품, 제로웨이스트 상품 등이 준비되며 상품 구매와 시식, 디저트 만들기 등 다양한 체험을 할 수 있다. 고병기 조직위원장은 14일 ""한 여름의 무더위를 풋귤의 싱그러움으로 날려버릴 수 있도록 가족과 함께할 수 있는 다양한 프로그램을 마련했다""며 도민과 관광객 등의 많은 관심과 참여를 부탁했다. 풋귤은 감귤의 기능성 성분을 이용할 목적으로 이용되는 덜 익은 노지감귤을 말한다. 완숙과에 비해 피로 해소에 좋은 구연산 함량이 3배나 높고, 항산화·항염 성분도 더 높은 것으로 알려져 있다. 제주도는 해마다 풋귤의 출하 시기를 조정해 정해진 시기(8월 1일∼9월 15일)에만 출하를 허용하고 출하 농가도 제한한다. 올해로 11회째를 맞는 제주감귤박람회는 '감귤로 빛나는 제주, 다함께 미래로'를 주제로 오는 11월 30일부터 12월 4일까지 서귀포농업기술센터와 감귤박물관 일대에서 열린다. ","{'쏠쏠정보': '0', '흥미진진': '0', '공감백배': '0', '분석탁월': '0', '후속강추': '0'}"
2023-08-14 13:40:00,경제,에이비엘바이오 2분기 영업손실 103억…적자 확대,"  에이비엘바이오는 올해 2분기 연결기준 영업손실이 103억원으로 지난해 같은 기간 영업손실 21억원에 비해 적자 폭이 늘어났다고 14일 밝혔다. 2분기 매출은 86억원으로 작년 동기 161억원 대비 절반 가까이 감소했다. 당기순손실은 104억원으로 적자로 돌아섰다. 에이비엘바이오는 다만, 올해 1분기 영업이익이 231억으로 상반기 누적 영업이익은 128억원을 기록했다고 덧붙였다. 에이비엘바이오는 ""현재 7개 임상 파이프라인에 대한 15개 글로벌 임상을 진행하고 있다""며 ""다양한 파이프라인을 확보한 만큼 임상 진척, 기술 이전, 마일스톤 수취 등 기업가치와 경영 지속성을 높일 많은 기회가 있을 것으로 기대한다""고 밝혔다. ","{'쏠쏠정보': 1, '흥미진진': '0', '공감백배': '0', '분석탁월': '0', '후속강추': '0'}"
2023-08-14 13:41:00,경제,"태광그룹, 이호진 前회장 복권에 ""경제 활성화 이바지로 보답""","  태광그룹은 14일 이호진 전 회장의 특별사면과 관련해 ""지속적인 투자와 청년 일자리 창출로 국가 발전에 힘을 보태고 경제 활성화 이바지로 국민 여러분과 정부의 기대에 보답하겠다""고 밝혔다. 아울러 ""'함께 잘사는 국민의 나라'를 위해 사회와 같이 나누고 더불어 성장할 수 있도록 더욱 노력하겠다""고 덧붙였다. 이 전 회장은 이날 정부가 발표한 광복절 특사 명단에 복권 대상자로 이름을 올렸다. 횡령·배임과 법인세 포탈 등 혐의로 재판에 넘겨진 이 전 회장은 '황제 보석' 논란 속에 2018년 구속됐고, 징역 3년을 확정받아 2021년 10월 만기 출소했다. 앞서 그는 검찰에 기소된 이후인 2012년 태광산업과 대한화섬 대표이사를 포함해 그룹 내 모든 법적 지위와 회장직에서 물러났다. ","{'쏠쏠정보': '0', '흥미진진': '0', '공감백배': 1, '분석탁월': '0', '후속강추': '0'}"
2023-08-14 13:42:00,사회,"충북경찰청, 광복절 이륜차 폭주 행위 집중단속"," 천경환 기자= 충북경찰청은 광복절을 맞아 이륜차 폭주 행위를 집중적으로 단속한다고 14일 밝혔다. 충북 경찰은 암행순찰팀, 기동대, 교통경찰 등 50여명의 인력과 순찰차 등 19대 장비를 도내 주요 도심에 배치해 폭주족 집결을 차단하고 법규 위반 행위를 단속할 계획이다. 공동위험 행위나 난폭 운전 등 폭주 행위 발생 시 현장 채증 후 사후 수사를 통해 엄중 처벌할 방침이다. 경찰 관계자는 ""최근 청소년층 등을 중심으로 집단적인 이륜차 폭주 행위가 증가하고 있다""며 ""국경일 기념을 빙자한 폭주 행위는 시민들에게 교통 불편과 사고 위험을 초래하는 만큼 무관용 원칙을 적용할 것""이라고 말했다. 앞서 충북경찰청은 그동안 어린이날 등에 여섯 차례의 이륜차 폭주 행위를 집중단속해 57건의 번호판 미부착 등 자동차 관리법 위반과 신호위반 등 교통법규 위반행위를 적발했다. ","{'쏠쏠정보': '0', '흥미진진': '0', '공감백배': '0', '분석탁월': '0', '후속강추': '0'}"
2023-08-14 13:42:00,경제,"보령시, 추석 낀 내달 섬 주민 택배 추가 배송비 지원","  충남 보령시는 올해 추석 민생 안정을 위해 다음 달 한 달간 섬 주민들의 택배 추가 배송비를 지원한다고 14일 밝혔다. 섬 주민들은 택배를 이용할 때마다 기본요금 외에 3천∼1만원의 별도 추가 배송비를 내야 해 비용 부담이 크다. 지원 대상은 섬 지역에 주민등록 주소를 둔 19세 이상 주민이다. 보령 해저터널로 육지와 연결된 원산도 지역은 제외된다. 지원 금액은 택배 물품 1건당 4천원, 1인 월 최대 4건 1만6천원 한도다. 다음 달부터 주소지 행정복지센터나 출장소에 방문해서 신청하면 된다. 보령에는 충남에서 가장 많은 105개 섬이 있다. 이 중 15개 유인도에 2천800여명의 주민이 생활하고 있다. ","{'쏠쏠정보': '0', '흥미진진': '0', '공감백배': '0', '분석탁월': '0', '후속강추': '0'}"
2023-08-14 13:45:00,세계,(LEAD) Swimming star Hwang Sun-woo under police investigation for hit-and-run charges,"(LEAD) swimmer-allegations (LEAD) Swimming star Hwang Sun-woo under police investigation for hit-and-run charges (ATTN: UPDATES with latest info in paras 7-8, 11) JINCHEON, South Korea, Aug. 14 (Yonhap) -- South Korean swimming star Hwang Sun-woo is under police investigation over a suspected hit-and-run accident, local authorities said Monday. Police in Jincheon, North Chungcheong Province, said Monday that Hwang is being accused of leaving the scene after striking an 80-something man with his vehicle's side-view mirror Sunday evening. Police added Hwang had been driving back to the National Training Center in the central county, where he'd been training for the upcoming Asian Games. According to police, the impact of the collision shattered the side mirror of Hwang's car, but the elderly man avoided serious injuries. Hwang returned to the scene about 30 minutes later and told police officers there that he might have caused the accident. An officer with the Jincheon police force said they are trying to find out further details about the case. An official with the Korea Swimming Federation (KSF) said Hwang had already settled the case with the elderly man and covered his medical expenses. ""Hwang told us he tried to avoid hitting a jaywalker and didn't realize at first he'd caused any accident,"" the official said. ""He said he returned to the scene after discovering that his side-view mirror had been damaged."" Hwang, 20, won the bronze medal in the men's 200-meter freestyle at the world swimming championships last month in Japan. He'd won the silver medal in the same event at last year's world championships, and is the first South Korean to win a medal at consecutive worlds. Hwang is also considered one of South Korea's top medal hopefuls in the pool at the Asian Games in Hangzhou, China. Athletes convicted of a crime can be prevented from representing the country internationally, depending on the severity of their punishment. The KSF official said he didn't expect Hwang to be ruled out of the Asian Games, which will open on Sept. 23.  (END)","{'쏠쏠정보': '0', '흥미진진': '0', '공감백배': '0', '분석탁월': '0', '후속강추': '0'}"
2023-08-14 13:46:00,생활,"영상콘텐츠 세액공제 확대…""법인세 부담 경감에 재투자 기대""","문체부-콘진원, 세액공제 확대 효과 분석 보고서 발간   내년부터 영상콘텐츠 제작비 세액공제를 확대하면 제작사의 법인세 부담이 경감돼 콘텐츠 투자를 위한 선순환 기반이 조성될 것이란 연구 결과가 나왔다. 문화체육관광부와 한국콘텐츠진흥원은 지난달 세법 개정안에 따른 영상콘텐츠 제작비용 세액공제 확대의 예상 효과를 분석한 보고서를 14일 발표했다. 영상콘텐츠 제작비 세액공제는 콘텐츠를 만드는 데 지출한 금액의 일정 비율을 납부할 세액(법인세)에서 제외해주는 제도다. 이번 세법 개정안은 영상 콘텐츠 제작비의 기본 세액공제율을 2∼5%포인트(p) 상향해 대기업과 중견기업, 중소기업의 기본 공제율을 각각 5%, 10%, 15%로 확대했다. 국내 산업에 파급효과가 큰 영상콘텐츠 등을 대상으로 추가 공제를 적용하는 내용도 담아 대기업은 15%, 중견기업은 20%, 중소기업은 30%까지 세액공제를 적용받게 된다. 보고서는 이 제도가 시행된다면 제작 현장에서 법인세 부담이 경감되는 효과가 있을 것으로 내다봤다. 또한 콘텐츠를 통한 매출이 높을수록 제작비 세액공제 확대에 따른 체감도가 커질 것이며, 세액 공제된 비용이 제작 시장에 재투자돼 선순환될 것으로 기대했다. 보고서는 방송영상독립제작사를 비롯해 영상콘텐츠 산업 주요 협·단체, 학계 전문가 등의 목소리도 담았다. 제작 현장 종사자와 전문가들은 ""제작비 세액공제율 확대는 위축된 콘텐츠 제작 현장에 새로운 투자를 유도할 것""이라며 ""K-콘텐츠의 세계적인 인지도를 높이고, 국내 콘텐츠 산업의 전반적인 경쟁력 강화에 도움이 될 수 있다""고 봤다. 학계 전문가도 ""초기 기획부터 프로덕션 단계까지 포괄적으로 세액공제를 받을 수 있어 창업 중소기업이나 벤처기업, 연구개발(R&D) 등에 대한 세제 지원을 받기 어려운 영상콘텐츠 제작사들에는 매우 중요한 지원정책""이라고 평가했다. 보고서는 제작비 세액공제에 대한 현장 체감도를 높이기 위해 일몰 기한(세제 혜택을 받을 수 있는 기한)을 폐지하고 상시제도로 전환하는 등 추가적인 개선 사항도 담았다. 김도형 문체부 미디어정책국장은 ""이번 세법 개정안으로 우리 영상콘텐츠가 세계적 수준의 경쟁력을 유지할 수 있는 계기를 마련했다""며 ""보고서를 통해 제도 개편 의의와 산업에 미치는 효과가 알려지도록 하겠다""고 말했다. 보고서는 한국콘텐츠진흥원 누리집(www.kocca.kr, 콘텐츠 지식>정기 간행물>KOCCA 포커스)에서 내려받을 수 있다. ","{'쏠쏠정보': 3, '흥미진진': '0', '공감백배': '0', '분석탁월': '0', '후속강추': '0'}"
2023-08-14 13:47:00,사회,'2023 소설 토지의 날' 기념행사 15일 박경리 문학공원서 개최,"첫 장면과 마지막 장면, 소설을 탈고한 날로 특별한 의미 있어   박경리 작가의 대하소설 '토지'의 완간 일을 기념하는 행사가 오는 15일 열린다. 원주시는 '2023 소설 토지의 날' 기념행사를 박경리 문학공원에서 개최한다고 14일 밝혔다. 8월 15일은 소설 토지의 첫 장면과 마지막 장면, 박경리 선생의 옛집에서 토지를 탈고한 날로 특별한 의미가 있는 날이다. 이 행사에서는 소설 토지 필사, 한지 무드 등 만들기, 풍선아트 등 가족이 함께 체험할 수 있는 체험행사가 열린다. 또 '박경리 작가를 만나다 : 음악과 문학으로 만나는 인연' 등의 실내외 공연 프로그램도 진행한다. 남기주 문화예술과장은 ""소설 토지의 완간 일을 기념해 원주를 대표하는 박경리 작가를 알아가는 기회가 될 수 있도록 다채로운 행사를 마련했다""고 말했다. ","{'쏠쏠정보': '0', '흥미진진': '0', '공감백배': '0', '분석탁월': '0', '후속강추': '0'}"
2023-08-14 13:47:00,정치,남영진 KBS 이사장 해임제청안 방통위 통과(종합),"정미정 EBS 이사는 해임…권태선 방문진 이사장 해임 청문도 진행   방송통신위원회는 14일 전체회의를 열어 남영진 KBS 이사장에 대한 해임 제청안과 정미정 EBS 이사에 대한 해임안을 의결했다. 이날 회의에는 정부·여당 추천인 김효재 위원장 직무대행과 이상인 위원, 야당 추천인 김현 위원이 참석했다. 방통위는 먼저 남 이사장 측이 낸 김 직무대행에 대한 기피 신청안에 대해 표결했는데, 김 직무대행을 제외하고 이 위원과 김 위원이 각각 찬성표와 반대표를 던져 1대 1로 부결됐다. 방통위는 해당 안건이 기각된 것으로 처리했다. 이어 김 위원이 퇴장한 가운데 남 이사장에 대한 해임 제청안과 정 이사에 대한 해임안은 김 직무대행과 이 위원이 찬성해 통과됐다. 김 직무대행과 이 위원은 남 이사장이 KBS의 방만 경영을 방치했고, 법인카드 부정 사용 의혹도 있다며 해임 제청을 주장했다. 정 이사는 2020년 TV조선 재승인 심사 점수 변경 문제에 연루된 점이 해임 근거로 제시됐다. 반면 김 위원은 해임 사유가 부적절하고 절차도 미비했다고 주장했다. 김 위원은 회의에서 퇴장 후 기자회견을 열어 ""방통위법에 따라 위원회 회의는 재적위원 과반의 찬성으로 의결해야 하는데 의결정족수 2인에 미달됐는데도 회의를 진행하고 있다""고 비판했다. KBS 이사회의 경우 총원이 11명으로, 남 이사장의 해임제청안 통과 후 대통령이 재가하고 빈자리를 여권 인사가 채우게 되면 여야 6대 5 구도가 된다. 남 이사장은 해임제청안 의결 후 입장문을 내고 ""김 직무대행과 이 위원을 대상으로 직권남용 등 혐의로 형사고발 등 조치를 취할 것""이라고 밝혔다. 이날 방통위에서는 MBC 대주주인 방송문화진흥회 권태선 이사장에 대한 해임 청문도 진행됐다. 방통위는 권 이사장이 MBC 경영 관리·감독을 게을리하고, 주식 차명 소유 의혹이 불거진 안형준 MBC 사장을 선임한 점을 문제 삼고 있다. 방통위는 권 이사장에 대한 해임안도 조만간 상정해 의결할 전망이다. 이날 남 이사장 해임제청안·정 이사 해임안 의결과 권 이사장 해임 청문을 앞두고 공영방송 3사 야권 이사들은 정부과천청사 앞에서 항의하는 공동 기자회견을 열었다. 남 이사장과 권 이사장, 유시춘 EBS 이사장을 비롯한 야권 이사들은 ""윤석열 정부는 야만적인 공영방송 이사진 해임을 즉각 멈추고 공영방송 장악 기도를 포기해야 한다""며 ""이동관 방통위원장 후보자 지명을 철회하고 위법적 방송장악을 주도하고 있는 김효재 방통위원장 직무대행을 해임하라""고 주장했다. 권 이사장은 청문 출석 전 ""방통위는 해임 결정 과정도 알리지 않고 자료 열람과 청문 공개 요청도 거부했다. '네 죄를 네가 알렸다' 식의 '원님 재판'""이라며 ""방문진은 관리·감독을 해태한 적이 없고, 이사회 논의 결과를 이사장 해임 사유로 삼을 수는 없다. 해임 시 법적 대응 하겠다""고 밝혔다. ","{'쏠쏠정보': 4, '흥미진진': 2, '공감백배': 226, '분석탁월': 0, '후속강추': 9}"
2023-08-14 13:48:00,사회,"[게시판] 흥국화재, 충북에 호우피해 복구 성금 2억원 전달"," 태광그룹 금융계열사인 흥국화재는 충청북도에 호우피해 복구지원을 위한 성금 2억원을 전달했다고 14일 밝혔다. 이번 성금은 재해구호협회와 협의를 통해 충북지역 이재민을 위한 구호품 지원과 피해복구 등에 사용될 예정이다. 임규준 흥국화재 사장은 ""폭우로 피해가 큰 충북 지역 주민들이 힘을 내길 바란다""고 말했다. ","{'쏠쏠정보': '0', '흥미진진': '0', '공감백배': '0', '분석탁월': '0', '후속강추': '0'}"
2023-08-14 13:48:00,세계,世界スカウト大会「無難に終わった」　企業や自治体の支援に謝意＝尹大統領,【ソウル聯合ニュース】韓国の尹錫悦（ユン・ソクヨル）大統領は１４日の首席秘書官会議で、韓国で開催されたボーイスカウト・ガールスカウトの祭典「世界スカウトジャンボリー」が「無難に終わった」と評価し、運営の支援に尽力した人々に感謝の意を示した。大統領室の李度運（イ・ドウン）報道官が伝えた。 尹大統領は「経済の対外依存度が世界で最も高い韓国は国家ブランドイメージが何より重要だ」と強調したうえで、「ジャンボリーを無難に終えることで国家ブランドイメージを守る役割を果たした宗教界や企業、大学、自治体に感謝する」と述べた。 約１５０カ国から４万人余りが参加した世界スカウトジャンボリーは今月１日に南西部・全羅北道のセマングムで始まった。キャンプ地の不十分な猛暑対策や設備の不備などが指摘され、政府が設備や物資、人員を投じて状況の改善に当たった。だが、台風６号の朝鮮半島接近によりキャンプ地からの早期撤収が決まり、参加者は全国各地に拠点を移した。 自治体は参加者のためのさまざまな体験プログラムを用意し、企業も研修施設を宿泊先として提供するなどサポートに努めた。ジャンボリーは１１日にソウルワールドカップ競技場で閉営式が行われた。 ,"{'쏠쏠정보': '0', '흥미진진': '0', '공감백배': '0', '분석탁월': '0', '후속강추': '0'}"
2023-08-14 13:58:00,경제,"LG전자, 태풍 피해 지역서 침수 가전 세척·수리 지원", LG전자는 태풍 '카눈'으로 피해가 발생한 지역에서 수해 복구 활동에 나섰다고 14일 밝혔다. 사진은 지난 11일 LG전자 서비스 매니저들이 대구광역시 군위군 효령면에서 수해 피해를 본 가구를 찾아 복구 활동을 펼치는 모습.   ,"{'쏠쏠정보': '0', '흥미진진': '0', '공감백배': '0', '분석탁월': '0', '후속강추': '0'}"
2023-08-14 13:58:00,세계,BTS' 'Permission to Dance' MV tops 600 mln YouTube views,"BTS-YouTube views BTS' 'Permission to Dance' MV tops 600 mln YouTube views By Shim Sun-ah SEOUL, Aug. 14 (Yonhap) -- The music video for K-pop giant BTS' 2021 hit song ""Permission to Dance"" has surpassed 600 million views on YouTube. The video hit the milestone at 4:21 a.m. Monday, bringing to 12 the number of the band's music videos seen more than 600 million times, according to BigHit Music. Including them, 39 music videos from the group have garnered more than 100 million views. ""Permission to Dance"" is an all-English song from ""Butter,"" the group's single released on July 9, 2021. The dance-pop song delivers a message for everyone who has hit the wall of reality and had a tiring day that they can dance as much as they like without permission. The tune shot to the top of the U.S. Billboard's Hot 100 main songs chart immediately after its release.  (END)","{'쏠쏠정보': 2, '흥미진진': '0', '공감백배': '0', '분석탁월': '0', '후속강추': '0'}"
2023-08-14 13:58:00,사회,"""대림동서 칼춤 춘다""…서울 살인예고 5번째 구속","112에 흉기난동 전화 예고도…""관심받고 싶어서""  장보인  서울경찰청 사이버범죄수사대는 서울 영등포구 대림동에서 칼부림을 하겠다고 협박한 혐의로 30대 남성 A씨를 구속해 수사 중이라고 14일 밝혔다. 경찰에 따르면 A씨는 지난달 23일 온라인 커뮤니티 일간베스트 저장소(일베)에 ""대림동에서 칼춤을 추겠다"", ""지금 출발한다"" 등 흉기난동 예고 글을 쓴 혐의(협박·위계공무집행방해)를 받는다. A씨는 대림동을 목적지로 설정한 내비게이션 화면 캡처와 흉기 사진을 함께 올렸다. 경찰은 인터넷 주소(IP)를 추적해 지난 10일 인천 거주지에서 A씨를 검거하고 12일 구속했다. 경찰은 이날까지 서울 시내에서 살인 등 흉기 범죄를 저지르겠다는 예고 글을 올린 29명을 검거하고 이 중 5명을 구속했다. 서울 동대문경찰서는 112에 전화를 걸어 청량리역에서 사람들을 흉기로 찌르겠다고 예고한 30대 남성 B씨를 지난 10일 위계공무집행방해 혐의로 구속하기도 했다. B씨는 지난 8일 오후 9시10분께 경찰에 전화해 ""청량리역이다. 칼로 다 찔러 죽이겠다""며 허위로 신고한 혐의를 받는다. 경찰은 청량리역 인근 경동시장에서 B씨를 검거했다. B씨는 당시 흉기를 갖고 있지 않았다. 그는 경찰에서 ""외로워서 관심받고 싶었다"", ""경찰관이 얼마나 빨리 출동하는지 실험해봤다""고 말했다. ","{'쏠쏠정보': 1, '흥미진진': 1, '공감백배': '0', '분석탁월': '0', '후속강추': '0'}"
2023-08-14 13:59:00,사회,교육활동 보호를 위한 3대 제안 제도화 촉구,"  '교육활동 보호를 위한 3대 제안 즉각 제도화 촉구' 서명을 받아온 교사노동조합연맹 조합원들이 14일 오후 서명지를 국회에 전달하기에 앞서 국회 정문에서 기자회견을 하고 있다. 6만5천5백여 명의 교사가 서명한 3대 요구사항은 아동학대 신고로부터 정상적인 교육활동 보호받을 수 있는 즉각적인 입법, 수업방해 학생 분리 학교장 보호제도 도입, 학교민원관리시스템 구축 등이다.  ","{'쏠쏠정보': '0', '흥미진진': '0', '공감백배': '0', '분석탁월': '0', '후속강추': '0'}"
2023-08-14 13:59:00,사회,교육활동 보호를 위한 3대 제안,"  '교육활동 보호를 위한 3대 제안 즉각 제도화 촉구' 서명을 받아온 교사노동조합연맹 조합원들이 14일 오후 서명지를 국회에 전달하기에 앞서 국회 정문에서 기자회견을 하고 있다. 6만5천5백여 명의 교사가 서명한 3대 요구사항은 아동학대 신고로부터 정상적인 교육활동 보호받을 수 있는 즉각적인 입법, 수업방해 학생 분리 학교장 보호제도 도입, 학교민원관리시스템 구축 등이다.  ","{'쏠쏠정보': '0', '흥미진진': '0', '공감백배': '0', '분석탁월': '0', '후속강추': '0'}"
