date,category,title,content,reaction
2023-08-13 10:22:00,정치,"""미국·일본, 북중러 극초음속 무기 요격미사일 공동개발 방침""","한미일 정상회의 때 양자회담서 합의 전망   일본이 북한·중국·러시아의 극초음속 무기에 대응하기 위한 요격용 미사일을 미국과 공동 개발할 방침을 굳혔다고 요미우리신문이 13일 보도했다. 보도에 따르면 조 바이든 미국 대통령과 기시다 후미오 일본 총리는 오는 18일(현지시간) 미국 워싱턴DC 인근 캠프데이비드에서 열리는 한미일 정상회의를 계기로 양국 정상회담을 별도로 개최할 계획이다. 특히 양국은 이번 회담의 합의 내용 중 하나로 극초음속 무기 요격 미사일 공동개발을 발표하는 방안을 조율 중이다. 최종 합의가 이뤄지면 2017년에 개발된 'SM-3 블록 2A'에 이어 양국의 요격 미사일 공동개발 사례로 두 번째가 된다. 양국 정부는 10년 이내에 새 요격 미사일을 공동 개발하는 것을 목표로 할 것으로 알려졌다. 극초음속 무기는 음속의 5배인 마하 5 이상의 속도를 내며 저공에서 변칙 궤도로 비행하기 때문에 기존 레이더로는 포착하기 어려워 요격이 곤란한 것으로 여겨진다. 그러나 중국은 이미 2021년 7월에 극초음속 무기의 발사실험에 성공했고 러시아는 우크라이나전에서 사용도 한 것으로 알려졌다. 또 북한도 2021년 9월 이후 발사 실험을 반복하면서 작년 1월 실험에서는 최고 속도가 마하 약 10에 달했다는 분석도 나온 바 있다. 이와 관련해 일본 방위성은 육상자위대의 중거리지대공미사일(SAM-4) 성능 향상을 도모해왔지만, 착탄 직전 단계가 아니면 요격이 어려워 한층 더 고도화된 요격 수단 확보가 필요한 상황이라고 요미우리는 전했다. 일본 정부는 또 극초음속 무기 요격에 불가결한 미사일 조기 탐지를 위해 미국이 구축을 추진 중인 소형 위성망과의 연계도 검토하고 있다. 일본은 작년 말 국가안전보장전략 등 3대 안보 문서 개정을 통해 '반격 능력'(적기지 공격능력) 보유를 선언하고 이를 담보할 장거리 미사일의 정비도 추진하고 있다. ","{'쏠쏠정보': 2, '흥미진진': '0', '공감백배': 18, '분석탁월': '0', '후속강추': 1}"
2023-08-13 10:23:00,사회,"인천공항공사, 출국 잼버리 대원 환송", 지난 12일 인천공항 제1여객터미널 출국장에서 이학재 인천국제공항공사 사장이 출국하는 잼버리 대원들에게 인천공항 기념품 및 여행용품 등을 기념품으로 전달하고 있다.   ,"{'쏠쏠정보': '0', '흥미진진': '0', '공감백배': 2, '분석탁월': '0', '후속강추': '0'}"
2023-08-13 10:24:00,사회,"인천공항공사, 출국 잼버리 대원 환송", 지난 12일 인천공항 제1여객터미널 출국장에서 이학재 인천국제공항공사 사장이 출국하는 잼버리 대원들에게 인천공항 기념품 및 여행용품 등을 전달 후 기념 촬영을 해주고 있다.   ,"{'쏠쏠정보': '0', '흥미진진': '0', '공감백배': 2, '분석탁월': '0', '후속강추': '0'}"
2023-08-13 10:24:00,사회,잼버리 대원들과 기념 촬영하는 이학재 사장, 지난 12일 인천공항 제1여객터미널 출국장에서 이학재 인천국제공항공사 사장이 출국하는 잼버리 대원들에게 인천공항 기념품 및 여행용품 등을 전달 후 잼버리 대원들과 기념 촬영하고 있다.   ,"{'쏠쏠정보': '0', '흥미진진': '0', '공감백배': '0', '분석탁월': '0', '후속강추': '0'}"
2023-08-13 10:24:00,사회,잼버리 대원들 격려하는 이학재 사장, 이학재 인천국제공항공사 사장이 지난 12일 인천공항에 마련된 잼버리 대원 전용 대기공간을 방문해 대원들을 격려하고 있다.   ,"{'쏠쏠정보': '0', '흥미진진': '0', '공감백배': '0', '분석탁월': '0', '후속강추': '0'}"
2023-08-13 10:24:00,스포츠,"한국계 페굴라, 1위 시비옹테크 제압…캐나다오픈 테니스 결승행","  제시카 페굴라(3위·미국)가 세계 1위 이가 시비옹테크(폴란드)를 물리치고 여자프로테니스(WTA) 투어 캐나다오픈(총상금 278만8천468 달러) 결승에 진출했다. 페굴라는 12일(현지시간) 캐나다 몬트리올에서 열린 대회 6일째 단식 준결승에서 시비옹테크와 2시간 30분 승부 끝에 2-1(6-2 6-7<4-7> 6-4)로 이겼다. 페굴라는 엘레나 리바키나(4위·카자흐스탄)-루드밀라 삼소노바(18위·러시아) 경기 승자를 상대로 통산 3번째 투어 대회 단식 우승에 도전한다. 이번 대회에서 우승하면 지난해 과달라하라 대회에 이어 2년 연속 WTA 1000시리즈 대회 단식 우승을 이룬다. WTA 1000시리즈는 4대 메이저 대회 바로 아래 등급에 해당하며, 1년에 9개 대회가 열린다. 시비옹테크와 상대 전적에서는 3승 5패로 격차를 좁혔다. 페굴라는 한국에서 태어나 미국으로 입양된 킴 페굴라를 어머니로 둔 한국계다. 킴 페굴라와 아버지 테리 페굴라가 천연가스, 부동산, 스포츠, 엔터테인먼트 사업 등으로 7조원이 넘는 재산을 일군 재력가여서 '갑부의 딸'로도 유명하다. 직전에 참가한 바르샤바오픈에서 올해 4번째 단식 우승을 일군 시비옹테크는 이날 패배로 연승 행진이 8경기에서 멈췄다. 이날 한창 뜨거운 승부가 펼쳐지던 2세트 타이브레이크에서 주최 측의 실수로 흥겨운 컨트리풍 음악인 '코튼 아이 조'가 갑자기 흘러나와 두 선수와 관중을 당황하게 했다. 페굴라가 4-3으로 앞선 상황에서 두 선수가 한창 샷을 주고받을 때 음악이 나왔다. 심판은 플레이를 무효로 돌리면서 ""음향팀 고마워요""라고 말해 야유하던 팬들을 웃게 했다. 두 선수는 별다른 항의 없이 플레이를 재개했다. 토론토에서 열린 남자프로테니스(ATP) 캐나다오픈(총상금 660만 달러)에서는 앨릭스 디미노어(18위·호주)가 알레한드로 다비도비치 포키나(37위·스페인)를 2-0(6-1 6-3)으로 물리치고 결승에 선착했다. 디미노어는 토미 폴(14위·미국)-얀니크 신네르(8위·이탈리아) 경기 승자와 결승에서 대결한다. ","{'좋아요': 12, '슬퍼요': '0', '화나요': 6, '팬이에요': 1, '후속기사 원해요': 1}"
2023-08-13 10:26:00,경제,"현대차, 'N 비치 시즌 2' 행사 개최", 현대자동차가 오는 20일까지 강원도 동해시에 위치한 '나인비치37ES'에서 고성능 브랜드 N을 체험할 수 있는 'N 비치(beach) 시즌 2' 행사를 진행한다고 13일 밝혔다. 사진은 다양한 식음료를 즐길 수 있는 'N 비치 라운지'.   ,"{'쏠쏠정보': '0', '흥미진진': '0', '공감백배': '0', '분석탁월': '0', '후속강추': '0'}"
2023-08-13 10:27:00,경제,"현대차, 'N 비치 시즌 2' 행사 개최", 현대자동차가 오는 20일까지 강원도 동해시에 위치한 '나인비치37ES'에서 고성능 브랜드 N을 체험할 수 있는 'N 비치(beach) 시즌 2' 행사를 진행한다고 13일 밝혔다. 사진은 국내 최초로 전시되는 '아이오닉 5 N 드리프트 스펙'.   ,"{'쏠쏠정보': '0', '흥미진진': '0', '공감백배': '0', '분석탁월': '0', '후속강추': '0'}"
2023-08-13 10:39:00,경제,"이란 ""韓 동결자금 70억달러中 10억달러 줄어…원화값 하락 탓""","중앙은행 총재 ""전액 동결 해제됐다…제3국으로 이체""   이란 중앙은행 총재는 12일(현지시간) 한국에 동결된 자금이 약 70억 달러(약 9조3천240억원)에서 원화 가치 하락으로 거의 10억 달러 정도가 줄었다고 밝혔다. 이란 관영 IRNA 통신에 따르면 모하마드레자 파르진 이란 중앙은행 총재는 이날 한국 은행들에 몇년 간 이란 자금 약 70억 달러가 '무이자' 형태로 묶여있었다며 이같이 말했다. 그는 심지어 이란 자금 가치가 거의 10억 달러 줄어들었으며, 이는 달러당 원화가치가 내려갔기 때문이라고 덧붙였다. 그는 그러면서 한국에 동결된 이란 자금 전액이 해제됐으며, 이를 원화에서 유로화로 환전하기 위해 제3국으로 이체됐다고 밝혔다. 파르진 총재는 이어 유로화로 전환된 자금 전액이 곧 카타르의 이란 은행 6곳 계좌로 이체될 것이라면서, '비제재 물품' 구매를 위해 쓰일 것이라고 덧붙였다. 로이터, 신화 통신도 파르진 총재가 12일 X(옛 트위터)를 통해 한국 내 동결 자금이 모두 해제돼 유로화로 환전됐으며, 환전 수수료는 제3국에서 부담할 것이라고 밝혔다고 보도했다. 이같은 언급은 존 커비 백악관 국가안보회의(NSC) 전략소통조정관이 11일 미국과 이란이 한국 내 이란 동결 자금 해제에 합의한 것과 관련, 한국 정부와 사전에 폭넓게 공조했다고 밝힌 가운데 나온 것이다. 앞서 미국과 이란은 각각 자국 내 수감자 5명씩을 맞교환하는 협상을 타결하면서, 한국을 포함해 이라크와 유럽 등에 동결된 이란 자금을 해제하기로 합의한 바 있다. 파르진 총재가 '비제재 물품' 구매를 언급한 것은 앞서 커비 조정관이 ""해당 자금은 식량과 의약품, 군사적 전용 가능성이 없는 의료 기구 구입을 위해서만 사용될 수 있다""고 언급한 것과 맥락을 같이 하는 것으로 보인다. 한국에 동결된 이란 자금은 2019년 5월 트럼프 당시 미국 행정부의 대(對)이란 제재로 국내 은행 등에 묶여 있던 이란산 원유 수입 대금이다. 파르진 총재는 이날 언급에서 제3국이 어디인지 언급하지 않았으나 앞서 IRNA 통신이 한 소식통을 인용해 한국에 동결돼 있던 이란 자금이 스위스 은행으로 이체됐다고 보도했다. ","{'쏠쏠정보': 1, '흥미진진': 3, '공감백배': 12, '분석탁월': '0', '후속강추': 6}"
2023-08-13 10:40:00,경제,"농협유통 하나로마트, 올해 처음 출하된 햇배 선보여", 농협유통·농협하나로유통이 올해 처음 출하된 원황 품종 '햇배'를 선보였다고 13일 밝혔다. 사진은 모델들이 올해 처음 출하된 원황 품종 '햇배'를 소개하는 모습.   ,"{'쏠쏠정보': '0', '흥미진진': '0', '공감백배': '0', '분석탁월': '0', '후속강추': '0'}"
2023-08-13 10:41:00,정치,"안철수 ""볼턴, 전술핵 재배치가 북핵에 좋은 대응수단이라 해""","워싱턴 DC서 면담…""볼턴, 한국 '핵추진 잠수함·핵연료 재처리기술' 보유 방안 긍정평가""   국민의힘 안철수 의원은 13일 존 볼턴 전 백악관 국가안보보좌관이 북핵 대응을 위해 한반도 전술핵 재배치 필요성을 거론했다고 전했다. 미국 출장 중인 안 의원은 이날 자신의 페이스북을 통해 지난 11일(현지시간) 워싱턴 DC에서 볼턴 전 보좌관과 면담했다면서 이같이 밝혔다. 안 의원은 ""존 볼턴은 북한의 미사일 기술이 나날이 고도화되고 있는 것은 확실하며, 북한의 김정은이 핵을 포기할 전략적 이유는 전혀 없다고 판단하고 있었다""고 전했다. 그러면서 ""북핵의 근본적 해결책은 통일이지만, 지금 상황에서는 미국의 관리하에 전술핵 재배치를 하는 것도 좋은 북핵 대응 수단의 하나가 될 것이라는 개인적인 견해를 밝혔다""고 덧붙였다. 안 의원은 볼턴 전 보좌관이 ""한국의 핵추진 잠수함이나 핵연료 재처리 기술 보유에 대해서는 긍정적으로 평가하며, 한국이 먼저 요구해야 할 의제일 것이라고 했다""라고도 전했다. 볼턴 전 보좌관은 면담에서 러시아-우크라이나 전쟁의 정전협정 논의가 가을 중 나올 가능성을 배제할 수 없다고 했고, 블라디미르 푸틴 러시아 대통령이 핵무기를 사용할 가능성은 높게 보지 않았다고 안 의원은 밝혔다. 안 의원은 ""대북 강경파로 잘 알려진 존 볼턴 전 보좌관은 저를 따뜻하고 친절하게 맞아줬다""며 ""조만간 한국을 방문할 때 다시 만나자며 서로 연락처를 교환했다""고 덧붙였다. 국회 외교통일위원회 위원인 안 의원은 지난달 미국 출장에선 콘돌리자 라이스 전 국무부 장관과 면담하기도 했다. ","{'쏠쏠정보': '0', '흥미진진': 1, '공감백배': 37, '분석탁월': '0', '후속강추': 1}"
2023-08-13 10:43:00,경제,"코스맥스, 광저우서 조인트벤처 생산공장 가동…아시아 최대규모","""연간 4억개 제품 생산""…중국시장 확대   화장품 제조업자 개발 생산(ODM) 업체 코스맥스는 중국 이센그룹과 광저우시에 화장품 생산 공장을 짓고 본격적인 가동에 들어갔다고 13일 밝혔다. 광저우시에 지어진 '이센생물과학유한공사' 공장은 6만593㎡ 규모로, 단일 화장품 공장으로는 아시아 최대다. 코스맥스는 2020년 이센그룹과 조인트벤처(JV)를 설립하고 공장 건립을 추진해왔다. 코스맥스는 이곳에서 연간 4억개 규모의 제품을 생산해나갈 계획이다. 기존 상하이·광저우 공장에서 생산하던 이센그룹 물량은 새로운 공장으로 순차적으로 이관한다. 또 기존 공장에는 추가 생산 여력이 발생하는 만큼 중국 진출을 모색하는 국내 신규 브랜드사를 적극적으로 발굴하기로 했다. 코스맥스는 이를 통해 중국 시장에서의 영향력을 확대하고, 한중 경제 교류에도 기여할 수 있을 것으로 기대하고 있다. 이센그룹은 중국의 유명 색조 브랜드 '퍼펙트 다이어리'(完美日記) 등을 운영하는 화장품 회사다. 2020년 중국 화장품 기업으로는 처음으로 미국 나스닥에 상장했고, 2021년에는 영국 스킨케어 브랜드 '이브롬'을 인수하기도 했다. 코스맥스는 퍼펙트 다이어리 론칭 초기부터 제품 개발과 생산을 맡아오고 있다. ","{'쏠쏠정보': '0', '흥미진진': '0', '공감백배': '0', '분석탁월': '0', '후속강추': 1}"
2023-08-13 10:47:00,세계,望ましい南北関係　５２％「往来自由な２国家」＝韓国調査,【ソウル聯合ニュース】韓国大統領直属の諮問機関、民主平和統一諮問会議は１３日、「国民統一世論調査」（４～６月期）の結果を発表した。調査では回答者の５２％が望ましい南北の未来像として「往来が自由な２国家」を選び、「統一国家」を選んだ人は２８．５％にとどまった。「１国家・２体制」（９．８％）、「今と同じ２国家」（７．９％）と続いた。調査は６月９～１１日、全国の満１９歳以上の成人男女１０００人を対象に実施された。 民主平和統一諮問会議は定期的に実施している世論調査で、２０２１年７～９月期に初めて南北の未来に対する類似の質問を導入。今年１～３月期まで、望ましい南北の姿として挙げた回答は、「欧州連合（ＥＵ）のような経済交流協力が自由な状態」（３３．６～４０．１％）、「東西ドイツのように統一された状態」（３３．２～３８．８％）、「米国とカナダのような良き隣国の関係」（２３．８～２５．７％）の順だった。 今年１～３月期の回答では「ドイツ型」が３８．８％、「ＥＵ型」が３３．６％、「米国・カナダ型」が２４．６％だったが、４～６月期は、「統一国家」を選んだ人が３割を切るなど、２国家体制を好む人が明確に増えている。 一方、南北統一が必要かどうかを問う質問に対しては、「非常に必要」（４２．９％）と「ある程度必要」（３０．８％）を合わせ７３．７％が必要だと答えている。 民主平和統一諮問会議は「統一が必要だと答えた集団でも望ましい南北の未来像として往来可能な２国家を好む回答が４８．６％と半数近くに達した。これは統一に対する国民の認識が変化していることを示す」と分析している。 また北朝鮮に対する認識については、回答者の４２．１％が「敵対・警戒の対象」と回答。「協力・支援の対象」（４７．１％）より少なかったものの、２０１７年１０～１２月期の調査時（４２．５％）以来の高水準となった。 調査では回答者の８８．０％が北朝鮮の人権侵害が深刻だと答えた。尹錫悦（ユン・ソクヨル）現政権が北朝鮮人権報告書を初めて一般公開するなど北朝鮮の人権問題を積極的に発信していることについては、３４．５％が「問題解決にさほど役立たない」と回答。「全く役立たない」（１６．３％）を加えると５０．８％が役立たないと認識していることが分かった。「非常に役立つ」は１０．２％、「ある程度役立つ」は３１．９％だった。 韓米が４月の首脳会談で発表した「ワシントン宣言」については、４７．１％が「対北朝鮮拡大抑止力が強化された」とし、「拡大抑止力が弱まった」（３６．０％）を上回った。 ５月に日本で開かれた先進７カ国首脳会議（Ｇ７サミット）で韓米日首脳が合意した３カ国戦略連携の強化については、５３．２％が朝鮮半島情勢に肯定的な影響を与えると回答した。 ,"{'쏠쏠정보': '0', '흥미진진': '0', '공감백배': '0', '분석탁월': '0', '후속강추': '0'}"
2023-08-13 10:48:00,생활,해외도 좋지만 제주도 좋아,  광복절 징검다리 연휴가 이어지는 13일 오전 제주국제공항에 도착한 관광객들이 대합실을 빠져나와 렌터카 주차장으로 향하고 있다.  ,"{'쏠쏠정보': '0', '흥미진진': '0', '공감백배': '0', '분석탁월': '0', '후속강추': '0'}"
2023-08-13 10:55:00,정치,청년들 격려하는 박진 장관, 르완다를 방문 중인 박진 외교부 장관이 지난 12일 르완다에서 우리 정부의 개발협력 사업에 참여하고 있는 청년들을 만나 격려하고 있다.   ,"{'쏠쏠정보': '0', '흥미진진': '0', '공감백배': '0', '분석탁월': '0', '후속강추': '0'}"
2023-08-13 10:56:00,정치,르완다 방문한 박진 장관, 르완다를 방문 중인 박진 외교부 장관이 지난 12일 르완다에서 우리 정부의 개발협력 사업에 참여하고 있는 청년들을 만나 기념 촬영하고 있다.   ,"{'쏠쏠정보': '0', '흥미진진': '0', '공감백배': '0', '분석탁월': '0', '후속강추': '0'}"
2023-08-13 10:59:00,세계,中国人団体客をつかめ　韓国業界が着々と受け入れ態勢強化,【ソウル聯合ニュース】中国人の韓国への団体旅行が解禁されたことを受け、韓国の旅行・ホテル業界は受け入れ態勢の強化に乗り出している。 業界によると、旅行大手のモドゥツアーはホテル、ショッピングセンター、レストランなどの国内インフラを点検したほか、中国語ガイドをさらに確保するため力を入れている。 ロッテ観光開発は済州島の複合リゾートカジノのスタッフ４００人を新規採用する。リゾート内にあるグランドハイアット済州のカフェとレストラン全店に中国語で注文できるテーブルオーダーシステムを導入し、観光客が夜をゆっくり楽しめるよう一部店舗は営業時間を午前０時以降までに延長した。 カジノ大手のパラダイスも顧客誘致に向けた旅行商品を開発し、Ｋーカルチャーイベントを開催する。 ロッテホテルソウルは中国人スタッフを配置するなど、中国人に配慮した営業戦略を立てる。 ホテル新羅も中国の現地事務所を通じ、中国内のマーケティングを強化する。 中国人観光客に人気だった高麗人参や炊飯器の製造会社も中国人向けの商品を強化している。 中国政府は１０日、韓国や日本、米欧などを含む世界７８カ国・地域への団体旅行を解禁したと発表した。韓国への団体旅行は２０１７年に米国の最新鋭地上配備型迎撃システム「高高度防衛ミサイル（ＴＨＡＡＤ、サード）」の韓国配備を機に中断して以来、約６年ぶりの再開となる。 ,"{'쏠쏠정보': '0', '흥미진진': '0', '공감백배': '0', '분석탁월': '0', '후속강추': '0'}"
2023-08-13 11:00:00,정치,"해수부, 세계해사대학과 불법어업 근절 역량 강화 프로그램 진행","  해양수산부는 세계해사대학, 한국해양수산개발원과 함께 오는 14∼25일 스웨덴 말뫼에서 '불법·비보고·비규제(IUU) 어업' 근절을 위한 역량 강화를 주제로 국제 여름 아카데미를 개최한다고 13일 밝혔다. 이번 여름 아카데미는 2021년 6월 해수부와 세계해사대학이 체결한 '불법어업 대응 역량강화사업 공동 추진을 위한 양해각서(MOU)'에 따라 개최되는 것으로, 올해는 어업 관련 국제협약과 정책, 무역·해상범죄 등을 주제로 발표와 토론, 선박 추적 실습 등이 진행된다. 특히 지중해 어업자원 보존을 위해 지중해 어업위원회(GFCM)가 불법어업 대응 역량 강화를 위한 심도 있는 교육 과정을 진행할 계획이다. 아카데미에는 GFCM 소속 국가인 알바니아, 시리아, 리비아, 알제리, 몬테네그로, 레바논, 튀르키예, 모로코, 이집트, 튀니지 등에서 불법어업 담당 공무원 30여명과 국제기구, 비정부조직(NGO) 관계자 등이 참여한다. ","{'쏠쏠정보': '0', '흥미진진': '0', '공감백배': '0', '분석탁월': '0', '후속강추': '0'}"
2023-08-13 11:00:00,생활,"해수부, 물고기 생명의 길 '어도' 사진 공모전 개최","  해양수산부는 한국농어촌공사와 함께 오는 16일부터 10월 5일까지 '어도(魚道) 사진 공모전'을 연다고 13일 밝혔다. 어도는 댐, 수중보와 같은 구조물에 물고기 등 수산 생물이 지나갈 수 있도록 만든 생태통로를 뜻한다. 올해로 6회째인 공모전 참여를 희망할 경우 전국의 강과 하천에 설치된 어도의 모습이나 어도의 중요성을 알 수 있는 장면을 직접 촬영해 국가어도정보시스템 누리집을 통해 신청하면 된다. 해수부는 주제 부합성, 작품성, 홍보 활용도 등을 심사해 대상 1점, 최우수상 3점, 우수상 5점, 입선 15점 등 총 24점의 우수작을 선정할 계획이다. 올해부터는 휴대전화로 촬영한 사진도 대상을 받을 수 있다. ","{'쏠쏠정보': '0', '흥미진진': '0', '공감백배': '0', '분석탁월': '0', '후속강추': '0'}"
2023-08-13 11:00:00,경제,"산업부, 국민 참여 자유무역지역 콘텐츠 공모전","  산업통상자원부는 '2023 국민 참여 자유무역지역 콘텐츠 공모전'을 이달 14일부터 9월 8일까지 4주간 진행한다고 13일 밝혔다. 엠블럼, 일러스트, 슬로건 3개 분야로 나뉘어 진행되는 공모전에는 자유무역지역에 관심이 있는 국민 누구나 참여할 수 있다. 공모전 공식 사이트(www.kotra.spectory.net/trade)를 통해 온라인으로 접수할 수 있다. 자유무역지역의 정체성과 상징성을 대표하는 콘텐츠를 발굴하기 위한 공모전 수상작은 국민이 직접 참여한 온라인 국민투표로 선정된다. 9월 8일까지 접수된 응모작을 대상으로 평가위원회의 1차 심사와 2차 발표 평가, 온라인 국민투표를 거쳐 최종 수상작을 선정한다. 3개 분야별 최우수상 수상자에게는 상금과 산업부 장관상이 각각 수여된다. ","{'쏠쏠정보': '0', '흥미진진': '0', '공감백배': '0', '분석탁월': '0', '후속강추': '0'}"
