date,category,title,content,reaction
2023-08-31 12:49:00,스포츠,"태권도유소년선수권 銀 2개 우크라 ""위험에도 꿈 포기 안 해""","  ""매우 어렵고 위험한 상황에서도 꿈을 포기하지 않고 노력 중이다. 우크라이나는 현재 대부분 위험 지역이다."" 우크라이나 선수단을 이끌고 2023 세계태권도연맹(WT) 유소년선수권대회에 나선 나자리 코티아시 감독은 30일(현지시간) WT를 통해 이같이 말했다. 우크라이나 대표팀은 보스니아 헤르체고비나 사라예보의 힐스호텔 아레나에서 진행 중인 대회의 사흘 차인 이날 은메달 2개를 수확했다. 이는 전 연령대를 통틀어 WT 주최 대회에서 전쟁 발발 이후 우크라이나가 거둔 최고 성적이다. 폐막까지 하루가 남았지만 벌써 지난해 불가리아 소피아에서 열린 세계청소년선수권대회의 성적(동메달 3개)을 넘었다. 코티아시 감독은 ""우린 간절한 마음으로 여기에 왔다. 목표한 금메달은 아니지만 너무나 값진 은메달 2개를 얻었다. 너무 행복하고 선수들이 자랑스럽다""고 말했다. 이어 ""선수들이 어렵고 위험한 환경에서 훈련해온 걸 누구보다 잘 안다. 우린 승리자""라며 ""아직 하루가 더 남았다. 더 큰 기적을 일으키기 위해 긴장을 풀지 않겠다""고 덧붙였다. 러시아와 전쟁 발발 후 정상적 소집 훈련이 어려워진 우크라이나 선수 대부분이 폴란드 등 제3국에서 훈련 중이다. 남녀를 통틀어 16체급에 16명이 출전했고, 대부분 독일, 스페인, 폴란드, 이탈리아 등에서 흩어진 채 대회를 준비했다. 물론 전란에 휩싸인 조국을 떠나지 않은 선수도 있다. 각각 남녀 168㎝ 이하(43~59㎏)급에서 나란히 은메달을 목에 건 '13세 동갑내기' 키릴 쿠즈녜초우와 폴리나 투프치가 그렇다. 둘은 수시로 포탄이 터지는 수도 키이우에서 훈련해왔다고 WT는 전했다. 결승전에서 멕시코의 기예르모 마누엘 코르테스에 라운드 점수 0-2로 완패해 우승을 놓친 쿠즈녜초우는 시상식에서 준비해온 우크라이나 국기를 휘날리며 은메달을 자축했다. 쿠즈녜초우는 ""어려운 여건에서도 힘이 되어준 가족, 코치, 동료 선수들에게 감사하다""고 말했다. 투프치는 결승 상대 이란의 로잔 소우피를 상대로 초반 분투하며 1승을 먼저 따냈다. 그러나 라운드 2개를 연이어 내주며 역전패했고, 서운함이 몰려왔는지 한동안 경기장을 빠져나가지 못했다고 한다. 투프치는 ""금메달을 못 따 너무 아쉽다. 그래도 이 순간 행복하다""며 ""우리를 기억해줬으면 좋겠다. 우린 승리자고, 앞으로 어려운 환경이 계속 이어지겠지만 절대 포기하지 않겠다""고 밝혔다. 한편 우리나라 선수단은 대회 3일 차까지 남자부(금메달 1개, 동메달 2개)와 여자부(금메달 2개, 동메달 2개)를 합쳐 메달 7개를 수확했다. ","{'좋아요': '0', '슬퍼요': '0', '화나요': '0', '팬이에요': '0', '후속기사 원해요': '0'}"
2023-08-31 12:51:00,세계,'고공행진' 호주 물가 잡히나…7월 물가상승률 5% 아래로 떨어져," 정동철 통신원 = 지난 7월 호주의 물가상승률이 5% 아래로 떨어지면서 연 7% 이상 고공행진을 벌이던 물가가 잡히고 있다는 분석이 나왔다. 호주 공영 ABC 방송은 31일 호주통계청(ABS)이 전날 발표한 자료를 인용해 전달 호주의 연 물가상승률이 4.9%로 6월의 5.4%에 비해 0.5% 포인트 하락했다고 전했다. 이는 지난 2분기(2023.4~6)의 연 소비자물가지수(CPI) 상승률 6%는 물론 대부분의 경제 전문가가 예측한 5.2%보다 훨씬 낮은 수치이다. ABS는 임대료 등 주거비는 여전히 상승세를 유지했으나 유류와 신선식품 가격이 내려가면서 전체 물가상승률 하락을 이끌었다고 분석했다. 이 기간에 임대료는 7.6% 상승했지만, 유류·신선식품 가격은 각각 7.6%·5.4% 하락한 것으로 나타났다. ABS의 미셸 마쿼트 물가통계국장은 ""연간 물가상승률이 2022년 12월 8.4%로 정점을 찍은 후 계속 하락하는 추세를 보이고 있다""고 분석했다. 호주중앙은행(RBA)은 작년 5월부터 연 7% 이상 치솟는 물가를 잡기 위해 역대 최저 수준인 0.1%였던 기준금리를 12차례 인상해 4.1%까지 끌어 올렸다. 최근 인플레이션이 주춤하면서 지난 7, 8월 두 달 연속 기준금리를 동결한 RBA는 이번 물가 통계를 토대로 다음 달에도 이 기조를 이어갈 것이라는 관측에 힘이 실리고 있다. 경제분석사 캐피탈 이코노믹스의 마르셀 틸리언트 아시아-태평양 국장은 ""인플레이션의 급격한 하락으로 RBA가 예상보다 빨리 긴축을 마무리하고 통화 완화로 돌아설 가능성이 높아졌다""면서 ""이번 통계로 4분기(2023.10~12)에 마지막 금리 인상이 있을 것이라는 예측이 거의 현실성을 잃었다""고 말했다. 그는 ""이제 RBA가 언제 기준금리 인하에 나설 것인가가 더 중요한 문제가 됐다""고 덧붙였다. 베타쉐어즈의 데이비드 바사니스 수석 이코노미스트도 ""RBA의 금리 인상이 끝났다""면서 ""기준금리는 올해 말까지 현행 수준을 유지하다가 내년 4월부터 인하가 시작될 것""이라고 내다봤다. ","{'쏠쏠정보': '0', '흥미진진': '0', '공감백배': '0', '분석탁월': '0', '후속강추': '0'}"
2023-08-31 12:54:00,스포츠,"KPGA에 미국 유학생 아마 돌풍 예고…이병호, 홀인원에 버디 3개"," 권훈 기자 = 올해 아마추어 선수가 2차례 우승한 한국프로골프(KPGA) 코리안투어에서 이번에는 미국 유학생 아마추어 돌풍이 불 조짐이다. 미국 텍사스주 댈러스의 스프링 크리크 아카데미 고교 12학년 이병호(18)는 31일 경기도 안산시 대부도 더헤븐 컨트리클럽(파72)에서 열린 KPGA 코리안투어 LX 챔피언십(총상금 6억원) 1라운드에서 2언더파 70타를 쳤다. 순위는 20위권이지만 이병호의 경기 내용은 남달랐다. 195㎝의 큰 키에서 뿜어나오는 호쾌한 스윙에 그린을 단 두 번밖에 놓치지 않은 정교한 샷을 구사해 눈길을 끌었다. 1번 홀부터 시작한 이병호는 2번 홀(파4)에서 1타를 잃었지만 4번 홀(파5)에서 세 번째 샷으로 홀 4ｍ에 붙여 이날 첫 버디를 뽑아냈다. 6번 홀(파5·570야드)에서는 301야드를 날아간 티샷에 이어 두 번 만에 그린에 볼을 올려 가볍게 1타를 더 줄였다. 135야드짜리 8번 홀(파3)에서는 홀인원의 행운을 누렸다. 46도 웨지로 티샷한 볼이 홀에 빨려 들어갔다. 11번 홀(파5)에서는 3ｍ 버디 퍼트를 넣어 한때 공동 선두에 나섰다. 18번 홀(파5)에서 이병호는 드라이버로 친 티샷이 왼쪽으로 크게 빗나가는 OB가 된 바람에 더블보기를 적어낸 게 아쉬웠다. 이병호는 미국 주니어 무대에서 이미 소문난 강호다. 초등학생 때 국내 무대를 휩쓸고 중학교부터 미국으로 유학, 미국주니어골프협회(AJGA) 주관 대회 우승 트로피를 여러 개 손에 넣었다. 2020년에는 텍사스주 주니어 골프 올해의 선수상을 받았고 작년에는 미국 주니어 대회에서 메이저급 전국 대회인 폴로 골프 주니어 클래식에서 우승했다. 미국프로골프(PGA) 투어 진출이라는 목표를 향해 달리는 이병호는 내년 8월 미국 대학 골프 명문으로 꼽히는 캘리포니아주 페퍼다인대학교 입학이 이미 확정됐다. 미국 유학을 떠난 뒤 6년 만에 한국 코스에서 열리는 대회에 출전한 이병호는 ""전혀 낯설진 않다. 다만 코스가 오르막과 내리막이 심한 편이라 거리 조절에 신경이 많이 쓰였지만, 연습 라운드를 통해 충분히 감을 잡아놔 문제가 없었다""고 말했다. ""오늘은 8언더파는 칠 수 있었다""는 이병호는 ""서너 발걸음 버디 퍼트를 너무 많이 놓쳤다""고 아쉬워했다. 18번 홀 더블보기에 대해서는 ""(평소 잘 구사하지 않는) 드로 구질로 코스를 공략하려다 왼쪽으로 감아쳤다. 어이없는 실수였다. 내일은 안전한 페이드 구질로 티샷을 치겠다""고 말했다. 겁 없는 고교생답게 이병호는 거침없는 자신감을 보였다. 미국에서도 프로 대회에는 출전해본 적이 없어 이번에 첫 프로 대회 경험이지만 ""하나도 긴장되거나 떨리지 않는다""는 이병호는 ""부모님은 컷 통과가 당면 과제라고 말씀하시지만 내 목표는 우승""이라고 말했다. ","{'좋아요': 13, '슬퍼요': '0', '화나요': 5, '팬이에요': 1, '후속기사 원해요': '0'}"
2023-08-31 12:55:00,세계,"가봉 쿠데타 장군 ""봉고 대통령 물러나…군대가 책임 맡기로""","'차기지도자 유력' 공화국 수비대 사령관 佛 르몽드 인터뷰   아프리카 가봉의 쿠데타를 주도한 인물 중 한 명으로 꼽히는 공화국 수비대 사령관은 30일(현지시간) ""알리 봉고 온딤바 대통령은 3선을 할 권리가 없었고 헌법을 위반했다""며 쿠데타는 어쩔 수 없는 선택이었다고 밝혔다. 브리스 올리귀 은구마 장군은 이날 프랑스 일간 르몽드와의 독점 인터뷰에서 이번 쿠데타를 오래전부터 준비했느냐는 질문에 이같이 답했다. 그는 ""가봉에는 (대통령에 대한) 불만이 있고, 이런 불만 외에도 국가 원수에게 병이 있다는 것을 알고 있다""며 ""모두가 그것에 대해 이야기하고 있지만, 아무도 책임을 지지 않는다. 그래서 군대가 책임을 맡기로 결정했다""고 덧붙였다. 르몽드는 봉고 대통령이 2018년 10월 뇌졸중을 겪은 뒤 건강이 약화했다고 설명했다. 은구마 장군은 봉고 대통령의 향후 거취에 대해선 ""그는 물러났고 모든 권리를 누리고 있다""면서 ""그는 다른 사람들과 마찬가지로 평범한 가봉 국민""이라고 말했다. 다만 은구마 장군은 봉고 대통령의 가택 연금이 사실인지 묻는 질의엔 ""아무것도 말씀드릴 수 없다""며 ""차차 알게 될 것""이라고 말했다. 은구마 장군은 이번 쿠데타가 성공할 경우 차기 지도자에 오를 가능성이 있다고 르몽드는 보도했다. 은구마 장군은 자신을 새로운 국가 원수로 생각하느냐는 질의엔 ""아직 선언하지 않았고, 현재로서는 아무것도 고려하지 않고 있다""며 ""그것은 모든 장군과 함께 논의해야 할 사안""이라고 말했다. 이어 그는 ""오후 논의에서 모든 사람이 아이디어를 제시하고 가장 좋은 아이디어와 함께 전환을 이끌 사람의 이름을 선택할 것""이라고 말했다. 앞서 가봉 군부는 이날 새벽 국영 방송을 통해 ""모든 안보·국방력을 대표하는 우리가 권력을 장악했다. 가봉 공화국의 국가 기관을 해산한다""고 주장했다. 이들은 이어 봉고 대통령의 3연임으로 결론 난 최근 선거 결과를 신뢰할 수 없다면서, 선거 결과를 무효로 한다고 덧붙였다. 군 지도부는 또 ""알리 봉고 대통령이 반역죄로 체포됐으며, 가족 및 의사들에 둘러싸인 채 가택 연금됐다""고 말했다. 봉고 대통령은 42년간 장기 집권한 아버지 오마르 봉고에 이어 2009년부터 14년간 가봉을 통치해 왔다. ","{'쏠쏠정보': '0', '흥미진진': '0', '공감백배': '0', '분석탁월': '0', '후속강추': '0'}"
2023-08-31 12:59:00,정치,"김기현 ""이재명, 뜬금포 단식 선언…민생 발목잡기 참 답답""","與 ""본인만을 위한 단식…애먼 사람 고생시키지 말고 대표직 내려와 단식하라""  류미나  국민의힘 김기현 대표는 31일 더불어민주당 이재명 대표의 '무기한 단식 선언'에 대해 ""민생을 챙기고 국민의 삶을 돌봐야 하는 정기국회 개회를 앞두고 웬 뜬금포 단식인지 모르겠다""고 맹비난했다. 김 대표는 이날 전남 순천 현장최고위원회의 후 기자들과 만나 이같이 말한 뒤 ""제1야당 당 대표가, 그것도 거대 야당을 이끌고 있으면서 직무유기를 하겠다는 것에 다름이 아니다""라고 지적했다. 김 대표는 특히 ""정 자기 사법 리스크가 두렵고 체포동의안 처리가 두려우면 그 불체포특권을 포기하면 되는데 왜 자꾸 민생 발목잡기를 하는 지 참 답답하다""라고도 꼬집었다. 강민국 수석대변인도 '오직 자신만을 지키기 위한 제1야당 대표의 '뜬금포' 단식 선언. 대표직에서 내려오고 하시라'라는 제목의 논평에서 ""대체 무엇을 위한 단식인가. 결국 자신을 향한 법의 심판이 다가오니 어떻게든 관심을 돌려보기 위해 가장 치졸한 방법을 선택한 것""이라고 비판했다. 이어 ""제1야당 대표가 되지도 않는 핑계로 단식에 나선다고 하니 황당함을 넘어 분노가 치민다""며 ""게다가 오늘은 정기국회를 단 하루 앞둔 날이다. 산적한 현안과 법안, 그리고 예산심사를 앞둔 마당에 제1야당 대표가 이렇듯 무책임한 발상을 하고 있으니 국민들 억장이 무너진다""고 덧붙였다. 강 수석대변인은 그러면서 ""국민이 제1야당 대표에게 원하는 것은 단식이 아니라 제대로 된 정치다. 본인의 잘못에는 침묵하고 이제는 정치까지 내팽개친 이 대표에게 당 대표직은 걸맞지 않다""고 쏘아붙였다. 또 ""오직 이 대표 본인만을 위한 단식을 위해 조 짜고, 격려 방문하며 애먼 주위 사람들 고생시키지 말고 부디 대표직에서 내려오고 단식하시라""라고 비꼬았다. ","{'쏠쏠정보': 19, '흥미진진': 9, '공감백배': 493, '분석탁월': 2, '후속강추': 18}"
2023-08-31 13:00:00,정치,행안부 장관과 이태원참사 유가족,  31일 국회 행정안전위원회에서 전체회의 종료 후 이태원 참사 유가족이 이상민 행정안전부 장관에게 항의하고 있다. 이날 행안위는 '이태원 참사 특별법'을 야당 단독으로 처리했다. 국민의힘 의원들은 법안 의결에 반대하며 퇴장했다.  ,"{'쏠쏠정보': '0', '흥미진진': '0', '공감백배': '0', '분석탁월': '0', '후속강추': '0'}"
2023-08-31 13:00:00,연예,행정법원 출석한 권태선 전 방문진 이사장,  권태선 전 방송문화진흥회 이사장이 31일 오전 서초구 서울행정법원에서 열린 방송통신위원회 해임 처분 집행정지 신청 심문기일에 출석하며 발언하고 있다.  ,"{'좋아요': '0', '응원해요': '0', '축하해요': '0', '기대해요': '0', '놀랐어요': '0', '슬퍼요': '0'}"
2023-08-31 13:00:00,연예,권태선 전 이사장 집행정지 신청 규탄하는 MBC 제3노조,  권태선 전 방송문화진흥회 이사장이 31일 오전 서초구 서울행정법원에서 열린 방송통신위원회 해임 처분 집행정지 신청 심문기일에 출석하기 전 취재진 앞에 서자 MBC노동조합(제3노조) 조합원들이 규탄 팻말 들어보이고 있다.  ,"{'좋아요': '0', '응원해요': '0', '축하해요': '0', '기대해요': '0', '놀랐어요': '0', '슬퍼요': '0'}"
2023-08-31 13:00:00,경제,"현대차그룹, 정몽구배 한국양궁대회 공식 후원","  현대자동차그룹은 대한양궁협회 주관으로 31일 개막한 '현대자동차 정몽구배 한국양궁대회 2023'을 공식 후원한다고 밝혔다. 내달 3일까지 용산 전쟁기념관과 목동 종합운동장 주경기장에서 열리는 정몽구배 한국양궁대회는 2016년 창설돼 올해로 3회째를 맞는다. 올해 대회는 한국 양궁 60주년을 기념하고자 규모가 크게 확대됐고, 기존 리커브 종목에 더해 컴파운드 종목이 신설돼 선수들의 참가 기회도 늘었다. 현대차그룹은 1985년 정몽구 명예회장이 대한양궁협회 회장에 취임한 이후 현재 대한양궁협회 회장을 5연속 연임 중인 정의선 회장에 이르기까지 38년째 대한양궁협회를 지원하고 있다. 이는 국내 단일 종목 스포츠협회 후원 중 최장 기간이라고 현대차그룹은 전했다. 대회 기간 전쟁기념관 평화의 광장에 설치되는 전시·체험존에서는 현대차그룹이 지원하는 양궁 훈련 장비도 볼 수 있다. 현대차그룹은 국내 양궁계 지원 외에 아시아양궁연맹 회장사(회장 정의선)를 맡고 있으며, 2025년까지 현대차와 세계양궁협회 간 스폰서십 계약을 맺고 '현대 양궁 월드컵'과 '현대 세계 양궁 선수권대회'를 후원하며 세계 양궁 저변 확대를 위해 노력하고 있다. 현대차그룹 관계자는 ""현대자동차 정몽구배 한국양궁대회 2023이 한국 양궁 60주년을 빛내는 상징적인 대회가 될 수 있도록 지원을 아끼지 않을 것""이라며 ""앞으로도 현대차그룹은 한국 양궁의 끊임없는 발전과 양궁 대중화를 위한 노력을 이어갈 것""이라고 말했다. ","{'쏠쏠정보': '0', '흥미진진': '0', '공감백배': '0', '분석탁월': '0', '후속강추': '0'}"
2023-08-31 13:00:00,연예,권태선 전 이사장 앞 규탄 팻말,  권태선 전 방송문화진흥회 이사장이 31일 오전 서초구 서울행정법원에서 열린 방송통신위원회 해임 처분 집행정지 신청 심문기일에 출석하며 발언하고 있다. 맞은편에서 MBC노동조합(제3노조) 조합원들이 규탄 팻말을 들고 있다.  ,"{'좋아요': '0', '응원해요': '0', '축하해요': '0', '기대해요': '0', '놀랐어요': '0', '슬퍼요': '0'}"
2023-08-31 13:01:00,정치,"""카자흐스탄 태권도대회 참가 北선수단, 中단둥서 열차로 귀국""","북중 여객열차, 국경 봉쇄 후 첫 운행…단둥 北 인력도 나흘 연속 버스로 귀국   카자흐스탄 세계태권도대회에 참가했던 북한 선수단이 31일 중국 단둥에서 열차로 귀국했다고 단둥 소식통들이 전했다. 소식통들에 따르면 북한 선수단은 이날 오전 7시 35분께(이하 현지시간) 열차 편으로 단둥에 도착, 북한으로 가는 여객열차로 갈아탄 뒤 오전 11시께 압록강철교를 건너 신의주로 넘어갔다. 코로나19 발생에 따라 북한이 2020년 1월 국경을 봉쇄한 이후 북중 간 여객열차가 운행한 것은 이번이 처음이다. 북한 선수단은 지난 29일 카자흐스탄에서 여객기로 베이징에 도착, 주중 북한대사관에서 머물다 전날 오후 5시 26분발 단둥행 열차에 탑승, 귀국길에 오른 것으로 알려졌다. 앞서 지난 16일 북한 선수단은 신의주에서 버스를 타고 단둥으로 입국해 베이징으로 이동한 뒤 카자흐스탄으로 떠난 바 있다. 이날 오전 단둥에서는 북한 선수단 귀국에 앞서 북한 인력이 여러 대의 버스에 나눠타고 귀국했다. 단둥에서 버스를 이용한 북한 인력의 귀국은 지난 28일부터 이날까지 나흘 연속 이뤄졌다. 앞서 지난 22일과 24일, 26일, 29일 베이징에서 북한의 고려항공 여객기가 북한 주민들을 실어 귀국시켰다. 중국에서 코로나19가 발생하자 북한이 2020년 1월 국경을 봉쇄한 이후 북중 간 대규모 인적 왕래가 이뤄진 것은 이번이 처음이다. 다만 중국인의 북한 입국은 아직 이뤄지지 않고 있으며, 북한에서 중국으로 나온 인력도 국제대회 출전을 위한 특수한 경우여서 북중 간 인적 왕래가 본격화됐다고 보기는 어렵다는 분석이 나온다. 중국 관영 글로벌타임스는 지난 28일 ""북한이 내년에야 국경을 완전히 개방할 것이라는 시각이 있지만, 그렇게 오래 걸리지 않을 것""이라고 전망했다. 그러나 중국 내 북한 전문 여행사 관계자는 ""내년 4월에나 관광객이 북한을 방문할 수 있을 것""이라며 북중 간 국경 완전 개방이 해를 넘길 것으로 관측했다. ","{'쏠쏠정보': 1, '흥미진진': '0', '공감백배': '0', '분석탁월': '0', '후속강추': '0'}"
2023-08-31 13:02:00,정치,행안부 장관 보는 이태원참사 유가족,  31일 국회에서 열린 행정안전위원회에서 이태원참사 유가족이 이상민 행정안전부 장관을 보고 있다. 이날 행안위는 '이태원 참사 특별법'을 야당 단독으로 처리했다. 국민의힘 의원들은 법안 의결에 반대하며 퇴장했다.  ,"{'쏠쏠정보': '0', '흥미진진': '0', '공감백배': '0', '분석탁월': '0', '후속강추': '0'}"
2023-08-31 13:03:00,IT,"네오위즈 ""일본 애니메이션 '보노보노' 모바일 게임 개발 계약""","  네오위즈는 자회사 게임온과 함께 일본 애니메이션 제작사 '에이켄'과 TV 애니메이션 '보노보노' 지식재산(IP)을 활용한 모바일 게임 개발 계약을 체결했다고 31일 밝혔다. 보노보노는 1986년부터 현재까지 연재되고 있는 이가라시 미키오 작가의 만화가 원작으로, 해달 '보노보노'와 다람쥐 '포로리' 등 동물 캐릭터들이 보내는 일상을 담고 있다. 네오위즈가 개발하고 게임온이 서비스 예정인 '보노보노' 게임의 제목은 '보노보노, 뭐하니?'(가칭)로, 장르는 방치형 힐링 모바일 게임이다. 출시일은 미정이다. ","{'쏠쏠정보': '0', '흥미진진': '0', '공감백배': '0', '분석탁월': '0', '후속강추': '0'}"
2023-08-31 13:10:00,사회,'벌금 300만원 구형' 김미나 창원시의원,  이태원 참사 유가족과 화물연대 조합원을 비하하는 글을 올린 혐의(모욕)로 기소된 김미나 창원시의원이 31일 오전 경남 창원시 마산합포구 창원지법 마산지원에서 열린 공판을 마치고 걸어가고 있다.  ,"{'쏠쏠정보': '0', '흥미진진': '0', '공감백배': '0', '분석탁월': '0', '후속강추': 1}"
2023-08-31 13:10:00,정치,행안위 참석한 이태원참사 유가족,  31일 국회에서 열린 행정안전위원회 방청석에 이태원참사 유가족이 앉아 있다. 앞쪽은 이상민 행정안전부 장관. 이날 행안위는 '이태원 참사 특별법'을 야당 단독으로 처리했다. 국민의힘 의원들은 법안 의결에 반대하며 퇴장했다.  ,"{'쏠쏠정보': '0', '흥미진진': '0', '공감백배': '0', '분석탁월': '0', '후속강추': '0'}"
2023-08-31 13:10:00,정치,"행안위, 이태원참사 특별법 처리",  31일 국회 행정안전위원회에서 김교흥 위원장이 회의를 진행하고 있다. 이날 행안위는 '이태원 참사 특별법'을 야당 단독으로 처리했다. 국민의힘 의원들은 법안 의결에 반대하며 퇴장했다.  ,"{'쏠쏠정보': '0', '흥미진진': '0', '공감백배': '0', '분석탁월': '0', '후속강추': '0'}"
2023-08-31 13:11:00,정치,"행안위, 이태원참사 특별법 처리",  31일 국회 행정안전위원회에서 김교흥 위원장이 회의를 진행하고 있다. 이날 행안위는 '이태원 참사 특별법'을 야당 단독으로 처리했다. 국민의힘 의원들은 법안 의결에 반대하며 퇴장했다.  ,"{'쏠쏠정보': '0', '흥미진진': '0', '공감백배': '0', '분석탁월': '0', '후속강추': '0'}"
2023-08-31 13:11:00,사회,가습기살균제 참사 피해자들의 유품,  31일 서울역 앞 계단에서 열린 가습기살균제 참사 12주기 캠페인 및 기자회견에서 가습기살균제 참사 피해자들의 유품이 놓여있다.  ,"{'쏠쏠정보': '0', '흥미진진': '0', '공감백배': '0', '분석탁월': '0', '후속강추': '0'}"
2023-08-31 13:12:00,사회,가습기살균제 참사 피해자들의 유품,  31일 서울역 앞 계단에서 열린 가습기살균제 참사 12주기 캠페인 및 기자회견에서 가습기살균제 참사 피해자들의 유품이 놓여있다.  ,"{'쏠쏠정보': '0', '흥미진진': '0', '공감백배': '0', '분석탁월': '0', '후속강추': '0'}"
2023-08-31 13:14:00,사회,가습기살균제 참사 12주기,  31일 서울역 앞 계단에서 열린 가습기살균제 참사 12주기 캠페인 및 기자회견에서 가습기살균제 참사 피해자들의 유품이 놓여있다.  ,"{'쏠쏠정보': '0', '흥미진진': '0', '공감백배': '0', '분석탁월': '0', '후속강추': '0'}"
2023-08-31 13:14:00,사회,가습기살균제 참사 12주기,  31일 서울역 앞 계단에서 열린 가습기살균제 참사 12주기 캠페인 및 기자회견에서 가습기살균제 참사 피해자들의 유품이 놓여있다.  ,"{'쏠쏠정보': '0', '흥미진진': '0', '공감백배': 3, '분석탁월': '0', '후속강추': 4}"
2023-08-31 13:15:00,정치,"행안위, 여당 퇴장",  31일 국회 행정안전위원회에서 김교흥 위원장이 회의를 진행하고 있다. 이날 행안위는 '이태원 참사 특별법'을 야당 단독으로 처리했다. 국민의힘 의원들은 법안 의결에 반대하며 퇴장했다.  ,"{'쏠쏠정보': '0', '흥미진진': '0', '공감백배': '0', '분석탁월': '0', '후속강추': '0'}"
