date,category,title,content,reaction
2023-08-23 10:01:00,생활,"전북기독교계 ""잼버리 파행 전북 희생양 삼아선 안 돼""","  전북기독교총연합회 등 전북기독교계는 새만금 세계스카우트잼버리 파행과 관련해 ""정치권은 전북도를 희생양 삼아선 안 된다""고 주장했다. 전북지역 목사 등 교인들은 23일 전북도청 앞에서 기자회견을 열고 ""잼버리 파행에 대한 질책은 겸허하게 받아들이고 문제점은 개선해야 마땅하다""면서 ""그러나 책임 대부분을 전북도에 전가하고 잼버리와 상관없이 진행된 새만금 개발의 타당성을 부정하고 백지화하려는 움직임은 전북도민들에게 치욕과 상처를 주는 것""이라고 강조했다. 그러면서 ""잼버리를 빌미로 새만금 사업의 이익을 추구했다는 주장은 선동적이며 터무니없는 허위 사실""이라며 ""새만금공항 등 국가사업의 타당성을 부정하려는 음모는 즉각 중단돼야 한다""고 목소리를 높였다. 전북기독교계는 ""누구보다도 잼버리의 성공을 기원하고 헌신·응원했던 전북도민에게 위로와 격려의 메시지는 보내지 못하더라도 전북도와 도민을 희생양으로 삼아 폄훼·모욕하고 상처를 주는 모든 행위를 즉각 멈추라""고 촉구했다. 이날 회견에는 전북기독교총연합회와 도내 14개 시·군 기독교연합회, 전북목회자협의회 등이 이름을 올렸다. ","{'쏠쏠정보': 1, '흥미진진': '0', '공감백배': '0', '분석탁월': '0', '후속강추': '0'}"
2023-08-23 10:02:00,사회,"[경남소식] 경남관광재단-통영시, 야간관광 특화도시 조성 협력"," 경남관광재단은 통영시와 '야간관광 특화도시 조성사업' 성공 추진을 위한 업무협약을 체결했다고 23일 밝혔다. 지난 22일 통영시청에서 진행된 협약식에는 천영기 통영시장과 황희곤 경남관광재단 대표이사 등 양 기관 관계자들이 참석했다. 이번 협약에서 양 기관은 야간관광 특화도시 조성사업을 위한 실무협의회 구성·운영, 국내외 공동 홍보·마케팅, 야간관광 콘텐츠 발굴 등을 적극 추진해 나가기로 했다. 지난해 9월 '국내 제1호 야간관광 특화도시 공모'에 선정된 통영시는 대표명소인 강구안을 중심으로 야간 예술작품 전시, 야간 축제 개발, 나이트 프린지 공연 등 2025년까지 총 29억원을 투입해 글로벌 야간관광 도시를 조성할 계획이다.","{'쏠쏠정보': '0', '흥미진진': '0', '공감백배': '0', '분석탁월': '0', '후속강추': '0'}"
2023-08-23 10:04:00,정치,"국민의힘, 후쿠시마 원전 오염수 방류 대응 긴급회의",  국민의힘 윤재옥 원내대표가 23일 국회에서 열린 우리바다 지키기 검증 TF 긴급회의에서 발언하고 있다.  ,"{'쏠쏠정보': '0', '흥미진진': '0', '공감백배': '0', '분석탁월': '0', '후속강추': '0'}"
2023-08-23 10:04:00,정치,발언하는 윤재옥 원내대표,  국민의힘 윤재옥 원내대표가 23일 국회에서 열린 우리바다 지키기 검증 TF 긴급회의에서 발언하고 있다.  ,"{'쏠쏠정보': '0', '흥미진진': '0', '공감백배': '0', '분석탁월': '0', '후속강추': '0'}"
2023-08-23 10:04:00,경제,"[게시판] 라카, 아이섀도 신제품 '포에버6 아이 팔레트' 출시", 국내 뷰티 브랜드 라카(Laka)는 아이섀도 신제품 '포에버6 아이 팔레트'를 출시했다고 23일 밝혔다. 5가지 질감과 6가지 색을 한 팔레트에 담았다. '비기닝'과 '어텐션' 2종이다. 제품은 라카 공식 온라인 스토어와 일본 큐텐에서 만나볼 수 있다. ,"{'쏠쏠정보': '0', '흥미진진': '0', '공감백배': '0', '분석탁월': '0', '후속강추': '0'}"
2023-08-23 10:04:00,정치,우리바다 지키기 검증 TF 긴급회의 참석하는 윤재옥,"  국민의힘 윤재옥 원내대표가 23일 국회에서 열린 우리바다 지키기 검증 TF 긴급회의에 참석하며 정부 측 참석자들과 인사하고 있다. 왼쪽부터 박구연 국무조정실 1차장, 오영주 외교부 2차관, 윤 원내대표, 박성훈 해양수산부 차관.  ","{'쏠쏠정보': '0', '흥미진진': '0', '공감백배': '0', '분석탁월': '0', '후속강추': '0'}"
2023-08-23 10:04:00,정치,국민의힘 우리바다 지키기 검증 TF 긴급회의,  국민의힘 윤재옥 원내대표가 23일 국회에서 열린 우리바다 지키기 검증 TF 긴급회의에서 발언하고 있다.  ,"{'쏠쏠정보': '0', '흥미진진': '0', '공감백배': '0', '분석탁월': '0', '후속강추': '0'}"
2023-08-23 10:04:00,경제,"연준 인사 ""美경제 다시 성장 가능…인플레 목표 변경 반대""","리치먼드 연은 총재 ""내달 FOMC 회의 결과 예단하지 않을 것"" ""인플레 목표 2%는 절대 달성할 수 없는 마법의 유니콘 숫자 아냐""   토머스 바킨 리치먼드 연방준비은행(연은) 총재는 미국 경제가 둔화보다 다시 성장할 가능성에 대해 열린 자세를 가져야 하며, 이는 연방준비제도(연준·Fed)의 인플레이션(물가 상승)과의 싸움에도 영향을 미칠 수 있다고 22일(현지시간) 말했다. 바킨 총재는 이와 함께 최근 연준의 '인플레이션 목표 2%'의 효용성 논란과 관련해 연준이 이를 달성하기도 전에 목표치의 변경을 고려한다면 신뢰를 잃을 수도 있다고 지적했다. 바킨 총재는 이날 로이터 통신과의 인터뷰에서 미국의 7월 소매판매가 예상보다 강세를 보였고 소비자 신뢰도 상승하면서 ""(경제의) 재가속 시나리오가 3∼4개월 전과는 전혀 다른 방식으로 테이블 위에 올랐다""고 전했다. 여기에는 인플레이션이 높게 유지되고 경제가 더욱 강해질 가능성을 포함하고 있다고 바킨 총재는 덧붙였다. 그는 이어 ""인플레이션이 높은 수준으로 유지되고 수요가 인플레이션이 둔화할 것이라는 신호를 주지 않는다면 추가 금리 인상을 통한 보다 강력한 긴축 통화정책의 근거가 될 수 있을 것""이라고 말했다. 미국의 7월 소매 판매는 전월보다 0.7% 증가하면서 전문가의 예상치를 크게 뛰어넘었고, 연율 2.4%인 2분기 국내총생산(GDP) 증가율도 연준 인사들이 인플레이션을 진정시킬 수 있다고 판단하는 수준을 크게 웃돌았다. 이 같은 경기 호조 가능성은 최근 경제가 경기침체에 빠질지 또는 이른바 '연착륙'을 달성할지를 놓고 벌여온 연준의 최근 논의를 뛰어넘는 차원을 의미한다고 바킨 총재는 평가했다. 그는 이어 다음 달 연방공개시장위원회(FOMC) 회의에서 금리동결 가능성이 높은 것으로 전망되고 있지만 실제로 어떤 결과가 나올지에 대해 예단하지 않을 것이라고 말했다. 바킨 총재는 최근 시장 움직임에서 금융환경이 과도하게 또는 우려할만한 방식으로 위축되고 있다고 볼만한 것은 없었다고 덧붙였다. 그는 이와 함께 이날 버지니아주 댄빌에서 열린 한 행사에서 연설을 통해 ""(인플레이션 목표치) 2%는 절대 달성할 수 없는 마법의 유니콘 숫자 같은 게 아니다""고 강조했다. 이와 관련해 국제통화기금(IMF) 전 수석 이코노미스트이자 현재 피터슨 국제경제연구소(PIIE) 연구원 올리비에르 블랑샤드, 버락 오바마 대통령 시절 백악관 경제자문위원회(CEA) 위원장을 지낸 하버드대 제이슨 퍼먼 교수 등 저명한 경제 전문가들은 최근 연준이 인플레이션 목표치를 상향해야 한다는 주장을 제기했다. ","{'쏠쏠정보': 1, '흥미진진': '0', '공감백배': '0', '분석탁월': '0', '후속강추': '0'}"
2023-08-23 10:05:00,경제,"'더 맛있게, 더 즐겁게'…CJ제일제당, 비비고 글로벌 마케팅","  CJ제일제당은 '더 맛있게, 더 즐겁게'라는 메시지로 비비고 브랜드의 글로벌 마케팅을 전개한다고 23일 밝혔다. CJ제일제당은 앞서 '정성 담은 한 끼'로 소비자와 유대감을 강화해왔고, 앞으로는 '리브 딜리셔스'(Live delicious)라는 슬로건을 앞세워 젊은 소비자와 교감을 시도한다. 국내에서는 소비자들이 가족, 친구와 함께 비비고를 즐길 수 있도록 '비비고 피크닉 테이블'을 운영한다. 미국에서는 비비고와 공식 파트너십을 맺은 LA레이커스의 인프라를 활용한 마케팅을 펼치고, 일본에서는 비비고 제품을 구매하는 소비자에게 추첨을 통해 한국 여행 항공권을 제공한다. 유럽에서는 영국을 중심으로 만두, 치킨, 김치 등을 앞세워 비비고 브랜드의 인지도를 높이는 활동을 진행한다. 태국에서는 떡볶이 등 'K-스트리트 푸드'를 중심으로 임시 매장을 운영한다. ","{'쏠쏠정보': '0', '흥미진진': '0', '공감백배': 1, '분석탁월': '0', '후속강추': '0'}"
2023-08-23 10:06:00,경제,"정선군, 용탄1리·화암1리에 LPG 소형저장탱크 보급","  강원 정선군은 정선읍 용탄2리와 화암면 화암1리에 액화석유가스(LPG) 소형저장탱크를 보급한다고 23일 밝혔다. 도시가스를 공급할 수 없는 마을에 연료 사용 환경 개선 등 에너지 복지 향상을 위한 사업이다. 총사업비 7억4천여만원을 투입하는 이번 사업을 완료하면 용탄2리 46가구와 화암1리 85가구가 LPG를 공급받는다. 마을 단위 LPG 소형저장탱크는 개별 LPG 용기 사용 대비 최대 30% 저렴한 가격으로 LPG를 공급할 수 있다. 황승훈 전략산업과장은 ""에너지 취약계층의 연료비 절감과 가스 사용의 안전성 및 편리성이 향상될 것으로 기대한다""며 ""LPG 소형저장탱크 보급을 차례대로 확대할 계획""이라고 말했다. ","{'쏠쏠정보': '0', '흥미진진': '0', '공감백배': '0', '분석탁월': '0', '후속강추': '0'}"
2023-08-23 10:06:00,경제,"하나투어, 에너지의 날 맞아 '여행만보 에너지만보' 챌린지","  하나투어는 지난 22일 '제20회 에너지의 날'을 맞아 ESG(환경·사회·지배구조) 캠페인 '여행만보 에너지만보 챌린지'를 펼쳤다고 23일 밝혔다. 에너지시민연대가 주관하는 '불을 끄고 별을 켜다' 서명 캠페인에 하나투어가 기업 별빛지기로 서명하고, 이를 연계한 사내 임직원 동참 이벤트를 진행했다. 하나투어는 에너지의 날인 전날 저녁 일정 시간 본사 외벽 조명을 소등했으며 하나투어 앱에서 선보인 여행만보 서비스로 일정 걸음 이상 달성한 임직원 대상으로 리워드를 제공했다. 이 외에도 컴퓨터 절전 및 이면지 사용, 계단 이용 등 사내에서 실천할 수 있는 다양한 방법을 제시하며 임직원들의 참여를 독려했다. ","{'쏠쏠정보': '0', '흥미진진': '0', '공감백배': '0', '분석탁월': '0', '후속강추': '0'}"
2023-08-23 10:06:00,사회,[게시판] 한국방송학회 '지상파 콘텐츠의 가치 진단' 세미나," 한국방송학회는 오는 29일 오후 2시 30분 서울 중구 프레스센터 19층 매화홀에서 '디지털 미디어 패권 시대, 지상파 콘텐츠의 가치와 경쟁력 모색'을 주제로 세미나를 개최한다고 23일 밝혔다. 홍원식 동덕여대 교수, 노창희 디지털산업정책연구소장이 각각 발제를 맡는다. 한국방송학회 공식 유튜브 계정에서 생중계로 시청할 수 있다. ","{'쏠쏠정보': '0', '흥미진진': '0', '공감백배': '0', '분석탁월': '0', '후속강추': '0'}"
2023-08-23 10:10:00,사회,취업상담·병역정보·멘토링…내주 후기 이주배경청소년 박람회,"  이주배경청소년지원재단(소장 유기옥)이 만 19세 이상 다문화 청소년이 늘어남에 따라 이들의 특성을 고려해 맞춤형 서비스를 제공하기 위한 자리를 마련한다. 재단은 다음 달 2일 서울 동작구 서울여성플라자 1층 국제회의장에서 제1회 후기 이주배경청소년 박람회 '어쩌다 어른이 되는 그대에게'를 개최한다고 23일 밝혔다. 이주배경청소년은 탈북청소년, 다문화청소년, 중도입국청소년 등을 뜻한다. 후기 이주배경청소년은 이주 배경을 가진 청소년 가운데 청소년기에서 성인기로 성장하는 중간 시기인 만 19∼24세에 해당하는 청소년을 말한다. 재단은 후기 이주배경청소년들은 이주 배경으로 인한 체류자격의 제한과 정보 획득의 어려움 등으로 성인이 되더라도 생활하는 데 여전히 어려움이 많다고 본다. 이에 따라 이들에게 다양한 교육과 정보를 얻을 기회를 제공하기 위해 박람회를 준비했다. 박람회는 크게 진학, 진로, 병역이라는 주제를 중심으로 진행된다. 이는 재단 측에서 지난 5월 이주배경청소년과 유관기관 실무자 등 169명을 대상으로 진행한 프로그램 수요조사 결과에 따른 것이다. 수요조사에 참여한 후기 이주배경청소년들은 대학 진학, 취업 등을 한국 생활이 어려운 이유로 꼽았다. 행사장은 IT 로봇 체험, 군복 체험, 유튜버 체험 등을 할 수 있는 '체험존'과 대학 진학, 취업, 병역 영역의 전문가들과 심층 상담을 할 수 있는 '전문가존' 등으로 꾸며진다. 재외동포(F-4), 비전문취업(E-9), 유학(D-2) 등 각종 비자에 관한 궁금증을 해결하는 코너와 재단의 상담 서비스 및 프로그램을 신청할 수 있는 코너도 준비된다. 유기옥 이주배경청소년지원재단 소장은 ""후기 이주배경청소년이 어쩌다 어른이 되는 과정에서 포기하지 않고 성장하며 적응할 수 있도록 지지하는 멘토를 만나고, 정보를 구할 기회를 가질 수 있기를 바란다""고 말했다. ","{'쏠쏠정보': 1, '흥미진진': '0', '공감백배': 3, '분석탁월': '0', '후속강추': '0'}"
2023-08-23 10:10:00,사회,시의회 감사서 거짓증언한 전 인천교통공사 간부 벌금형,"  인천시의회 행정사무감사에서 거짓 증언을 했다가 고발된 전직 인천교통공사 간부가 재판에 넘겨져 벌금형을 선고받았다. 인천지법 형사5단독 홍준서 판사는 위증 혐의로 기소된 전 인천교통공사 간부 A(66)씨에게 벌금 500만원을 선고했다고 23일 밝혔다. A씨는 지난해 11월 18일 인천시의회 건설교통위원회의 인천교통공사 행정사무감사에 증인으로 출석해 위증한 혐의로 기소됐다. 당시 A씨는 공사 협력업체에 개인용 차량 정비를 맡겼다는 의혹에 대해 ""협력업체인지 몰랐다""는 취지로 답변했다. 그는 ""직원들에게 (업무용 차량) 운전을 시킨 적이 있느냐""는 시의원 질의에도 ""공적으로 한 번 있다""고 답했다. 그러나 인천교통공사의 특별조사 결과 A씨는 자신과 아내가 소유한 외제차 정비를 공사 협력업체에 맡겼고, 직원으로부터 해당 업체가 협력업체라는 사실을 보고받아 알고 있었던 것으로 파악됐다. 조사에서는 A씨가 지난해 7월 14일부터 10월 27일까지 업무용 차량을 이용하면서 직원들에게 6차례 운전을 시킨 사실도 확인됐다. 인천시의회는 이에 A씨가 증인 선서를 하고서도 위증을 했다며 올해 초 의장 명의로 그를 고발했다. 홍 판사는 ""A씨가 초범인 점과 범행 동기, 범행 후 정황 등을 종합적으로 고려했다""고 양형 이유를 밝혔다. ","{'쏠쏠정보': '0', '흥미진진': '0', '공감백배': '0', '분석탁월': '0', '후속강추': '0'}"
2023-08-23 10:11:00,사회,영동 국도 절개지서 500t 낙석…차량 통제 중,"  23일 오전 8시 7분께 충북 영동군 영동읍 하가리 국도 4호선 절개지의 토사 500t가량이 도로 위로 무너져 내렸다. 사고 당시 통행 차량이 없어 인명피해는 발생하지 않았다. 영동군과 대전지방관리청 보은국토관리사무소는 이 구간 도로를 통제한 채 중장비 등을 투입해 무너진 토사를 치우고 있다. 영동군 관계자는 ""추가 붕괴에 대비해 양방향 통행을 차단했다""며 ""무너진 토사량이 많아 통행 재개까지는 시간이 걸릴 것""이라고 말했다. ","{'쏠쏠정보': '0', '흥미진진': '0', '공감백배': '0', '분석탁월': '0', '후속강추': '0'}"
2023-08-23 10:11:00,세계,APEC 제주 유치하면 경제파급효과 1조700억원 이상,"제주연구원 효과 분석…제주도, 연말 신청서 제출   제주도가 '2025 아시아태평양경제협력체(APEC) 정상회의'를 유치하면 직접적인 경제 파급효과가 1조700억원이 넘는다는 예측이 나왔다. 23일 제주연구원의 APEC 정상회의 제주 유치에 따른 지역경제 효과분석에 따르면 APEC 유치로 제주 지역 생산유발효과 7천256억원, 부가가치유발효과 3천463억원, 취업유발 7천244명 등의 경제 파급효과가 발생할 것으로 분석됐다. 이는 APEC 유치에 따른 인프라 투자, 회의 운영 수입, 회의 기간 제주를 방문한 관광객의 지출 등을 고려한 수치라고 제주연구원은 설명했다. 제주연구원은 이 외 간접 효과로 APEC이 개최되는 2025년 한 해 전반적으로 제주 방문 관광객이 증가할 것으로 기대했다. 제주연구원은 APEC 유치 경쟁을 벌이는 인천과 경북과 비교해 제주에 유치하면 관광객 방문 효과가 더 클 것으로 전망했다. 강영준·고경민 제주연구원 연구진은 APEC 정상회의 제주 유치를 위해 생태·평화·친환경, 공항 접근성 등 차별성을 강조하고 정부를 설득할 논리와 도민 공감대 형성이 필요하다고 조언했다. 제주도는 올해 연말 APEC 정상회의 유치 신청서를 제출할 예정이다. 도는 유치 제안서 작성 전담 조직을 구성해 논리를 발굴하고 있으며, 민간 단체의 참여와 온라인·오프라인 홍보를 강화하고 있다. ","{'쏠쏠정보': '0', '흥미진진': '0', '공감백배': '0', '분석탁월': '0', '후속강추': '0'}"
2023-08-23 10:12:00,정치,"특별귀화 1호 인요한, 與 강연서 ""한국인 타협 잘못해…고쳐야""","'선진국으로 가는 길' 강연…""타협은 '내가 손해보는 것'이라는 문화를 국회도 고쳐야""  김연정  인요한 연세대 의과대학 교수는 23일 국민의힘 친윤(친윤석열)계 의원들의 공부모임 '국민공감' 강연에서 ""한국(인)이 타협을 잘 못 하고 단합을 잘하지 못하는데 좀 더 발전하려면 이런 점을 고쳤으면 한다""고 말했다. 인 교수는 이날 국회 의원회관에서 열린 국민공감 모임에서 '선진국으로 가는 길 - 우리가 잃어버린 1%'를 주제로 강의하면서 이같이 말했다. 19세기 미국에서 온 선교사 유진 벨 씨의 증손자인 인 교수는 2012년 대한민국에 기여한 공로를 인정받아 특별귀화 1호의 주인공이 됐다. 인 교수 가문은 4대째 대를 이어 한국에서 교육 및 의료 활동을 펼치고 있다. 인 교수는 미국 의회가 상·하원으로 출발한 것을 거론, ""미국의 첫 단추가 대타협이었다""고 소개한 뒤 ""한국말로 타협은 '내가 손해 보는 것'인데 미국에서는 '내가 손해 보고 이기는 것'이다. (한국이) 그 문화를 좀 고쳐야 하고 여러분(국회)도 고쳐야 한다""고 했다. 또 ""(한국은) 단합을 잘하지 못한다. 주류, 비주류 알죠""라며 ""병원에서도 선거를 하면 경기고, 용산고, 제물포고등학교도 대단한데 저는 외국인학교를 졸업해서 줄 설 데가 없었다. 그런 게 별로 도움이 안 된다는 것""이라고 꼬집었다. 이어 인 교수는 한국인이 고쳐야 할 점으로 ""지나치게 감정적이고, 배타적이고, 법과 질서를 지키지 않는 것""을 꼽으며 ""비행기 안 뜬다고 데모하는 사람 한국인밖에 없고, 한국은 미워하는 사람을 제쳐버린다""고 말했다. 이 밖에도 인 교수는 ""한국 사람들이 스스로를 과소평가하는데 이건 추방돼야 할 나쁜 생각""이라고 했다. 인 교수는 이날 강연 도중 ""어제 기자 전화가 와서 '당신 국민의힘 출마하냐'고 해서 쓸데없는 소리 한다고 했다. 학생 가르치고 있으니 끊으라고 했다""고 말해 좌중에 웃음이 터졌다. 인 교수는 2012년 대선 당시 새누리당(국민의힘 전신) 대통합위원회 부위원장을 맡았었다. 인 교수는 강연 후 질의응답에서 윤석열 대통령이 미국 방문 때 영어 연설을 하고 영어로 '아메리칸 파이' 노래를 부른 것을 언급, ""대통령이 영어를 그렇게 잘하는지 몰랐는데 정말 잘한다. 영어가 거의 완벽하다""며 ""그것보다 중요한 건 (윤 대통령이 부른) '아메리칸 파이'다. 이 노래는 미국 사람 고유의 상징성을 가진 노래로 미국 사람 심금을 울리는 노래""라고 했다. 또 제주 4·3 폄훼 발언 논란 등으로 당 윤리위원회에서 징계받은 탈북민 출신 태영호 의원에 대해 ""그분이 말실수를 좀 했는데 그분 말실수가 오해다. 이것은 여러분들이 이해해주셔야 한다""고 감싸면서 ""(북한) 만경대를 내가 7번 갔는데, 북쪽에선 김구 선생을 김일성의 아주 한참 아래로, 김일성한테 배우러 온 초등학생으로 만들어놨다""고 말했다. ","{'쏠쏠정보': 1, '흥미진진': '0', '공감백배': 38, '분석탁월': '0', '후속강추': 2}"
2023-08-23 10:12:00,정치,발언하는 지영미 청장, 지영미 질병관리청장이 23일 충북 오송 질병관리청에서 열린 코로나19 중앙사고수습본부 회의에서 발언하고 있다.   ,"{'쏠쏠정보': '0', '흥미진진': '0', '공감백배': '0', '분석탁월': '0', '후속강추': '0'}"
2023-08-23 10:12:00,생활,'대를 이은 진도 예술의 혼' 박병천 명인 예술세계 조명,"남도국악원 토요상설, 박병천가무악보존회 초청공연   국립남도국악원은 오는 26일 오후 3시 대극장 진악당에서 (사)박병천가무악보존회(이하 보존회) 초청공연을 연다. 보존회는 진도군을 대표하는 예술인 중 한 명인 고(故) 박병천 명인의 가무악을 보존하기 위한 단체이다. '대를 잇는 혼'이란 주제로 열릴 무대는 박병천 명인의 자제이며 부산대 국악과 교수를 역임한 대금의 박환영 명인과 박미옥·박성훈 선생 등 대를 잇고 있는 가족과 제자들이 함께 출연해 박 명인의 예술세계를 함께 돌아본다. 박 명인의 생전 마지막 작품인 '비손'을 주제로 한 '산자를 위한 축원 덕담'을 시작으로 장수를 비는 뜻으로 술잔을 올리는 헌수 때 음악을 재구성한 '헌수 음악', 제석님께 비는 춤인 '제소춤'과 나쁜 액과 살을 풀고자 하는 '액풀이'가 준비했다. 박 명인의 작은할아버지인 박종기 명인의 대금 가락을 엮어 만든 '박종기류 대금산조'를 박환영 명인이 선보인다. 마지막으로 진도의 흥을 느낄 수 있는 '박병천류 북춤'으로 대미를 장식한다. 남도국악원 관계자는 23일 ""공연은 무료이며 공연 전후 진도 읍내와 국악원으로 오가는 무료 셔틀버스를 제공한다""고 말했다. ","{'쏠쏠정보': '0', '흥미진진': '0', '공감백배': '0', '분석탁월': '0', '후속강추': '0'}"
2023-08-23 10:12:00,사회,"성동구, 시설 열악한 의류제조업체 작업환경 개선 지원","  서울 성동구(구청장 정원오)는 시설이 열악한 의류제조업체의 작업환경 개선을 지원한다고 23일 밝혔다. 옷감 재단 시 먼지나 분진 등이 많이 나와 화재 발생 위험이 높고 근로자 건강도 악화시킬 수 있음에도 관내 대다수 의류제조업체는 임대료 부담으로 지하에 있어 환기조차 어렵다고 구는 설명했다. 이에 구는 해당 업체들에 근무 환경 개선을 위한 물품 구입비용을 지원한다. 소화기나 냉·난방기, 공기청정기, 재단 테이블 등 총 43종 물품이 대상이다. 물품 구입 금액의 90％를 구가 부담하는 방식으로 한 업체당 최대 900만원까지 지원한다. 이 사업으로 연말까지 총 74개의 의류제조업체에 5억7천800만원을 투입할 예정이다. 정원오 성동구청장은 ""경기 침체로 어려움을 겪는 지역 의류제조업체와 노동자들에게 조금이나마 도움이 되기를 바란다""라며 ""앞으로도 더욱 쾌적한 근로환경을 만들어 노동자들의 건강과 안전을 지키도록 노력하겠다""라고 말했다. ","{'쏠쏠정보': 0, '흥미진진': 1, '공감백배': '0', '분석탁월': '0', '후속강추': '0'}"
