date,category,title,content,reaction
2023-08-13 07:19:00,생활,"프랑스 매료한 웹툰 '픽 미 업!'…""日만화에 없는 신선한 컬러""","이광은 디렉터 인터뷰…佛재팬엑스포 라이브드로잉에 관객 탄성   ""판타지 작품은 문화적 특색이 크게 드러나지 않으니 해외 독자들도 낯설지 않은 느낌으로 접근할 수 있잖아요. 아무래도 장르가 이점이 된 것 같아요."" 웹툰 '픽 미 업!'의 작화 총책임자인 이광은 아트디렉터는 9일 경기 부천시 3B2S(쓰리비투에스) 본사에서 연합뉴스와 인터뷰하며 외국에서 누리는 큰 인기의 비결을 이렇게 밝혔다. '픽 미 업!'은 모바일 게임을 즐기다가 그 속에 빨려 들어간 주인공의 이야기를 그린 노블코믹스로, 프랑스 픽코마의 스마툰(Smartoon·웹툰) 액션 장르 1위에 오른 해외 인기작이다. 이 작가는 지난달 13일(이하 현지시간) 프랑스에서 열린 재팬엑스포 메인 스테이지에서 직접 '픽 미 업!' 속 주인공을 그리는 라이브 드로잉쇼를 선보였다. 웹툰 주인공 한 이스라트가 작중 의미 있는 아이템인 군마 조각상을 들고 있는 장면을 약 30분에 걸쳐 실제 원고 수준의 완성도로 그렸다. 당시 현장을 지켜본 관계자에 따르면 초반 선화(線畵) 작업까지 숨죽이고 지켜보던 관객들은 이 작가가 그림에 색을 얹는 순간 다 함께 탄성을 쏟아냈다고 한다. 이 작가는 ""서구권 독자는 흑백인 일본 만가(漫畵)에 익숙하다 보니 웹툰의 컬러 작업이 신선한 느낌으로 다가온 것 같다""고 설명했다. 프랑스 독자들의 만가 사랑은 익히 알려져 있다. 1999년부터 매년 파리에서 일본 만가, 애니메이션, 게임, 음악 등 일본 문화를 접할 수 있는 재팬엑스포를 개최하고 있는 것만 봐도 이를 짐작할 수 있다. 하지만 최근에는 '나 혼자만 레벨업' 등 소년 액션 장르를 중심으로 웹툰도 서서히 주목받는 모습이다. 17일에는 '픽 미 업!'을 띄워놓고 성우가 현장에서 대사를 읽는 라이브 더빙쇼가 진행됐는데 약 3천명이 관람하기도 했다. 이 작가도 ""프랑스에서 웹툰이 각광받는 느낌""이라며 ""라이브 드로잉 쇼, 사인회에도 많은 분이 참석했고, 작품을 깊게 읽은 현지 기자가 있어 놀랐다""고 덧붙였다. '픽 미 업!'은 처음에는 약체였지만 성장하는 주인공, 게임처럼 레벨과 스킬이 존재하는 세계관 때문에 고(故) 장성락 작가의 '나 혼자만 레벨업'과 비슷하다는 평가를 받아왔다. 특히 주인공 한 이스라트가 '나 혼자만 레벨업' 속 주인공 성진우와 닮았다는 독자들의 반응도 있었다. 이에 대해 이 작가는 ""장성락 작가 밑에서 액션 연출과 스타일을 배웠고, '픽 미 업!'을 작업하면서 이를 많이 녹이려고 했다""며 ""(한과 성진우가) 닮았다는 말들은 오히려 칭찬이라고 생각한다""고 유쾌하게 답했다. '픽 미 업!' 뒤에는 잘 알려진 원작 웹소설이 있다. 그는 ""아무래도 원작이 있다 보니 원작 팬의 기대치를 맞추기 위해 배경, 캐릭터 이미지에 신경을 많이 썼다""며 ""한은 침착하고 냉정하고 차가운 인상, 제나는 엉뚱하고 발랄한 면이 있기 때문에 눈매 등에서 이를 살리려고 했다. 몬스터 디자인의 경우 동물적인 이미지를 많이 가져왔다""고 설명했다. 이 작가의 전작은 로맨스 장르 웹툰인 '오피스 누나 이야기'다. 그는 ""두 장르는 신경 써야 하는 포인트가 다르다""라며 ""'오피스 누나 이야기'는 남녀 간의 감정선을 중요하게 봐야 하고 몰입할 수 있게 해야 했다면 액션은 합이나 멋있는 동작을 많이 보여주는 것이 중요하다고 본다""고 강조했다. 작업할 때는 세로 스크롤이라는 웹툰의 특징에 어울리는 액션 연출을 늘 고민한다. ""고블린 무리와의 전투 장면을 그릴 때 출판 만화라면 한 페이지를 다 써서 박력 있게 연출할 수 있지만, 웹툰은 화면을 돌려봐야 한다""며 ""대신 활을 쏘거나 창을 찌르는 액션 연출은 세로 스크롤로 보면 속도감이 느껴진다""고 했다. '픽 미 업!' 속 화려한 액션을 움직이는 영상으로도 볼 수 있을 전망이다. 현재 애니메이션화 논의가 이뤄지고 있으며, 내년 상반기에는 짧은 애니메이션 형태의 뮤직비디오를 선보일 계획이다. ","{'쏠쏠정보': '0', '흥미진진': '0', '공감백배': '0', '분석탁월': '0', '후속강추': '0'}"
2023-08-13 07:21:00,사회,"걸핏하면 침수, 파손…포항 형산강 둔치 야외물놀이장 어쩌나","포항시 2020년 건립 후 시설관리공단 운영…정비·청소에 예산 또 투입   경북 포항시시설관리공단이 운영하는 형산강 야외물놀이장이 많은 비가 내리면 침수되는 일이 반복되고 있다. 13일 포항시에 따르면 지난 10일 한반도를 관통한 제6호 태풍 '카눈'으로 많은 비가 내려 형산강 물이 둔치까지 넘치면서 형산강야외물놀이장이 침수됐다. 물놀이장은 차양막 구실을 하는 철제 시설물과 일부 시설을 제외하면 물놀이장임을 알 수 있는 것들이 거의 안 보일 정도로 물에 잠겼다. 포항시시설관리공단은 태풍이 오기 전에 가설건축물인 탈의실, 샤워장, 화장실 등을 형산강 둑 주변으로 치웠다. 그러나 강물이 범람하면서 상륙에서 떠내려온 토사와 물, 쓰레기가 물놀이장을 뒤덮었다. 이에 따라 공단은 토사나 물을 치우고 파손된 시설물을 보수해야 하는 상황이다. 이 때문에 태풍 영향을 받은 10일부터 13일까지 휴장한 채 시설물 재설치와 정비를 벌이고 있다. 포항시 남구 연일읍 형산강 둔치에 자리 잡은 물놀이장은 2020년 8월 포항시가 건립해 개장한 이후 그해 8월과 지난해 9월 태풍이 휩쓸고 가거나 많은 비가 내릴 때마다 침수돼 정비에 많은 인력과 예산이 투입됐다. 그러다가 보니 1년 중 7월 중순부터 8월 말까지 40여일간만 운영함에도 문을 닫는 날이 많은 상황이다. 공단 측은 ""물놀이장 이용에 불편을 드려 죄송하다""며 ""재개장 일정은 홈페이지 공지사항에 공지하겠다""고 밝혔다. ","{'쏠쏠정보': 1, '흥미진진': '0', '공감백배': '0', '분석탁월': '0', '후속강추': '0'}"
2023-08-13 07:22:00,사회,전국 5곳 국립정신병원 '의사 태부족'…전문의 충원율 38%,"개원의 대비 낮은 보수 탓에 구인난…복지부 ""보수체계 개선""   최근 잇단 흉기 난동 사건으로 중증 정신질환자에 대한 국가의 책임을 강화해야 한다는 요구가 커지고 있는 가운데 국립정신병원들의 의사난은 여전히 심각한 것으로 나타났다. 13일 보건복지부에 따르면 이달 기준 국내 5개 국립정신병원에 근무하는 정신건강의학과 전문의는 원장을 포함해 모두 30명으로, 정원(80명)의 37.5%에 불과하다. 서울에 있는 국립정신건강센터는 39명 정원에 13명만 근무 중이고, 정원이 각각 11명인 국립부곡병원과 국립공주병원의 전문의는 각 3명뿐이다. 정원 7명인 국립춘천병원의 경우 한동안 정신건강의학회 전문의가 0명인 상태로 운영되다 그나마 최근 원장이 임명되고 의사 1명이 충원되면서 2명이 됐다. 가장 사정이 나은 국립나주병원도 전문의 수가 9명으로, 정원(12명)에 못 미친다. 전문의 부족은 병원 기능에도 직접적으로 영향을 미친다. 감사원은 지난 5월 말 국회에 제출한 2022회계연도 국가결산 검사 보고서에서 ""국립정신건강센터와 국립춘천병원, 국립공주병원은 의료진 퇴사, 의료진 부족으로 인해 진료 대기시간이 증가해 전반적인 이용자 고객 만족도가 목표치에 미달했다""고 지적한 바 있다. 국립정신병원이 의사 부족을 겪는 이유는 무엇보다 개원의를 비롯해 민간 의료기관에 근무하는 의사들에 비해 크게 열악한 보수 체계 때문이다. 복지부의 지난해 보건의료인력실태조사 결과에 따르면 2020년 기준 표시과목이 정신건강의학과인 의원에 근무하는 의사들의 연평균 임금은 2억3천581만원가량이었다. 국립정신병원에 근무하는 의사들의 경우 공무원 임금체계를 적용받기 때문에 임금이 민간 의료기관 근무 의사들의 30∼50% 수준이었다고 복지부는 설명했다. 다만 복지부 관계자는 ""최근 인사혁신처와 협의해 의무직 공무원 보수체계를 어느 정도 개선했다""며 ""이전 3년 동안은 내내 (병원을) 나가는 분들만 있었는데 최근엔 새로 들어오시는 분들도 있다""고 말했다. 국립정신건강센터를 포함한 5개 국립정신병원들은 권역별로 국민의 정신건강 증진을 위한 서비스를 제공하는 거점 의료기관이다. 최근 정신질환 진단을 받고도 제대로 치료를 받지 않은 이들이 저지른 흉악 범죄가 잇따르면서 의료계와 정신질환자 가족 등을 중심으로 중증 정신질환 치료를 개인과 가족에만 맡길 것이 아니라 국가가 책임져야 한다는 주장이 커지고 있다. 정부는 연내 전 국민 정신건강 관리를 위한 종합대책을 수립해 발표할 예정이다. ","{'쏠쏠정보': '0', '흥미진진': '0', '공감백배': 6, '분석탁월': '0', '후속강추': 3}"
2023-08-13 07:29:00,사회,침수우려 반지하주택에 물막이판 없으면 과태료 500만원,"지하주차장 등 지하공간 침수 인명피해 예방 행안부, 자연재해대책법 개정안 입법예고…9월 국회 제출   지난해 집중호우와 태풍으로 서울 반지하주택과 포항 아파트 지하주차장에서 모두 10명 넘는 사망자가 나왔다. 이같은 인명피해를 예방하기 위해 정부가 침수 우려가 있는 지하공간에 침수방지시설을 설치하지 않으면 500만원 이하의 과태료를 부과하기로 했다. 지방자치단체들이 올해 침수우려 반지하주택에 무료로 물막이판(차수판)을 설치해줬지만 '침수되는 집'이라고 꼬리표가 붙어 집값이 내려갈 것을 우려한 집주인들이 설치를 거부하는 사례가 많았는데 앞으로 과태료가 도입되면 이런 일이 줄어들 것으로 보인다. 행정안전부는 침수우려 지하공간의 침수방지시설 미설치시 500만원 이하의 과태료를 규정하는 내용의 자연재해대책법 개정안을 다음달 국회에 제출할 계획이라고 13일 밝혔다. 행안부는 개정안을 마련해 최근 입법 예고했다. 개정안에 따르면 침수우려 지역의 반지하주택이나 지하주차장, 지하도로, 지하광장, 지하도상가, 도시철도나 철도 등의 소유자, 관리자 또는 점유자는 침수방지시설을 설치해야 한다. 침수방지시설 미설치 시 500만원 이하의 과태료를, 유지관리가 미흡하면 300만원 이하의 과태료를 부과한다. 지금까지는 침수방지시설 설치에 관한 과태료 부과 규정은 없었다. 행안부 관계자는 ""앞으로 침수 피해가 우려되는 지역의 반지하주택의 경우 물막이판 같은 침수방지시설을 설치하지 않으면 집주인이 500만원 이하의 과태료를 내야한다""면서 이번 법 개정으로 침수방지시설 설치가 늘어날 것으로 기대했다. 올해 행안부와 지자체가 침수 우려 반지하주택의 물막이판 설치를 늘리려고 애썼지만 지난 6월말 장마가 시작될 때까지 대상 가구 약 3만4천곳의 설치율은 36%로 저조했다. 전문가들은 정부와 지자체가 물막이판을 빨리 설치해야 한다고 강조해왔다. 이번 개정안에는 물막이판을 포함한 침수방지 시설을 설치하기 위해 지자체가 조례를 정해 예산을 지원할 수 있게 하는 근거도 마련했다. 또한 지하공간 침수 방지를 위해 수방기준을 정해야 하는 대상에 도시철도와 광역철도 외에 일반철도와 고속철도도 포함했다. 개정안은 사업장 관리책임자의 재해영향평가 관련 교육 이수도 의무화했다. 행안부는 올해 안에 자연재해대책법을 개정하고 관련 시행안까지 만들어 내년 장마철 전인 상반기 안에 시행할 계획이다. ","{'쏠쏠정보': '0', '흥미진진': '0', '공감백배': 2, '분석탁월': '0', '후속강추': '0'}"
2023-08-13 07:31:00,경제,임직원 비위 끊이지 않는 LH…2018년부터 징계 299건,"뇌물·금품 수수, 음주운전 등으로 형사 처벌도   한국토지주택공사(LH)가 철근 누락 사태를 계기로 또다시 조직문화 혁신과 대대적인 쇄신을 예고한 가운데 LH 임직원의 크고 작은 비위는 최근 수년간 끊이지 않은 것으로 나타났다. 13일 국회 국토교통위원회 소속 더불어민주당 박상혁 의원이 LH로부터 받은 징계 현황에 따르면 2018년부터 올해 8월 1일까지 LH 임직원의 내부 징계 건수는 299건으로 집계됐다. 징계 수위별로 보면 가장 낮은 수위인 견책은 160건으로 최다였고, 감봉 58건, 정직 32건, 파면 24건, 해임 18건, 강등 7건 등이었다. 공무원 징계 수위는 견책, 감봉, 정직, 강등, 해임, 파면 순으로 높다. 징계 사유는 취업규칙 위반, 품위유지의무 위반, 임직원 행동강령 위반, 업무처리 부적정 등이었다. 연도별 징계 건수를 보면 2018년 32건, 2019년과 2020년은 각 35건에 그쳤으나, 2021년에는 95건으로 2배 넘게 뛰었고 지난해는 68건을 기록했다. 특히 2021년에는 중징계인 해임이 4건, 파면이 10건에 달했다. 이는 당시 땅 투기 사태 영향으로 내부 감사 수위가 높아진 데다, 외부 기관에서 적발된 임직원 비위 사실에 대한 징계가 이뤄진 데 따른 것으로 풀이된다. 올해는 이달 1일까지 이미 34건의 징계가 이뤄졌다. 견책은 17건이었고, 정직 8건, 감봉 5건, 해임 3건, 파면 1건이었다. LH 임직원 일부는 뇌물 및 금품 수수, 음주운전 등 혐의로 처벌되기도 했다. 2018년 이후 현재까지 LH 임직원을 상대로 수사기관이 수사를 개시한 건수는 122건이었다. 특정범죄 가중처벌 등에 관한 법률(특가법)상 뇌물, 업무상 횡령, 부패방지법 위반 등으로 유죄판결이 나온 건은 9건이었다. 22건은 재판에 넘겨졌고, 벌금형 6건, 일부 무혐의·일부 기소 2건, 일부 무혐의·일부 벌금형 3건 등이었다. LH는 내부 징계 건수가 늘어난 것은 자체 감사 기능이 제대로 작동한 영향이라고 해명했다. LH 관계자는 ""2021년 투기 사태 이후 재발 방지를 위해 내부 통제를 강화하고 적발된 일탈 행위에 무관용 원칙을 내세우고 있다""며 ""징계 처분 건수가 많다는 것은 자체 감사 기능이 원활히 작용하고 있는 것으로 보고 있다""고 했다. 박상혁 의원은 ""신도시 땅 투기 사건에 이어 최근 철근 누락 순살 아파트까지 밝혀지면서 LH 임직원의 공직기강 해이가 심각한 수준으로 드러나고 있다""며 ""LH는 국민의 주거 안정을 책임지고 있는 중요한 역할을 하는 만큼 지금이라도 뼈를 깎는 혁신을 통해 국민의 신뢰를 회복해야 한다""고 말했다. ","{'쏠쏠정보': 2, '흥미진진': '0', '공감백배': '0', '분석탁월': 2, '후속강추': 10}"
2023-08-13 08:00:00,경제,[증시 풍향계] 장마철 같은 박스권 장세…테마주 순환매 현상 지속,"  국내 증시도 장마철 날씨와 같은 박스권에 갇혔다. 13일 금융투자업계에 따르면 코스피는 지난 11일 2,591.26으로 마쳐 2,600 아래로 떨어졌다. 이는 일주일 전인 지난 4일 종가(2,602.80) 대비 0.44% 하락한 수준이다. 코스피는 2,600을 시원하게 뚫지 못한 채 박스권에서 움직이는 흐름을 지속하고 있다. 코스닥지수도 912.20으로 마쳤다. 주초 약세에서 중후반 강세로 전환했으나 일주일 전(918.43)보다 0.68% 떨어졌다. 개인이 코스피와 코스닥시장에서 주식을 사들였으나 기관이 주식을 내다 팔면서 시장 전반적으로 투자심리가 위축됐다. 박희찬 미래에셋증권 연구원은 ""이달 들어 글로벌 증시 모멘텀은 다소 위축됐다""며 ""양호한 기업 실적, 디스인플레이션(물가 상승 둔화)이 선명해진 점은 긍정적이지만 실질금리 상승과 테마주의 거품 논란, 중국·유럽 경제 부진 등의 변화는 충분히 반영되지 못했다""고 강조했다. 전문가들은 국내 증시가 국내외 경제 지표에 주목하면서 미국 국채 금리 상승, 이익 회복 개선 기대감 약화 등으로 인해 당분간 박스권에서 움직일 것으로 내다봤다. 나정환 NH투자증권 연구원은 ""첨단 산업 분야에서 미·중 갈등 요인이 발생하고, 미국 물가 재상승 우려 등 금리상승 요인이 잔존하는 구간에서 주가 상승 여력이 크지 않다""고 설명했다. 그러면서 ""코스피의 12개월 선행 주가수익비율(PER)이 12배를 밑도는 점은 주가지수의 하단을 지지하는 요인""이라며 ""미국 국채 금리 상승으로 할인율이 높아진 구간에서 주가의 박스권 흐름이 이어질 수 있다""고 강조했다. 그는 코스피 주간 변동폭으로 2,530∼2,660을 제시했다. 강대석 유안타증권 연구원은 ""최근 코스피가 2,600선 전후로 등락을 반복하면서 주도주와 그간 부진하던 업종 간의 불균형을 다소 회복하는 순환매 장세를 반복하고 있다""며 ""이런 현상이 더 지속할 가능성이 크다""고 전망했다. 미국 실질금리가 높은 수준을 유지하면 가치평가(밸류에이션) 상승을 제약할 수 있어 박스권 장세와 테마주 중심의 순환매 현상이 지속할 수 있다는 것이다. 최유준 신한투자증권 연구원도 ""금리 상승 압력과 중국 우려가 코스피 상단을 막고 있다""며 ""하반기 이익 회복 기대와 개선된 투자심리는 하단을 견고히 해 코스피는 박스권 흐름을 전개할 가능성이 크다""고 예상했다. 다만 오는 15일 발표되는 중국 실물지표 결과에 따른 환율시장 움직임에 코스피의 반등 가능성도 있다. 조재운 대신증권 연구원은 ""중국 실물지표가 시장 기대치에 부합한 것으로 나오면 투자심리에 긍정적으로 작용할 것""이라며 ""소매 판매 지표가 뚜렷하게 반등하는 모습을 보이면 경기 불안 심리 완화를 기대할 수 있다""고 분석했다. 그는 ""위안화 약세 압력이 축소되고 원/달러 환율이 하락(원화 가치 상승)하면 외국인 매수세가 강화하면서 코스피가 반등 시도에 나설 수 있다""고 전망했다. 이번 주 국내외 주요 경제지표 발표와 이벤트 일정(한국시간)은 아래와 같다.  15일(화) = 한국 광복절 휴장, 중국 7월 실물지표  16일(수) = 미국 7월 소매 판매, 영국 7월 소비자물가  17일(목) = 7월 연방공개시장위원회(FOMC) 의사록, 미국 7월 산업생산  18일(금) = 미국 7월 콘퍼런스보드(CB) 경기 선행지수 ","{'쏠쏠정보': 1, '흥미진진': '0', '공감백배': '0', '분석탁월': '0', '후속강추': '0'}"
2023-08-13 08:00:00,경제,"하나금융, '디지털 파워 온 프로젝트' 2기…청년 인재 양성","  하나금융그룹은 청년 디지털 인재 양성 프로젝트인 '하나 디지털 파워 온 프로젝트' 2기 선포식을 개최했다고 13일 밝혔다. 선포식은 지난 10일 인천 청라 하나글로벌캠퍼스에서 열렸으며, 이복현 금융감독원장, 엄종환 SK텔레콤 부사장, 이훈규 아이들과미래재단 이사장 등 외부 인사와 함영주 하나금융 회장 등 그룹 관계자들이 참석했다. 하나 디지털 파워 온 프로젝트는 금융감독원, 구글, 아마존웹서비스(AWS), 마이크로소프트, SK텔레콤이 함께 후원하는 하나금융의 청년 디지털 인재 양성 프로그램이다. 이번 2기 프로젝트에는 총 50여명이 16개 팀을 이뤄 참여한다. 이복현 원장은 ""금융환경 변화에 대응하고 금융산업을 선도해 나가기 위해 금융과 디지털을 아울러 혁신적인 아이디어를 창출할 수 있는 융합형 인재를 확보하는 것이 필요하다""고 강조했다. 함영주 회장도 ""미래 디지털금융 혁신을 선도해 나갈 청년 디지털 인재 양성과 청년 일자리 창출에 지속적인 관심과 노력을 기울이겠다""고 밝혔다. 이날 선포식 이후 프로젝트의 일환으로 '디지털 신기술 경진대회'가 진행됐다. 경진대회에서는 참가 팀들이 금융산업 현장에서 발생할 수 있는 다양한 문제해결을 위해 디지털 신기술 ABCD(AI, Blockchain, Cloud, Data)를 활용한 아이디어를 제안했다. 프로젝트 종료 후 최종 성과공유회를 통해 선정된 팀에게는 상금과 정보통신기업 견학 기회를 주고, 수료자 전원은 하나금융 입사 지원 시 서류전형 면제 혜택을 받을 수 있다. ","{'쏠쏠정보': 0, '흥미진진': 3, '공감백배': '0', '분석탁월': '0', '후속강추': '0'}"
