date,category,title,content,reaction
2023-08-13 14:44:00,생활,명동에 '유커' 돌아온다,  13일 서울 중구 명동의 한 가로 가판대에 중국 오성홍기 등 각국 국기가 부착돼 있다. 중국 정부가 코로나19 대유행 시작 3년여 만에 자국민의 해외 단체여행을 사실상 전면 허용하기로 했다. 이에 따라 2017년 3월께부터 본격화한 '사드(THAAD·고고도 미사일 방어체계) 보복' 이후 6년여 만에 중국인 관광객의 한국행 단체관광 빗장도 완전히 풀리게 됐다.  ,"{'쏠쏠정보': '0', '흥미진진': '0', '공감백배': '0', '분석탁월': '0', '후속강추': '0'}"
2023-08-13 14:45:00,사회,양산서 위안부 피해 증언 '김복동 할머니' 기림문화제 열려,"김 할머니와 인연 문재인 전 대통령 축전 보내   국가기념일인 '일본군 위안부 피해자 기림의 날'(8월 14일)과 제78주년 광복절을 앞두고 경남 양산시민들이 세계 각국에서 위안부 피해를 증언한 김복동(1926∼2019) 할머니를 기리고자 모였다. 25개 지역단체가 참여한 김복동평화공원 양산시민추진위원회는 13일 오후 양산초등학교 강당에서 '희망을 잡고서…김복동 기림문화제'를 개최했다. 양산초등학교는 양산시가 고향인 김 할머니 모교다. 참가 시민들은 김 할머니 활동상을 기록한 영상을 보고 '김복동의 길'을 테마로 한 특강을 들으며 김 할머니를 추모했다. 퇴임 후 양산시에 살면서 김 할머니와 인연이 있는 문재인 전 대통령은 축전을 보냈다. 문 전 대통령은 ""김복동 할머니의 삶과 업적을 기리기 위한 사업이 할머니의 고향 양산에서 활발히 진행된다는 소식을 들었다. 매우 반갑고 고마운 일""이라며 ""역사를 기억하고 돌아보며 양산을 인권과 평화의 도시로 만들어가고자 하는 김복동평화공원 양산시민추진위의 의지에 뜨거운 응원을 보내며, 저도 힘을 보태겠다""고 밝혔다. 김복동평화공원 양산시민추진위원회는 기림문화제와 함께 이날 김복동 평화공원 조성 기금을 마련하고자 가죽 키링, 책 등 '김복동 굿즈'를 판매했다. 또 평화나비 키링·배지 제작, 붓글씨, 소녀상 판화 찍기 등 체험 부스를 운영했다. 김복동 할머니는 만 14살 때 일본군 위안부로 끌려갔다. 이후 중국, 홍콩, 말레이시아, 인도네시아, 싱가포르 등에 끌려다니며 '성노예'로 피해를 봤다. 김 할머니는 1992년 위안부 피해를 공개하며 본격적인 여성 인권 운동의 길을 걸었다. 김 할머니는 1993년 오스트리아 빈 세계인권대회에 참석해 위안부 피해를 증언하는 것을 시작으로 세계 곳곳에서 증언을 이어갔다. 문 전 대통령은 현직이던 2018년 1월 입원한 김 할머니를 문병했다. 이듬해 1월 김 할머니가 별세하자 문 전 대통령은 현직 대통령으로서는 처음으로 빈소를 직접 찾아 조문했다. ","{'쏠쏠정보': '0', '흥미진진': '0', '공감백배': 2, '분석탁월': '0', '후속강추': 1}"
2023-08-13 14:45:00,생활,명동에 '유커' 돌아온다,  13일 서울 중구 명동의 한 가로 가판대에 중국 오성홍기 등 각국 국기가 부착돼 있다. 중국 정부가 코로나19 대유행 시작 3년여 만에 자국민의 해외 단체여행을 사실상 전면 허용하기로 했다. 이에 따라 2017년 3월께부터 본격화한 '사드(THAAD·고고도 미사일 방어체계) 보복' 이후 6년여 만에 중국인 관광객의 한국행 단체관광 빗장도 완전히 풀리게 됐다.  ,"{'쏠쏠정보': '0', '흥미진진': '0', '공감백배': '0', '분석탁월': '0', '후속강추': '0'}"
2023-08-13 14:45:00,생활,면세점 입구의 중국어 환영 문구,  13일 서울 중구의 한 면세점 입구에 중국어로 환영 문구가 표시돼 있다. 중국 정부가 코로나19 대유행 시작 3년여 만에 자국민의 해외 단체여행을 사실상 전면 허용하기로 했다. 이에 따라 2017년 3월께부터 본격화한 '사드(THAAD·고고도 미사일 방어체계) 보복' 이후 6년여 만에 중국인 관광객의 한국행 단체관광 빗장도 완전히 풀리게 됐다.  ,"{'쏠쏠정보': '0', '흥미진진': '0', '공감백배': '0', '분석탁월': '0', '후속강추': '0'}"
2023-08-13 14:49:00,생활,'유커'가 돌아오면,  13일 서울 중구 명동 거리에서 관광객들이 오가고 있다. 중국 정부가 코로나19 대유행 시작 3년여 만에 자국민의 해외 단체여행을 사실상 전면 허용하기로 했다. 이에 따라 2017년 3월께부터 본격화한 '사드(THAAD·고고도 미사일 방어체계) 보복' 이후 6년여 만에 중국인 관광객의 한국행 단체관광 빗장도 완전히 풀리게 됐다.  ,"{'쏠쏠정보': '0', '흥미진진': '0', '공감백배': 1, '분석탁월': '0', '후속강추': '0'}"
2023-08-13 14:49:00,세계,"인도네시아, 中자본 투입 고속철 개통 앞두고 안전 강조","상업운전 개시, 10월 1일 목표보다 늦어질 수도   아세안(ASEAN·동남아시아국가연합) 내 첫 고속철도 개통을 앞둔 인도네시아 정부가 '안전 최우선'을 내세워 개통 전 철저한 안전 점검을 할 예정이라고 현지 매체가 전했다. 이 때문에 당국이 목표로 하는 '10월 1일 개통'이 더 늦어질 수도 있을 것으로 보인다. 13일(현지시간) 일간 자카르타 포스트에 따르면 부디 카르야 수마디 인도네시아 교통부 장관은 최근 외신 인터뷰에서 이미 계획보다 늦어진 고속철도 개통과 관련해 안전을 가장 우선시하겠다고 밝혔다. 수도 자카르타와 반둥을 잇는 142km 길이의 이 고속철도는 인도네시아와 중국이 출자해 만든 인도네시아·중국 합자회사(KCIC)가 건설해 당초 2019년 완공할 예정이었다. 이 고속철도는 중국 정부가 야심 차게 추진하는 일대일로(중국-중앙아-유럽을 연결하는 육상·해상 실크로드) 사업의 일환으로 중국 자금 73억 달러(약 9조7천억원)가 투입됐다. 토지 구입 문제와 코로나19 대유행(팬데믹), 비용 초과 등을 겪어온 KCIC는 안전 문제를 감안해 예정된 시범운행을 당초 일정보다 두 주가량 늦은 오는 9월 1일 개시하기로 했다. 상업운행은 오는 10월 1일 시작하는 것을 목표로 하고 있다. 부디 장관은 인터뷰에서 상업운행 개시 일자가 아직 확정되지 않았다면서 ""(조코 위도도) 대통령이 내게 (상업운행을) 서두르지 말라고 했다. 그는 안전이 최우선 사안임을 알고 있다""고 말했다. 그는 사업의 복잡성을 강조하면서 교통부가 현재 안전 테스트를 실시하고 있다고 덧붙였다. 앞서 시진핑 중국 국가주석은 지난달 방중한 조코 위도도 인도네시아 대통령에게 준공을 앞둔 고속철도 사업이 높은 기준에 부합하도록 해야 한다고 말했다. ","{'쏠쏠정보': 2, '흥미진진': 1, '공감백배': 1, '분석탁월': '0', '후속강추': 1}"
2023-08-13 14:49:00,스포츠,공격하는 차지환,  OK 금융그룹 차지환이 13일 구미 박정희체육관에서 열린 2023 구미·도드람컵 프로배구대회 삼성화재와의 결승전에서 공격을 시도하고 있다.  ,"{'좋아요': '0', '슬퍼요': '0', '화나요': '0', '팬이에요': '0', '후속기사 원해요': '0'}"
2023-08-13 14:50:00,사회,"양구군, 태풍 피해지역서 긴급 복구 작업", 13일 강원 고성군 태풍 피해지역에서 양구군자원봉사센터 단원들이 농경지 긴급 복구 작업을 펼치고 있다.   ,"{'쏠쏠정보': 1, '흥미진진': '0', '공감백배': '0', '분석탁월': '0', '후속강추': '0'}"
2023-08-13 14:50:00,사회,"양구군, 태풍 피해지역서 긴급 복구 작업", 13일 강원 고성군 태풍 피해지역에서 양구군자원봉사센터 단원들이 농경지 긴급 복구 작업을 펼치고 있다.   ,"{'쏠쏠정보': '0', '흥미진진': '0', '공감백배': '0', '분석탁월': '0', '후속강추': '0'}"
2023-08-13 14:50:00,생활,면세점 입장 기다리는 관광객들,  13일 서울 중구의 한 면세점 입구에서 외국인 관광객들이 입장을 기다리고 있다. 중국 정부가 코로나19 대유행 시작 3년여 만에 자국민의 해외 단체여행을 사실상 전면 허용하기로 했다. 이에 따라 2017년 3월께부터 본격화한 '사드(THAAD·고고도 미사일 방어체계) 보복' 이후 6년여 만에 중국인 관광객의 한국행 단체관광 빗장도 완전히 풀리게 됐다.  ,"{'쏠쏠정보': '0', '흥미진진': '0', '공감백배': '0', '분석탁월': '0', '후속강추': '0'}"
2023-08-13 14:51:00,사회,"함명준 고성군수, 태풍 피해지역 점검", 13일 강원 고성군 현내면 명파리 태풍 피해지역에서 함명준 군수가 피해 상황을 살피고 있다.  [강원 고성군 제공. 재판매 및 DB 금지] ,"{'쏠쏠정보': '0', '흥미진진': '0', '공감백배': '0', '분석탁월': '0', '후속강추': '0'}"
2023-08-13 15:00:00,경제,상반기 서울 아파트 증여 비중 3년반만에 최저 기록,"  올해 상반기 서울 아파트 거래시장에서 증여 비중이 한 자릿수로 떨어지며 3년 반 만에 최저를 기록했다. 올해부터 증여 취득세가 올라 세 부담이 커진 반면, 지난해 꽉 막혔던 매매 거래는 회복세를 보이면서 증여 대신 매매를 택한 수요가 늘어난 것으로 보인다. 13일 한국부동산원의 아파트 거래량 통계에 따르면 올해 상반기에 거래된 서울 아파트 총 4만4천783건(신고일 기준) 가운데 증여 거래는 4천107건으로, 전체의 9.2%를 차지했다. 이는 2019년 하반기 8.4% 이후 반기 기준으로 3년 반 만에 가장 작은 것이다. 사진은 13일 서울 시내 아파트의 모습.  ","{'쏠쏠정보': '0', '흥미진진': '0', '공감백배': '0', '분석탁월': '0', '후속강추': '0'}"
2023-08-13 15:00:00,경제,취득세 인상에 상반기 서울 아파트 증여 비중 3년반만에 최저,"  올해 상반기 서울 아파트 거래시장에서 증여 비중이 한 자릿수로 떨어지며 3년 반 만에 최저를 기록했다. 올해부터 증여 취득세가 올라 세 부담이 커진 반면, 지난해 꽉 막혔던 매매 거래는 회복세를 보이면서 증여 대신 매매를 택한 수요가 늘어난 것으로 보인다. 13일 한국부동산원의 아파트 거래량 통계에 따르면 올해 상반기에 거래된 서울 아파트 총 4만4천783건(신고일 기준) 가운데 증여 거래는 4천107건으로, 전체의 9.2%를 차지했다. 이는 2019년 하반기 8.4% 이후 반기 기준으로 3년 반 만에 가장 작은 것이다. 사진은 13일 서울 시내 아파트의 모습.  ","{'쏠쏠정보': '0', '흥미진진': '0', '공감백배': '0', '분석탁월': '0', '후속강추': '0'}"
2023-08-13 15:00:00,사회,[연합뉴스 이 시각 헤드라인] - 15:00,"■ '잼버리 파행' 감사원이 들여다본다…이르면 이번 주 감사 착수 새만금 세계스카우트잼버리 대회 파행 사태의 책임 소재를 가리기 위해 감사원이 이르면 이번주 감사에 착수할 것으로 13일 전해졌다. 잼버리 대회 공식 종료(12일) 이후 대대적인 정부의 감찰 및 감사가 진행될 것이라는 전망이 제기된 가운데 감사원이 먼저 진상 규명에 나서는 것이다. 정부 관계자에 따르면 감사원은 잼버리 조직위원회와 전라북도 등 관계 기관과 여성가족부, 행정안전부 등 지원 부처에 대한 감사 준비에 들어갔다.  ■ 이종호 ""R&D예산 前정권서 10조 늘어…재검토는 비효율의 효율화"" 이종호 과학기술정보통신부 장관은 윤석열 대통령의 지시 사항인 연구개발(R&D) 예산 전면 재검토와 관련해 ""그동안 연구 개발에서 비효율적인 부분이 있었던 것도 사실""이라며 ""그 부분을 효율화하고 R&D다운 R&D를 할 수 있게 하기 위한 것""이라고 말했다. 이 장관은 13일 서울 중구 포스트타워에서 한 연합뉴스와 인터뷰에서 ""지난 수년간 정부 R&D 예산이 대폭 늘어나는 과정에서 비효율과 낭비가 관행화된 면이 있다""며 이같이 말했다. 그는 내년도 국가연구개발사업 예산 배분·조정안 재검토가 마무리 단계에 접어들었다고 밝히고, 검토 과정에서 비효율과 낭비 요인을 제거하도록 노력했고, 앞으로는 이를 감시하는 '재정집행 점검 추진단'을 만들어 운영하는 등 제도 개선도 병행하겠다고 강조했다.  ■ '갑질 논란' 교육부 사무관 ""선생님께 상처드린 점 사과"" 자신의 아이가 '왕의 DNA'를 가졌다고 언급하며 자녀의 담임교사에게 '갑질'을 했다는 의혹을 받는 교육부 사무관 A씨가 교사와 학교 측에 사과했다. 다만, 그는 해당 표현이 아동 치료기관 자료의 일부이며 자녀의 담임교사와 소통하는 과정에서 직장과 직급을 내세워 압박한 사실은 없다고 해명했다. A씨는 13일 교육부 출입기자단에 보낸 사과문에서 ""선생님과 학교 관계자 등에게 마음의 상처를 드린 점 진심으로 사과드린다""라며 ""이번 불찰로 이제까지 아이를 지도하고 보호해 주신 선생님들의 감사한 마음조차 훼손될까봐 마음이 아프다""고 밝혔다.  ■ 하와이 산불 사망자 89명으로…""美 100년만에 최악의 화마"" 하와이 산불 사망자가 12일(현지시간) 현재 89명으로 불어나면서 미국에서 100여년 만에 최악의 산불 피해 참사로 남게 됐다. AP 통신 등에 따르면 조시 그린 하와이 주지사는 마우이섬 등을 덮친 산불 닷새째인 이날 현재 사망자가 최소 89명으로 집계됐다고 밝혔다. 그는 그러면서 사망자가 ""계속 늘어나고 있다""면서 ""다들 이에 대비하기를 바란다""고 말했다.  ■ 서울 전역에 폭염주의보 기상청은 13일 오전 10시를 기해 서울 전역에 폭염주의보를 발효한다고 밝혔다. 폭염주의보는 최고 체감온도 33도를 웃도는 상태가 이틀 이상 계속되거나 더위로 큰 피해가 예상될 때 내려진다.   ■ 이란 ""韓 동결자금 70억달러中 10억달러 줄어…원화값 하락 탓"" 이란 중앙은행 총재는 12일(현지시간) 한국에 동결된 자금이 약 70억 달러(약 9조3천240억원)에서 원화 가치 하락으로 거의 10억 달러 정도가 줄었다고 밝혔다. 이란 관영 IRNA 통신에 따르면 모하마드레자 파르진 이란 중앙은행 총재는 이날 한국 은행들에 몇년 간 이란 자금 약 70억 달러가 '무이자' 형태로 묶여있었다며 이같이 말했다. 그는 심지어 이란 자금 가치가 거의 10억 달러 줄어들었으며, 이는 달러당 원화가치가 내려갔기 때문이라고 덧붙였다.  ■ 임직원 비위 끊이지 않는 LH…2018년부터 징계 299건 한국토지주택공사(LH)가 철근 누락 사태를 계기로 또다시 조직문화 혁신과 대대적인 쇄신을 예고한 가운데 LH 임직원의 크고 작은 비위는 최근 수년간 끊이지 않은 것으로 나타났다. 13일 국회 국토교통위원회 소속 더불어민주당 박상혁 의원이 LH로부터 받은 징계 현황에 따르면 2018년부터 올해 8월 1일까지 LH 임직원의 내부 징계 건수는 299건으로 집계됐다. 징계 수위별로 보면 가장 낮은 수위인 견책은 160건으로 최다였고, 감봉 58건, 정직 32건, 파면 24건, 해임 18건, 강등 7건 등이었다.  ■ 신한은행, 타행 송금 1시간여 '불통' 후 복구 전산 시스템 장애로 신한은행의 타행 송금 서비스가 13일 1시간 이상 중단됐다. 신한은행에 따르면 이날 낮 12시 40분께부터 오후 1시 50분께까지 신한은행과 다른 은행을 연결하는 계정(대외계) 관련 전산망에 오류가 생겨 타행 송금 서비스 등이 이뤄지지 못했다.  ■ ""취득세 부담""…상반기 서울 아파트 증여 비중 3년반만에 최저 올해 상반기 서울 아파트 거래시장에서 증여 비중이 한 자릿수로 떨어지며 3년 반 만에 최저를 기록했다. 올해부터 증여 취득세가 올라 세 부담이 커진 반면, 지난해 꽉 막혔던 매매 거래는 회복세를 보이면서 증여 대신 매매를 택한 수요가 늘어난 것으로 보인다. 13일 한국부동산원의 아파트 거래량 통계에 따르면 올해 상반기에 거래된 서울 아파트 총 4만4천783건(신고일 기준) 가운데 증여 거래는 4천107건으로, 전체의 9.2%를 차지했다.  ■ 한국, 6∼7월 중국보다 일본과 무역서 더 큰 적자냈다 최근 우리나라의 대중(對中) 무역적자 폭이 줄어들면서 무역적자 상대국 순위에서 지난 6월과 7월 두달 연속 일본이 중국을 제치고 2위에 올랐다. 올해 들어 중국과의 무역수지가 큰 폭의 마이너스 행진을 이어가면서 중국은 중동을 제외하고 우리에게 최대 무역적자를 안겼는데, 6월 이후 대일(對日) 무역적자 규모가 더 커진 것이다. 우리나라는 일본과의 무역에서 만년 적자를 이어왔다. ","{'쏠쏠정보': '0', '흥미진진': '0', '공감백배': '0', '분석탁월': '0', '후속강추': '0'}"
2023-08-13 15:00:00,경제,취득세 인상에 증여 대신 매매 거래 회복세,"  올해 상반기 서울 아파트 거래시장에서 증여 비중이 한 자릿수로 떨어지며 3년 반 만에 최저를 기록했다. 올해부터 증여 취득세가 올라 세 부담이 커진 반면, 지난해 꽉 막혔던 매매 거래는 회복세를 보이면서 증여 대신 매매를 택한 수요가 늘어난 것으로 보인다. 13일 한국부동산원의 아파트 거래량 통계에 따르면 올해 상반기에 거래된 서울 아파트 총 4만4천783건(신고일 기준) 가운데 증여 거래는 4천107건으로, 전체의 9.2%를 차지했다. 이는 2019년 하반기 8.4% 이후 반기 기준으로 3년 반 만에 가장 작은 것이다. 사진은 13일 서울 시내 아파트의 모습.  ","{'쏠쏠정보': '0', '흥미진진': '0', '공감백배': '0', '분석탁월': '0', '후속강추': '0'}"
2023-08-13 15:00:00,경제,"배터리협회 ""투자 활성화 위해 세액공제 직접환급 도입 필요""","""IRA 등 대응해 한일 공조 필요…일본과 교류·협력 강화""   한국배터리산업협회가 배터리 투자 활성화를 위해 세액공제 직접환급 도입을 정부에 적극 건의하기로 했다. 또 공급망 안정을 위해 일본 배터리 업계와의 교류·협력도 강화할 방침이다. 박태성 배터리산업협회 상근부회장은 지난 9일 서울 서초구 협회 사무실에서 간담회를 열고 협회의 주요 성과와 향후 계획을 밝혔다. 박 부회장은 ""K-배터리가 국가 핵심 전략사업으로 발전하는데 협회가 중심축 역할을 하고자 협회명을 한국배터리산업협회로 바꾸고 새롭게 출범하게 됐다""며 ""지난 6개월간 미국 인플레이션 감축법(IRA) 관련 공급망 관련 이슈에 적극 대응해왔다""고 설명했다. 앞서 올해 2월 권영수 LG에너지솔루션 부회장이 신임 협회장으로 취임하면서 한국전지산업협회는 이름을 한국배터리산업협회로 바꿨다. 또 기존 연구개발(R&D)과 전시 사업 중심으로 구성됐던 조직을 정책지원·통상대응·회원사 지원 등 3개 실로 재편했다. 협회는 하반기 중점 추진 과제로 우선 세액공제 직접환급 도입을 꼽았다. 현행법상 국내에서는 이익이 발생해야만 세액공제를 받을 수 있는데, 첨단산업의 경우 초기 대규모 투자를 해도 실제 이익이 나기까지 상당한 시간이 걸려 적기에 세액공제를 받기 어렵기 때문이다. 김승태 정책지원실장은 ""배터리처럼 초기 대규모 투자가 필요한 사업의 경우 당장 이익을 내기 어려운 기업도 많다""며 ""이익이 나지 않더라도 투자 규모에 따른 세액공제분을 직접 환급해주면 투자 활성화에 도움이 될 것""이라고 했다. 앞서 국민의힘 김상훈 의원이 지난 5월 대표발의한 조세특례제한법 개정안은 국가전략기술 투자 기업이 이익을 내지 못하더라도 해당 세액공제분만큼 현금 지원을 받을 수 있도록 하는 내용을 담고 있다. 김 실장은 이어 ""한국배터리아카데미를 출범할 예정""이라며 ""현장에 필요한 인력이 적시 공급되도록 교육과정을 개발 중""이라고 설명했다. 또 ""상반기 민간 배터리 얼라이언스에서 도출한 회의 결과를 바탕으로 사용후 배터리 통합관리체계 관련 건의서도 마련해 제출할 것""이라고 덧붙였다. 아울러 최근 배터리 소재 분야에서 한중 기업 간 합작사 설립이 활발해지는 것과 관련해 박 부회장은 ""미국이 지정하는 해외우려단체(FEOC)와 상충 가능성이 있고, 아직 불확실성이 걷히지 않았다""면서도 ""하지만 마냥 기다릴 수는 없는 상황""이라고 말했다. 공급망 구축에 중국의 역할이 일정 부분 필요하다면 일단 협력의 틀을 만들어 놓고, 이후 FEOC 가이드라인이 나오면 대응하는 것이 합리적이란 것이다. 최근 한중 합작사들이 다수 출범하는 것과 관련해 일각에선 미국이 앞으로 공개할 FEOC의 범위에 따라 IRA 보조금 혜택을 못 받을 수 있다는 우려도 나온다. 협회는 공급망 구축에 있어 객관성, 투명성, 예측가능성이 필요하고, 다양성을 고려한 신축적 운영이 중요하다는 내용을 담아 미국 측에 의견서를 제출한 것으로 알려졌다. 협회는 한일 관계 정상화에 따라 일본의 유관 단체와의 교류 협력도 확대할 계획이다. 박 부회장은 ""최근 일본 완성차 업체와 한국 배터리 업체의 합작 투자 사례가 나오듯이 IRA 등에 대응해 한일 양국이 공동보조를 맞춰갈 필요가 있다""며 ""일본 배터리협회와 협력을 강화하고 하반기 성과를 내려고 한다""고 밝혔다. ","{'쏠쏠정보': '0', '흥미진진': '0', '공감백배': '0', '분석탁월': '0', '후속강추': '0'}"
2023-08-13 15:02:00,사회,태풍에 밀려온 해변 쓰레기 청소, 13일 강원 고성군 현내면 대진리 초도 해수욕장에서 공무원 및 봉사자들이 태풍으로 인해 밀려든 쓰레기를 치우고 있다.  [강원 고성군 제공. 재판매 및 DB 금지] ,"{'쏠쏠정보': '0', '흥미진진': '0', '공감백배': '0', '분석탁월': '0', '후속강추': '0'}"
2023-08-13 15:03:00,사회,태풍에 밀려온 해변 쓰레기 청소, 13일 강원 고성군 현내면 대진리 초도 해수욕장에서 공무원 및 봉사자들이 태풍으로 인해 밀려든 쓰레기를 치우고 있다.  [강원 고성군 제공. 재판매 및 DB 금지] ,"{'쏠쏠정보': '0', '흥미진진': '0', '공감백배': '0', '분석탁월': '0', '후속강추': '0'}"
