date,category,title,content,reaction
2023-08-03 10:30:00,사회,"박영수, 두번째 구속심사 ""번번이 송구…있는 그대로 말하겠다""","대장동 민간업자에게 19억 수수 혐의…이르면 오늘밤 구속 여부 결정   대장동 민간업자들을 돕는 대가로 거액의 금품을 수수했다는 '50억 클럽' 의혹을 받는 박영수(71) 전 특별검사가 3일 두 번째 구속 갈림길에 섰다. 서울중앙지법 윤재남 영장전담 부장판사는 이날 오전 10시 30분부터 청탁금지법 위반·특정경제범죄가중처벌법상 수재 등 혐의를 받는 박 전 특검의 두 번째 구속 전 피의자 심문(영장심사)을 열고 구속 필요성을 심리하고 있다. 6월30일 박 전 특검의 첫 번째 구속영장이 기각된 지 34일 만이다. 오전 10시 13분께 남색 정장 차림으로 법원에 출석한 박 전 특검은 심경을 묻는 취재진에게 굳은 표정으로 ""번번이 송구스럽다. 법정에서 있는 그대로 말씀드리겠다""고 답했다. '대장동 일당에게서 받은 거액의 돈이 사업 관련 청탁의 대가인가', '망치로 휴대전화를 부순 이유가 무엇인가' 등 질문에는 손을 내젓거나 입을 열지 않았다. 박 전 특검의 구속 여부는 이르면 이날 밤 결정될 전망이다. 박 전 특검은 2014∼2015년 우리은행의 사외이사 겸 의사회 의장, 감사위원으로 재직하며 대장동 민간업자들의 청탁을 들어주는 대가로 거액의 돈과 부동산을 약속받고 8억원을 수수한 혐의를 받는다. 검찰은 박 전 특검이 2015년 대한변호사협회 회장 선거 자금 명목으로 현금 3억원을 받고, 우리은행의 역할이 축소된 2015년 3∼4월 여신의향서 발급 청탁의 대가로 5억원을 받은 뒤 50억원을 약정받았다고 본다. 박 전 특검은 이러한 혐의로 6월 첫 번째 영장심사를 받았으나 법원은 박 전 특검의 직무 해당성 여부, 금품의 실제 수수 여부, 금품 제공 약속의 성립 여부 등에서 다툼의 여지가 있다며 구속영장을 기각했다. 이에 검찰은 대대적인 보강수사를 통해 그가 특검 재직 기간인 2019∼2021년 딸 박모씨를 통해 화천대유에서 '단기 대여금'으로 가장한 돈 11억원을 수수한 혐의(청탁금지법 위반)도 추가해 구속영장을 재청구했다. ","{'쏠쏠정보': 20, '흥미진진': 1, '공감백배': 3, '분석탁월': '0', '후속강추': 5}"
2023-08-03 10:30:00,정치,[연합뉴스 이 시각 헤드라인] - 10:30,"■ 강릉 간밤 '초열대야'…끝 모르게 이어지는 무더위 무더위가 끝 간 데 없이 이어지고 있다. 고온다습한 북태평양고기압이 우리나라를 완전히 덮으면서 3일도 대부분 지역 체감온도가 35도 내외까지 올라 매우 무덥겠다. 도심과 해안을 중심으로 간밤 열대야를 겪었다. 특히 강원 강릉시에서는 밤 최저기온(오후 6시 1분부터 이튿날 오전 9시 사이 최저기온)이 30.5도로 '초열대야'가 나타났다.  ■ 태풍 강타한 日오키나와서 2명 사망·58명 부상…16만 가구 정전 제6호 태풍 '카눈'이 강타한 일본 남부 오키나와현에서 2명이 사망하고 58명이 다쳤다고 현지 공영방송 NHK가 3일 보도했다. 보도에 따르면 지난 1일 오키나와섬 북부 오기미 마을에서 무너진 차고에 깔렸던 90세 남성이 숨진 데 이어 같은 날 오키나와섬 남부 우루마시에서 주택 화재로 화상을 당한 89세 여성이 병원에서 치료를 받았으나 다음날 사망했다. 부상자들은 야외에서 작업을 하던 중 강한 바람에 넘어지는 사고 등을 당한 것으로 알려졌다.  ■ 野김은경 ""어르신들 마음 상하게 한 점 정중히 사과"" 더불어민주당 김은경 혁신위원장은 3일 '노인 폄하 논란'을 불러일으킨 자신의 발언과 관련해 ""어르신들의 마음을 상하게 한 점에 대해 더 정중히 사과드린다""고 말했다. 김 위원장은 이날 오전 10시 여의도 민주당사 앞에서 기자들과 만나 ""지난 일요일 청년 좌담회에서의 제 발언에 대한 여러 비판과 논란에 대해 사과의 말씀을 드린다""며 이같이 말했다. 앞서 김 위원장은 지난달 30일 서울 성동구에서 열린 청년좌담회에서 과거 아들과의 대화를 소개하며 ""자기 나이로부터 여명까지 비례적으로 투표해야 한다는 게 자기(아들) 생각이었다""며 ""되게 합리적이지(않으냐)""라고 말해 논란을 빚었다.  ■ 이동관측 ""배우자, 남들 꺼리던 대의원 맡은것…1% 지분은 필요조건"" 이동관 방송통신위원장 후보자 측은 3일 일부 언론에서 '아파트 지분 쪼개기를 통한 배우자 증여 의혹'을 제기한 데 대해 ""주민들끼리 우리가 살 아파트 잘 만들어보자고 의기투합해 후보자의 처가 대의원으로 참여하기로 했고, 이를 위해 1% 이상 지분이 필요하다고 해 최소한으로 증여한 것""이라며 의혹을 일축했다. 이 후보자 측은 설명자료를 통해 ""후보자가 2001년부터 보유하고 있던 잠원동 아파트 재건축 추진이 막 시작될 2010년 당시에는 부동산 가격이 하락해 재건축이 별로 인기가 없던 때여서 진척이 지지부진했고, 조합원들은 대우가 좋은 조합 이사만 선호하고 대의원은 서로 맡기를 꺼리는 분위기였다""며 이같이 말했다. 그러면서 이 후보자 측은 ""후보자의 처는 잠원동 아파트 재건축 조합 대의원으로 활동하며 어떤 특혜를 받거나 로비에 관여한 일이 없다""고 강조했다.  ■ 서울 분양시장 활기 되찾아…올해 청약 경쟁률 급등 올해 들어 서울 아파트 청약경쟁률이 6배 이상 뛴 것으로 나타났다. 3일 부동산R114에 따르면 올해 1∼7월 서울에서 13개 단지, 1천334가구(일반공급) 모집에 9만198명이 몰려 평균 67.6대 1의 경쟁률을 기록했다. 이는 6천707가구 공급에 7만3천81명이 신청해 평균 10.9대 1의 경쟁률 보인 지난해 연간 기록과 비교하면 6배 이상 높은 것이다.  ■ '이차전지 급변동'에 MTS 켠 개미들…지난달 이용자 10만명 늘어 ""예전에 재미 삼아 이차전지주를 조금 사놓고 신경 안 쓰고 묻어뒀거든요. 그런데 이번엔 하도 주가가 난리라고 해서 증권사 앱을 열었다가 며칠 내내 주가 창만 봤네요."" 서울 마포구에 사는 직장인 한모(28) 씨는 최근 이차전지 종목의 주가 급변동 소식을 듣고 오랜만에 모바일트레이딩시스템(MTS) 앱에 접속했다. 이처럼 이차전지주들이 극심한 변동성을 보이자 한씨처럼 MTS에 접속하는 투자자들이 늘어난 것으로 나타났다.  ■ 美신용등급 강등에 세계증시 '휘청'…美장기국채 금리 연중 최고 국제 신용평가사 피치가 미국 국가신용등급을 강등하면서 안전자산 선호 심리가 강해진 가운데 2일(현지시간) 아시아를 시작으로 유럽·미국 증시가 일제히 하락했다. 블룸버그통신에 따르면 위험자산 기피 속에 기술주 중심의 나스닥지수는 전장보다 310.47포인트(2.17%) 밀린 13,973.45로 마감했고, 스탠더드앤드푸어스(S&P) 500지수는 전장보다 63.34포인트(1.38%) 떨어진 4,513.39에 거래를 마쳤다. 3월 저점 대비 20%가량 올랐던 S&P 500지수는 4월 25일(-1.58%) 이후 3개월여 만에 일일 최대 낙폭을 기록했다.  ■ 니제르 쿠데타 수장 ""굴복안해""…미국, 대사관 부분 대피령 니제르의 군사정변(쿠데타) 수장이 민주주의 정권 전복을 멈추라는 주변국 요청을 공개적으로 일축했다. AFP통신 등에 따르면 압두라흐마네 티아니 대통령 경호실장은 2일(현지시간) 텔레비전 연설을 통해 ""그 어디에서 오더라도 그 어떠한 위협에도 굴복하지 않을 것""이라고 말했다. 티아니 실장은 니제르 독립기념일을 하루 앞두고 한 이날 연설에서 ""니제르 내정에 대한 어떠한 간섭도 거부한다""고 입장을 밝혔다.  ■ 젤렌스카 ""러 승리는 최악 시나리오…민주주의 위해 싸운다"" 우크라이나를 침공한 러시아의 승리는 인류에게 최악의 시나리오가 될 것이라고 볼로디미르 젤렌스키 우크라이나 대통령의 부인 올레나 젤렌스카 여사가 경고했다. 젤렌스카 여사는 2일(현지시간) 공개된 영국 인디펜던트 TV 인터뷰에서 우크라이나 병사들이 세계의 민주적 균형을 위해 싸우고 있다면서 이같은 말로 우크라이나에 대한 지속적인 관심을 촉구했다. 그는 러시아의 광범위한 위협을 세계가 과소평가하고 있어 매우 걱정스럽다면서 러시아의 승리는 국제사회의 억지력이 작동하지 않는다는 뜻이며 힘과 충분한 자금력만 있으면 무엇이든 할 수 있다는 의미이기 때문에 이를 막아야 한다고 강조했다.  ■ 피프티·소속사 분쟁, 9일 조정 시도…비공개 심리 그룹 피프티 피프티와 소속사 어트랙트의 전속계약 분쟁의 조정기일이 이달 9일로 잡혔다. 3일 법조계에 따르면 서울중앙지법 민사합의50부(박범석 수석부장판사)는 9일 오후 3시30분에 피프티가 어트랙트를 상대로 낸 전속계약 효력정지 가처분 신청 사건의 조정기일을 연다. 조정기일은 비공개로 열린다. 재판부는 지난달 31일 이 사건을 조정에 회부하기로 결정했다. 조정회부는 법원이 판결보다는 타협을 통해 양측의 갈등을 원만히 해결하는 게 바람직하다고 판단할 때 이를 유도하는 절차다. ","{'쏠쏠정보': '0', '흥미진진': '0', '공감백배': '0', '분석탁월': '0', '후속강추': '0'}"
2023-08-03 10:30:00,정치,'후쿠시마 오염수 시찰단 보고서 폐기 촉구' 기자회견에서 발언하는 우원식 의원,  3일 오전 서울 여의도 국회 소통관에서 열린 '후쿠시마 오염수 시찰단 보고서 폐기 촉구' 기자회견에서 더불어민주당 우원식 후쿠시마원전오염수해양투기저지총괄대책위원회 상임위원장이 발언하고 있다.  ,"{'쏠쏠정보': '0', '흥미진진': '0', '공감백배': '0', '분석탁월': '0', '후속강추': '0'}"
2023-08-03 10:30:00,생활,"국립중앙박물관, 광복절 맞아 이봉창·윤봉길 의사 유품 공개", 국립중앙박물관이 광복절을 맞아 오는 5일부터 31일까지 상설전시실 1층 대한제국실에서 이봉창(1900∼1932)·윤봉길(1908∼1932) 의사의 유품과 데니 태극기를 특별 공개한다고 3일 밝혔다. 사진은 이봉창 의사(왼쪽)와 윤봉길 의사가 한인애국단에 입단하며 찍은 사진.   ,"{'쏠쏠정보': 1, '흥미진진': '0', '공감백배': '0', '분석탁월': '0', '후속강추': 1}"
2023-08-03 10:30:00,연예,"블랙핑크 지수, 배우 안보현과 교제…""조금씩 알아가는 단계"""," 이태수  걸그룹 블랙핑크의 지수가 일곱 살 연상의 배우 안보현과 교제 중이다. 지수의 소속사 YG엔터테인먼트는 3일 ""좋은 감정으로 서로를 조금씩 알아가고 있는 단계""라며 ""두 사람을 따뜻한 시선으로 지켜봐 주시면 감사하겠다""고 밝혔다. 이날 디스패치는 두 사람이 서울 시내에 있는 지수의 집에서 데이트했다고 보도했고, 소속사가 곧이어 교제 사실을 인정했다. 지수는 지난 2016년 8월 블랙핑크의 리드보컬로 데뷔해 개성 있는 음색과 빼어난 외모로 글로벌한 인기를 누리고 있다. 그는 지난 2021년 JTBC 드라마 '설강화'에서 여주인공 은영로를 연기하며 배우로도 데뷔했다. 올해 3월에는 솔로 데뷔 싱글 '미'(ME)를 내놔 타이틀곡 '꽃'으로 각종 음원 사이트와 TV 음악 프로그램 1위를 석권했다. 안보현은 지난 2007년 모델로 데뷔한 이래 '이태원 클라쓰'(2020), '유미의 세포들'(2021), '군검사 도베르만(2022) 등에 출연해 배우로도 얼굴을 알렸다. 최근 종영한 tvN 로맨틱 코미디 드라마 '이번 생도 잘 부탁해'에 주연으로 출연했다. ","{'좋아요': '0', '응원해요': '0', '축하해요': '0', '기대해요': '0', '놀랐어요': '0', '슬퍼요': '0'}"
2023-08-03 10:31:00,정치,'후쿠시마 오염수 시찰단 보고서 폐기 촉구' 기자회견에서 발언하는 우원식 의원,  3일 오전 서울 여의도 국회 소통관에서 열린 '후쿠시마 오염수 시찰단 보고서 폐기 촉구' 기자회견에서 더불어민주당 우원식 후쿠시마원전오염수해양투기저지총괄대책위원회 상임위원장이 발언하고 있다.  ,"{'쏠쏠정보': '0', '흥미진진': '0', '공감백배': '0', '분석탁월': '0', '후속강추': '0'}"
2023-08-03 10:31:00,사회,서울-양평 고속도로 관련 입장 발표하는 김동연,  김동연 경기도지사가 3일 오전 경기도 수원시 경기도청에서 서울-양평 고속도로 사업 관련 입장을 발표하고 있다.  ,"{'쏠쏠정보': '0', '흥미진진': '0', '공감백배': 1, '분석탁월': '0', '후속강추': '0'}"
2023-08-03 10:31:00,세계,Korean battery makers see market share fall in H1 despite solid growth,"battery makers-H1 market share Korean battery makers see market share fall in H1 despite solid growth By Kim Seung-yeon SEOUL, Aug. 3 (Yonhap) -- Three major South Korean battery makers saw their market share fall in the first half of the year from a year earlier despite solid growth, as bigger Chinese rivals further expanded their overseas foothold, a report said Thursday. The combined market share of the three -- LG Energy Solution Ltd. (LGES), Samsung SDI Co. and SK On Co. -- came to 23.9 percent in the January-June period, compared with 26.1 percent from the previous year, according to the latest data from industry tracker SNE Research. LGES came third with 14.5 percent, unchanged from a year earlier, after China's CATL and BYD, whose combined share represented more than 52 percent. SK On accounted for 5.2 percent, down from 6.8 percent, placing fifth. Samsung SDI ranked seventh with 4.1 percent, sliding from 4.8 percent from a year earlier. The decline in the market share of the Korean companies is far from indicating a slowdown but has more to do with the relatively explosive growth of the Chinese players that is continuing on the back of robust domestic demand, SNE Research said. All of the three Korean battery makers posted double-digit growth in the volume of the battery installments for the six months. The volume of batteries from LGES installed in electric vehicles reached 44.1 gigawatt hours (GWh), up 50.3 percent from 29.3 GWh in the first half of 2022. SK On logged 15.9 GWh, up 16.1 percent on-year from 13.7 GWh, while that of Samsung SDI grew 28.2 percent to 12.6 GWh from 9.8 GWh. Strong sales of green cars equipped with the batteries made by the three battery companies helped fuel the growth, the report said. LGES batteries are used in the Tesla Model 3 and Y, the Volkswagen ID 3 and 4, and Ford's Mustang Mach-E. SK On supplies for the Hyundai Ioniq 5, Kia EV6 and Mercedes-Benz EQA and EQB. Samsung SDI batteries are installed in the Rivian R1T and R1S pickup trucks, BMW i4, i7 and iX, and Audi E-Tron.  (END)","{'쏠쏠정보': '0', '흥미진진': '0', '공감백배': '0', '분석탁월': '0', '후속강추': '0'}"
2023-08-03 10:31:00,사회,서울-양평 고속도로 관련 입장 발표하는 김동연,  김동연 경기도지사가 3일 오전 경기도 수원시 경기도청에서 서울-양평 고속도로 사업 관련 입장을 발표하고 있다.  ,"{'쏠쏠정보': '0', '흥미진진': '0', '공감백배': '0', '분석탁월': '0', '후속강추': '0'}"
2023-08-03 10:32:00,사회,두번째 영장심사 받는 박영수 전 특검,  대장동 민간 개발업자들을 돕는 대가로 금품을 수수했다는 이른바 '50억 클럽' 의혹을 받는 박영수 전 특별검사가 3일 오전 구속 전 피의자 심문(영장심사)에 출석하기 위해 서울 서초구 서울중앙지방법원으로 향하고 있다.  ,"{'쏠쏠정보': '0', '흥미진진': '0', '공감백배': '0', '분석탁월': '0', '후속강추': '0'}"
2023-08-03 10:32:00,경제,"직방·교원그룹, 가상오피스 사업 활성화 협력","  직방은 교원그룹과 가상오피스 사업 활성화를 위한 업무협약(MOU)을 체결했다고 3일 밝혔다. 협약에 따라 두 회사는 교육에 특화된 메타버스 학습센터를 구축하고, 메타버스 활용 방안을 구체화하는 데 협력하기로 했다. 앞서 직방은 2021년 7월 국내 최초로 자체 개발한 가상오피스 '메타폴리스'를 해외 시장을 겨냥해 지난해 5월 '소마'로 업그레이드해 재출시한 바 있다. 현재 직방의 모든 임직원이 소마를 통해 원격근무를 하고 있다. 교원은 그간의 교육 사업 노하우를 바탕으로 소마에 교육 전용 메타버스 학습센터를 구축하고, 그룹 관련 파트너사와 스타트업 등을 위한 원격근무 공간을 마련할 계획이다. 교원은 ""소마를 통한 원격근무가 오프라인 사무실 근무와 차이점이 없다고 판단해 적극적으로 협약을 추진하게 됐다""고 설명했다. 협약식은 지난달 31일 가상 공간인 소마에서 직방 안성우 대표, 소마 김재은 대표, 교원 신영욱 대표이사와 이규진 상무 등이 참석한 가운데 열렸다. ","{'쏠쏠정보': '0', '흥미진진': '0', '공감백배': '0', '분석탁월': '0', '후속강추': '0'}"
2023-08-03 10:32:00,사회,서울-양평 고속도로 관련 입장 발표하는 김동연,  김동연 경기도지사가 3일 오전 경기도 수원시 경기도청에서 서울-양평 고속도로 사업 관련 입장을 발표하고 있다.  ,"{'쏠쏠정보': '0', '흥미진진': '0', '공감백배': '0', '분석탁월': '0', '후속강추': '0'}"
2023-08-03 10:32:00,사회,서울-양평 고속도로 관련 입장 발표하는 김동연,  김동연 경기도지사가 3일 오전 경기도 수원시 경기도청에서 서울-양평 고속도로 사업 관련 입장을 발표하고 있다.  ,"{'쏠쏠정보': '0', '흥미진진': '0', '공감백배': 1, '분석탁월': '0', '후속강추': '0'}"
2023-08-03 10:34:00,IT,"나주시, '나주형 전력반도체' 산업 육성 '잰걸음'","  전남 나주시는 최근 '나주형 전력반도체 산업육성 로드맵 보고회'를 개최하는 등 전력 반도체 산업 육성에 속도를 내고 있다고 3일 밝혔다. 나주시는 산학연 전문가로 출범한 전력반도체 산업 육성위원회를 최근 열고 국내외 관련 기업 유치 및 집적화 방안 등을 논의했다. 전력반도체는 전기·전자제품에서의 직류·교류 변환과 전압, 주파수 변화 등의 제어·처리를 수행하는 반도체로 신속한 전력 변환과 제어에 특화돼있다. 발전소와 같은 대규모 전력 시스템, 태양광 발전 인버터 등 재생에너지 시스템, 전기차, 산업 자동화 등에 쓰이며 전동화 추세가 빨라지면서 세계적인 수요가 증가하고 있다. 나주시는 지난 2월 전력반도체 산업 육성 조례 제정을 시작으로 4월 육성위원회 출범, 이번 보고회 개최 등 전력 반도체 산업 육성에 발 빠르게 대응하고 있다. 이번 보고회에서 전력 반도체 성장 동력 발굴을 목표로 관련 기업 유치와 집적화를 통해 대한민국의 전력 반도체 중심지로 자리매김한다는 계획이다. 특히 전력반도체의 어느 한 분야가 아닌 전력 소자, 전력 컨버터, 전력 모듈, 전력 시스템 등 분야별 특화 산업 육성에 중점을 둔다. 나주시는 ""전남도도 '전남 반도체 산업' 육성을 목표로 나주를 중심으로 한 전력 반도체 R&D(연구개발) 클러스터 조성을 선언하는 등 힘을 보태고 있다""고 설명했다. 윤병태 나주시장은 ""전남형 반도체 산업 육성에서 나주시의 역할이 무엇보다 중요하다""며 ""나주시가 대한민국 반도체 중심지가 될 수 있게 하겠다""고 말했다. ","{'쏠쏠정보': '0', '흥미진진': '0', '공감백배': '0', '분석탁월': '0', '후속강추': '0'}"
2023-08-03 10:34:00,사회,"통영 욕지도·사천 신수도와 마도, 섬 발전 특성화사업 선정","주민 소득 창출·관광 활성화…항로 지원·LPG 시설 구축사업 추진   경남도는 행정안전부가 주관하는 내년 '섬 발전 특성화사업'에 통영 욕지도, 사천 신수도와 마도 3개 섬이 새로 선정돼 총사업비 150억원을 확보했다고 3일 밝혔다. 섬 발전 특성화사업은 지속 가능한 섬마을을 조성하기 위해 주민 주도로 지역 자원을 활용해 소득을 창출하는 것을 지원한다. 이번에 선정된 3개 섬에는 각각 50억원을 지원해 주민 소득증대와 관광 활성화 사업을 펼친다. 선정된 섬 중 통영시 욕지도는 역대 도지사로는 처음으로 지난 5월 박완수 지사가 방문해 욕지도 우수 관광자원을 발굴해 남해안 관광거점으로 조성할 것을 약속했던 곳이다. 특히 욕지도 내 우리나라 근대 어촌의 발상지인 좌부랑개 마을의 역사적 가치를 살려 마을 골목 내 유휴상가 리모델링, 근대어촌 발상지 테마 활용, 욕지도 특산품 특화사업 개발 등을 시행할 예정이다. 2010년 '한국의 명품섬 베스트 10'에 뽑힌 사천 신수도와 말을 닮아 크고 웅장한 섬을 뜻하는 사천 마도도 이번 사업 선정으로 내년부터 다양한 주민 소득 창출 및 관광 활성화사업이 추진된다. 경남도는 섬 발전 특성화사업 이외에도 내년에 '섬 발전 내역사업'을 시행해 도내 섬 지역 기반시설 구축과 섬 주민 이동권 확보 등을 지원한다. 이 중 섬 주민 이동권 확보를 위해 선령 만기가 다가온 통영 사량도∼수우도를 운항하는 일신1호를 대체하는 데 15억원을 투입하는 등 '도선 건조사업'을 지원한다. 또 정기 여객선과 도선이 다니지 않아 소외된 섬에는 지자체가 직접 선박을 투입하는 '소외도서 항로 운영 지원사업'도 한다. 경남도는 도내 14개 소외도서 중 통영 오곡도, 고성 자란도 2개 섬의 항로 운영 지원을 위해 1억8천만원을 확보했고, 유휴 어선 수리나 용도 변경으로 소외도서 항로 운영을 지원한다. 이밖에 육지와 떨어져 연료 수급이 불안한 통영 곤리도 등 3개 섬에는 26억원을 들여 '섬마을 액화석유가스(LPG) 시설 구축사업'을, 10인 미만이 거주해 무인화될 위기에 처한 작은 섬을 대상으로 식수·전력·접안 시설 등 정주기반 시설을 조성하는 '작은 섬 공도 방지사업'도 추진 중이다. 김제홍 경남도 해양수산국장은 ""섬 관광 활성화로 활력 넘치는 섬을 조성하고 섬 주민들의 이동권 보장 등 생활 편익 증진을 위해 최선을 다할 것""이라며 ""경남이 세계 해양관광 중심지로 발돋움하도록 섬이 가진 고유한 자원을 적극 활용해 섬이 남해안 관광의 핵심 역할을 하도록 노력하겠다""고 말했다. ","{'쏠쏠정보': '0', '흥미진진': '0', '공감백배': 1, '분석탁월': '0', '후속강추': '0'}"
