date,category,title,content,reaction
2023-08-31 10:31:00,정치,"전차·자주포 등 450여대 참가…육군, 대규모 야외기동훈련","K1A2 전차·K9A1 자주포 실사격…하천 도하·장애물 개척 훈련도   육군은 31일 '을지 자유의 방패' 한미연합연습 기간 연합·합동 야외기동훈련의 하나로 수도기계화보병사단이 대규모 궤도장비 기동 및 전투사격 훈련을 실시 중이라고 밝혔다. 이번 훈련은 28일부터 4박5일 일정으로 경기도 포천과 강원도 철원 일대에서 진행되며 사단 장병 1천600여 명과 K1A2전차, K9A1 자주포 등 궤도 및 일반차량 450여대가 참가했다. 훈련 참가 부대는 주둔지인 경기도 가평에서 240여대의 궤도장비를 실기동하며 훈련지역인 강원도 철원까지 이동했다. 강원도 철원의 지포리훈련장에서는 K1A2 전차와 K21 장갑차의 전투사격 훈련이 실시됐다. K1A2전차 승무원들은 1.5km 이상 떨어진 거리에서 이동하는 적 전차를 정확히 명중시켰다. 소대전투사격 중에는 이동하던 K1A2 전차의 엄호 사격을 받은 K21 장갑차가 진지를 점령하고 40mm 기관포로 적을 타격했다. 이어 뒤따르던 전차들이 목표물을 향해 일제히 사격하며 적을 격퇴하는 장면이 연출됐다. 지뢰·낙석 등 적 장애물지대에서는 K600 장애물개척전차를 이용해 장애물을 돌파하고, 간편조립교를 구축해 기계화 부대의 기동로를 확보했다. 신성철(중령) 전차대대장은 ""우리 군이 보유한 최신 장비의 성능과 장병들의 전투역량을 유감없이 발휘할 수 있었다""며 ""적의 어떤 도발에도 임무와 역할을 당당히 수행해나가겠다""고 말했다. 문혜리훈련장에서는 K9A1 자주포의 포병사격이 진행됐다. 경계지대 극복, 방어지대 돌파 등 아군의 초월공격(책임지역 밖 적을 공격하는 것) 간 발생 가능한 다양한 상황에서 화력지원 요청에 따라 K9A1 자주포들은 표적을 정확히 타격했다. 또 철원군 강포저수지에서는 한미연합 제병협동 도하훈련이 이뤄졌다. 먼저 전차의 사격지원을 받으며 공격단정이 강을 건넜고 뒤를 이어 K21 장갑차와 KA12 전차 순으로 도하에 나섰고, 한미 공병부대가 부교를 설치하자 궤도 및 일반 차량도 강을 건넜다. 남궁경(중령) 기계화보병 대대장은 ""승무원들의 자신감 향상은 물론 제병협동 팀워크를 배양할 수 있는 기회가 됐다""며 ""완벽한 작전 수행능력을 통해 적 중심을 타격하고 격멸할 수 있는 능력과 태세를 갖추겠다""고 말했다. ","{'쏠쏠정보': '0', '흥미진진': '0', '공감백배': 4, '분석탁월': '0', '후속강추': '0'}"
2023-08-31 10:31:00,사회,"""빚 독촉·카드값 때문에…"" 금은방 턴 30대 구속 송치",  빚 독촉에 시달리다 금은방을 턴 30대 남성이 검찰로 넘겨졌다. 대전유성경찰서는 31일 A(30)씨를 절도죄로 구속 송치했다고 밝혔다. A씨는 지난 14일 오후 9시 5분께 유성구 궁동 한 상가 건물의 귀금속 매대에서 1천500만원 상당의 귀금속 25점을 훔쳐 달아난 혐의를 받는다. A씨는 해당 금은방이 매장이 아닌 귀금속 매대로 건물 내에 오픈돼 있어 잠금장치나 경비가 허술한 것을 노리고 범행 대상으로 삼은 것으로 밝혀졌다. 진열대도 문이 잠겨있지 않아 A씨는 밖에서 진열대로 손을 뻗어 14Ｋ·18Ｋ 등의 귀금속을 손쉽게 훔칠 수 있었다. 피해자인 금은방 주인은 다음날 출근한 뒤에야 일부 귀금속이 사라진 사실을 알고 경찰에 신고했다. 경찰은 현장 주변 폐쇄회로(CC)TV를 분석해 A씨의 동선을 역추적하는 등의 방식으로 A씨 주거지를 특정했다. 주거지 근처에서 잠복하던 경찰은 범행 이틀 만에 귀가하던 A씨를 현행범 체포했다. 일정한 직업이 없던 A씨는 카드값과 사채 독촉에 시달리자 이 같은 범행을 저질렀다고 경찰에 진술했다. 경찰은 A씨가 귀금속 일부를 현금화해 가족에게 준 110만원을 압수해 피해자에게 돌려줬다. 그러나 A씨는 나머지 귀금속 행방 등에 대해서는 끝까지 진술을 거부했다. ,"{'쏠쏠정보': '0', '흥미진진': '0', '공감백배': '0', '분석탁월': '0', '후속강추': '0'}"
2023-08-31 10:32:00,경제,"르노코리아, 르노 익스피리언스 '밸류 업'…""가격 경쟁력 강화""","XM3·QM6 등 트림 재정비·편의성 추가…10월까지 '르노 시티 로드쇼'   르노코리아자동차가 종합 고객 경험 프로그램 '르노 익스피리언스'(R: Xperience)를 업데이트한 두 번째 버전 '밸류 업'을 선보인다. 스테판 드블레즈 르노코리아차 사장은 31일 서울 중구 프레스센터에서 기자간담회를 열어 오는 9월부터 밸류 업 프로그램을 시행한다고 밝혔다. 르노 익스피리언스는 고객 만족을 높이기 위한 상품·서비스의 지속적인 개선, 시승을 비롯한 온오프라인 체험 기회 등을 아우르는 프로그램이다. 르노코리아차는 지난 3월 서울모빌리티쇼에서 첫선을 보인 르노 익스피리언스에 이어 약 6개월 만에 두 번째 버전을 공개했다. 이번 르노 익스피리언스는 XM3, QM6 등 주요 모델을 상품성 측면에서 업그레이드하고, 세그먼트별로 가격 경쟁력을 강화하는 데 중점을 뒀다고 드블레즈 사장은 소개했다. 쿠페형 스포츠유틸리티차(SUV)인 XM3는 2024년형으로 연식변경을 한다. XM3 라인업 중 가장 높은 판매량을 차지하는 1.6 GTe 모델에는 가성비를 높이고 풍부한 편의 사양을 제공하는 '인스파이어' 트림이 추가된다. 아울러 2024년형 XM3에는 디자인 디테일이 강화되고 360도 어라운드뷰 모니터 등의 첨단기능이 새로 적용된다. QM6 역시 가성비를 한층 극대화하는 방향으로 트림 구성을 대폭 재정비한다. 2인승 SUV인 QM6 퀘스트는 공간 활용성을 더 높이기 위해 기존 2열 하단을 수납공간으로 활용할 수 있는 '언더 플로어 스토리지'를 새로 장착한다. 이외에 XM3, QM6, SM6 등 모든 모델에 초미세먼지 고효율 필터가 적용되며, LED 도어스폿 램프도 추가된다. 이번 르노 익스피리언스를 통해 스마트폰으로 차량의 상태와 위치를 확인하고 차량 개폐 및 원격시동 등을 하는 커넥티비티 서비스가 스마트워치에서도 가능하도록 확대된다. 차내에서 식음료 등 상품을 주문·결제부터 픽업까지 할 수 있는 인카페이먼트 서비스도 편의성이 개선된다. 르노코리아차는 이번 르노 익스피리언스를 통해 강화된 상품과 서비스를 고객이 직접 경험해 볼 수 있도록 오는 10월 9일까지 '르노 시티 로드쇼'를 전국 5개 도시에서 순차적으로 진행한다. 르노 시티 로드쇼는 서울시청 인근 프레스센터 앞(9월 1∼3일), 광주 비엔날레 전시관 야외광장(9월 7∼10일), 대전 갤러리아백화점 타임월드 야외광장(9월 13∼17일), 롯데프리미엄아울렛 기흥 펫파크 인근(9월 20∼24일), 롯데프리미엄아울렛 김해 가야광장(10월 5∼9일)에서 진행된다. 드블레즈 사장은 ""제품, 커넥티비티, 서비스 등 르노코리아가 고객과 만나는 모든 접점에서 르노코리아만의 가치를 고객에게 선사할 수 있도록 전문성 있는 새로운 영업 마케팅 조직 구성과 함께 선보이게 됐다""고 말했다. ","{'쏠쏠정보': 1, '흥미진진': 1, '공감백배': '0', '분석탁월': '0', '후속강추': '0'}"
2023-08-31 10:32:00,정치,[인사] 조달청,과장급 전보  조달품질원 조사분석과장 안태석 ,"{'쏠쏠정보': '0', '흥미진진': '0', '공감백배': '0', '분석탁월': '0', '후속강추': '0'}"
2023-08-31 10:35:00,정치,하천 건너는 전차와 장갑차,  31일 강원 화천군 화천대교 일원에서 열린 육군 2공병여단·3기갑여단 강습 및 문·부교 도하 작전 훈련에서 전차와 장갑차가 부교를 이용해 하천을 건너고 있다.  ,"{'쏠쏠정보': '0', '흥미진진': '0', '공감백배': '0', '분석탁월': '0', '후속강추': '0'}"
2023-08-31 10:36:00,정치,하천 건너는 전차와 장갑차,  31일 강원 화천군 화천대교 일원에서 열린 육군 2공병여단·3기갑여단 강습 및 문·부교 도하 작전 훈련에서 전차와 장갑차가 부교를 이용해 하천을 건너고 있다.  ,"{'쏠쏠정보': '0', '흥미진진': '0', '공감백배': '0', '분석탁월': '0', '후속강추': '0'}"
2023-08-31 10:36:00,사회,도심 질주하는 블랙이글스,  공군 특수비행팀 블랙이글스가 31일 오전 서울 도심 상공에서 제75주년 국군의 날 축하비행 훈련을 하고 있다.  ,"{'쏠쏠정보': '0', '흥미진진': '0', '공감백배': '0', '분석탁월': '0', '후속강추': '0'}"
2023-08-31 10:36:00,사회,국군의날 축하비행 훈련하는 블랙 이글스,  공군 특수비행팀 블랙이글스가 31일 오전 서울 도심 상공에서 제75주년 국군의 날 축하비행 훈련을 하고 있다.  ,"{'쏠쏠정보': '0', '흥미진진': '0', '공감백배': '0', '분석탁월': '0', '후속강추': '0'}"
2023-08-31 10:36:00,사회,광명역서 50대가 흉기 휘두르고 시민 폭행…2명 경상,불안감 조성으로 경범죄 처분 받은 것에 불만…중상자는 없어   경기 광명역에서 여성을 폭행한 50대가 이를 말리는 시민에게 흉기까지 휘둘러 철도경찰에 체포됐다. 31일 서울지방철도특별사법경찰대에 따르면 이날 오전 8시 20분께 KTX 광명역 2번 출구에서 50대 남성 A씨가 30대 여성 B씨를 폭행하고 이를 말리는 30대 남성 C씨에게 철제 공구를 휘둘러 오른팔 부위를 다치게 했다. 이로 인해 B씨와 C씨가 가벼운 부상을 입어 치료를 받았다. A씨는 철도경찰에 의해 현장에서 체포됐다. 이에 앞서 A씨는 역사 내 불안감 조성으로 철도경찰로부터 경범죄 처분을 받은 것에 화가 나 주변을 배회하던 중 B씨 등과 마주쳐 범행을 저지른 것으로 파악됐다. 경범죄 처분을 받은 이유는 A씨가 역사를 이동하던 중 또 다른 여성과 시비가 붙어 다툼을 벌였기 때문이었던 것으로 전해졌다. 철도경찰은 A씨를 상대로 정확한 사건 경위를 조사하고 있다. ,"{'쏠쏠정보': 1, '흥미진진': '0', '공감백배': '0', '분석탁월': '0', '후속강추': 6}"
2023-08-31 10:36:00,정치,"육군 2군단, 화천서 도하 훈련",  31일 강원 화천군 화천대교 일원에서 열린 육군 2공병여단·3기갑여단 강습 및 문·부교 도하 작전 훈련에서 전차와 장갑차가 부교를 이용해 하천을 건너고 있다.  ,"{'쏠쏠정보': '0', '흥미진진': '0', '공감백배': '0', '분석탁월': '0', '후속강추': '0'}"
2023-08-31 10:38:00,정치,"육군 2군단, 화천서 도하 훈련",  31일 강원 화천군 화천대교 일원에서 열린 육군 2공병여단·3기갑여단 강습 및 문·부교 도하 작전 훈련에서 전차와 장갑차가 부교를 이용해 하천을 건너고 있다.  ,"{'쏠쏠정보': '0', '흥미진진': '0', '공감백배': 1, '분석탁월': '0', '후속강추': '0'}"
2023-08-31 10:38:00,경제,광주시 공공기관 직원 54명 채용 통합 필기시험,"  광주시는 산하 8개 공공기관 직원 54명을 채용하고자 통합 필기시험을 실시한다고 31일 밝혔다. 기관별 선발 예정 인원은  광주도시공사 9명  광주도시철도공사 21명  광주관광공사 3명  광주환경공단 14명  광주문화재단 1명  광주그린카진흥원 1명  광주시체육회 3명  광주시장애인체육회 2명이다. 응시 원서 제출 등 지원은 다음 달 18∼22일 광주시 공공기관 직원 채용 누리집에서 하면 된다. 기관 또는 분야별 중복 지원은 할 수 없다. 기관별 응시 자격, 시험 과목 등 자세한 내용은 다음 달 1일 오전 10시부터 광주시 공공기관 직원 채용 누리집(www.gwangju.saramin.co.kr), 광주시 누리집(www.gwangju.go.kr), 해당 공공기관 누리집에서 확인할 수 있다. 시험일은 10월 14일이며 필기시험 합격자 발표, 서류 전형, 면접시험, 최종 합격자 발표 등 절차는 해당 기관에서 자체적으로 진행한다. 지난해 하반기 공공기관 직원 채용 통합 필기시험에는 5개 기관 26명 선발에 1천572명이 지원해 60.5대 1의 경쟁률을 보였다. ","{'쏠쏠정보': '0', '흥미진진': '0', '공감백배': '0', '분석탁월': '0', '후속강추': '0'}"
2023-08-31 10:38:00,생활,조각가 한용진이 돌에 기록한 예술 세계…최순우 옛집서 전시,"내셔널트러스트 문화유산기금, '혜곡의 영감' 한용진 조각전 선보여   내셔널트러스트 문화유산기금은 다음 달 1일부터 서울 성북구 혜곡최순우기념관에서 조각가 한용진(1934∼2019)의 작품을 전시로 선보인다고 31일 밝혔다. 한용진 조각가는 한국 추상 조각 1세대 작가로 꼽힌다. 서울대 미대를 졸업하고 1960년대부터 미국 뉴욕에서 활동해 온 그는 자연석에 최소한의 인위적인 손질을 하는 석조 조각 작업을 펼쳐왔다. 과거 그는 석조 작업과 관련, ""잃어버린 자아 그리고 아직 찾지 못한 자아를 찾는 나는 돌에서 마음의 화평을 얻으려 한다""고 설명한 바 있다. '혜곡의 영감' 세 번째 행사로 열리는 전시에서는 한 작가의 예술 세계를 표현한 석조 작품 14점과 드로잉과 판화 11점 등을 한자리에서 보여줄 예정이다. 전시는 10월 28일까지 무료로 볼 수 있다. 혜곡최순우기념관(최순우 옛집)은 1930년대 지어진 근대 한옥으로, 국립중앙박물관장을 지낸 최순우(1916∼1984) 선생이 1976년부터 1984년까지 살던 집이다. 2002년 내셔널트러스트 운동으로 집을 매입한 뒤 시민문화유산 제1호로 개방하고 있다. ","{'쏠쏠정보': '0', '흥미진진': '0', '공감백배': '0', '분석탁월': '0', '후속강추': '0'}"
2023-08-31 10:38:00,경제,중국 8월 제조업 PMI 49.7…5개월 연속 경기수축 국면,"전월 대비 소폭 올랐지만 다섯달 연속 50 아래…비제조업은 51   중국의 공식 제조업 구매관리자지수(PMI)가 5개월 연속 50 아래로 떨어지며 경기 수축 국면이 계속되고 있는 것으로 나타났다. 중국 국가통계국은 31일 중국의 8월 제조업 PMI가 49.7로 집계됐다고 발표했다. 이는 6월 49, 전달 49.3보다는 소폭 상승한 것이지만 경기 확장을 의미하는 '50 이상'에는 이르지 못했다. 중국의 제조업 PMI는 지난 4월 49.2를 기록하며 50 밑으로 떨어진 뒤 5개월 연속 50 위로 올라서지 못하고 있다. 기업의 구매 담당자 대상 조사를 바탕으로 작성되는 PMI는 관련 분야의 경기 동향을 보여주는 지표로 50보다 높으면 경기 확장, 낮으면 경기 수축 국면을 각각 의미한다. 중국의 8월 비제조업 PMI는 51로 확장세를 유지했다고 국가통계국은 밝혔다. 다만 전월의 51.5에 비해서는 하락하면서 작년 12월(41.6) 이후 가장 낮은 수치를 기록했다. ","{'쏠쏠정보': '0', '흥미진진': '0', '공감백배': '0', '분석탁월': '0', '후속강추': '0'}"
2023-08-31 10:39:00,사회,"케이조선 ""조선업황 개선 뚜렷…선제적 대규모 자금조달 완료""",  케이조선은 조선업황이 뚜렷한 개선 흐름을 나타냄에 따라 운전자금 부족에 대비하기 위해 선제적으로 대규모 자금조달을 완료했다고 31일 밝혔다. 자금조달 규모는 총 1천100억원 상당이다. 지난 6월 이뤄진 대주주의 자금지원 300억원과 지난 30일 외부 기관에서 조달한 800억원을 합친 금액이다. 케이조선은 조선 시황 개선에 따라 수주량 회복세가 뚜렷해지고 있음에도 선박을 인도할 때 잔금을 몰아주는 방식의 헤비테일(Heavy Tail) 결제방식이 아직 유지되고 있어 운전자금 부담이 확대될 것으로 예상돼 자금조달을 완료했다고 설명했다. 그러면서 조선업 인력수급 문제에도 불구하고 지체상금(LD·Liquidated Damage)이 발생하고 있지 않아 수익성을 확보한 선박이 건조되는 2024년에는 자금여건이 호전될 것으로 전망했다. ,"{'쏠쏠정보': '0', '흥미진진': '0', '공감백배': '0', '분석탁월': '0', '후속강추': '0'}"
2023-08-31 10:39:00,생활,"[게시판] 식약처, 나트륨·당류 줄이기 댄스 챌린지 수상작 발표"," 식품의약품안전처는 나트륨과 당류를 줄인 건강한 식생활 실천을 위해 최근 온라인으로 공모한 '마이나슈(나트륨·당류 줄이기) 댄스 챌린지'에서 12편의 수상작을 선정, 31일 발표했다. 최우수상은 '나 잘했슈?' 팀의 '고마해라, 마이 무긋다이가' 작품이, 우수상은 '줄짠줄단' 팀의 '나당을 이겨낸 자랑스런 우리나라' 등 2편이 선정됐다. 수상작은 식약처가 운영하는 유튜브 채널 '마이나슈 TV'와 인스타그램 등에 공개하고 앞으로 '공식 마이나슈 안무'로 제작해 건강한 식생활 실천과 올바른 식생활 문화 정착을 위한 홍보 콘텐츠로 활용할 계획이다. ","{'쏠쏠정보': '0', '흥미진진': '0', '공감백배': '0', '분석탁월': '0', '후속강추': '0'}"
2023-08-31 10:39:00,정치,답변하는 박진 장관,  31일 국회에서 열린 외교통일위원회에서 박진 외교부 장관이 답변하고 있다.  ,"{'쏠쏠정보': '0', '흥미진진': '0', '공감백배': '0', '분석탁월': '0', '후속강추': '0'}"
2023-08-31 10:40:00,정치,답변하는 박진 장관,  31일 국회에서 열린 외교통일위원회에서 박진 외교부 장관이 답변하고 있다.  ,"{'쏠쏠정보': '0', '흥미진진': '0', '공감백배': '0', '분석탁월': '0', '후속강추': '0'}"
2023-08-31 10:40:00,생활,광명 도심 공원 7곳에 맨발로 걷기 좋은 황톳길 산책로 조성,"  경기 광명시는 시민이 맨발로 걸을 수 있는 황톳길 산책로를 내년까지 도심 속 7개 정원에 조성할 계획이라고 31일 밝혔다. 우선 철산2동 현충근린공원과 철산3동 왕재산근린공원에는 올해 안으로 각각 길이 430ｍ와 200ｍ의 황톳길 산책로를 조성할 예정이다. 내년에는 광명5동 너부대근린공원(500m), 광명7동 도덕산근린공원(200m), 하안2동 철망산근린공원(300m), 소하2동 덕안근린공원(300m), 일직동 일직수변공원(250m)에 각각 황톳길을 만든다. 황톳길은 기존의 산책로 일부에 황토를 보충하고 주변에 운동시설과 세족장 등 편의시설을 설치하는 방식으로 조성될 예정이다. 황톳길 관리는 시장 직속 노인위원회 일자리분과의 제안에 따라 노인에게 맡긴다. 맨발로 걸으면 건강효과가 배 이상 높은 것으로 알려지면서 광명시를 비롯한 여러 지자체가 도심 속 공원 등에 시민건강 증진을 위해 맨발 황톳길 등을 조성하고 있다. ","{'쏠쏠정보': '0', '흥미진진': '0', '공감백배': '0', '분석탁월': '0', '후속강추': '0'}"
2023-08-31 10:43:00,사회,'경남은행 횡령 공범' 증권사 직원 구속심사,"1천억원대 횡령 중 617억원 공모 혐의   BNK경남은행 직원의 1천억원대 횡령을 도운 혐의를 받는 공범인 증권사 직원 황모(52)씨가 31일 구속 전 피의자 심문(영장심사)에 출석했다. 서울중앙지법 유창훈 영장전담 부장판사는 이날 오전 10시 30분부터 특정경제범죄 가중처벌법상 횡령, 증거인멸 교사 혐의로 구속영장이 청구된 황씨의 영장심사를 열었다. 오전 10시 16분께 법원에 도착한 황씨는 출금전표를 위조해 대출금을 횡령한 혐의를 인정하느냐는 취재진 물음에 ""아닙니다""라고 짧게 답했다. 증거인멸 교사 혐의를 인정하냐는 질문에는 입을 열지 않고 법정으로 향했다. 사건의 주범 경남은행 투자금융부장 이모(51·구속)씨와 고교 동문인 황씨는 현재 한국투자증권에 재직 중인 것으로 전해졌다. 그는 2016년 8월부터 2021년 10월까지 부동산 시행사 직원을 사칭해 출금전표를 임의 작성하는 등 방법으로 약 617억원의 프로젝트파이낸싱(PF) 대출금을 횡령하는 데 공모한 혐의를 받는다. 두 사람은 횡령한 돈으로 서울 여의도에 페이퍼 컴퍼니를 설립, 주식에 투자해 수익과 거래 수수료까지 챙긴 것으로 조사됐다. 올해 7월 금융감독원이 이러한 정황을 수상히 여겨 조사를 시작하자 황씨는 지인에게 이씨가 사용하던 PC를 포맷하도록 증거인멸을 지시한 혐의도 있다. 당초 금감원은 이씨가 횡령·유용한 회삿돈이 약 562억원이라고 밝혔으나 검찰은 이씨가 여러 횡령한 PF 대출을 '돌려막기' 한 점을 고려할 때 횡령액이 최대 1천100억원에 이를 것으로 판단한다. 검찰은 구속된 이씨와 함께 황씨의 신병도 확보해 최장 내달 12일까지인 이씨의 구속 기간 내에 추가 횡령 여부와 범죄수익 은닉 규모 등을 규명할 방침이다. ","{'쏠쏠정보': '0', '흥미진진': '0', '공감백배': '0', '분석탁월': '0', '후속강추': '0'}"
2023-08-31 10:43:00,사회,"KB국민은행, 대백제전 후원금 1억원 충남도에 전달","  KB국민은행이 '2023 대백제전' 성공 개최를 위한 후원금 1억원을 31일 충남도에 전달했다. 도는 후원금을 다음 달 23일부터 17일 동안 공주·부여 일원에서 열리는 대백제전 콘텐츠 개발 등에 활용할 계획이다. 김태흠 충남지사는 이날 도청에서 열린 후원금 전달식에서 ""우리나라를 대표하는 역사 문화축제인 대백제전 발전에 큰 힘이 될 것""이라고 감사의 마음을 전했다. 김동록 KB국민은행 기관고객그룹 부행장은 ""찬란한 백제문화를 세계에 알리는 대백제전에 동참할 수 있어 매우 뜻깊다""고 답했다. ","{'쏠쏠정보': '0', '흥미진진': '0', '공감백배': '0', '분석탁월': '0', '후속강추': '0'}"
2023-08-31 10:43:00,세계,케냐 투르카나주 식수위생개선사업 종료식," 30일(현지시간) 오후 케냐 투르카나주 로드워에서 개최된 'UNICEF 투르카나주 기후변화대응력 강화를 위한 식수위생개선사업' 종료식에서 주요 인사들이 기념 촬영을 하고 있다. 임장희 코이카 케냐사무소장, 존 에루스 투르카나주 부지사, 앨리스 와오메 중앙정부 수자원부 장관, 샤힌 닐로퍼 유니세프 케냐사무소장 등이 참석했다. ","{'쏠쏠정보': '0', '흥미진진': '0', '공감백배': '0', '분석탁월': '0', '후속강추': '0'}"
2023-08-31 10:43:00,정치,"블랙이글스, 국군의 날 축하비행 연습",  공군 특수비행팀 '블랙이글스'가 31일 오전 서울 도심 상공에서 제75주년 국군의 날 축하비행 예행연습을 하고 있다.  ,"{'쏠쏠정보': '0', '흥미진진': '0', '공감백배': '0', '분석탁월': '0', '후속강추': '0'}"
2023-08-31 10:43:00,세계,케냐 투르카나주 식수위생개선사업 종료식서 인사하는 코이카 사무소장, 30일(현지시간) 오후 케냐 투르카나주 로드워에서 개최된 'UNICEF 투르카나주 기후변화대응력 강화를 위한 식수위생개선사업' 종료식에서 임장희 코이카 케냐사무소장이 인사말을 하고 있다.   ,"{'쏠쏠정보': '0', '흥미진진': '0', '공감백배': '0', '분석탁월': '0', '후속강추': '0'}"
2023-08-31 10:43:00,정치,외통위 준비하는 장관들,  31일 국회에서 열린 외교통일위원회에서 박진 외교부 장관과 김영호 통일부 장관이 서류를 준비하고 있다.  ,"{'쏠쏠정보': '0', '흥미진진': '0', '공감백배': '0', '분석탁월': '0', '후속강추': '0'}"
2023-08-31 10:43:00,정치,서울 상공 비행하는 블랙이글스,  공군 특수비행팀 '블랙이글스'가 31일 오전 서울 도심 상공에서 제75주년 국군의 날 축하비행 예행연습을 하고 있다.  ,"{'쏠쏠정보': '0', '흥미진진': '0', '공감백배': '0', '분석탁월': '0', '후속강추': '0'}"
