date,category,title,content,reaction
2023-08-31 01:06:00,세계,"러, 곡물협정 대안 제시…""러-튀르키예 외무장관 회담서 논의""(종합2보)","""튀르키예, 러 곡물 100만t 가공해 필요한 국가에 공급…카타르가 재정 지원"" 양국 외무장관 31일부터 이틀간 모스크바서 회담   러시아와 튀르키예가 외무장관 회담에서 흑해곡물협정 대안을 논의할 계획이라고 러시아 외무부가 밝혔다. 러시아는 카타르가 재정 지원을 하고 튀르키예가 러시아 곡물을 가공해 각국에 공급하는 방식으로 흑해곡물협정을 대신할 것을 제안했다. 마리야 자하로바 러시아 외무부 대변인은 30일(현지시간) 브리핑에서 세르게이 라브로프 러시아 외무장관이 모스크바를 방문하는 하칸 피단 튀르키예 외무장관과 오는 31일부터 이틀간 회담하면서 흑해곡물협정을 의제 중 하나로 다룰 예정이라고 말했다. 흑해곡물협정은 러시아가 우크라이나에서 '특별군사작전'을 벌이는 중에도 우크라이나가 흑해 항구들을 통해 곡물을 수출하도록 하는 협정으로, 지난해 7월 유엔과 튀르키예의 중재로 성사됐다. 그러나 러시아는 협정 내용 중 러시아의 비료·곡물 수출 관련 내용이 이행되지 않고 있다며 지난달 협정에서 철수했다. 러시아 외무부는 양국 외무장관이 러시아 곡물 100만t을 카타르의 재정 지원으로 튀르키예에 공급하는 대안을 논의할 예정이라고 밝혔다. 외무부는 이 대안이 블라디미르 푸틴 러시아 대통령의 계획이라고 설명했다. 이 방안에서 튀르키예는 카타르의 지원으로 러시아 곡물을 할인가에 공급받고, 이를 추가로 가공해 가장 필요한 국가에 제공하는 역할을 하게 된다. 외무부는 ""우리는 이 프로젝트가 흑해곡물협정에 대한 최선의 잠정적 대안이라고 간주한다""고 밝혔다. 외무부가 이날 발표한 성명에는 우크라이나 곡물 수출을 보장하는 방안은 언급되지 않았다. 다만 외무부는 흑해곡물협정이 중단된 이후로는 '흑해를 통해 우크라이나로 가는 선박을 모두 잠재적 군사 화물선으로 간주하겠다'는 기존 입장을 다시 한번 튀르키예 측에 전달할 방침이라고 밝혔다. 자하로바 대변인은 ""러시아의 참여 없이 흑해곡물협정이 운영되는 것은 불가능하다""고 강조했다. 자하로바 대변인은 라브로프 장관과 피단 장관이 회담에서 우크라이나, 시리아, 리비아, 남 캅카스 지역 등 국제 문제와 러시아와 튀르키예의 에너지 부분 프로젝트 등 양자 협력에 대해서도 논의할 예정이라고 덧붙였다. 우크라이나 사태와 관련해 외무부는 ""양 장관이 현 상황에 대한 의견을 나누고, 정치적, 외교적 해결 방안을 논의할 것""이라며 포로 교환 등 인도주의 문제도 다룰 예정이라고 밝혔다. 푸틴 러시아 대통령과 레제프 타이이프 에르도안 튀르키예 대통령도 조만간 러시아에서 정상회담을 갖고 흑해곡물협정 문제를 논의할 예정이나, 아직 구체적인 일정은 공개되지 않았다. 이날 드미트리 페스코프 크렘린궁 대변인은 양국 정상회담 일정에 대해 ""러시아에서 곧 열린다. 우리는 말 그대로 며칠 안에 공식 발표를 할 것""이라고 밝혔다. 튀르키예의 한 소식통은 타스 통신에 푸틴 대통령과 에르도안 대통령이 러시아 남부 도시 소치에서 회담한 이후 다수의 협정을 체결할 가능성이 있다고 전했다. ","{'쏠쏠정보': '0', '흥미진진': '0', '공감백배': 1, '분석탁월': '0', '후속강추': '0'}"
2023-08-31 01:06:00,세계,(LEAD) N. Korea in active negotiations with Russia for arms deal: NSC,"(LEAD) N Korea-Russia arms deal (LEAD) N. Korea in active negotiations with Russia for arms deal: NSC (ATTN: UPDATES with additional remarks, more information, background) By Byun Duk-kun WASHINGTON, Aug. 30 (Yonhap) -- A group of Russian officials recently trip to North Korea, indicating a potential arms deal between the two countries, a National Security Council (NSC) official said Wednesday. John Kirby, NSC coordinator for strategic communications, said the trip may be followed by high-level discussions that could lead to the provision of North Korean weapons to Russia for use in its war against Ukraine. ""We have new information, which we are able to share today, that arms negotiations between Russia and the DPRK are actively advancing,"" the NSC spokesperson told a virtual press briefing, referring to North Korea by its official name, the Democratic People's Republic of Korea. ""Following these negotiations, high level discussions may continue in coming months. Now, among these potential deals, Russia would receive significant quantities and multiple types of munitions from the DPRK, which the Russian military plans to use in Ukraine,"" he added. The reported trip to North Korea by Russian officials follows a high-profile visit by Russian Defense Minister Sergei Shoigu to Pyongyang in July, which then prompted suspicions that the two close neighbors may be seeking to advance their military cooperation. North Korea is said to have provided millions of infantry artillery shells and rockets to Russia late last year. North Korea has strongly and repeatedly dismissed the accusation. ""The DPRK has said publicly that they will not sell (weapons) to Russia. But we remain concerned that the DPRK continues to consider providing military support to Russia's military forces in Ukraine,"" Kirby told the press briefing. ""Russian Minister of Defense Sergei Shoigu recently traveled to the DPRK to try to convince Pyongyang to sell artillery ammunition to Russia,"" he added. ""Our information further indicates that following Shoigu's visit another group of Russian officials traveled to Pyongyang to follow up discussions about potential arms deals between the DPRK and Russia."" The NSC official noted that North Korea may also seek to provide raw materials for Russia's defense industrial base. ""These potential deals could also include the provision of raw materials that would assist Russia's defense industrial base, said Kirby, noting that ""export controls and sanctions are very much targeted at trying to eliminate Russia's ability to have those kinds of raw materials and basic ingredients."" ""We will continue to identify, expose and counter Russian attempts to acquire military equipment from the DPRK or frankly any other state that is prepared to support its war in Ukraine,"" he added.  (END)","{'쏠쏠정보': '0', '흥미진진': '0', '공감백배': '0', '분석탁월': '0', '후속강추': '0'}"
2023-08-31 02:10:00,세계,"한미일 ""북러간 무기거래 안보리 결의 위반…협상 중단해야""(종합)","3국 유엔대사 회견…""러, 자신이 찬성한 대북 결의 위반"" ""러의 이란산 드론 수입도 결의 위반…유엔, 러의 위반 조사해야""   유엔 주재 한미일 3국 대사들은 30일(현지시간) 북한과 러시아 간 무기 거래가 유엔 안전보장이사회(안보리) 결의에 위배된다며 협상을 중단할 것을 촉구했다. 린다 토머스-그린필드 유엔 주재 미국 대사는 이날 뉴욕 유엔본부에서 기자 회견을 열고 ""러시아는 우크라이나를 향해 사용할 다양한 종류의 탄약을 상당한 규모로 들여오는 것과 관련해 북한과 협상하고 있다""고 말했다. 그러면서 북한과 러시아간의 무기 거래 협상은 북한에 대해 모든 형태의 무기 거래를 금지한 유엔 안보리 결의 위반임을 지적하고 협상을 중단할 것을 요구했다. 이날 발표한 공동 선언문에는 한미일 3국과 영국이 참여했다. 회견에는 황준국 유엔 대사와 일본의 이시카네 기미히로 대사도 함께 참석했다. 토머스-그린필드 대사는 ""러시아는 자신이 찬성한 안보리 결의를 포함해 안보리가 만장일치로 통과시킨 북한의 핵무기 및 탄도미사일 발사 관련 다수의 제재 결의를 위반하게 될 것""이라고 경고했다. 이어 ""이번 일은 (북한이) 러시아에 무기를 팔 경우 러시아가 (북한의) 핵무기 개발을 방어해주고 나아가 허용해줄 수 있다는 잘못된 메시지를 핵무기 확산 추구자들에게 줄 것""이라고 비판했다. 또 그는 ""북한은 러시아에 무기를 판매하지 않을 것이라고 공개적으로 말해왔다""면서 ""북한은 러시아와의 무기 협상을 중단하고 공개적 약속을 지킬 것을 촉구한다""라고 말했다. 한미일은 나아가 러시아가 이란산 드론을 수입해 우크라이나 공격에 사용한 명백한 증거가 있다며 이 역시 이란산 무기 금수 조치를 담은 안보리 결의안을 위반한 것이라고 비판했다. 토머스-그린필드 대사는 ""유엔이 러시아의 안보리 결의 위반에 대해 조사 및 보고 의무를 이행하지 않는 것은 매우 실망스러운 일""이라고 지적했다. 또 러시아를 향해서는 ""핵확산 시도 정권을 지원하면서 안보리 상임이사국으로서의 책임을 무시하는 반복적인 행태는 용납할 수 없다""라고 비판했다. 토머스-그린필드 대사는 이어 ""우리는 북한의 대량살상무기 및 탄도미사일 프로그램을 다루는 것에 관한 협력을 지속해 강화할 것""이라며 ""이는 국제 평화와 안보와 관련한 긴급한 문제""라고 강조했다. ","{'쏠쏠정보': '0', '흥미진진': '0', '공감백배': 1, '분석탁월': '0', '후속강추': '0'}"
2023-08-31 02:14:00,세계,"아마존, '주 3일 출근' 압박…""안 지키면 해고될 수도""","  세계 최대 전자상거래 업체 아마존이 해고 가능성까지 언급하며 직원들의 사무실 출근을 압박하고 나섰다. 30일(현지시간) 미 경제 매체 인사이드 등에 따르면 앤디 재시 아마존 최고경영자(CEO)는 최근 내부 행사에서 직원들에게 ""회사의 출근 규정을 따르지 않는다면 다른 일자리를 고려하는 것이 낫다""고 말했다. 그는 ""사무실 복귀는 비즈니스 결과를 포함한 다양한 요인을 평가해 판단한 결과""라며 ""무기한 원격 근무 정책을 뒷받침할 데이터는 거의 없고, 과거에 제한된 데이터를 기반으로 판단을 내려야 했다""고 설명했다. 이어 ""직원들을 사무실로 복귀시키는 회사의 결정에 직원들이 동의하지 않고 비판할 권리는 있지만, 정책을 무시할 권리는 없다""며 ""회사 정책을 받아들일 수 없는 직원들은 아마존에 남을 가능성이 작아 보인다""고 전했다. 그의 언급은 아마존이 코로나19 기간 재택근무를 해오다 지난 5월부터 직원들에게 주 3일 출근을 하도록 하고 있지만, 잘 지켜지고 있지 않은 데 따른 것이다. 지난 5월 직원 1천명은 주 3일 출근이 ""경직되고 획일적인 명령""이라며 파업을 벌였고, 사측은 직원들에게 출퇴근 기록을 추적하고 나선 것으로 알려졌다. 재시 CEO는 그러면서 ""모든 팀원은 일주일에 3일은 출근해야 하고 이를 거부하는 것은 옳지 않다""며 ""이를 지키지 않으면 회사를 떠나야 할 수도 있다""고 거듭 강조했다. 최근 버지니아주 알링턴에 제2의 본사를 오픈한 아마존은 지난달에는 소규모 사무실이나 원격으로 일하는 근무자에게 샌프란시스코와 뉴욕, 텍사스 등 대도시의 사무실로 옮길 것을 통보했다. 이에 대도시 근무를 위해 거주지까지 이전해야 하는 직원들은 이에 반발해 사직을 고려하는 것으로 알려졌다. 앞서 구글은 지난해 4월부터 시행해 온 '주 3일 출근'이 잘 지켜지지 않자 지난 6월에 ""이를 지키지 않으면 인사 고과에 반영될 수 있다""고 경고하기도 했다. ","{'쏠쏠정보': '0', '흥미진진': '0', '공감백배': '0', '분석탁월': '0', '후속강추': '0'}"
2023-08-31 02:16:00,세계,"中외교 ""'하나의 중국' 준수해야""…英외무 ""정상 간 대화 필요""(종합3보)","왕이 ""양국 관계 전략적 선택 직면…상호존중하고 평등하게 대우해야"" 클레벌리 ""우크라서 中 역할 강조…홍콩 국보법 문제·대만 해협 안정 강조""  최윤정  5년 만에 이뤄진 영국 고위급 관료의 중국 방문에서 양국 인사들은 관계 개선의 필요성에는 공감했으나 긴장을 완전히 풀지는 못하는 모습이었다. 제임스 클레벌리 영국 외무부 장관은 30일 중국 베이징을 방문해 한정 국가부주석과 왕이 공산당 중앙정치국 위원 겸 외교부장과 연이어 회동했다. 중국 외교부에 따르면 왕 부장은 이날 오후 클레벌리 장관을 만나 ""역사 진화의 시각에서 볼 때 중·영 관계는 어디로 갈지 전략적 선택에 직면해 있다""며 ""중국은 항상 영국의 대국 지위와 역할을 중시하고 안정적·호혜적 양국 관계를 위해 힘쓰며 양국 협력이 세계에 영향을 끼친다고 생각한다""고 말했다. 이어 왕 부장은 ""상호존중을 견지하고 평등하게 대우하며 서로의 발전을 객관적으로 바라보고 이해와 신뢰를 높이면 중·영 관계는 장애물을 제거할 수 있고 광활한 전망을 개척할 수 있다""고 주장했다. 왕 부장은 특히 영국 하원이 대만을 '독립 국가'로 언급한 사실을 고려한 듯 대만 독립과 대만해협의 안정을 사자성어 '수화불용'(水火不容·물과 불처럼 서로 어울리지 못한다는 의미)에 비유하며 ""영국은 중국의 핵심 이익을 존중하고 하나의 중국 정책을 준수해야 한다""고 강조했다. 이에 대해 클레벌리 장관은 중국의 빈곤 탈출과 경제발전을 높이 평가한 뒤 ""영국과 중국은 유구한 역사와 글로벌 비전을 가진 대국으로 긍정적인 양국 관계는 양국 국민과 세계에 혜택을 줄 것""이라고 화답했다. 이어 ""대만 문제에 대한 영국 정부의 입장은 변화 없으며 '하나의 중국' 정책을 견지하고 있다""면서 ""영국은 중국과 소통을 강화하고 적극적인 행동으로 어려움을 해결하며 이해를 높이기 위해 노력하고 있다""고 말했다. 또 ""영국 기업은 중국과 협력하고 중국 시장을 개척하기를 기대하고 있다""며 ""양국 정부는 경제 무역 관계를 긴밀하게 하고 과학기술·인공지능·친환경 에너지 분야 협력을 강화해 미래 세대를 행복하게 해야 한다""고 강조했다. 로이터 통신에 따르면 클레벌리 장관은 아울러 ""장관 대 장관 등 상호 간 소통 채널을 유지하는 게 중요하다""며 ""물론, 궁극적으로는 우리 총리와 중국 주석이 직접 대화할 기회를 갖는 것도 중요하다""고 강조했다. 왕 부장과 클레벌리 장관은 이밖에 우크라이나 문제, 한반도 핵 문제 등에 대해서도 의견을 교환했다고 중국 외교부는 전했다. 클레벌리 장관은 왕 부장을 만나기에 앞서 한정 국가 부주석도 만났다. 이 자리에서 한정 부주석은 ""양국의 각 분야 실무협력이 긍정적인 성과를 거두고 있다""며 ""양국 정부는 기업을 위한 좋은 비즈니스 환경을 조성하고 실무 협력의 새로운 성장점을 적극적으로 모색해야 한다""고 강조했다. 클레벌리 장관도 ""중국과 고위급 교류와 전략적 소통을 강화하고 공감대를 결집하고 협력을 심화하기를 원한다""고 말했다. 이날 중국 고위급과의 회동에 앞서 ""의견이 다른 부분은 직접적이고 명확하게 얘기하겠다""고 했던 클레벌리 장관은 러시아·우크라이나 전쟁 종식을 위한 중국의 역할을 촉구하기도 했다. 그는 블룸버그 통신 인터뷰에서 ""중국 관리들에게 우크라이나 영토 보전을 위한 과거 약속을 지킬 것을 촉구했다""고 밝혔다. 그는 ""러시아의 우크라이나에 대한 야만적인 침공은 모스크바나 다른 어떤 곳에서도 정당화될 수 없다""고 강조했다. 영국 외무부도 성명을 내 클레벌리 장관이 이번 방문에서 중국이 홍콩에 부과한 국가보안법으로 인한 피해 문제를 거론했으며, 이와 관련해 영국 의원에 대한 제재 해제를 촉구했다고 밝혔다. 아울러 대만 해협의 평화와 안정의 중요성도 강조했다고 덧붙였다. 클레벌리 장관은 왕이 외교부장의 초청으로 중국을 공식 방문했다. 영국 고위 관료의 중국 방문은 2018년 제러미 헌트 당시 외무장관 방중 이후 5년 만에 처음이다. 클레벌리 장관은 당초 지난달 중국을 방문할 계획이었으나, 친강 중국 외교부장이 갑자기 경질되면서 방문 일정이 지연된 것으로 알려졌다. 영국과 중국 관계는 한동안 황금기를 누렸으나 지난 수년간은 홍콩 국가보안법, 영국 내 중국 스파이 활동, 중국의 러시아 지원 등과 관련해서 극도로 냉각됐다. 영국은 그러나 작년 10월 리시 수낵 총리가 취임한 후로는 무역, 기후변화, 전염병 예방 등에서는 중국과 협력하는 것이 국익에 부합한다며 전보다 유화적인 태도를 보이고 있다. 수낵 총리는 다음 달 주요 20개국(G20) 정상회의에서 시진핑 국가 주석과 회담을 모색 중인 것으로 알려졌다. 그러나 영국 의회에선 이런 유화 분위기에 반발하는 움직임도 나오고 있다. 영국 하원 외교위원회는 클레벌리 장관의 중국 방문에 맞춰 대만을 독립 국가로 인정하는 내용의 보고서를 채택했다. 또 미국·영국·호주의 안보동맹인 '오커스'(AUKUS) 합의 중 첨단 방위기술 협력 관련 협정에 한국과 일본을 가입시켜야 한다는 내용의 보고서도 내놨다.  ","{'쏠쏠정보': '0', '흥미진진': '0', '공감백배': 1, '분석탁월': '0', '후속강추': '0'}"
2023-08-31 02:26:00,세계,2025년에 전기자동차 보유비용 내연기관차와 같아진다,"PwC 전세계 신차판매량 중 전기차 비중 2030년 40%·2040년 70% 2030년 전세계 전기모빌리티 시장 판매규모 1천215조원  이율 특파원 = 오는 2025년이면 전기자동차를 사서 유지하는 데 드는 총소유비용(TCO)이 내연기관차와 같아진다는 분석이 나왔다. 글로벌 회계·컨설팅업체 프라이스워터하우스쿠퍼스(PwC) 산하 기업컨설팅 부문 스트래터지&의 분석보고서에 따르면 차세대 전기차가 출시되는 2025년에는 모든 차종에 걸쳐 전기차의 TCO가 내연기관차와 같아진다고 디벨트가 30일(현지시간) 전했다. 독일자동차클럽 ADAC의 분석에 따르면 이미 지금도 폭스바겐 ID.3의 TCO가 내연기관차 골프보다 저렴하다. 반면에 BMW i4의 경우에는 내연기관차 430i보다 TCO가 비싸다. 테슬라 모델3과 같은 중형차의 경우에는 디젤가격이 1L당 1.5유로인 경우 전기가격이 1KW당 80센트에 다다를 때까지 전기차의 TCO가 내연기관차보다 저렴했다. 중형차 미만에서는 전기차의 TCO가 거의 모든 경우 내연기관차보다 높았다. ADAC는 차량 구매부터 연료가격에 더해 보험, 수리비용, 세금, 타이어마모 등 유지비용을 함께 계산했다. 전기차의 운영비용이 원칙적으로 내연기관차보다 저렴한 가운데, 전반적인 차이를 만드는 것은 구매가격이다. 구매가격은 배터리가격에 좌우된다. 저장장치가 클수록 가격은 비싸다. 이는 고성능 세단보다는 소형차에서 더 중요해진다. 스트래터지&은 배터리를 포함한 동력장치의 비용은 2030년에는 30% 하락할 것으로 내다봤다. 배터리셀과 전기모터에서 비용 절감이 이뤄질 것이라는 전망이다. 이에 더해 전기차의 동력장치는 더욱 효율적으로 될 것이라는 게 이들의 분석이다. 충전시 도달거리가 50% 늘어나고, 충전 속도는 2배로 늘어날 것으로 이들은 분석했다. 고급·럭셔리 차량의 경우 10분 만에 400km 이상을 달릴 수 있는 분량의 전기를 충전할 수 있게 되고 도달거리가 800km 이상이 될 것이라고 이들은 내다봤다. 스트래터지&은 기술 도약과 맞물려 2030년에는 전세계 신차판매량 중 전기차가 40%를, 2040년에는 70%를 차지하게 될 것이라고 내다봤다. 특히 혁신은 고급 차량부터 시작되는 만큼 2040년에는 모든 프리미엄 승용차 중 90%가 전기차고, 전체 시장에서는 80%, 입문 차량 부문에서는 60%가 전기차가 될 것이라는 게 이들의 전망이다. PwC는 2030년 전세계 전기모빌리티 시장 판매규모가 8천400억 유로(1천215조원)에 달할 것이라고 전망했다. ","{'쏠쏠정보': 4, '흥미진진': '0', '공감백배': 1, '분석탁월': '0', '후속강추': '0'}"
2023-08-31 02:30:00,세계,"美당국 ""테슬라 오토파일럿 켜고 장시간 방치 가능""…조사 확대","운전자 개입 없이 주행 연장 가능한 설정 확인…""부주의 늘어날 우려"" 관련 자료 제출 명령…테슬라의 '운전자 부주의 조장 책임론' 커질 듯   전기차 업체 테슬라의 주행보조장치인 오토파일럿(Autopilot)의 결함 여부를 조사 중인 미국 교통 당국이 운전자의 개입 없이 주행을 장시간 방치할 수 있게 하는 기능의 존재를 파악하고 관련 조사를 진행 중인 것으로 확인됐다. 미 도로교통안전국(NHTSA)은 지난달 26일(현지시간) 테슬라에 서한을 보내 오토파일럿 기능만으로 장시간 차량을 주행할 수 있게 하는 시스템 변경 사항과 관련해 각종 데이터를 제출하라고 명령했다고 30일 밝혔다. NHTSA는 이 서한에서 ""최근 NHTSA는 테슬라가 오토파일럿 사용 중 운전대에 힘을 가하라는 알림이 뜨지 않는 상태로 장시간 주행할 수 있게 하는 설정을 도입했다는 것을 알게 됐다""고 말했다. 이어 ""NHTSA는 이 기능이 일반 소비자들의 차량에 도입되고, 해당 기능의 존재가 널리 알려지면서 더 많은 운전자가 이 기능을 활성화하려고 시도할 것을 우려하고 있다""며 ""이는 결국 운전자의 부주의를 늘리고 운전자가 오토파일럿을 제대로 통제하지 못하게 할 수 있다""고 지적했다. 그러면서 ""안전법 및 관련 규정 준수 여부를 감독하고 테슬라가 운전자 모니터링 시스템에 적용한 변경 사항과 안전에 미치는 잠재적 영향을 평가하기 위해 특별 명령을 발령한다""고 밝혔다. NHTSA는 관련 조사를 위해 해당 소프트웨어 업데이트를 도입한 날짜와 업데이트의 구체적인 내용, 업데이트가 적용·설치된 차량 수, 변경 사항 도입 목적 등에 대한 자료를 모두 제출하라고 테슬라에 명령했다. 자료 제출 기한은 서한 발송 이래 한 달 뒤인 이달 25일이었다. 테슬라는 기한 내에 답변을 제출했으며, NHTSA는 이후 지난 29일에야 해당 내용을 홈페이지에 공개했다. 앞서 경제매체 CNBC는 지난 6월 한 보안 전문가의 조사 결과를 인용해 테슬라의 오토파일럿이나 자율주행 시스템에서 운전자의 개입을 지시하는 경고음을 끈 채로 장시간 주행할 수 있는 설정이 존재한다고 보도했다. 그동안 테슬라는 오토파일럿이나 자율주행 기능을 이용하는 운전자들에게 ""항상 주의를 기울여야 하며, 운전대에 손을 올려놓고 차량을 통제하는 것은 운전자의 책임""이라고 강조해 왔다. 하지만 이런 경고음 알림을 끈 상태로 자율주행을 방치하게 하는 설정을 도입했다는 사실이 확인되면 테슬라가 운전자의 부주의를 조장했다는 책임을 피할 수 없을 것으로 미 매체들은 전망했다. NHTSA는 오토파일럿 기능을 작동한 테슬라 차량이 응급 차량 등과 충돌하는 사건이 잇따르자 2021년 8월 관련 조사에 착수했다. 당국은 특히 오토파일럿 시스템이 운전자의 부주의에 대해 제대로 경고를 보냈는지 등을 면밀히 조사해 왔다. ","{'쏠쏠정보': '0', '흥미진진': '0', '공감백배': '0', '분석탁월': '0', '후속강추': 1}"
