date,category,title,content,reaction
2023-08-14 02:50:00,세계,"멕시코 또 버스 사고 ""7명 사망""…한국대사관 ""항공편 권장""","  최근 멕시코에서 장거리 이동 버스 사고가 빈번하게 발생하고 있다. 주멕시코 한국대사관은 한국인 여행객과 교민의 버스 이용 자제를 권고했다. 멕시코 고속도로를 운영·관리하는 카푸페(CAPUFE)는 13일(현지시간) 소셜미디어 엑스(X·옛 트위터)에 ""멕시코시티∼케레타로를 잇는 고속도로에서 사고가 발생해 오전 한때 멕시코시티 방면 차량 통행을 폐쇄했다""고 밝혔다. 현지 매체 '포로TV'에 따르면 이날 오전 5시께 멕시코주 멕시코시티∼케레타로 고속도로 84㎞ 지점(멕시코시티 기점)에서 버스가 차로를 이탈해 인근 풀숲으로 빠지면서 옆으로 넘어졌다. 이 사고로 최소 7명이 숨지고, 13명이 다쳤다. 사망자 중에는 젖먹이를 포함한 미성년자도 있다고 멕시코 일간지 엑셀시오르는 보도했다. 사고 차량은 멕시코시티에서 590㎞가량 떨어진 할리스코주 시우아드구스만에서 출발한 장거리 버스라고 경찰은 밝혔다. 고속도로 경찰은 ""버스가 과속으로 달렸다""는 목격자 진술도 확보했다. 현지 매체는 졸음운전 등 운전자가 차량을 통제하지 못하는 상황이 있었을 가능성에 대해 경찰이 조사하고 있다고 전했다. 멕시코에서는 수개월 새 버스 사고에 따른 인명 사고가 잇따르고 있다. 앞서 열흘 전에는 멕시코 서부 나야리트주에서 버스가 도로 옆 계곡으로 추락하면서 최소 17명이 숨졌고, 지난달 5일 남부 오악사카주에서는 버스가 20ｍ 아래 낭떠러지로 추락해 29명이 사망했다. 4월에도 나야리트주에서 버스 추락으로 18명이 목숨을 잃었다. 남한보다 20배 가까이 넒은 면적(197만㎢)의 멕시코에서는 육로 이동 시 기차보다는 버스 같은 차량이 주 이동 수단으로 활용된다. 운전자 2명의 교대 운전에 의지해 야간에도 운행하는 버스도 그중 하나다. 그러나, 계곡과 산길 등 급경사 도로가 많아 주의가 필요하다. 주멕시코 한국대사관은 ""최근 여러 건의 사고에서 한국인 피해자는 없었지만, 버스 이용 시 자칫 큰 사고로 이어질 가능성이 높다""며 ""장거리 여행 시 경비 절감을 이용해 무리해서 버스를 택하기보다는 항공편을 이용할 것을 권장한다""고 당부했다. ","{'쏠쏠정보': 9, '흥미진진': 8, '공감백배': 14, '분석탁월': 7, '후속강추': 18}"
2023-08-14 02:53:00,스포츠,"신지애, AIG 여자오픈 3위…한국 선수 2년 만에 '메이저 무관'","부, 올해만 메이저 2승 포함 3승…'안니카 어워드' 수상  최윤정 특파원  일본여자프로골프(JLPGA) 투어에서 활동하는 베테랑 신지애(35)가 미국여자프로골프(LPGA) 투어 메이저 대회에서 또 한 번 상위권 성적을 내며 '클래스'를 입증했다. 신지애는 13일(현지시간) 영국 잉글랜드 서리의 월턴 히스 골프클럽(파72·6천713야드)에서 열린 AIG 여자오픈(총상금 900만 달러) 최종 4라운드에서 버디 3개와 보기 하나를 묶어 2언더파 70타를 쳤다. 최종 합계 7언더파 281타를 기록한 신지애는 단독 3위로 대회를 마쳤다. 우승자 릴리아 부(미국·14언더파 274타)와는 7타 차다. 신지애는 지난달 US여자오픈 준우승에 이어 이번 시즌 LPGA 투어 메이저 대회에서 두 번째 '톱3' 성적을 냈다. LPGA 투어 11승을 비롯해 각국 프로 대회에서 통산 64승을 올린 신지애는 2014시즌부터는 일본 투어에 전념하고 있다. LPGA 투어는 일본, 호주에서 열리는 대회 정도만 가끔 나서다가 4년 만의 '미국 나들이'였던 US여자오픈에서 선전했고, 이번 대회에서도 한국 선수 최고 순위를 기록하며 저력을 뽐냈다. AIG 여자오픈이 '브리티시 여자오픈'으로 불리던 2008년과 2012년 정상에 올랐던 신지애는 이 대회엔 7년 만에 출전해 또 한 번 좋은 기억을 남겼다. 현역 LPGA 투어 선수 중엔 김효주와 양희영이 공동 4위(6언더파 282타)로 가장 좋은 순위를 기록하며 이번 시즌 5개 메이저 대회가 모두 막을 내린 가운데 한국 선수 우승자는 나오지 않았다. 지난해 6월 KPMG 여자 PGA 챔피언십의 전인지 이후 7개 대회 메이저 우승 소식이 끊겼다. 한국 선수들은 2021년 11년 만에 '메이저 무관'에 그쳤고, 지난해 전인지의 우승으로 체면치레했으나 올해 다시 우승 없이 지나갔다. 최근 3개 시즌을 통틀어 메이저 대회 우승이 한 차례 뿐이다. 찰리 헐(잉글랜드)과 공동 선두로 최종 라운드에 나섰던 부는 이날 5타를 줄여 2위 헐(8언더파 280타)을 6타 차로 크게 따돌리고 우승을 차지했다. 우승 상금은 135만 달러(약 18억원)다. 부는 올해 2월 혼다 LPGA 타일랜드에서 정규 투어 첫 승을 신고한 뒤 4월 시즌 첫 메이저 대회 셰브론 챔피언십을 제패했고, 마지막 메이저 대회도 우승으로 장식했다. 베트남계 미국인으로, 외할아버지가 1982년 공산화된 베트남을 보트를 타고 탈출한 사연으로도 알려진 부는 한 해 열린 여자 골프 메이저 대회에서 가장 좋은 성적을 낸 선수에게 주는 '안니카 메이저 어워드'도 거머쥐었다. 12번 홀(파4)까지 버디만 4개를 솎아내는 안정적인 경기로 독주 체제를 구축한 부는 4타 차로 앞서던 15번 홀(파4)에서 첫 보기가 나오며 흔들릴 뻔했으나 같은 홀에서 헐도 보기를 써내며 격차가 유지돼 여유 있는 우승을 거뒀다. 이후 헐이 타수를 더 줄이지 못한 사이 부는 버디 2개를 추가해 압도적 승자가 됐다. 3라운드까지 선두와 한 타 차 공동 3위를 달려 역전 우승 기대감을 키웠던 김효주는 마지막 날 2타를 잃고 공동 4위에 만족해야 했다. 김효주는 6월부터 치른 LPGA 투어 7개 대회 중 두 차례 준우승을 포함해 5차례 톱10에 진입했고, 가장 좋지 않은 성적이 공동 20위일 정도로 꾸준한 기량을 보였지만, 우승 갈증을 해소하진 못했다. 양희영은 이날 2타를 줄이며 함께 4위에 올라 셰브론 챔피언십 공동 4위, 6월 마이어 LPGA 클래식 공동 3위에 이어 시즌 3번째 톱10에 진입했다. 올해 US여자오픈 우승자 앨리슨 코푸즈는 앨리 유잉, 에인절 인(이상 미국)과 공동 6위(4언더파 284타)에 올랐고, 앤드리아 리(미국)는 공동 9위(3언더파 285타)에 자리했다. 세계랭킹 1위 넬리 코다(미국)는 공동 11위(2언더파 286타)로 마쳤다. 신지은과 이정은은 3개 대회 연속 우승에 도전한 셀린 부티에(프랑스) 등과 공동 16위(1언더파 287타), 신인왕 후보인 유해란은 공동 21위(이븐파 288타)다. 세계랭킹 2위 고진영은 공동 30위(1오버파 289타), 지난해 이 대회 준우승자 전인지는 김아림 등과 공동 40위(3오버파 291타)에 그쳤다. US여자오픈(2015년), 에비앙 챔피언십(2016년), KPMG 여자 PGA 챔피언십(2022년)에서 우승을 보유한 전인지는 셰브론 챔피언십이나 AIG 여자오픈에서 우승을 더하면 5대 메이저 대회 중 4개 대회에서 정상에 오르는 커리어 그랜드슬램을 달성할 수 있었으나 올해에는 불발됐다. ","{'좋아요': 24, '슬퍼요': 3, '화나요': 18, '팬이에요': 5, '후속기사 원해요': 1}"
2023-08-14 02:55:00,스포츠,[최종순위] AIG 여자오픈,AIG 여자오픈 골프대회 최종순위 ,"{'좋아요': 1, '슬퍼요': '0', '화나요': '0', '팬이에요': '0', '후속기사 원해요': '0'}"
2023-08-14 04:09:00,세계,피살 에콰도르 대선후보 '대체자' 곡절 끝 낙점…오는 20일 선거(종합),"탐사보도 언론인 출신…""대선후보 지명됐던 부통령 후보는 자격 안 돼"" 정부 '뒤늦은 치안 강화'…악명 높은 갱단 수장, 최고 보안 교도소로 이감   총격으로 암살된 에콰도르 대통령선거 후보 페르난도 비야비센시오(59)의 대체 후보가 곡절 끝에 선거를 일주일 앞두고 최종 낙점됐다. 비야비센시오 후보 소속당인 '건설운동'은 13일(현지시간) 현지 주요 언론의 생중계로 진행된 기자회견에서 새 대선 후보로 저명 언론인 크리스티안 수리타(53)를 지명했다고 밝혔다. 현지 매체 엘우니베르소와 디아리오라오라 등에 따르면 수리타 후보는 비야비센시오와 함께 에콰도르 탐사 저널리즘 분야에서 한 획을 그은 기자 출신이다. 특히 라파엘 코레아 전 대통령(2007∼2017년 재임)의 각종 부패 행위를 파헤쳐 명성을 얻었다. '건설운동'은 관련 성명에서 ""비야비센시오 공약을 계승하고 부패 및 마피아와의 싸움에 있어 최전선에 설 수 있는 적임자""라고 설명했다. '건설운동' 선거 운동을 도왔던 수리타 후보는 비야비센시오 후보 피격 당시 현장에도 있었다고 한다. 앞서 이 정당은 환경운동가 출신인 안드레아 곤살레스(36) 부통령 후보를 새 대선 후보로 내세운다고 발표했다가, 만 하루 만에 철회했다. '이미 부통령 후보로 등록해 선거운동 중인 사람은 대통령 후보로 다시 나설 수 없다'는 선거관리위원회의 관련 규정 해석에 따른 것이라고 엘우니베르소는 전했다. 곤살레스는 여전히 부통령 후보로, 수리타와 함께 유세에 나설 예정이다. 오는 20일 치러지는 에콰도르 대선을 불과 일주일 앞두고 뒤숭숭한 분위기 속에 대권 도전에 나서게 된 수리타 후보는 코레아 전 대통령 측 인사인 '시민혁명운동' 소속 루이사 곤살레스(45) 후보(전 국회의원) 저격수로 나설 전망이다. 곤살레스는 여론조사 상 8명의 후보 중 선두를 달리고 있고, 비야비센시오 후보는 생전 중위권이었다. 규정에 따라 투표에서 과반을 얻거나, 40% 이상을 득표하고 2위에 10%포인트 앞선 후보가 나오면 당선은 확정된다. 그렇지 않으면 1, 2위 후보가 결선 양자 대결(10월 15일 예정)을 치른다. 이번 사건에 대한 대응으로 국가 비상사태를 선포한 에콰도르 정부는 주요 교도소를 대상으로 한 작전을 수행해 총기 및 탄약류, 마약, 방탄조끼 등을 대거 압수하는 등 뒤늦은 치안 강화 조처에 나섰다. 검찰은 전날 소셜미디어에 금지 물품을 반입한 수감자들 사진도 공개했다. 게시물에는 상의를 탈의한 채 속옷만 입은 수십명의 수감자들이 손목과 발목을 포박당한 채 바닥에 엎드려 있는 모습이 보인다. 에콰도르 당국은 또 '피토'라는 별명을 가진 아돌포 마시아스를 전날 새벽 과야킬 제8교도소에서 이 나라 최대 보안 교도소인 '라 로카'로 이감했다. 마시아스는 에콰도르 마약 밀매 카르텔인 '로스 초네로스'의 수장이다. 그는 지난 8일 총격을 받고 숨진 대선 후보 페르난도 비야비센시오에게, 그의 생전에 살해 위협 메시지를 보낸 인물로 지목받고 있다. 비야비센시오 후보는 공직자 부패에 대한 직설과 함께 카르텔과 정부 요원 간 밀착 의혹 등에 대해 강한 비판을 이어온 바 있다. 이번 이감 작전에는 수천 명의 군인과 경찰관이 무장차량을 동원해 수행했다고 현지 매체인 엘우니베르소는 보도했다. 기예르모 라소 에콰도르 대통령은 자신의 소셜미디어에 ""시민과 수감자 안전을 위한 조처""라며 ""이와 관련해 누구든 폭력적인 양상으로 반발한다면, 우리는 총력을 다해 대응해 평화를 회복할 것""이라고 썼다. 그러나 비야비센시오의 미망인 베로니카 사라우스는 전날 발표한 성명에서 ""남편이 숨진 뒤에야 국가가 갑자기 기민하게 움직이고 있다""며 ""남편의 죽음에 대한 책임은 국가에 있다""고 힐난했다. ","{'쏠쏠정보': '0', '흥미진진': '0', '공감백배': '0', '분석탁월': 1, '후속강추': '0'}"
2023-08-14 04:28:00,스포츠,"AIG여자오픈 3위 신지애 ""LPGA 투어 메이저대회 도전 이어갈 것""","""후배들 힘들어도 부딪치며 기회 많이 만들길""   ""내년에도 미국 여자프로골프(LPGA) 투어 메이저 대회 도전을 할 생각이다."" 신지애(35)는 13일(현지시간) 영국 서리주 태드워스의 월턴 히스 골프클럽(파72)에서 열린 AIG 여자오픈을 단독 3위로 마친 뒤 이처럼 말했다. 신지애는 대회 후 인터뷰에서 내년 메이저 대회 출전 계획에 관한 질문을 받고 ""세인트앤드루스(내년 AIG여자오픈 개최지)에 꼭 다시 돌아오고 싶고 미국 대회도 좀 생각하고 있다""고 답했다. 그는 ""AIG 여자오픈 첫 출전 경험을 한 곳이 세인트앤드루스였는데 그때 좀 힘들었기 때문에 복수를 하고 싶다""고 말하며 웃었다. 그는 ""그 이후 이 대회와 인연이 생기고 링크스 코스에서 좋은 성적을 거뒀으니 다시 가면 잘되지 않을까 기대도 된다""고 덧붙였다. 신지애는 이번 대회에 출전한 선수 가운데 유일하게 AIG 여자오픈을 두차례(2008년과 2012년) 우승했다. 최근엔 LPGA 투어는 일본, 호주에서 열리는 대회 정도만 가끔 나서다가 지난달 4년 만의 '미국 나들이'였던 US여자오픈에서 준우승하며 저력을 뽐냈고 이번에도 한국 선수 최고 성적을 냈다. 그는 ""일본에서 10년간 활동해서 익숙해졌기 때문에 가끔 새로운 것이 필요하다""며 ""이번에도 여기 와서 오랜 친구들뿐 아니라 실력 좋은 젊은 선수들을 보고 배우고 싶었다""고 말했다. 이에 더해 ""할머니 이유가 가장 컸고 후배들과 함께 '으쌰으쌰'하고 싶은 것도 있었다""고 말했다. 그는 최근 별세한 할머니가 메이저 대회 출전하는 모습을 좋아했다고 밝힌 적이 있다. 신지애는 최근 한국 여자 골프에서 메이저 대회 우승이 잘 나오지 않는 상황에 관해 ""후배들이 더 도전하고 부딪쳐서 이겨낼 기회를 많이 만들면 좋겠다""고 말했다. 그는 ""처음부터 잘하기는 어려우니 부담이 되고, 해외 투어가 쉽지 않다는 얘기를 많이 들어서 위축된 것도 같다""며 ""투어를 하는 인원이 적어지다 보니 함께 모여서 내는 힘도 줄었나 싶기도 하다""고 말했다. 그는 ""우리도 선배들이 길을 열어줘서 따라갈 수 있었는데, 이 흐름이 끊기지 않길 바란다""며 ""이번 대회에서 후배들과 같이 연습하고 얘기를 많이 나눴다""고 덧붙였다. 신지애는 이날 성적에 관해서는 ""압박이 없어서 잘 할 수 있었다""며 ""찬스를 많이 살릴 수 있었으면 좋았겠지만 최선을 다했고 안정적으로 경기를 한 것 같다""고 말했다. 앞으로 계획에 관해선 ""한주 쉰 뒤 일본으로 복귀할 계획""이라며 ""지금 일본에서 2위인데 1위에 오르고 싶다""고 말했다. 신지애는 현재 일본여자프로골프(JLPGA) 투어 대상 포인트 격인 메르세데스 랭킹에서 2위, 상금도 2위다. 그는 ""한국에는 팬들이 보고 싶어서 기회를 만들려고 한다""고 덧붙였다. 신지애는 LPGA 투어 시즌 마지막 메이저대회인 이번 대회에서 최종 합계 7언더파 281타를 기록했다. 3라운드를 선두에 4타 뒤진 공동 7위로 마감했고 이날 4라운드에서는 2언더파 70타를 치며 순위를 끌어 올렸다. ","{'좋아요': 11, '슬퍼요': '0', '화나요': '0', '팬이에요': 3, '후속기사 원해요': '0'}"
2023-08-14 04:28:00,스포츠,"류현진, 5이닝 2실점 비자책 호투…444일 만의 승리 보인다","  '코리안 몬스터' 류현진(36·토론토 블루제이스)이 팔꿈치 수술 후 처음으로 승리 요건을 채우고 마운드에서 내려왔다. 류현진은 14일(한국시간) 캐나다 온타리오주 토론토의 로저스 센터에서 열린 2023 미국프로야구 메이저리그 시카고 컵스와의 홈 경기에 선발 등판해 5이닝 동안 안타 2개와 볼넷 2개만 내주고 2실점(비자책) 했다. 실점은 모두 야수 실책에 따른 비자책이었다. 8-2로 앞선 6회 마운드를 넘긴 류현진은 토론토가 동점을 내주지 않고 승리하면, 지난해 5월 27일 로스앤젤레스 에인절스전(5이닝 6피안타 2실점) 이후 444일 만에 선발승을 챙긴다. 2022년 6월 19일 왼쪽 팔꿈치 인대접합 수술을 받은 류현진은 길고 지루한 재활을 견디고 올해 8월 2일 볼티모어 오리올스를 상대로 복귀전을 치렀다. 볼티모어전에서는 5이닝 9피안타 4실점으로 패전 투수가 됐고, 8일 클리블랜드 가디언스를 상대로는 4회까지 노히트 피칭을 했지만, 4회말 2사 1루에서 오스카 곤살레스가 친 시속 157㎞의 강한 타구에 오른쪽 무릎 안쪽을 맞아 5회에는 마운드에 서지 못했다. 다행히 무릎에는 큰 이상이 없었고, 류현진은 예정대로 14일 컵스전에 등판했다. 이날 류현진은 1회 1사 1루에서 나온 토론토 1루수 브랜던 벨트의 포구 실책으로 위기에 몰렸고, 2사 1, 2루에서 댄스비 스완슨에게 3루수 옆을 뚫은 2타점 2루타를 얻어맞았다. 하지만, 류현진은 이후 실점 없이 5회까지 던지며 승리 투수 요건을 채웠다. 시즌 평균자책점은 4.00에서 2.57로 크게 낮췄다. ","{'좋아요': '0', '슬퍼요': '0', '화나요': '0', '팬이에요': 1, '후속기사 원해요': '0'}"
2023-08-14 04:30:00,스포츠,[표] 류현진 시카고 컵스전 이닝별 투구,"류현진 14일(한국시간) 시카고 컵스전 이닝별 투구 ※ 컵스 타순 = ① 크리스토퍼 모렐(지명타자·우타자) ② 니코 호너(2루수·우타자) ③ 이언 햅(좌익수·스위치히터) ④ 코디 벨린저(중견수·좌타자) ⑤ 댄스비 스완슨(유격수·우타자) ⑥ 스즈키 세이야(우익수·우타자) ⑦ 패트릭 위즈덤(1루수·우타자) ⑧ 닉 마드리갈(3루수·우타자) ⑨ 미겔 아마야(포수·우타자) ※ 1회 2사 1, 2루에서 스완슨의 2루타 때 주자 2명 득점. ※ 3회 1사 1루에서 호너의 2루 도루 저지. ","{'좋아요': 2, '슬퍼요': '0', '화나요': '0', '팬이에요': 1, '후속기사 원해요': '0'}"
2023-08-14 04:50:00,스포츠,"류현진, 5이닝 2실점 비자책 호투…444일 만의 승리 보인다(종합)","8-2로 앞선 6회 마운드 넘겨…팔꿈치 수술 후 첫 승리 유력   '코리안 몬스터' 류현진(36·토론토 블루제이스)이 팔꿈치 수술 후 처음으로 승리 요건을 채우고 마운드에서 내려왔다. 류현진은 14일(한국시간) 캐나다 온타리오주 토론토의 로저스 센터에서 열린 2023 미국프로야구 메이저리그 시카고 컵스와의 홈 경기에 선발 등판해 5이닝 동안 안타 2개와 볼넷 2개만 내주고 2실점(비자책) 했다. 삼진은 3개를 잡았다. 실점은 모두 야수 실책에 따른 비자책이었다. 8-2로 앞선 6회 마운드를 넘긴 류현진은 토론토가 동점을 내주지 않고 승리하면, 지난해 5월 27일 로스앤젤레스 에인절스전(5이닝 6피안타 2실점) 이후 444일 만에 선발승을 챙긴다. 2022년 6월 19일 왼쪽 팔꿈치 인대접합 수술을 받은 류현진은 길고 지루한 재활을 견디고 올해 8월 2일 볼티모어 오리올스를 상대로 복귀전을 치렀다. 볼티모어전에서는 5이닝 9피안타 4실점으로 패전 투수가 됐고, 8일 클리블랜드 가디언스를 상대로는 4회까지 노히트 피칭을 했지만, 4회말 2사 1루에서 오스카 곤살레스가 친 시속 157㎞의 강한 타구에 오른쪽 무릎 안쪽을 맞아 5회에는 마운드에 서지 못했다. 다행히 무릎에는 큰 이상이 없었고, 류현진은 예정대로 14일 컵스전에 등판했다. 이날 류현진은 1회 1사 1루에서 나온 토론토 1루수 브랜던 벨트의 포구 실책으로 위기에 몰렸고, 2사 1, 2루에서 댄스비 스완슨에게 3루수 옆을 뚫은 2타점 2루타를 얻어맞았다. 하지만, 류현진은 이후 추가 실점 없이 5회까지 던지며 승리 투수 요건을 채웠다. 시즌 평균자책점은 4.00에서 2.57로 크게 낮췄다. 류현진은 1회 첫 타자 크리스토퍼 모렐을 시속 125㎞ 체인지업으로 헛스윙 삼진으로 돌려세웠다. 하지만, 니코 호너에게 풀 카운트(3볼-2스트라이크)에서 던진 회심의 시속 146㎞ 몸쪽 직구가 볼 판정을 받아 이날 첫 출루를 허용했다. 류현진은 이언 햅을 체인지업으로 내야 땅볼로 유도했으나 1루수 브랜던 벨트가 공을 뒤로 흘려 1사 1, 2루가 됐다. 로스앤젤레스 다저스 시절 동료인 코디 벨린저를 좌익수 뜬공으로 처리한 류현진은 이어진 2사 1, 2루에서 스완슨에게 시속 145㎞ 몸쪽 낮은 직구를 던졌다가 3루수 옆을 뚫은 2타점 2루타를 얻어맞았다. 공식 기록원은 벨트의 실책이 유발한 실점으로 판단해 류현진의 책임이 없는 비자책점으로 기록했다. 류현진은 처음 만난 일본인 타자 스즈키 세이야를 우익수 뜬공으로 잡아내 첫 이닝을 마쳤다. 실책이 나오고 풀 카운트 승부도 3차례 이어져 1회에만 31개를 던졌다. 하지만, 이후 날카로운 제구로 추가 실점 없이 5회를 채웠다. 류현진은 패트릭 위즈덤을 풀 카운트에서 시속 128㎞ 체인지업으로 헛스윙 삼진 처리하더니, 닉 마드리갈은 커브로 3루수 앞 땅볼, 미겔 아마야는 직구로 중견수 뜬공으로 돌려세워 삼자범퇴로 2회를 막았다. 토론토 타선도 류현진에게 힘을 줬다. 0-2로 뒤진 2회말 무사 1, 2루에서 돌턴 바쇼가 오른쪽 담을 넘어가는 역전 3점포를 터뜨렸다. 2사 1, 2루에서 블라디미르 게레로 주니어의 좌전 적시타, 조지 스프링어의 우전 적시타가 연거푸 터져 토론토는 5-2로 달아났다. 3회에는 첫 타자 모렐의 잘 맞은 타구가 좌익수 정면으로 날아가고, 호너의 빗맞은 타구가 중견수 앞에 떨어지는 행운과 불운이 교차했다. 햅의 타석에서 2루를 훔치려던 1루 주자 호너를 토론토 포수 대니 잰슨이 정확한 송구로 잡아내자 류현진의 어깨는 한결 가벼워졌다. 류현진은 햅을 우익수 뜬공으로 잡아내며 3회를 마쳤다. 4회에 류현진은 첫 타자 벨린저에게 풀 카운트 승부 끝에 볼넷을 내줘 불안하게 출발했다. 하지만, 스완슨을 컷 패스트볼(커터)로, 스즈키를 체인지업으로 우익수 뜬공으로 유도하며 아웃 카운트를 늘렸다. 위즈덤에게는 주 무기 체인지업을 던져 헛스윙 삼진으로 돌려세웠다. 토론토 타선은 4회말 안타 4개와 볼넷 1개를 묶어 3점을 추가하며 류현진을 도왔다. 힘을 얻은 류현진은 5회초 마드리갈, 아마야, 모렐을 손쉽게 삼자 범퇴로 처리하며 이닝을 종료했다. 이날 류현진은 86개로 5이닝을 채웠다. 직구(40개) 구속은 최고 시속 147㎞(91.1마일), 평균 시속 142㎞(88.4마일)로 앞선 두 차례 등판과 비슷했지만, 구석을 찌르는 제구가 돋보였다. 주 무기 체인지업(24개)은 날카롭게 떨어졌다. 류현진이 잡은 삼진 3개의 결정구는 모두 체인지업이었다. 류현진은 커터(12개)와 커브(10개)도 효과적으로 활용했다. ","{'좋아요': 110, '슬퍼요': 1, '화나요': 3, '팬이에요': 15, '후속기사 원해요': 2}"
