date,category,title,content,reaction
2023-08-03 13:38:00,사회,"울산 북구 통합관제센터, 속옷 절도범 포착해 검거 도와","  울산 북구는 폐쇄회로(CC)TV 통합관제센터 실시간 모니터링 중 남의 집 베란다에서 속옷을 훔치는 절도범을 발견, 경찰의 검거를 도왔다고 3일 밝혔다. 북구에 따르면 지난 2일 오전 1시 52분께 북구 주택가에서 한 남성이 빌라 베란다 창문을 열고 여성용 속옷을 훔치는 모습이 CCTV 통합관제센터 요원에게 포착됐다. 관제센터 요원은 곧바로 경찰에 신고하고, CCTV를 통해 남성의 동선을 실시간으로 전달했다. 출동한 경찰은 오전 2시 22분께 해당 남성을 파출소로 연행, 범죄 사실을 확인한 뒤 절도범으로 체포했다. 북구 CCTV 통합관제센터 관계자는 ""여름철 각종 범죄와 사고로부터 주민들이 안전하게 생활할 수 있도록 더 촘촘하게 CCTV 모니터링을 하겠다""고 말했다. ","{'쏠쏠정보': '0', '흥미진진': '0', '공감백배': '0', '분석탁월': '0', '후속강추': '0'}"
2023-08-03 13:38:00,정치,"경기도선관위, 국회의원 후원회에 연간 한도액 초과 기부자 고발","정치자금법 위반 5천900만원 기부 혐의…기부 한도액 연간 2천만원   경기도선거관리위원회는 연간 한도액을 초과해 기부한 A씨를 정치자금법 위반 혐의로 검찰에 고발했다고 3일 밝혔다. A씨는 지난해 다수의 국회의원 후원회 등에 300만∼500만원씩 총 5천900만원을 기부해 후원인의 연간 기부한도액 2천만원을 초과한 혐의를 받는다. 정치자금법은 연간 2천만원을 초과해 후원회에 후원하는 경우 5년 이하의 징역 또는 1천만원 이하의 벌금에 처한다고 규정한다. A씨는 관련 규정을 알지 못했다고 진술한 것으로 알려졌다. 경기도선관위는 ""소액 다수의 후원금은 건전한 정치자금 기부 문화 조성을 위한 밑거름이지만, 법에 위반되는 사항이 없도록 각별한 주의를 바란다""고 말했다. ","{'쏠쏠정보': '0', '흥미진진': '0', '공감백배': '0', '분석탁월': '0', '후속강추': '0'}"
2023-08-03 13:38:00,스포츠,"프로농구 KCC, 외국인 선수 존슨 영입…G리그 평균 15.5점","  프로농구 전주 KCC가 외국인 선수 알리제 존슨(201㎝)을 영입했다고 3일 발표했다. 미국 미주리주립대 출신 존슨은 2018년 미국프로농구(NBA) 신인 드래프트에서 전체 50순위로 인디애나 페이서스에 지명된 선수다. NBA에서 정규리그 통산 76경기에 나와 평균 2.5점, 3리바운드를 기록했고, 프로 데뷔 이후 NBA와 NBA 하부리그인 G리그에서만 경력을 쌓았다. 2022-2023시즌에는 G리그에서 22경기에 나와 평균 15.5점, 12.2리바운드의 성적을 냈다. KCC는 ""다양한 포지션을 소화할 수 있는 다재다능한 선수""라며 ""공수 전환도 빨라 득점과 공수 밸런스 등에 안정감을 더할 수 있을 것""이라고 기대했다. ","{'좋아요': 3, '슬퍼요': '0', '화나요': '0', '팬이에요': '0', '후속기사 원해요': '0'}"
2023-08-03 13:41:00,경제,"한샘, 건축박람회 '2023 코리아빌드' 참여…하이마트와 협업","  한샘은 강남 코엑스에서 진행되는 건설·건축·인테리어 전문 박람회 '2023 코리아빌드'에 참여한다고 3일 밝혔다. 한샘리하우스 41개 대리점이 참여해 맞춤형 인테리어 상담 서비스를 제공한다. 한샘은 박람회에서 가전콜라보존, 전시존, 샘플전시존 등 다양한 전시공간을 운영한다. 가전콜라보존에서는 유로500첼시 등 한샘 부엌 신제품과 롯데하이마트의 가전이 함께 전시된 부엌 공간을 만나볼 수 있다. 전시존에는 부엌 벽면에 부착하는 가상의 타일을 스크린으로 확인할 수 있는 '키친 컬러링존'과 홈 사물인터넷(IoT)을 접목한 '욕실존'이 설치된다. ","{'쏠쏠정보': '0', '흥미진진': '0', '공감백배': '0', '분석탁월': '0', '후속강추': '0'}"
2023-08-03 13:43:00,세계,"[영상] 러시아, 나토 코앞 우크라 항구 또 공습…세계 곡물가격 우려"," 러시아가 북대서양조약기구(NATO·나토) 회원국인 루마니아와 국경을 맞댄 우크라이나의 다뉴브강 항구를 또다시 공습했다고 2일(현지시간) 로이터, AP 통신 등이 보도했습니다. 우크라이나 국방부는 이날 남부 오데사 지역 이즈마일 항구의 곡물 저장고가 러시아에 의해 손상됐다고 소셜미디어를 통해 밝혔는데요. 이즈마일은 다뉴브강을 경계로 루마니아와 국경을 접하고 있는 우크라이나 남단의 항구 도시로, 다뉴브강을 통해 러시아의 흑해 봉쇄를 우회할 수 있어 우크라이나의 곡물 대체 수송로로 이용되는 지역입니다. 우크라이나 남부 작전사령부는 페이스북에서 러시아의 공습으로 이즈마일 항만에서 화재가 발생하고 곡물 저장고가 부서졌다면서 ""적의 목표는 분명히 항만 시설과 산업 기반 시설이었다""고 밝혔는데요. 영상으로 보시죠. 제작: 왕지웅·안창주 영상: 로이터·우크라이나 국방부 트위터","{'쏠쏠정보': 3, '흥미진진': '0', '공감백배': 1, '분석탁월': '0', '후속강추': '0'}"
2023-08-03 13:51:00,사회,"경북경찰, 송유관 구멍 내 석유 21억원어치 빼돌린 일당 구속","  경북경찰청은 3일 송유관에 구멍을 뚫어 석유 21억원어치를 훔친 혐의(송유관 안전관리법 위반)로 A씨 등 5명을 구속 송치했다. 또 절도 행위를 돕거나, 훔친 석유를 유통한 공범 3명은 장물취득 등 혐의로 불구속 송치했다. 이들은 2022년 7월 경북의 한 주유소 유류 저장소를 빌린 뒤 이곳에서 약 300ｍ 떨어진 국도 주변 지하 2m 지점에 매설된 송유관에 구멍을 뚫고 고압호스를 연결, 2023년 4월까지 석유 121만ℓ(시가 21억원 상당)를 빼낸 혐의를 받는다. 이들은 장물업자 2명을 포섭해 대구, 경북, 대전, 충남 등 주유소에 훔친 석유를 유통한 것으로 드러났다. 경찰은 일당 검거 과정에 범죄 수익금 5천여만원을 압수했으며, 유류 저장소에 보관 중인 석유 12만5천ℓ(시가 2억원 상당)를 압수해 대한송유관공사에 가환부 조치했다. 경찰은 또 이들이 송유관에 구멍을 뚫은 직후인 지난해 7월께 유류 저장소 일대에서 석유 유출 사고가 발생해 주변 토양이 오염된 사실도 파악했다. 이진식 경북경찰청 강력범죄수사대장은 ""송유관 석유 절도는 대형 화재나 대규모 토양 오염 가능성이 있어 경제적 손실뿐만 아니라 안전 및 환경에 끼치는 해악이 매우 큰 범죄""라면서 ""피의자들은 조직적으로 역할을 분담하면서도 총책 역할을 한 1인 외에는 서로의 신분을 알지 못하게 치밀하게 정보를 차단했다""고 설명했다. ","{'쏠쏠정보': '0', '흥미진진': '0', '공감백배': '0', '분석탁월': '0', '후속강추': 1}"
2023-08-03 13:51:00,스포츠,칩샷 하는 황연서, 황연서가 3일 제주시 블랙스톤 제주 컨트리클럽에서 열린 제10회 제주 삼다수 마스터스 1라운드 14번 홀에서 칩샷 하고 있다.   ,"{'좋아요': '0', '슬퍼요': '0', '화나요': '0', '팬이에요': '0', '후속기사 원해요': '0'}"
2023-08-03 13:52:00,정치,발언하는 김영호 장관,"  김영호 통일부 장관이 3일 오후 정부서울청사 장관실에서 열린 납북자, 북한 억류자, 국군포로 관련 단체 대표 및 억류자 가족과의 면담에서 발언하고 있다.  ","{'쏠쏠정보': '0', '흥미진진': '0', '공감백배': '0', '분석탁월': '0', '후속강추': '0'}"
2023-08-03 13:52:00,정치,김영호 통일장관 첫 대외 일정은 납북자·국군포로 단체 면담,"  김영호 통일부 장관이 3일 오후 정부서울청사 장관실에서 열린 납북자, 북한 억류자, 국군포로 관련 단체 대표 및 억류자 가족과의 면담에서 발언하고 있다.  ","{'쏠쏠정보': '0', '흥미진진': '0', '공감백배': '0', '분석탁월': '0', '후속강추': '0'}"
2023-08-03 13:53:00,정치,서울 종로서 사할린 한인 삶과 역사 기록한 사진전 개최,"  지구촌동포연대는 일제 강점기 러시아 사할린으로 강제 징용됐다가 돌아오지 못한 한인 1세대와 후손의 삶을 담은 사진전을 개최한다고 3일 밝혔다. '사할린, 기록되지 않은 역사'를 주제로 오는 12일부터 21일까지 서울 종로구 갤러리 인텍스에서 열리는 이번 전시는 이예식(74) 사할린 새고려신문 사진기자가 찍은 작품으로 꾸며졌다. 사할린 한인 2세인 이 기자는 대학 졸업 후 구소련 매체들의 지역 통신원으로 활동하다가 1999년부터 새고려신문에서 사진기자로 활동하고 있다. 이번 전시에서는 구소련 시절에도 한민족 풍습을 지켜왔던 사할린 한인들의 생활상과 영주귀국 모습 등이 소개된다. 12일 개막일에는 작가와의 대화 시간도 마련된다. 지구촌동포연대 관계자는 ""1990년 러시아와 수교를 맺기 전까지 귀향길이 막힌 채 힘든 삶을 살면서도 한민족의 정체성을 지켜온 한인들의 존재를 알리고 지금도 이어지고 있는 이산의 아픔을 소개하는 전시""라고 밝혔다. ","{'쏠쏠정보': '0', '흥미진진': 1, '공감백배': '0', '분석탁월': '0', '후속강추': '0'}"
2023-08-03 13:53:00,정치,김영호 통일장관 첫 대외 일정은 납북자·국군포로 단체 면담,"  김영호 통일부 장관이 3일 오후 정부서울청사 장관실에서 열린 납북자, 북한 억류자, 국군포로 관련 단체 대표 및 억류자 가족과의 면담을 위해 자리로 향하고 있다.  ","{'쏠쏠정보': '0', '흥미진진': '0', '공감백배': '0', '분석탁월': '0', '후속강추': '0'}"
2023-08-03 13:53:00,사회,광복회 '대한민국 원년은 1919년',  이종찬 광복회장이 3일 오전 서울 여의도 광복회관 앞에서 열린 '대한민국 정체성 선포식'에서 인사말을 하고 있다.  ,"{'쏠쏠정보': '0', '흥미진진': '0', '공감백배': '0', '분석탁월': '0', '후속강추': '0'}"
2023-08-03 13:54:00,정치,납북자·국군포로 단체 면담 나선 김영호 장관,  김영호 통일부 장관이 정부서울청사 통일부 장관실에서 납북자·북한 억류자·북한포로 관련 단체 대표 및 억류자 가족들과 면담하고 있다.  ,"{'쏠쏠정보': '0', '흥미진진': '0', '공감백배': '0', '분석탁월': '0', '후속강추': '0'}"
2023-08-03 13:54:00,사회,축사하는 우원식,  더불어민주당 우원식 의원이 3일 오전 서울 여의도 광복회관 앞에서 열린 '대한민국 정체성 선포식'에서 축사하고 있다.  ,"{'쏠쏠정보': '0', '흥미진진': '0', '공감백배': '0', '분석탁월': '0', '후속강추': '0'}"
2023-08-03 13:54:00,경제,"소공연 ""불볕더위에 '냉방비 폭탄' 우려…에너지 대책 마련해야""","  소상공인연합회(소공연)는 3일 불볕더위에 소상공인의 '냉방비 폭탄'이 우려된다며 정부에 지원대책을 마련하라고 촉구했다. 소공연은 이날 성명을 내고 ""한계 상황에 몰린 소상공인을 에너지 취약계층에 포함하는 '에너지 지원 법제화', 전기요금체계 개편을 통한 '소상공인 전용 요금제 신설' 등 체감할 수 있는 종합적인 정책을 마련하길 강력하게 촉구한다""고 밝혔다. 이들은 ""전기요금은 지난해부터 올해 2분기까지 다섯 차례에 걸쳐 상승했고, 이 기간 인상률은 39.6%에 달한다""며 ""소상공인에게는 냉방비 폭탄을 피할 수 있는 '즉시 요금할인'이 절실하다""고 덧붙였다. 정부가 에너지 비용 부담 완화를 위해 노후 냉방기 교체 지원 사업, 고효율기기 지원 사업 등을 추진하고 있으나, 현장에선 전기요금 감소를 체감하지 못한다는 게 소공연의 주장이다. 소공연은 ""프랑스는 10조8천억원의 전기세를 감면하고, 스페인은 전기요금 부가가치세를 10%로 인하하는 등 실질적인 요금할인 정책을 펼치고 있다""며 정부에 ""요금 납부유예 등 단기 대책에만 매달리지 말고 하절기 요금할인, 소상공인 전기요금체계 개편 등 중장기적인 대책을 마련해야 한다""고 요구했다. ","{'쏠쏠정보': '0', '흥미진진': '0', '공감백배': '0', '분석탁월': '0', '후속강추': '0'}"
2023-08-03 13:54:00,사회,"청소년정책연대 ""잼버리 즉각 축소·실내 전환해야""","""중환자 없다는 이유로 강행…정부·조직위 무사안일""   새만금 세계스카우트잼버리에서 온열질환자가 연이어 발생하자 청소년 단체가 행사를 즉각 축소 시행할 것을 촉구했다. 한국청소년정책연대는 3일 낸 성명서에서 ""살인적인 폭염 속에서 중환자가 나오지 않았다는 이유로 행사를 강행하고 있는 정부와 잼버리 조직위원회를 규탄한다""라며 이같이 밝혔다. 정책연대는 ""즉각적으로 행사 일정을 축소하고 프로그램을 변경하는 등 긴급 조치를 통해 세계 각국에서 참가한 청소년들의 건강과 안전을 보호할 것을 강력히 촉구한다""라고 강조했다. 정책연대는 ""전날 개영식에서 84명이 온열로 인한 탈진 등으로 실려갔는데 주최 측은 중환자가 없다는 이유를 들어 30분이나 더 행사를 강행했다""라며 ""정부와 조직위의 태도는 무사안일하다""라고 비판했다. 정책연대는 ""10일이나 남은 잼버리 기간을 대폭 축소하고, 즉시 야외활동을 실내로 전면 전환할 것을 검토하라""라며 ""잼버리 성공의 가장 중요한 척도는 참가 청소년들이 안전하고 건강하게 교류한 후 자신들의 나라로 돌아가는 것""이라고 강조했다. 잼버리 조직위에 따르면 전날 오후 8시부터 시작된 개영식에서 발생한 온열질환자는 108명이며, 두통, 복통, 근골격계 손상 등의 유형을 포함하면 개영식 관련 환자는 모두 139명이다. ","{'쏠쏠정보': '0', '흥미진진': '0', '공감백배': 1, '분석탁월': '0', '후속강추': 4}"
2023-08-03 13:54:00,사회,'제25회 세계 외국인 한국어 말하기 대회' 참가자 모집,"경희대 국제교육원·연합뉴스 공동 주최…본선 10월 19일   경희대학교 국제교육원은 연합뉴스와 공동으로 주최하는 '제25회 세계 외국인 한국어 말하기 대회' 참가 신청을 받는다고 3일 밝혔다. 대회 주제는 'AI가 대신할 수 없는 한국어 표현'과 '한국 생활 비법을 전합니다'이다. 한국어를 구사할 수 있는 전 세계 외국인은 누구나 이들 주제 중 한 가지를 선택해서 지원할 수 있다. 참가 신청은 오는 7일부터 9월 1일까지 홈페이지(http://speechinkorean.iie.ac.kr)를 통해서 하면 된다. 신청 때 원고도 함께 제출해야 한다. 예선은 9월 13∼14일 이틀간 열리며, 본선은 10월 19일 경희대 크라운관에서 열린다. 본선에서는 대상 1명(150만원), 최우수상 2명(각 100만원), 특별상 3명(각 80만원), 우수상 3명(각 50만원)을 선정한다. 경희대 국제교육원과 연합뉴스는 1998년부터 2019년까지 세종대왕 탄신일인 매년 5월 15일 대회를 개최해왔다. 2020년에는 코로나19 팬데믹으로 중단됐다가 2021년 온라인으로 진행되며 재개됐다. 지난해에는 한글날을 3일 앞둔 10월 6일 개최됐다. 당시 34개국 외국인 1천25명이 참가했다. ","{'쏠쏠정보': '0', '흥미진진': '0', '공감백배': '0', '분석탁월': '0', '후속강추': 1}"
2023-08-03 13:54:00,사회,조폭 연루 330억원대 불법 도박사이트 운영한 17명 송치,"  조직폭력배가 연루된 330억원대 불법 도박사이트를 운영한 일당이 경찰에 붙잡혔다. 제주경찰청은 도박장 개장과 도박 방조 혐의 등으로 총괄 책임자 30대 A씨 등 3명을 구속하고 B씨 등 14명을 불구속해 최근 검찰에 송치했다고 3일 밝혔다. A씨 등은 지난해 2월부터 지난 2월까지 서울과 제주에 사무실을 차려 330억원 규모의 불법 도박사이트를 운영한 혐의를 받는다. 경찰 조사 결과 불구속된 피의자 14명 가운데 3명은 도내 폭력조직 2곳에 소속돼 직접 도박하거나 계좌를 빌려주고 돈을 챙겼다. 이 도박사이트 이용자는 총 3천여 명으로 이 중 판돈을 최대 9억원까지 건 이용자도 있었던 것으로 확인됐다. 경찰은 판돈 규모가 억대인 상습 도박자 20명을 상대로 수사를 확대하고 있다. 또 A씨 등이 거둔 범죄 수익 19억7천만원을 환수하기 위해 예금과 재산 등을 동결 조치했다. 경찰 관계자는 ""이 사건은 제주 폭력조직원들을 비롯해 각 폭력조직과 연관된 자들이 불법 도박사이트를 운영하고 그 범행에 가담했다는 것이 특징""이라며 ""이는 조직을 넘어 각종 이권에 따라 이합집산하며 불법 사업을 전개하는 조폭들의 행태를 여실히 보여주는 사례""라고 말했다. 앞서 제주경찰청은 지난 3월 13일부터 지난달 12일까지 '상반기 조직폭력 특별단속'을 벌여 모두 37명을 검거하고 이 중 6명을 구속했다. 연령대별로 보면 30대가 19명으로 가장 많았으며 이어 20대 11명, 40대 7명 순이다. 전과별로는 9범 이상이 18명에 달했다. ","{'쏠쏠정보': '0', '흥미진진': '0', '공감백배': '0', '분석탁월': '0', '후속강추': 1}"
2023-08-03 13:54:00,생활,새로운 수학 세계로…부산서 중학생 '매쓰 펀' 캠프,"  부산시 해운대교육지원청은 중학교 1∼2학년생 115명을 대상으로 4∼5일 2023 해운대 중학생 매쓰 펀(Math Fun) 캠프를 운영한다고 3일 밝혔다. 수영구도서관, 부산 수학문화관, 국립부산과학관 등지에서 진행되는 캠프는 다양한 창의·융합 수학 체험을 통해 학생들의 수학에 대한 관심과 흥미를 높여주고, 수학적 사고력을 키워주기 위해 마련됐다. 4일 행사는 수영구 희망교육지구 사업의 하나로 열린다. 오전에는 수영구도서관에서 '심화 탐구 수학', '게임 수학' 프로그램이 진행된다. 오후에는 부산 수학문화관에서 다양한 수학 관련 전시물 관람·체험 프로그램을 운영한다. 5일 행사는 국립부산과학관에서 '심화 탐구 수학', '게임 수학', '융합 탐구 수학' 등 3개 과정을 학년별 2개 반으로 나눠 진행한다. 심화 탐구 수학 과정에서 1학년은 '퍼즐로 배우는 수학', '테셀레이션을 활용한 문양 디자인' 등을 배운다. 2학년은 '육각 엮기를 활용한 인테리어 소품 만들기', '오연환과 하노이탑' 프로그램을 운영한다. 게임 수학 과정은 보드게임을 활용한 모둠별 수학 활동으로 진행한다. 국립부산과학관과 연계해 운영하는 융합 탐구 수학 과정은 1학년은 '놀이공원 속의 과학', 2학년은 '소형인공위성 캔셋' 등 프로그램으로 구성됐다. ","{'쏠쏠정보': '0', '흥미진진': '0', '공감백배': '0', '분석탁월': '0', '후속강추': '0'}"
2023-08-03 13:55:00,사회,"광복회, 대한민국 정체성 선포식",  이종찬 광복회장이 3일 오전 서울 여의도 광복회관 앞에서 열린 '대한민국 정체성 선포식'에서 인사말을 하고 있다.  ,"{'쏠쏠정보': '0', '흥미진진': '0', '공감백배': '0', '분석탁월': '0', '후속강추': 1}"
2023-08-03 13:56:00,경제,"'대리석 바닥, 전문 용액으로 관리하세요'",  3일 서울 강남구 코엑스에서 열린 건축·인테리어 전문 전시 '2023 코리아빌드위크' 한 부스에서 대리석 관리 용액을 시연하고 있다.  ,"{'쏠쏠정보': '0', '흥미진진': '0', '공감백배': '0', '분석탁월': '0', '후속강추': '0'}"
2023-08-03 13:56:00,경제,카메라로 보고 뚫는 배관 청소기,  3일 서울 강남구 코엑스에서 열린 건축·인테리어 전문 전시 '2023 코리아빌드위크' 한 부스에서 배관 청소기를 시연하고 있다.  ,"{'쏠쏠정보': '0', '흥미진진': '0', '공감백배': '0', '분석탁월': '0', '후속강추': '0'}"
2023-08-03 13:56:00,경제,'어떤 집 지을까?',  3일 서울 강남구 코엑스에서 열린 건축·인테리어 전문 전시 '2023 코리아빌드위크'에서 한 관람객이 견본 주택 사진을 살펴보고 있다.  ,"{'쏠쏠정보': '0', '흥미진진': '0', '공감백배': '0', '분석탁월': '0', '후속강추': '0'}"
2023-08-03 13:56:00,경제,"SK바이오팜 ""과학자문위 출범…초대 위원장에 방영주 박사""","  SK바이오팜은 기존 제품의 가치를 높이고 새 치료 접근법을 확보하기 위해 과학자문위원회(Scientific Advisory Board·SAB)를 출범했다고 3일 밝혔다. 사장 직속 기구로 신설된 위원회는 의사 과학자와 임상·진단· 치료·신약 개발 분야 전문가 5명으로 구성됐다. 초대 위원장은 위암 표적항암과 면역항암 임상의학 분야에서 세계적인 권위자로 손꼽히는 방영주 박사가 맡았다. 방 위원장은 대한암학회 이사장, 대한종양내과학회 이사장, 서울대병원 내과 교수 및 의생명연구원장, 임상시험센터장 등을 역임했으며 항암 연구와 치료 발전에 기여한 공로를 인정받아 2012년 고바야시 재단 어워드를 받은 인물이라고 회사는 설명했다. 이 밖에 미국뇌전증재단 최고 의학·혁신 책임자인 재클린 프렌치 미국 뉴욕주립대 의대 신경학 교수, 스티브 정 배너대 의대 신경학 교수, 민일 존스홉킨스 의과대 방사선과·방사선과학 교수, 맹철영 박사가 자문위원으로 참여한다. 회사는 위원회와 협업해 제2 상업화 제품을 인수하고 방사성의약품치료제(RPT), 표적단백질분해(TPD), 세포·유전자 치료제(CGT) 등 기술을 도입해 신약 개발 사업에 속도를 내겠다고 밝혔다. 이동훈 SK바이오팜 사장은 ""위원회의 최고 수준 과학적 통찰력은 불확실한 미래에 확실한 나침반이 되어줄 것""이라며 ""세계적 권위자로 이뤄진 과학자문위원회가 회사의 혁신과 발전에 큰 힘이 될 것""이라고 기대했다. ","{'쏠쏠정보': '0', '흥미진진': 2, '공감백배': '0', '분석탁월': '0', '후속강추': '0'}"
2023-08-03 13:56:00,경제,수증기로 만드는 장작불,  3일 서울 강남구 코엑스에서 열린 건축·인테리어 전문 전시 '2023 코리아빌드위크' 한 부스에서 수증기로 장작불 모양을 내는 조명을 전시하고 있다.  ,"{'쏠쏠정보': '0', '흥미진진': '0', '공감백배': '0', '분석탁월': '0', '후속강추': '0'}"
2023-08-03 13:56:00,경제,코리아빌드위크 개막,  3일 서울 강남구 코엑스에서 열린 건축·인테리어 전문 전시 '2023 코리아빌드위크' 한 부스에서 관람객들이 상담을 받고 있다.  ,"{'쏠쏠정보': '0', '흥미진진': '0', '공감백배': '0', '분석탁월': '0', '후속강추': '0'}"
2023-08-03 13:56:00,경제,'달리다 멈추면 여기가 우리집',  3일 서울 강남구 코엑스에서 열린 건축·인테리어 전문 전시 '2023 코리아빌드위크'에서 관람객들이 이동형 주택을 살펴보고 있다.  ,"{'쏠쏠정보': '0', '흥미진진': '0', '공감백배': '0', '분석탁월': '0', '후속강추': '0'}"
2023-08-03 13:56:00,경제,식기에 쓰는 재질로 만든 장식벽,  3일 서울 강남구 코엑스에서 열린 건축·인테리어 전문 전시 '2023 코리아빌드위크'에서 관람객이 벽 장식재를 살펴보고 있다.  ,"{'쏠쏠정보': '0', '흥미진진': '0', '공감백배': '0', '분석탁월': '0', '후속강추': '0'}"
2023-08-03 13:56:00,경제,'우리집 벽 장식재 무엇이 좋을까?',  3일 서울 강남구 코엑스에서 열린 건축·인테리어 전문 전시 '2023 코리아빌드위크'에서 관람객이 벽 장식재를 살펴보고 있다.  ,"{'쏠쏠정보': '0', '흥미진진': '0', '공감백배': '0', '분석탁월': '0', '후속강추': '0'}"
2023-08-03 13:56:00,경제,다양한 크기와 모양의 싱크대,  3일 서울 강남구 코엑스에서 열린 건축·인테리어 전문 전시 '2023 코리아빌드위크'에서 관람객들이 싱크대를 살펴보고 있다.  ,"{'쏠쏠정보': '0', '흥미진진': '0', '공감백배': '0', '분석탁월': '0', '후속강추': '0'}"
2023-08-03 13:58:00,사회,간담회 주재하는 한화진 장관," 한화진 환경부 장관이 하천 정비 관련 의견을 나누기 위해 3일 오전 서울 중구에서 교수 및 연구원, 기술 관계자들을 만나 간담회를 주재하고 있다.   ","{'쏠쏠정보': '0', '흥미진진': '0', '공감백배': '0', '분석탁월': '0', '후속강추': '0'}"
