date,category,title,content,reaction
2023-08-03 01:09:00,정치,"윤석열 대통령 내외, 세계스카우트잼버리 개영식 참석",  윤석열 대통령과 김건희 여사가 2일 오후 전북 부안 새만금 부지에서 열린 '2023 새만금 제25회 세계스카우트잼버리' 개영식에서 행사를 지켜보고 있다.   ,"{'쏠쏠정보': '0', '흥미진진': '0', '공감백배': '0', '분석탁월': '0', '후속강추': '0'}"
2023-08-03 01:10:00,정치,환영사 하는 윤석열 대통령,  윤석열 대통령이 2일 오후 전북 부안 새만금 부지에서 열린 '2023 새만금 제25회 세계스카우트잼버리' 개영식에서 환영사를 하고 있다.   ,"{'쏠쏠정보': '0', '흥미진진': '0', '공감백배': '0', '분석탁월': '0', '후속강추': '0'}"
2023-08-03 01:10:00,정치,환영사 마치고 인사하는 윤석열 대통령,  윤석열 대통령이 2일 오후 전북 부안 새만금 부지에서 열린 '2023 새만금 제25회 세계스카우트잼버리' 개영식에서 환영사를 마친 뒤 인사하고 있다.   ,"{'쏠쏠정보': '0', '흥미진진': '0', '공감백배': '0', '분석탁월': '0', '후속강추': '0'}"
2023-08-03 01:11:00,정치,종이비행기 날리는 윤석열 대통령 부부,  윤석열 대통령과 김건희 여사가 2일 오후 전북 부안 새만금 부지에서 열린 '2023 새만금 제25회 세계스카우트잼버리' 개영식에서 종이비행기 날리기 퍼포먼스를 하고 있다.   ,"{'쏠쏠정보': '0', '흥미진진': '0', '공감백배': '0', '분석탁월': '0', '후속강추': '0'}"
2023-08-03 01:12:00,정치,스카우트 대원들과 기념사진 찍는 윤석열 대통령 내외,  윤석열 대통령과 김건희 여사가 2일 오후 전북 부안 새만금 부지에서 열린 '2023 새만금 제25회 세계스카우트잼버리' 개영식에서 스카우트 대원들과 기념사진을 찍고 있다.   ,"{'쏠쏠정보': '0', '흥미진진': '0', '공감백배': '0', '분석탁월': '0', '후속강추': '0'}"
2023-08-03 01:12:00,정치,스카우트 대원들과 악수하는 윤석열 대통령,  윤석열 대통령이 2일 오후 전북 부안 새만금 부지에서 열린 '2023 새만금 제25회 세계스카우트잼버리' 개영식에서 스카우트 대원들과 악수하고 있다.   ,"{'쏠쏠정보': '0', '흥미진진': '0', '공감백배': '0', '분석탁월': '0', '후속강추': '0'}"
2023-08-03 01:13:00,정치,반기문 전 유엔 사무총장과 악수하는 김건희 여사,  윤석열 대통령 부인 김건희 여사가 2일 오후 전북 부안 새만금 부지에서 열린 '2023 새만금 제25회 세계스카우트잼버리' 개영식에서 반기문 전 유엔 사무총장과 악수하고 있다.   ,"{'쏠쏠정보': '0', '흥미진진': '0', '공감백배': '0', '분석탁월': '0', '후속강추': '0'}"
2023-08-03 01:45:00,세계,'미 신용등급 강등' 아시아·유럽 증시 동반 하락…원화 약세(종합2보),"닛케이 -2.3%, 항셍 -2.47%…""장기적 영향 크지 않을 것"" 관측도 유럽 주요국 증시도 일제히 1%대하락  차병섭 기자  국제 신용평가사 피치가 미국 국가신용등급을 강등하면서 안전자산 선호 심리가 강해진 가운데 2일 아시아와 유럽 주요국 증시가 동반 하락했다. 블룸버그통신에 따르면 이날 닛케이225 평균주가(닛케이지수)는 전장 대비 2.30% 내려간 32,707.69로 장을 마감했다. 전날까지 지난달 12일 저점 대비 5% 넘게 올랐던 닛케이지수는 지난달 31일 33,172.22를 기록한 지 이틀 만에 종가 기준 33,000선 아래로 내려왔다. 이날 코스피와 코스닥이 각각 1.90%, 3.18% 떨어진 것을 비롯해 대만 자취안지수(-1.85%), 호주 S&P/ASX 200 지수(-1.29%)도 하락세를 면치 못했다. 중국 본토의 상하이종합지수와 선전성분지수는 각각 전장 대비 0.89%, 0.28% 떨어졌고, 한국시간 오후 4시 8분 기준 홍콩 항셍지수는 2.47% 내린 채 마감됐다. 미국 뉴욕 증시에서는 E-미니 나스닥100 선물이 0.626% 빠진 것을 비롯해 E-미니 스탠더드앤드푸어스(S&P)500지수 선물(-0.44%)과 E-미니 다우존스산업평균지수 선물(-0.288%)도 약세다. 유럽 증시도 일제히 하락 마감했다. 영국 FTSE100 지수와 독일 DAX 지수는 1.36%씩 하락해 각각 7,561.63, 16,020.02로 장을 마쳤다. 프랑스 CAC40 지수와 범유럽 지수인 유로 Stoxx 50지수 역시 각각 1.26%, 1.60% 내린 7.312,84, 4.336,85를 기록했다. 앞서 피치는 미국의 국가신용등급(IDRs·장기외화표시발행자등급)을 'AAA'에서 'AA+'로 하향했다. 3대 국제 신용평가사 가운데 한 곳이 미국의 국가신용등급을 강등한 것은 2011년 스탠더드앤드푸어스(S&P) 이후 12년 만으로, 피치는 ""향후 3년간 예상되는 미국의 재정 악화와 국가채무 부담 증가, 거버넌스 악화 등을 반영한다""고 밝혔다. 호주 아이지(IG) 마켓의 토니 시커모어 애널리스트는 피치의 이번 결정으로 위험자산 기피가 강해지면서 아시아 증시가 약세를 보이고 미 국채와 같은 안전자산 선호가 늘어날 것으로 내다봤다. 또 외환시장에서는 호주·뉴질랜드 달러 등 위험한 통화 대신 엔화 등 안전한 통화가 강세를 보일 가능성이 있다는 것이다. 반면 자산관리 업체 로베코의 조슈아 크래브는 ""최근 시장 흐름이 매우 좋았다""면서 ""(차익 실현을 위해) 우려할만한 것들을 찾고 있었을 뿐""이라고 평가하기도 했다. 일각에서는 미국 자산을 대체할 만한 것들이 마땅하지 않고 미국 경제의 성장세가 견고한 만큼 장기적으로 피치의 이번 결정이 미국 자산의 지위에는 큰 영향을 끼치지 않을 것이라는 평가를 내놓고 있다. 2011년 스탠더드앤드푸어스(S&P)의 미국 국가신용등급 하향 때도 세계적인 위험자산 매도세가 연출됐지만, 오히려 미 국채 가격은 올랐다는 것이다. 주요 6개국 통화 대비 달러의 가치를 보여주는 달러인덱스는 이날 장중 101.959까지 떨어졌다가 다시 102선을 회복, 전장 대비 0.171 하락한 102.132를 기록 중이다. 아시아 외환시장에서는 원화 약세가 두드러졌다. 원/달러 환율은 전장 대비 14.7원(1.14%) 상승한 1,298.5원에 장을 마쳤다. 중국 부양책에 대한 실망감과 경제 둔화 우려가 이어지는 가운데 역외위안/달러 환율은 0.0243위안 오른 7.1926위안을 기록 중이다. 반면 엔화 가치가 장중 약세에서 강세로 돌아서면서, 엔/달러 환율은 전장 대비 0.02엔 내린 142.72엔에 거래되고 있다. 국립호주은행(NAB)의 로드리고 카트릴 선임 환율전략가는 ""피치의 이번 결정이 중요하다고 보지 않는다""면서 ""오늘 오전 장에서 다소 시장이 움직였지만 단기간을 넘어서 더 오래 지속될 동력이 되지는 않을 것""이라고 평가했다. 호주뉴질랜드(ANZ) 은행의 데이비드 크로이 전략가는 ""액면 그대로 보면 미국의 명성과 위상에 먹칠하는 것이지만 시장의 불안과 위험회피 움직임을 부추긴다면 미 국채와 달러화 등 안전자산 매수로 이어질 수 있다""고 말하기도 했다. ","{'쏠쏠정보': 1, '흥미진진': '0', '공감백배': '0', '분석탁월': 1, '후속강추': '0'}"
2023-08-03 02:13:00,세계,美 그랜드 캐니언서 버스 전복…1명 사망·56명 부상,  미국 서부지역의 관광 명소인 그랜드캐니언에서 관광버스가 전복돼 1명이 숨지고 수십명이 다쳤다. 2일(현지시간) 현지 당국에 따르면 지난 1일 오전 9시 50분께 애리조나주 북쪽에 위치한 그랜드 캐니언 웨스트에서 관광버스가 전복됐다. 이 사고로 1명이 숨지고 버스에 타고 있던 관광객 등 56명이 다쳤다. 이 중 8명은 헬기 등을 통해 인근 병원으로 후송됐다. 사망자의 신원은 확인되지 않았다. 구체적인 사고 경위도 알려지지 않았다. 그랜드 캐니언 웨스트는 그랜드 캐니언 국립공원과는 별도로 후알라파이(Hualapai)라고 하는 부족에 의해 운영되는 곳이다. 이 부족 관계자는 그랜드 캐니언 웨스트 주차장 인근에서 이 버스와 다른 차량이 충돌해 사고가 발생했다고 전했다. 후알라파이 국가 경찰국과 애리조나 공공안전국은 정확한 사고 경위를 조사 중이며 현재로서 추가적인 정보는 없다고 밝혔다. ,"{'쏠쏠정보': '0', '흥미진진': '0', '공감백배': '0', '분석탁월': '0', '후속강추': 1}"
2023-08-03 02:32:00,세계,"젤렌스키 ""사우디 회의 계기로 가을 중 평화정상회의 개최희망""","""사우디 회의에 약 40개국 참여…평화정상회의 디딤돌 될 것""   볼로디미르 젤렌스키 우크라이나 대통령은 오는 5일 사우디아라비아에서 열릴 예정인 우크라이나 평화 관련 국제회의를 계기로 가을 중 우크라이나 평화 정상회의를 개최하길 바란다고 밝혔다. 2일(현지시간) 로이터 통신에 따르면 젤렌스키 대통령은 이날 자국 외교관들과의 회의에서 ""우크라이나 평화 정상회의가 가을에 열리기를 바란다""며 ""이번 사우디 회의에 거의 40개국이 참여하기로 했다. 이번 회의가 이 같은 목표를 위한 디딤돌이 될 것""이라고 기대했다. 그는 또 ""우리는 가을 중 평화 정상회의가 성사되도록 노력하고 있다""면서 ""가을은 매우 이르지만, 회의를 준비하고 세계 대부분 국가를 참여시킬 시간이 여전히 있다""고 말했다. 오는 5~6일 사우디아라비아 제다에서는 우크라이나 전쟁 종식을 위한 국제회의가 열릴 예정으로, 우크라이나와 미국, 유럽연합(EU), 브라질, 인도, 인도네시아, 이집트, 멕시코, 칠레 등 30개국 정부 관계자가 초청됐고 러시아는 불참할 것으로 알려졌다. 우크라이나는 이 회의에서 러시아군 철수와 정의 회복, 핵 안전과 식량안보, 에너지 안보 등 10개 항으로 된 평화공식을 논의할 예정이다. 젤렌스키 대통령은 지난해 11월 인도네시아에서 열린 주요 20개국(G20) 정상회의에서 해당 평화공식과 함께 이를 위한 논의의 장으로서 우크라이나 평화 정상회의 개최를 제안한 바 있다. 우크라이나 평화 정상회의의 정확한 개최 장소나 시기는 아직 결정되지 않았다. 우크라이나 정부와 서방 관계자들은 이 회의에 러시아는 초청되지 않을 것이라는 입장이다. ","{'쏠쏠정보': '0', '흥미진진': '0', '공감백배': 5, '분석탁월': '0', '후속강추': '0'}"
2023-08-03 04:45:00,사회,경기 부천 상동서 상수도관 파손…500세대 단수 피해,"  경기도 부천에서 도로 지하에 묻힌 상수도관이 터져 단수가 발생했다. 3일 경기도소방재난본부에 따르면 전날 오후 9시 2분께 경기도 부천시 상동역 인근 도로에서 지하에 매설된 상수도관이 파손됐다. 이 사고로 인명 피해는 없었으나 인근에 거주하는 500세대가량에 7시간 넘게 수돗물 공급이 끊긴 상태다. 또 파손된 관로에서 수돗물이 도로로 흘러나와 인근 건물 지하주차장의 차량 출입이 통제됐다. 부천시는 이날 오전 0시 43분께 '수도관 파손으로 일대 단수가 발생했다'며 '식수와 생활용수를 확보해달라'는 긴급 재난 문자를 보냈다. 이후 밤샘 복구 작업을 거쳐 8시간 만인 이날 오전 5시께부터 수돗물이 끊긴 세대에 급수를 재개할 방침이다. 경기도소방재난본부 관계자는 ""인도 아래에 묻힌 수도관이 갑자기 파손돼 누수가 발생한 것으로 보고 있다""고 말했다. ","{'쏠쏠정보': '0', '흥미진진': '0', '공감백배': '0', '분석탁월': '0', '후속강추': '0'}"
2023-08-03 05:00:00,정치,"윤재옥, 오늘 어르신 무더위쉼터 폭염 대응 점검","  국민의힘 윤재옥 원내대표가 3일 기록적 폭염에 대비해 폭염 취약 계층인 어르신들의 무더위쉼터를 방문한다. 윤 원내대표는 이날 서울 종로구 한 경로당을 찾아 냉방시설 등을 점검하고 폭염 대응 상황을 살필 예정이다. 현장 방문에는 당 최고위원을 포함한 지도부와 종로구를 지역구로 둔 최재형 의원 등이 참여한다. 당 관계자는 ""날씨가 무덥고 장소도 협소한 만큼 가급적 소규모로 방문할 예정""이라고 설명했다. ","{'쏠쏠정보': '0', '흥미진진': '0', '공감백배': '0', '분석탁월': '0', '후속강추': '0'}"
2023-08-03 05:00:00,IT,"[사이테크+] 사상 최대 동물 바뀌나…""최대 340t 고대 고래 화석 발견""","獨 연구팀 ""대왕고래의 2~3배…체중, 3천900만년 전 최고치 도달한 듯""   페루에서 발견된 3천900만년 전 화석을 토대로 복원한 고대 고래의 체중이 최대 340t에 달하는 것으로 추정돼 역사상 가장 무거운 동물로 꼽히는 대왕고래를 능가했을 가능성이 큰 것으로 나타났다. 독일 슈투트가르트 국립 자연사박물관 엘리 암슨 박사팀은 3일 '네이처'(Nature)에서 페루 남부에서 발견된 척추 13개, 갈비뼈 4개, 엉덩이뼈 1개 등을 분석한 결과 신종 고래 '페루세투스 콜로서스'(Perucetus colossus)로 분류됐으며, 몸무게가 대왕고래의 2~3배에 달했을 것으로 추정된다고 밝혔다. 발견된 뼈 화석을 토대로 전체 몸을 복원한 결과 이 동물은 에오세 중기인 3천900만년 전에 살던 바실로사우루스과에 속하는 신종 고래로 밝혀졌으며, 몸길이가 최대 20ｍ, 몸무게는 85~340t에 달할 것으로 추정됐다. 연구팀은 이는 몸길이 25ｍ, 몸무게 130~150t으로 역사상 가장 무거운 동물인 대왕고래와 최소한 비슷하거나 2~3배 더 무거운 것으로 해양 포유류의 거대화 추세가 지금까지 생각했던 것보다 일찍 시작됐을 수 있음을 시사한다고 설명했다. 연구팀은 고래와 돌고래 등 포유류가 속한 고래목 동물의 화석은 일부 육상 동물이 바다로 돌아갔을 때 포유류의 진화 역사 기록에 매우 중요하다고 밝혔다. 이어 이전 기록에 따르면 이들이 바다로 돌아간 뒤 수중 생활에 적응해 몸이 커지면서 체중도 증가한 것으로 나타났지만 고래의 체중이 최대치에 도달한 것은 상대적으로 최근의 일로 추정돼 왔다고 말했다. 그러나 페루세투스 콜로서스의 발견은 고래류가 이전까지 추정해온 것보다 3천만년가량 더 이른 시기에 이미 수중 환경에 완전히 적응하는 신체 특성을 갖췄고 체중 역시 최대치에 도달했음을 시사한다고 연구팀을 설명했다. 특히 페루세투스 콜로서스의 골 질량은 알려진 포유류나 수생 척추동물들의 골 질량을 능가하는 것으로 나타났으며, 이는 바실로사우루스과 고래가 해안같이 얕은 물 속 환경에 맞게 특화돼 진화했다는 기존 이론을 뒷받침하는 것으로 풀이된다. 미국 노스이스트 오하이오 의대 J.G.M. 테위센 교수는 논문과 함께 게재된 논평에서 ""고대 고래의 골격과 체중이 예상외로 거대했음을 보여주는 이 화석은 동물 몸 크기의 진화에 대한 우리 이해에 이의를 제기하는 것""이라며 ""이 화석의 중요성은 이전에 알려지지 않은 생명체 하나가 발견됐다는 것 그 이상""이라고 말했다. ","{'쏠쏠정보': 7, '흥미진진': 9, '공감백배': 3, '분석탁월': 2, '후속강추': 2}"
2023-08-03 05:01:00,정치,"민주 민생채움단, 플랫폼 스타트업과 간담회…지원방안 논의","  더불어민주당 민생채움단은 3일 플랫폼 스타트업 업계와 미래 산업 지원 방안을 두고 머리를 맞댄다. 민생채움단은 출범 사흘째인 이날 오후 서울 마포구 프론트원에서 플랫폼 기업 로톡, 닥터나우, 삼쩜삼, 알스퀘어 등의 관계자와 간담회를 연다. 행사에는 박광온 원내대표를 비롯한 원내지도부와 함께 강훈식 의원 등 국회 스타트업 연구모임 유니콘팜 소속 의원들이 자리할 예정이다. 이들은 간담회에서 스타트업 관계자들로부터 혁신 성장 지원 방안과 애로사항 등을 두루 청취할 예정이다. '국민의 삶을 채우는 민주당'을 슬로건으로 내건 민생채움단은 정기국회를 앞두고 입법·정책 과제를 모색하기 위해 지난 1일 발족하고 현장 행보를 이어가고 있다. ","{'쏠쏠정보': '0', '흥미진진': '0', '공감백배': '0', '분석탁월': '0', '후속강추': '0'}"
2023-08-03 05:27:00,세계,"재선 차질 우려 美 바이든 정부 ""신용등급강등은 트럼프탓"" 공세","바이든, 연일 바이드노믹스 강조했는데 강등…옐런 ""경제 강력한데 당혹""   미국 바이든 정부가 국제신용평가사 피치의 국가신용등급 강등 조치에 대해 연일 강도 높게 비판하고 있다. 조 바이든 대통령이 이른바 '바이드노믹스'를 앞세워 재선 도전에 나선 상황에서 신용등급 '강등 조치'가 나오자 전임 트럼프 정부의 책임과 피치의 평가 시스템을 문제 삼는 모습이다. 재닛 옐런 재무부 장관은 2일(현지시간) 버지니아주 맥클린의 국세청(IRS) 사무실을 방문한 자리에서 ""저는 피치의 결정에 강하게 반대하며 전적으로 부당하다고 생각한다""고 말했다. 이어 ""피치의 오류가 있는 평가는 오래된 데이터에 기반했으며 (바이든 정부 출범 후) 지난 2년반 간의 거버넌스 등 관련 지표의 개선 상황을 반영하는 데 실패했다""고 말했다고 블룸버그통신, CNBC 방송 등이 보도했다. 그는 ""피치의 결정은 우리가 미국에서 경험하는 강력한 경제에 비춰볼 때 당혹스럽다""면서 ""피치의 결정은 미국 국채가 세계 최고의 안전자산이고 미국 경제가 근본적으로 강력하다는 사실을 바꾸지 않는다""고 반박했다. 옐런 장관은 전날 피치의 강등 결정 직후에도 성명을 내고 이번 결정에 대해 ""자의적""이라고 반발했다. 그러면서 피치의 정량평가 모델이 트럼프 정부 때인 지난 2018~2020년 현저하게 하락했다가 바이든 정부에서는 개선됐는데 이런 부분이 반영되지 않았다고 주장했다. 케빈 무노스 바이든 대선 캠프 대변인은 아예 이번 강등을 '트럼프 강등'으로 지칭했다. 그는 NBC 방송 등에 ""이번 '트럼프 등급 강등'은 극단적인 마가(MAGA·미국을 다시 위대하게라는 뜻의 트럼프 전 대통령 선거 슬로건) 공화당 어젠다의 직접적 결과""라면서 ""도널드 트럼프는 수백만개의 일자리가 사라지게 했으며, 부자와 대기업에 대한 재앙적 감세로 적자를 확대했다""고 비판했다. 그는 또 피치가 등급 강등의 이유로 꼽은 부채한도 협상 문제와 관련해 트럼프 전 대통령이 요구사항 관철을 위해 채무불이행(디폴트)을 감수해야 한다고 언급한 것도 거론했다. 바이든 정부의 이런 고강도 반발은 피치 결정에 따른 경제적 영향과 함께 정치적 파장도 고려한 것으로 분석된다. 바이든 대통령은 대규모 투자 유치 및 일자리 창출, 인플레이션 하락, 낮은 실업률 등 경제 성과를 부각하면서 재선 캠페인을 벌이고 있는데 자칫하면 신용등급 강등 사태로 선거 전략이 차질을 빚을 수 있기 때문이다. 앞서 피치는 전날 12년만에 미국 신용등급을 미국의 국가신용등급을 'AAA'에서 'AA+'로 하향하고 올해 연말이나 내년 초에 미국의 경기가 침체할 수 있다는 전망도 내놨다. ","{'쏠쏠정보': 1, '흥미진진': '0', '공감백배': 3, '분석탁월': '0', '후속강추': 1}"
2023-08-03 05:29:00,세계,"美국방차관보, 中외교 북미담당에 '군사 소통 채널' 강조","  미국을 방문 중인 양타오 중국 외교부 북미대양주사(司) 사장(국장급)이 미국 국무부에 이어 국방부의 중국 담당을 만나 양국 관계 현안을 논의했다. 미국 국방부 대변인은 2일(현지시간) 성명에서 ""일라이 래트너 국방부 인도태평양 안보 담당 차관보가 오늘 양 국장과 대화했다""며 양측이 ""미중 국방 관계와 역내 안보 현안들을 논의했다""고 밝혔다. 대변인은 ""차관보는 미중 간 군 대 군 소통 채널을 열어두고자 하는 국방부의 지속적인 의지도 강조했다""고 설명했다. 그동안 미국은 우발적 충돌 가능성을 차단하는 데 필요하다며 중국에 군 대 군 소통 채널 복원을 거듭 촉구하고 있지만 아직 중국이 응하지 않고 있다. 양 국장은 전날 국무부에서 대니얼 크리튼브링크 동아태차관보를 만났으며 크리튼브링크 차관보는 이 자리에서 왕이 중국 외교부장의 미국 방문을 공식 초청했다. ","{'쏠쏠정보': '0', '흥미진진': '0', '공감백배': '0', '분석탁월': '0', '후속강추': '0'}"
2023-08-03 05:40:00,사회,낮 최고 38도 폭염…곳곳 소나기,"  목요일인 3일 전국 대부분 지역의 체감온도가 35도 내외로 올라 매우 무더운 가운데 일부 지역에 소나기가 내리겠다. 낮 최고기온은 33∼38도로 예보됐다. 이날 오전 5시 현재 기온은 서울 26.1도, 인천 25.1도, 수원 23.7도, 춘천 22.2도, 강릉 30.8도, 청주 25.8도, 대전 24.0도, 전주 26.0도, 광주 26.0도, 제주 28.3도, 대구 27.0도, 부산 27.2도, 울산 24.8도, 창원 25.5도 등이다. 대기 불안정으로 제주도에 가끔 소나기가 내리는 곳이 있겠다. 오후부터 저녁 사이엔 충청권 내륙·전북·전남권 북부·경북권(북부 동해안 제외)·울산·경남 내륙에도 소나기가 내리는 곳이 있겠다. 소나기가 내리는 지역에서는 대기가 불안정하여 돌풍과 천둥·번개를 동반한 시간당 30㎜ 내외의 강한 소나기가 내리는 곳이 있겠다. 예상 강수량은 대전·세종·충남 내륙(남동내륙 제외)·충북 중부·충북 북부 5~40㎜, 전북·광주·전남 북부·대구·경북(북부 동해안 제외)·울산·경남 내륙·제주 5~60㎜다. 미세먼지 농도는 원활한 대기 확산으로 전 권역이 '좋음'∼'보통' 수준을 보이겠다. 내륙에는 안개가 짙게 끼는 곳이 있겠으니 교통 안전에 유의해야 한다. 바다의 물결은 동해 앞바다에서 0.5∼1.5m, 서해 앞바다에서 0.5∼2.0m, 남해 앞바다에서 0.5∼2.0m로 일겠다. 안쪽 먼바다(해안선에서 약 200㎞ 내의 먼바다)의 파고는 동해 0.5∼2.0m, 서해 0.5∼4.0m, 남해 1.5∼4.0m로 예측된다.  ※ 이 기사는 엔씨소프트의 인공지능 기술인 자연어처리기술(NLP)과의 협업을 통해 제작되었습니다. 인공지능이 쓴 초고와 기상청 데이터 등을 토대로 취재 기자가 최종 기사를 완성했으며 데스킹을 거쳤습니다. 기사의 원 데이터인 기상청 기상예보는 웹사이트(https://www.weather.go.kr)에서도 확인할 수 있습니다.","{'쏠쏠정보': '0', '흥미진진': 2, '공감백배': '0', '분석탁월': '0', '후속강추': 5}"
