date,category,title,content,reaction
2023-08-23 16:06:00,경제,"코스피, 잭슨홀 회의 앞두고 약보합…외인·기관 매도에 2,500대(종합)","이차전지 종목 하락…양자컴퓨터 테마주 강세   코스피가 23일 잭슨홀 회의를 앞두고 외국인과 기관의 매도에 밀려 소폭 내렸다. 이로써 코스피는 지난 21일 이후 이틀 연속 이어오던 상승세를 멈췄다. 이날 코스피 종가는 전장보다 10.24포인트(0.41%) 내린 2,505.50으로 집계됐다. 지수는 전장보다 5.74포인트(0.23%) 내린 2,510.00으로 출발한 뒤 하락세를 이어왔다. 유가증권시장에서 외국인과 기관은 각각 75억원, 890억원어치 순매도하며 지수를 끌어 내렸다. 반면 개인은 942억원어치 매수 우위를 보였다. 이날 증시는 잭슨홀 회의를 앞두고 경계심리가 산재한 가운데 중국 증시의 약세에 영향을 받는 흐름을 보였다. 이경민 대신증권 연구원은 ""미국 국채 금리 상승 부담이 지속되는 상황에서 잭슨홀 회의를 앞두고 관망심리가 유입되며 국내 증시가 부진했다""며 ""특히 중국 상하이종합지수와 연동된 흐름으로 코스피가 하락세를 지속했다""고 분석했다. 오는 25일(현지 시간) 제롬 파월 연방준비제도(연준·Fed) 의장이 잭슨홀 회의 연설에서 금리 인상과 관련해 어떤 입장을 드러낼지 투자자들의 이목이 집중되고 있다. 시가총액(시총) 상위 종목 가운데 LG에너지솔루션(-2.41%), POSCO홀딩스(-1.25%), 포스코퓨처엠(-3.54%) 등 이차전지 관련 종목이 일제히 하락했다. 이외에도 현대차(-0.11%), NAVER(-2.04%) 등이 내렸다. 반면 삼성전자(0.75%), 카카오(0.72%), KB금융(1.15%) 등은 올랐다. 또한 이날 국내 연구진이 상온에서 대규모 양자 얽힘 현상을 구현할 수 있는 양자 소재 후보 물질을 실험으로 증명했다고 밝히자 우리로(29.96%), 엑스게이트(29.88%), 코위버(29.90%) 등 양자컴퓨터 관련 종목이 일제히 급등해 상한가에 장을 마쳤다. 업종별로는 화학(-1.10%), 철강 및 금속(-1.28%), 의료정밀(-4.86%) 등이 하락한 반면, 음식료품(1.12%), 전기가스업(0.57%) 등은 올랐다. 코스닥지수는 전장보다 10.46포인트(1.17%) 내린 882.87로 장을 마쳤다. 지수는 전장보다 0.68포인트(0.08%) 내린 892.65로 출발한 뒤 하락 폭을 키웠다. 외국인과 기관이 각각 1천715억원, 782억원어치를 순매도하며 지수를 끌어내렸다. 반면 개인은 2천528억원어치를 순매수했다. 시총 상위 종목 가운데 에코프로(-3.17%) 와 에코프로비엠(-4.89%), 엘앤에프(-5.19%) 등 이차전지 관련 종목이 하락했다. 반면 JYP엔터테인먼트(0.55%), 에스엠(1.61%), 파라다이스(0.36%)등은 올랐다. 이날 하루 유가증권시장과 코스닥시장의 거래대금은 각각 8조4천650억원, 12조5천270억원으로 집계됐다. ","{'쏠쏠정보': '0', '흥미진진': '0', '공감백배': '0', '분석탁월': '0', '후속강추': '0'}"
2023-08-23 16:09:00,사회,'음주운전 3회' 20대 남성 차량 압수 조치…충남 첫 사례,"  무면허 상태로 음주운전을 하다 적발된 상습 음주운전자 차량이 압수됐다. 23일 충남경찰청은 2019년과 지난해 두 차례 만취운전으로 면허가 취소된 상태에서 최근에 또 음주운전을 하다 적발된 20대 A씨 소유의 2006년형 SM5 차량을 압수했다고 밝혔다. A씨는 지난 21일 오전 4시께 충남 공주의 한 도로에서 무면허 상태로 음주운전을 하다 경찰에 붙잡혔다. 당시 혈중알코올농도는 0.242％로 면허 취소 수준이었다. A씨는 무면허 상태임에도 지난 6월 자신의 명의로 승용차를 다시 구입해 운전한 것으로 조사됐다. 경찰은 재범 위험성이 높다고 보고 법원으로부터 압수 영장을 발부받아 A씨 차량을 압수했다. 경찰 관계자는 ""상습 음주운전 차량 압수를 통해 재범의지를 사전에 차단하고, 음주운전 처벌을 피하려고 술을 마시지 않은 동승자나 동종 전력이 없는 지인을 가짜 운전자로 내세우는 경우 엄벌할 방침""이라고 말했다. ","{'쏠쏠정보': 1, '흥미진진': 1, '공감백배': 2, '분석탁월': '0', '후속강추': 3}"
2023-08-23 16:11:00,사회,홍천군 민방위 대피훈련, 23일 오후 강원 홍천군청에서 민방위훈련이 열려 직원들이 대피훈련을 하고 있다.  [홍천군 제공.재판매 및 DB 금지] ,"{'쏠쏠정보': '0', '흥미진진': '0', '공감백배': '0', '분석탁월': '0', '후속강추': '0'}"
2023-08-23 16:11:00,사회,춘천시 민방위훈련 응급처치, 23일 오후 강원 춘천시 사북면 행복복지센터에서 을지연습 연계 공습 대비 민방위훈련이 열려 주민들이 응급 처치 방법을 배우고 있다.  [춘천시 제공.재판매 및 DB 금지] ,"{'쏠쏠정보': '0', '흥미진진': '0', '공감백배': '0', '분석탁월': '0', '후속강추': '0'}"
2023-08-23 16:11:00,정치,"북한, 코로나 이후 중국서 첫 전시관 개설…상품 열띤 홍보","韓 매체에도 적극 설명…관람객과 기념사진 찍기도   코로나19 발생 이후 3년 7개월여만에 중국 내 공개 전시행사에 처음 참가한 북한이 열심히 북한산 제품을 홍보하며 그간 사실상 중단했던 대외 경제활동을 적극 재개하려는 모습을 보였다. 23일 중국 창춘에서 개막한 '중국-동북아 박람회'에서 북한은 국가관과 상품 전시관 두 곳을 개설, 운영에 나섰다. 국가관 책임자는 ""중국 훈춘∼원정리 통상구가 개방된 이후 우리 제품이 정상적으로 수입되고 있다""며 ""국가관이라 일부 제품만 전시하고 있으며, 우리 제품을 전문으로 판매하는 인터넷 쇼핑몰에서 손쉽게 구매할 수 있다""고 설명했다. 그는 ""가장 인기 있는 제품은 고려인삼으로 만든 인삼 술·화장품""이라며 ""인삼 술 가격은 700위안(약 12만8천원)가량인데 잘 팔린다""고 덧붙였다. 다만 그는 언제 북중 국경이 전면 개방되고, 인적 왕래가 재개되는지에 대한 질문에는 말끝을 흐렸다. 상품 전시관에는 한복을 입은 4명의 북한 여성이 관람객들을 맞이했다. 이들은 밝은 표정으로 관람객들의 질문에 상세하게 대답하며 상품을 안내했다. 한 북한 직원은 ""이번 박람회에 화장품, 과자, 술 등 200여 종의 제품을 전시, 판매한다""고 소개했다. 이 직원은 ""'금당-5 알약'을 적극 권한다""며 ""인삼과 오미자 추출물 등의 성분을 나노화 등 첨단기술을 적용해 제조한 약물로 면역 효과뿐 아니라 코로나19 후유증을 극복하는 데도 도움이 된다""고 말했다. 이들은 한국 매체라고 밝혔음에도 기피하지 않고 거리낌 없이 인터뷰에 응하는 등 개의치 않는 모습을 보였다. 또 관람객들의 요구에 기념사진 촬영에 응하는 등 적극적인 모습을 보였다. 코로나19 발생 이후 3년 7개월 만에 공식 행사로는 처음으로 이날 박람회 개막식에 참석한 구영혁 주선양 북한 총영사는 개막식이 끝난 뒤 북한 국가관과 상품 전시관을 찾아 진행 상황을 확인하고, 관계자들을 격려했다. 남북한과 중국, 일본, 러시아, 몽골 등 6개국이 참가하고, 전시관도 운영하는 이 박람회에서 북한 상품 전시관에는 많은 관람객이 몰리며 주목받았다. 한 중국 관람객은 ""코로나19 이후 지금까지 북한 상품 전시회를 접할 기회가 없었다""며 ""사람들의 관심이 많은 전시관이라고 해 가장 먼저 관람했다""고 말했다. ","{'쏠쏠정보': '0', '흥미진진': '0', '공감백배': 1, '분석탁월': '0', '후속강추': '0'}"
2023-08-23 16:11:00,사회,"[현장] 광주 정율성거리 전시관 가보니…""찾는 이 없어, 썰렁""","역사공원 사업 의견 갈려 ""공원으론 괜찮아"" vs ""행적 잘 따져야""   ""신종 코로나바이러스 감염증(코로나19)이 시작하기 전에는 중국인 관광객들이 오기는 했지만, 지금은 신경 쓰는 사람도 별로 없어요"" '정율성 역사공원' 조성사업을 두고 벌어진 박민식 국가보훈부 장관과 강기정 광주시장의 설전이 주목받는 가운데 23일 찾아가 본 광주 남구 양림동 정율성거리 전시관. 아파트와 인도를 구분 짓는 외벽을 게시대 삼아 지어진 전시관에는 정율성의 일대기, 연혁을 소개하는 게시물과 초상화 등 사진 20여점이 걸려 있었다. 전시관 끝자락에 마련된 방명록에는 찾는 이가 없었던 듯 방문자 이름 대신 검은 펜으로 적힌 낙서만 가득했다. 200ｍ 길이의 정율성거리에는 시민들이 간혹 오가기는 했지만 그를 기리기 위해 지어진 전시관을 눈여겨보는 이는 찾기 힘들었다. 인근에서 상가를 운영 중인 상인들은 조성된 지 14년이 지난 정율성거리와 전시관에 대해 별다른 관심이 없거나 정율성이라는 인물 자체를 모른다고 떨떠름해 했다. 전시관 인근에 정율성 생가까지 있지만 그가 어떤 행적을 남긴 인물인지도 구체적으로 알지 못한다는 표정이었다. 식료품 판매업자 A씨는 ""3년 전에는 중국인 관광객들이 대형 버스를 타고 방문해 초상화 앞에서 추모하기도 했다""며 ""지금은 중국인들도 오지 않고, 애써 시간을 내서 오는 시민들도 없다. 관광객 발길이 끊긴 지 오래""라고 말했다. 이어 ""상가 입점하고 나서야 도로명 주소가 정율성로라서 정율성이라는 사람을 알게 됐는데 오죽하겠느냐""고 덧붙였다. 또 다른 상인도 ""과거 행적이나 역사적 업적보다는 이런 시설로 인해 관광객들이 얼마나 오고 매출에 영향을 주는지 관심이 있을 뿐""이라며 ""전반적인 상가 분위기가 그렇다""고 전했다. 박 장관의 사회관계망서비스(SNS) 글을 통해 전날 논란이 된 역사공원 조성사업에 대해서는 '있어도 괜찮다'와 '필요 없다'는 입장으로 나눴다. 이곳에서 13년째 음식점을 운영하는 박모 씨는 ""특정 인물의 이름을 건 시설일 경우 사전에 행적 등을 검증할 필요가 있겠지만 친일파와 같이 용서하지 못할 죄를 저지른 것이 아니라면 공원과 같은 편의 시설이 들어서는 것이 낫다""고 말했다. 과거 행적으로 논란이 일고 있는 상황에서 파문을 확산할 이유가 없다며 반대한 상인도 있었다. 상인 김모 씨는 ""생가나 이미 조성한 전시관은 그렇다고 쳐도 중공군을 위한 응원가를 만들었다고 시끄러운데 공원에 굳이 그 사람의 이름을 붙일 필요는 없는 것 같다""고 말했다. 또 ""태어난 곳이 광주라는 이유로 관련 시설물을 조성하는 것도 고려해볼 문제""라며 ""우리가 그 인물을 기릴 만큼 우리 지역의 역사와 관련이 있는지 잘 살펴야 한다""고 강조했다. 박 장관과 강 시장은 광주시가 추진하는 '정율성 역사공원' 조성사업을 두고 SNS에 글을 올리며 설전을 벌였다. 박 장관은 ""정율성은 공산군 응원 대장이다""며 사업 철회를 요구했고, 강 시장은 ""한중우호에 기여한 인물""이라고 반박하며 논란이 일었다. ","{'쏠쏠정보': 8, '흥미진진': '0', '공감백배': 1, '분석탁월': '0', '후속강추': '0'}"
2023-08-23 16:12:00,사회,대구 황금동∼범안삼거리 왕복 6차로 도로 신설 추진,"예비타당성 조사 대상사업에 선정   대구 수성구 황금동 황금고가교와 연호동 범안삼거리를 연결하는 왕복 6차로 도로 건설이 추진된다. 대구시는 이 사업이 기획재정부 재정사업평가위원회에서 예비타당성 조사 대상사업으로 선정됐다고 23일 밝혔다. 해당 사업은 2천798억원(국비 765억원, 지방비 2천33억원)을 투입해 총연장 3.1㎞ 도로를 신설하는 내용이다. 이 도로가 건설되면 주변 달구벌대로와 범안로 일대 출퇴근 시간대 심각한 교통혼잡이 일부 해소될 것으로 기대된다. 대구시 관계자는 ""2030년 대구경북신공항이 개항하면 해당 구간 교통혼잡이 더 가중될 것으로 예상되는 만큼 교통량 분산을 위해 도로 신설이 필요한 상황""이라고 밝혔다. ","{'쏠쏠정보': 1, '흥미진진': 1, '공감백배': 1, '분석탁월': '0', '후속강추': '0'}"
2023-08-23 16:12:00,사회,폴리텍대학 순천캠퍼스 개방형 체육공간 새 단장,  전남 순천시는 23일 한국폴리텍대학 순천캠퍼스 운동장을 개방형 체육공간으로 새로 단장했다고 밝혔다. 시는 3억원을 들여 풋살장 1면과 농구장 1면을 만들고 운동장 둘레에 맨발 걷기가 가능한 어싱길을 조성했다. 운동장은 평일 정규 수업 시간을 제외한 오전 7시부터 오후 9시까지 전면 개방된다. 시는 내년에 운동장 남은 공간에 인조 잔디를 조성할 예정이다. ,"{'쏠쏠정보': '0', '흥미진진': '0', '공감백배': '0', '분석탁월': '0', '후속강추': '0'}"
2023-08-23 16:12:00,사회,속초시 도심거리 민방위훈련, 23일 오후 강원 속초시 도심 거리에서 을지연습 연계 민방공 대피훈련이 열리고 있다.  [속초시 제공.재판매 및 DB 금지] ,"{'쏠쏠정보': '0', '흥미진진': '0', '공감백배': '0', '분석탁월': '0', '후속강추': '0'}"
2023-08-23 16:12:00,사회,속초시 민방위훈련, 23일 오후 강원 속초시 도심 거리에서 을지연습 연계 민방공 대피훈련이 열리고 있다.  [속초시 제공.재판매 및 DB 금지] ,"{'쏠쏠정보': '0', '흥미진진': '0', '공감백배': '0', '분석탁월': '0', '후속강추': '0'}"
2023-08-23 16:14:00,사회,"조달청, 공습 대비 민방위 훈련", 김윤상 조달청장(왼쪽)이 23일 공습 대비한 민방위 훈련에 참여해 대응 태세 등을 점검하고 있다.   ,"{'쏠쏠정보': '0', '흥미진진': '0', '공감백배': '0', '분석탁월': '0', '후속강추': '0'}"
2023-08-23 16:14:00,생활,"'마스크걸' 김용훈 감독 ""열연한 배우들 호평받을 때 가장 기뻐""","넷플릭스 비영어권 2위…""인간의 이중성·양면성 담으려 노력""   ""'마스크걸'은 배우들이 가장 조명받을 수 있는 작품이 될 거라고 생각했어요. 그만큼 배우들의 도전이 필요한 작품이었고, 그 도전 없이는 만들기 힘든 작품이었죠."" 김용훈 감독의 말처럼 지난 18일 공개된 넷플릭스 오리지널 드라마 '마스크걸'은 배우들의 과감한 변신과 연기 도전이 돋보였다. 배우 안재홍은 분장을 거쳐 주인공 김모미에게 집착하는 못생긴 직장 상사 주오남으로 변신했고, 염혜란은 아들을 잃고 복수심에 사로잡힌 김경자의 광기를 연기해 호평받았다. '3인 1역'으로 김모미를 연기한 이한별, 나나, 고현정도 호연을 보여줬다. 이 때문인지 김 감독은 23일 서울 강남구 한 카페에서 진행된 인터뷰 내내 배우들을 칭찬했다. 주로 소셜미디어(SNS)를 통해 반응을 살핀다는 김 감독에게 어떤 반응이 기쁜지 묻자 ""배우들이 호평받는 게 가장 기쁘다""는 대답이 돌아왔다. 김 감독은 드라마 촬영 과정에서 배우들의 열정을 느낀 일화를 소개했다. 안재홍은 시청자가 자기 모습을 몰라볼 정도로 분장하고 싶다며 의욕을 보였고, 도수 높은 안경까지 착용하며 더 못생긴 외모를 보여주려 해 도리어 김 감독이 말렸다고 한다. 또 염혜란은 물 공포증이 있는데도 두려움을 극복하고 물에 빠진 자동차에서 탈출하는 장면을 연기했다. 김 감독은 ""수중 촬영분을 본 염혜란 배우가 만족하지 못한 듯 '다시 찍고 싶다'고 말해 그 열정에 놀랐다""고 떠올렸다. 동명 웹툰을 원작으로 한 '마스크걸'은 못생겼다는 이유로 가수의 꿈을 접은 평범한 직장인 김모미가 가면을 쓴 채 마스크걸이란 별명으로 인터넷 방송을 하면서 벌어지는 일을 그렸다. 직장인 시절의 김모미는 이한별이, 살인 사건에 휘말려 성형수술을 한 뒤의 김모미는 나나가, 자수해서 교도소에 수감된 지 10년이 지난 뒤의 김모미는 고현정이 각각 연기했다. 김 감독은 ""김모미는 한 명의 인물이지만, 서로 다른 사람처럼 느껴지게 연출하고 싶었다""며 ""살인 사건을 겪은 김모미는 이전과 다른 인물이 되고, 10년간 교도소에 수감된 뒤에는 또 다른 인물이 될 것이라 생각했다""고 설명했다. 이처럼 3인 1역이란 색다른 시도로 드라마가 주목받고 있지만, 제작 과정이 순탄하지만은 않았다고 한다. 김 감독은 ""(3인 1역이) 워낙 과감한 시도여서 제작진 내부에서도 반대가 심했다""며 ""실제 분장으로 다른 모습을 연출할 수 있을지 테스트도 해 봤지만, 도저히 원하던 결과가 나오지 않아 결국 3인 1역으로 촬영했다""고 말했다. 이중 직장인 시절 김모미는 새로운 얼굴로 주목받았다. 김 감독은 ""아무리 떠올려도 성형 전 김모미의 모습에 알맞은 배우가 보이지 않았다""며 ""조감독이 모델 에이전시에 원하는 배우의 캐릭터를 설명하고 나오는 길에 프로필 접수를 하는 분 모니터에서 이한별을 발견했다""고 했다. 김 감독은 ""이한별 배우는 연기에 열망이 컸는데 마지막 도전이라 생각하고 모델 에이전시에 프로필을 냈다고 한다""며 ""김모미에게는 인간적인 매력이 있어야 했는데, 이한별에게서 그런 매력이 느껴졌다""고 덧붙였다. 이한별은 날씬한 몸매의 김모미로 변신하기 위해 2개월 동안 배구선수 김연경의 트레이너에게 혹독한 트레이닝을 받았다고 한다. 넷플릭스 집계에 따르면 '마스크걸'은 지난주(14∼20일) 비영어권 국가에서 두 번째로 많이 시청됐다. '마스크걸'은 굿데이터코퍼레이션이 집계한 주간 TV 및 OTT(온라인 동영상 서비스) 화제성 1위에도 올랐다. 김 감독은 ""'마스크걸'은 표면적으로는 외모지상주의를 다루지만, 그 저변에는 인간의 이중성과 양면성이 있다""고 강조했다. 그는 ""모든 인물에 대해 '이 사람이 왜 이렇게 됐을까' 하는 의문을 풀어내고 싶었다""며 ""김모미와 주오남이 이런 인물이 된 이유가 과연 그들 자신만의 문제였을까, 하는 부분을 조명하려 했다""고 설명했다. ","{'쏠쏠정보': '0', '흥미진진': 2, '공감백배': '0', '분석탁월': '0', '후속강추': '0'}"
2023-08-23 16:15:00,정치,북한 전시관 찾은 구영혁 주선양 북한총영사,  구영혁 주선양 북한총영사가 23일 중국 창춘에서 개막한 '중국-동북아 박람회'를 방문해 전시관을 살펴보고 있다.  ,"{'쏠쏠정보': '0', '흥미진진': '0', '공감백배': '0', '분석탁월': '0', '후속강추': '0'}"
2023-08-23 16:15:00,사회,"남강댐 드론 테러 막아라…경남도, 을지연습 실제 훈련","공습 대비 전 도민 대상 민방위 훈련도 6년 만에 실시   경남도는 23일 오후 진주 한국수자원공사 남강댐지사에서 2023년 을지연습 도 대표 실제훈련인 '국가중요시설 남강댐 드론 테러 대응 종합훈련'을 했다. 박완수 지사를 비롯해 39사단장, 국정원 경남지부장, 경남경찰청 공공안전부장, 진주시장, 지역주민 등 250여 명이 참관한 이날 훈련에는 소방헬기, 장갑차, 드론 등 21종 30여 점의 장비가 동원됐다. 이번 훈련은 국가총력전 수행에 필수적인 국가중요시설을 대상으로 한 드론 등 새로운 유형의 공격에 대처하는 능력 향상과 방호기능 강화로 인적·물적 피해 최소화, 민·관·군·경·소방의 협조체계 구축으로 위기관리 역량을 강화하려는 취지로 실시됐다. 훈련은 드론 폭발물 테러 대응, 군·경 합동 초동 조치, 유관기관 합동 인명구조, 화재진압 훈련 등 새로운 유형의 테러 대응을 위한 유관기관 합동훈련이 펼쳐졌다. 박완수 지사는 현장에서 ""현장관리자 초동 조치와 민·관·군·경·소방의 유기적인 협업을 통한 임무수행의 중요성을 보여주는 훈련""이라며 ""드론 등을 이용한 대처능력을 향상하기 위해 변화한 안보환경을 정확하게 파악하고 제대로 대응할 수 있도록 역량을 높여 나가야 한다""고 말했다. 앞서 경남도는 이날 오후 2시부터 20분간 전 도민을 대상으로 공습상황에 대비한 민방위 대피훈련을 실시했다. 6년 만에 시행된 이번 전국단위 훈련은 주민 대피 훈련, 어린이집·유치원·초·중·고등학교 학생 대피 훈련, 도내 45개소 다중이용시설 훈련, 시·군 단위 23개소 차량 이동통제 훈련, 긴급 차량 실제 운행 훈련이 실시됐다. 박완수 지사는 진주 중앙지하상가 현장을 찾아 비상차로 이동 통제훈련, 비상시 긴급차량 실제 운행 훈련, 대피소 내 대피 주민들의 심폐소생술 및 방독면 착용 등 빙상 시 행동요령 교육을 참관했다. ","{'쏠쏠정보': '0', '흥미진진': '0', '공감백배': '0', '분석탁월': '0', '후속강추': '0'}"
2023-08-23 16:15:00,스포츠,"프로야구 롯데-LG 맞대결, 이틀 연속 우천 취소",  23일 오후 6시 30분 서울 잠실구장에서 열릴 예정이던 2023 신한은행 SOL KBO리그 LG 트윈스와 롯데 자이언츠의 맞대결이 비로 취소됐다. 전날 경기도 비 때문에 치르지 못했던 두 팀은 이틀 연속 하늘만 바라보다 돌아가게 됐다. 이날 취소된 경기는 추후 편성된다. LG와 롯데에 모두 이번 시즌 13번째 우천 취소다. ,"{'좋아요': 1, '슬퍼요': 2, '화나요': 8, '팬이에요': '0', '후속기사 원해요': '0'}"
2023-08-23 16:16:00,정치,창춘에서 개막한 '중국-동북아 박람회'의 북한 상품 전시관,  23일 중국 창춘에서 개막한 '중국-동북아 박람회'에서 관람객들이 북한 상품 전시관을 둘러보고 있다.  ,"{'쏠쏠정보': '0', '흥미진진': '0', '공감백배': '0', '분석탁월': '0', '후속강추': '0'}"
2023-08-23 16:16:00,사회,경찰 사칭해 '칼부림 예고' 30대 회사원 구속영장,"""블라인드에 불만…논란 일으키려고 게시"" 진술   경찰청 사이버테러수사대는 23일 경찰관을 사칭해 인터넷에 '살인예고' 글을 올린 혐의로 30대 회사원 A씨의 구속영장을 신청했다. 경찰에 따르면 A씨는 지난 21일 오전 직장인 온라인 커뮤니티 '블라인드' 게시판에 경찰 직원 계정으로 '오늘 저녁 강남역 1번 출구에서 칼부림한다'라는 제목의 게시글을 쓴 혐의(협박)를 받는다. A씨의 구속 전 피의자 심문(영장심사)은 오는 24일 오후 서울동부지법에서 열린다. A씨는 경찰에서 ""블라인드에 대한 사회적 논란을 발생시키려고 글을 작성했다. 실제로 살인을 할 생각은 없었다""고 말했다. 그는 과거 다른 이용자와 욕설 댓글 문제로 갈등을 겪어 블라인드에 삭제를 요청했으나 받아들여지지 않자 블라인드에 불만을 품었다고 진술했다. A씨는 경찰관으로 근무한 적이 없고 가족 중에도 전·현직 경찰 직원은 없는 것으로 조사됐다. 경찰은 A씨가 경찰 계정을 어떻게 얻었는지 추가로 조사할 방침이다. 블라인드는 이메일이나 재직 관련 서류로 소속된 직장을 인증해야 가입해 글을 올릴 수 있다. 경찰은 A씨가 '경찰청'으로 직장이 표시될 줄 알면서도 살인예고 글을 올린 데 대해 형법상 공무원자격사칭이나 경범죄처벌법상 공무원사칭 혐의를 적용할 수 있는지 검토 중이다. 부당한 방법으로 계정을 생성했다면 정보통신망법 위반 혐의가 추가될 수 있다. ","{'쏠쏠정보': '0', '흥미진진': '0', '공감백배': '0', '분석탁월': '0', '후속강추': 1}"
