date,category,title,content,reaction
2023-08-14 10:32:00,세계,S. Korea retakes No. 1 spot in global shipbuilding orders in July,"shipbuilders-July orders S. Korea retakes No. 1 spot in global shipbuilding orders in July SEOUL, Aug. 14 (Yonhap) -- South Korea recaptured the top spot in new global shipbuilding orders for the first time in five months in July, industry data showed Monday. Local shipyards clinched orders totaling 1.46 million compensated gross tons (CGTs) to build 29 ships, accounting for 44 percent of the global total of 3.33 million CGTs, according to London-based Clarkson Research Services Ltd. The world total was up 22 percent from the same month a year earlier. It marks the first time since February for South Korean shipbuilders to take the leading spot. China placed second with 1.13 million tons to construct 48 vessels, taking up 34 percent of the global total. In terms of order backlog, China topped the list with 55.35 million CGTs, or 47 percent of the global total at 117.77 million CGTs as of end-July, which was up 190,000 CGTs from the prior month. China's number rose 13 percent on-year. South Korea came second with 39.26 million CGTs, which was up 9 percent from a month earlier and accounted for 33 percent of the world total. Clarkson's Newbuilding Price Index, a barometer of price changes in newly built ships, came to 172.38 points last month, up 10.80 points from a year ago. (END)","{'쏠쏠정보': '0', '흥미진진': '0', '공감백배': '0', '분석탁월': '0', '후속강추': '0'}"
2023-08-14 10:32:00,생활,"동해시, 숙박업 제도 개선 대정부 건의안 반영 '성과'","온라인 중개 플랫폼 영업자 사전 신고 의무화·처벌 규정 강화   강원 동해시가 불법 숙박 영업 제로화를 추진 중인 가운데 관련 제도 대정부 건의안이 반영되는 성과를 거두었다. 14일 시에 따르면 현행법상 미신고·미등록 숙박업소의 영업을 금지하고 있으나 시는 올해만 온라인 숙박 플랫폼을 통한 불법 숙박업소 16곳을 적발해 형사고발과 행정처분을 했다. 이런 불법 숙박 영업이 성행하는 배경에는 온라인 중개 플랫폼 운영자의 경우 업소의 신고(등록) 여부를 확인할 의무가 없고, 적발된 미신고 숙박업소 영업자의 경우 백만원대 벌금형이나 집행유예에 그치는 문제가 있기 때문이다. 불법 숙박업소는 위생과 안전 규정을 준수하지 않은 채 운영되고 여러 범법적 사회문제 발생의 소지가 있다. 시는 2020년부터 전수조사를 통해 온라인 플랫폼 영업 등 314곳의 불법 숙박업소를 적발해 행정지도를 했으며 행정지도에 따르지 않은 49곳은 형사고발 하는 등 불법 영업 행위 근절에 나서고 있다. 시는 이에 그치지 않고 지난 2월 행정안전부가 추진하는 현장 중심 안전 제도 개선 사업에 건의안을 제출했다. 시는 건의안에서 온라인 중개 플랫폼 영업자의 사전 신고(등록) 업소 확인 의무화, 미신고 불법 숙박 영업행위 처벌 규정 강화를 골자로 하는 '불법 숙박 영업행위 방지 특별법' 제정을 요구했는데, 지난 7월 중장기 과제에 반영됐다. 국회에서도 최근 관련 법 개정안이 발의돼 개정안이 통과되면 시가 건의한 정부 입법 없이도 제도개선이 이루어질 전망이다. 발의된 개정안에는 온라인 중개 플랫폼업자의 불법 숙박업소 판매 중개를 제한하고, 중개업소의 사전 검증 의무를 강화하는 내용이 담겼다. 또 신고하지 않고 숙박 영업을 한 자에 대해서도 형량을 강화하도록 했다. 최기순 예방관리과장은 ""불법 숙박업소는 국민의 안전은 물론 영세 합법 숙박업자의 생계를 위협하는 문제""라며 ""관련 제도 개선이 하루빨리 이루어지길 바란다""고 말했다. ","{'쏠쏠정보': '0', '흥미진진': '0', '공감백배': '0', '분석탁월': '0', '후속강추': '0'}"
2023-08-14 10:32:00,사회,광복절 의미 기리며,  제78주년 광복절을 하루 앞둔 14일 오전 광주 북구청 광장에서 북구청직장어린이집 원생들이 바람개비 태극기를 들고 즐거워 하고 있다.  ,"{'쏠쏠정보': '0', '흥미진진': '0', '공감백배': '0', '분석탁월': '0', '후속강추': '0'}"
2023-08-14 10:32:00,사회,"""대한독립 만세"" 외치는 어린이들",  제78주년 광복절을 하루 앞둔 14일 오전 광주 북구청 1층 로비에서 북구청직장어린이집 원생들이 태극기 부채와 바람개비를 들고 만세 삼창을 하고 있다.  ,"{'쏠쏠정보': '0', '흥미진진': '0', '공감백배': '0', '분석탁월': '0', '후속강추': '0'}"
2023-08-14 10:36:00,정치,국민의힘 강원지역 주요인사 입당식,"  국민의힘 김기현 대표가 14일 강원 원주시 국민건강보험공단에서 열린 강원지역 주요인사 입당식에서 이날 입당한 박주현 전 동해시 의원(왼쪽), 김종문 전 동해시 부시장(오른쪽)과 기념촬영을 하고 있다.  ","{'쏠쏠정보': '0', '흥미진진': '0', '공감백배': '0', '분석탁월': '0', '후속강추': '0'}"
2023-08-14 10:36:00,정치,국민의힘 강원지역 주요인사 입당식,"  국민의힘 김기현 대표가 14일 강원 원주시 국민건강보험공단에서 열린 강원지역 주요인사 입당식에서 이날 입당한 박주현 전 동해시 의원(왼쪽), 김종문 전 동해시 부시장(오른쪽)에게 꽃다발을 전달하고 있다.  ","{'쏠쏠정보': '0', '흥미진진': '0', '공감백배': '0', '분석탁월': '0', '후속강추': '0'}"
2023-08-14 10:36:00,정치,인사말 하는 김기현 대표,  국민의힘 김기현 대표가 14일 강원 원주시 국민건강보험공단에서 열린 강원지역 주요인사 입당식에서 인사말을 하고 있다.  ,"{'쏠쏠정보': '0', '흥미진진': '0', '공감백배': '0', '분석탁월': '0', '후속강추': '0'}"
2023-08-14 10:37:00,사회,부산서 오피스텔 임대관리업체 '이중계약' 의혹…경찰 조사,"  부산의 한 오피스텔 관리업체가 세입자들의 보증금을 횡령했다는 의혹이 제기돼 경찰이 조사에 나섰다. 14일 부산 동래경찰서에 따르면 최근 A오피스텔 세입자들이 해당 오피스텔 관리업체 대표 B씨를 사기 혐의로 고소했다. 세입자들은 B씨가 2018년부터 해당 오피스텔의 임대차 계약을 진행하면서 가구당 1천만원에서 4천만원 정도의 보증금을 빼돌렸다고 주장하고 있는 것으로 알려졌다. 피해자들은 B씨가 임차인과 임대인에게 계약 내용을 각각 다르게 적용하는 '이중계약'을 체결한 것으로 의심한다. 이 때문에 임대차 계약이 끝난 이후에도 곧바로 보증금을 돌려받지 못할 위기에 놓였다. 피해자는 100여명, 피해 금액은 100억원 내외인 것으로 전해졌다. 경찰 관계자는 ""현재 고소인들을 상대로 조사를 진행 중이고, 조만간 피고소인 조사도 진행할 예정""이라고 말했다. ","{'쏠쏠정보': '0', '흥미진진': '0', '공감백배': '0', '분석탁월': '0', '후속강추': 2}"
2023-08-14 10:37:00,정치,[그래픽] 김정은 최근 주요 활동,"  김정은 북한 국무위원장이 주요 군수공장들을 시찰하고 ""전쟁준비의 질적수준은 군수산업발전에 달려있다""며 무기 생산능력의 제고를 독려했다. 조선중앙통신은 김 위원장이 지난 11∼12일 전술미사일 생산공장과 전술미사일 발사대차 생산공장, 전투장갑차 생산공장, 대구경 조종방사포탄 생산공장 등을 현지지도했다고 14일 보도했다. 김 위원장의 군수공장 시찰은 지난 3∼5일에 이어 엿새만으로, 이달 중 진행될 한미연합연습을 앞두고 진행됐다.   ","{'쏠쏠정보': '0', '흥미진진': '0', '공감백배': '0', '분석탁월': '0', '후속강추': '0'}"
2023-08-14 10:37:00,세계,Gov't to approve Liberation Day special pardons,"Liberation Day-presidential pardons Gov't to approve Liberation Day special pardons SEOUL, Aug. 14 (Yonhap) -- The government was to grant special presidential pardons Monday on the occasion of this week's Liberation Day anniversary, with many business tycoons expected to be among the beneficiaries. The Cabinet was scheduled to meet to approve a list of beneficiaries of the presidential pardons. These would be the third presidential pardons since President Yoon Suk Yeol took office in May last year. The pardons will legally take effect at the beginning of Tuesday, the Liberation Day anniversary that commemorates the end of Japan's 1910-45 colonial rule of the Korean Peninsula. Among the beneficiaries are expected to be scores of big-name businesspeople, including Lee Joong-keun, founder of Booyoung Group; Park Chan-koo, honorary chairman of Kumho Petrochemical Group; and Chong Kun Dang Chairman Rhee Jang-han. Lee and Park were given a prison term and a suspended prison term, respectively, both on charges of breach of duty, while Rhee was sentenced to prison on charges of bullying his driver. Former Gangseo Ward office chief Kim Tae-woo is also expected to be among the beneficiaries. He was given a suspended prison term on charges of leaking official secrets and ousted from office.  (END)","{'쏠쏠정보': '0', '흥미진진': '0', '공감백배': '0', '분석탁월': '0', '후속강추': '0'}"
2023-08-14 10:37:00,사회,암사자가 빠져나간 우리,  14일 오전 경북 고령군 한 목장에서 암사자가 탈출했다가 사살됐다. 사진은 해당 사자를 키우던 우리.  ,"{'쏠쏠정보': '0', '흥미진진': '0', '공감백배': '0', '분석탁월': '0', '후속강추': '0'}"
2023-08-14 10:37:00,생활,"천안시, 내달 30일까지 축구역사박물관 관련 유물 공개 구입","  충남 천안시는 축구역사박물관 조성을 위해 다음 달 30일까지 민간 소장 한국 축구 유물과 자료를 공개 구입한다고 14일 밝혔다. 구입 대상 유물은 일제강점기 이후 1990년대까지 국제대회에 참가한 국내 선수 관련 자료, 1980∼1990년대 K리그 선수·스태프 유니폼, 축구화, 트로피, 입장권, 대회 관련 책자 등 각종 기념물, 일제강점기 이후 현대까지 축구 관련 신문 자료(원본), 잡지 등 각종 기록물, 기타 한국 축구 관련 자료다. 구입 유물은 천안시가 건립을 추진하는 축구역사박물관에서 연구·전시 및 교육 자료로 활용된다. 유물 판매를 원하는 개인 소장가, 문화재매매업자, 법인 등은 천안시청 누리집(https://www.cheonan.go.kr)에서 '2023년 제2차 축구역사박물관 유물 구입 공고'를 검색한 뒤 서식을 내려받아 이메일(chleeisk@korea.kr)이나 우편 또는 방문 접수하면 된다. 천안시는 축구역사박물관과 관련해 지난달 문화체육관광부에 '공립박물관 설립 타당성 사전평가' 신청 서류를 제출했으며, 서류평가와 현장평가 등의 과정을 거쳐 본격적으로 건립을 진행할 예정이다. ","{'쏠쏠정보': '0', '흥미진진': '0', '공감백배': '0', '분석탁월': '0', '후속강추': '0'}"
2023-08-14 10:37:00,사회,태풍으로 연기된 사천 삼천포항 전어축제 18일 개막,"  경남 사천시는 제6호 태풍 '카눈' 영향으로 연기된 '제20회 사천시 삼천포항 자연산 전어축제'를 오는 18일부터 20일까지 팔포음식특화지구 일원에서 개최한다고 14일 밝혔다. 올해 축제는 지난 7일 일정이 축소·변경된 데 이어 10일 잠정 연기되며 내년으로 미뤄질 가능성이 높았다. 그러나 태풍에 의한 큰 피해가 발생하지 않았고 지역경제 활성화를 위해 다시 개최하기로 했다. 이번 축제는 '잡수시고 노시고 주무시고 가이소'라는 주제로 열린다. 싱싱하고 맛깔스러운 전어회와 전어무침, 전어구이 등 전어로 만든 다양한 요리를 맛볼 수 있다. 특히 참여 상인들이 바가지요금 해결을 위해 전어 먹거리를 정찰가로 판매하기로 했다. 책정된 가격은 전어회와 전어 회무침 3만원, 전어구이 2만원, 소주·맥주 4천원, 음료수 2천원 등이다. 무료 시식회, 맨손 전어 잡기를 비롯해 생선껍질 공예 전시, 특산품 깜짝 경매, 비즈공예 체험, 전어모형 만들기 등 다채로운 부대행사도 함께 마련된다. ","{'쏠쏠정보': 1, '흥미진진': '0', '공감백배': '0', '분석탁월': '0', '후속강추': '0'}"
2023-08-14 10:38:00,정치,강원 현장최고위 참석하는 김기현,  국민의힘 김기현 대표가 14일 강원 원주시 국민건강보험공단에서 열린 강원 현장최고위원회의에 참석하고 있다.  ,"{'쏠쏠정보': '0', '흥미진진': '0', '공감백배': '0', '분석탁월': '0', '후속강추': '0'}"
2023-08-14 10:40:00,정치,국민의힘 강원 현장최고위원회의,  국민의힘 김기현 대표가 14일 강원 원주시 국민건강보험공단에서 열린 강원 현장최고위원회의에서 발언하고 있다.  ,"{'쏠쏠정보': '0', '흥미진진': '0', '공감백배': '0', '분석탁월': '0', '후속강추': '0'}"
2023-08-14 10:40:00,스포츠,"신유빈, 또 국제대회 2관왕…WTT탁구 리우 여복·혼복 정상(종합)","여자복식 결승서 전지희와 함께 최효주-김나영 조 격파 임종훈도 남복 등 2관왕…한국, 복식 3종목 모두 석권   한국 여자 탁구 간판 신유빈(대한항공)이 월드테이블테니스(WTT) 컨텐더 리우데자네이루 2023에서 복식 2관왕에 올랐다. 신유빈-전지희(미래에셋증권) 조(1위)는 13일(현지시간) 브라질 리우데자네이루에서 열린 대회 마지막 날 여자 복식 결승에서 최효주(한국마사회)-김나영(포스코인터내셔널) 조(40위)에 3-1(9-11 11-8 11-6 11-7)로 승리했다. 전날 임종훈(한국거래소)과 혼합 복식 우승을 합작한 신유빈은 이로써 이번 대회 2관왕을 차지했다. 여자 단식과 여자 복식을 석권한 직전 컨텐더 리마 대회에 이어 두 대회 연속으로 2관왕에 올랐다. 단·복식에서 고루 좋은 성적을 내는 신유빈은 올해 WTT에서 3차례 2관왕을 기록했다. 앞서 지난 6월 열린 컨텐더 라고스에서도 단식과 여자 복식에서 우승한 바 있다. 5월 더반 세계선수권대회에서 전지희와 함께 복식 은메달을 따낸 뒤 경기력과 자신감이 크게 올라간 모습이다. 컨텐더 리마 대회 결승에서도 신유빈-전지희 조에 패했던 최효주-김나영 조는 두 대회 연속 준우승에 만족해야 했다. 마찬가지로 한국 선수 간의 맞대결로 치러진 남자 복식 결승에서는 임종훈-안재현(한국거래소) 조(22위)가 이상수-조대성 조(5위·이상 삼성생명)를 3-1(11-7 11-8 5-11 11-8)로 물리치고 올해 2번째 우승을 합작했다. 임종훈은 대회 2관왕에 올랐다. 한국 선수들이 복식 3종목을 모두 석권하는 좋은 결과가 만들어졌지만, 단식에서는 정반대였다. 여자 단식에서는 이은혜(71위·대한항공)와 김나영(76위)이 8강까지 오른 게 한국 선수의 최고 성적이며, 남자 단식에서는 조승민(38위·삼성생명)과 장우진(8위·미래에셋증권)이 나란히 준결승에서 탈락했다. 한편, 이번 대회에는 '최강' 중국 선수들이 출전하지 않았다. 일본에서도 상위 랭커가 대거 빠졌다. ","{'좋아요': 3, '슬퍼요': '0', '화나요': '0', '팬이에요': 1, '후속기사 원해요': '0'}"
2023-08-14 10:41:00,사회,고령서 탈출한 사자 사살,  14일 오전 7시 24분께 경북 고령군 덕곡면 옥계리 한 사설 목장에서 탈출한 암사자가 사살돼 이송되고 있다.  ,"{'쏠쏠정보': '0', '흥미진진': '0', '공감백배': '0', '분석탁월': '0', '후속강추': '0'}"
2023-08-14 10:41:00,생활,왕의 집무실·왕비 생활실로 꾸며 9월 18일까지 공개," 문화재청 궁능유적본부는 이달 15일부터 9월 18일까지 경복궁 내 건청궁을 특별 개방하고 당시의 궁중 생활상을 볼 수 있는 유물을 선보인다고 14일 밝혔다. 고종의 처소였던 장안당을 왕의 집무실과 생활실로, 명성황후가 지냈던 곤녕합을 왕비의 알현실과 생활실, 궁녀 생활실 등으로 꾸며 선보인다. 사진은 건청궁 장안당 내 왕의 집무실.   ","{'쏠쏠정보': '0', '흥미진진': '0', '공감백배': '0', '분석탁월': '0', '후속강추': '0'}"
2023-08-14 10:42:00,정치,"[속보] 尹대통령 ""잼버리 무난한 마무리…종교계·기업 등에 감사""",,"{'쏠쏠정보': '0', '흥미진진': '0', '공감백배': 20, '분석탁월': '0', '후속강추': '0'}"
2023-08-14 10:42:00,정치,국무회의 참석하는 감사원 사무총장,  유병호 감사원 사무총장이 14일 오전 서울 종로구 정부서울청사에서 열리는 국무회의에 참석하고 있다.  ,"{'쏠쏠정보': '0', '흥미진진': '0', '공감백배': '0', '분석탁월': '0', '후속강추': '0'}"
2023-08-14 10:43:00,사회,손 인사하는 원세훈 전 국정원장,"  재직 시절 각종 정치공작을 벌인 혐의로 복역 중이던 원세훈 전 국정원장이 14일 오전 경기 안양교도소에서 가석방으로 출소하면서 정문에 있던 지지자들에게 손 인사를 하고 있다. 원 전 원장은 국정원 예산으로 민간인 댓글부대를 운영한 혐의, 고(故) 김대중·노무현 전 대통령의 비위 풍문을 확인하는 데 예산을 쓴 혐의, 이명박 전 대통령 등에게 국정원 특수활동비 2억원을 건넨 혐의 등으로 유죄가 확정돼 복역해왔다.  ","{'쏠쏠정보': '0', '흥미진진': '0', '공감백배': '0', '분석탁월': '0', '후속강추': '0'}"
2023-08-14 10:43:00,사회,목례하는 원세훈 전 국정원장,"  재직 시절 각종 정치공작을 벌인 혐의로 복역 중이던 원세훈 전 국정원장이 14일 오전 경기 안양교도소에서 가석방으로 출소하면서 정문에 있던 지지자들에게 목례하고 있다. 원 전 원장은 국정원 예산으로 민간인 댓글부대를 운영한 혐의, 고(故) 김대중·노무현 전 대통령의 비위 풍문을 확인하는 데 예산을 쓴 혐의, 이명박 전 대통령 등에게 국정원 특수활동비 2억원을 건넨 혐의 등으로 유죄가 확정돼 복역해왔다.  ","{'쏠쏠정보': '0', '흥미진진': '0', '공감백배': '0', '분석탁월': '0', '후속강추': '0'}"
2023-08-14 10:43:00,생활,경복궁 깊숙이 자리한 역사적 공간…건청궁 특별 개방, 경복궁에서 가장 깊숙한 곳에 자리 잡은 공간인 건청궁이 한 달간 문을 열고 관람객을 맞는다. 문화재청 궁능유적본부는 이달 15일부터 9월 18일까지 경복궁 내 건청궁을 특별 개방하고 당시의 궁중 생활상을 볼 수 있는 유물을 선보인다고 14일 밝혔다. 사진은 건청궁 곤녕합 내 궁녀 생활실.   ,"{'쏠쏠정보': '0', '흥미진진': '0', '공감백배': '0', '분석탁월': '0', '후속강추': '0'}"
2023-08-14 10:43:00,사회,"강진군, 장전지구 등 9개 지구 토지 경계 결정","  전남 강진군은 9개 지적재조사 사업지구(2천272필지, 132만9천857.9㎡)에 대한 심의를 마치고 토지 경계를 결정했다고 14일 밝혔다. 지적재조사사업은 국토의 효율적인 관리와 군민의 재산권 보호를 위해 지적공부와 토지의 실제 이용현황이 불일치하는 문제점을 바로잡아 토지의 가치를 높이는 사업이다. 최근 경계결정위원회를 열고 강진읍 장전지구(383필지 23만9천9㎡), 송현지구(161필지 10만4천124㎡), 군동면 시목지구(376필지 13만2천915㎡), 내동안풍지구(313필지) 등에 대해 토지의 합리적 이용 형태 등을 고려해 경계에 관한 결정을 심의·의결했다. 위원회에서 결정된 사항은 토지소유자와 이해관계인에게 통지할 예정이며, 이의가 있는 경우에는 통지서를 받은 날부터 60일 이내 이의신청하면 된다. 김동남 강진군 민원봉사과장은 ""지적재조사 사업을 통한 토지경계 분쟁 해소로 주민 재산권 보호와 효율적 토지 사용을 위해 최선을 다하고 있다""고 말했다. ","{'쏠쏠정보': '0', '흥미진진': '0', '공감백배': '0', '분석탁월': '0', '후속강추': '0'}"
2023-08-14 10:44:00,정치,"박광온 ""'채상병 사망사건' 수사 외압 의혹, 특검 통해 밝혀야""","잼버리 파행에 '맛집 인수 뒤 질저하' 비유…""前주인 탓한다고 現주인 책임 안없어져""  김남권  더불어민주당 박광온 원내대표는 14일 ""고(故) 채수근 상병 수사 외압 의혹은 특검(특별검사)을 통해서 명명백백히 밝혀야 한다""고 말했다. 박 원내대표는 이날 국회에서 열린 최고위원 회의에서 ""젊은 병사의 죽음을 왜곡하는 것은 숨진 병사와 유가족, 국민들에 대해 국가가 할 일이 아니다""라며 이같이 강조했다. 박 원내대표는 ""어제 대통령실은 '국가안보실이 (수사에) 개입한 상황은 전혀 없었다고 본다'고 밝혔다""며 ""'없었다'가 아니라 '없었다고 본다'는 애매한 입장""이라고 지적했다. 그러면서 ""박정훈 전 해병대 수사단장은 수사기관이 아닌 대통령실 국가안보실에서 수사 보고서를 제출하라는 적법하지 않은 요구를 여러 차례 받았다고 분명하게 밝혔다""며 ""중대한 권력 남용과 국기문란이다. 권력남용이 국가 시스템을 무너뜨리는 일을 묵과할 수 없다""고 강조했다. 박 원내대표는 이어 ""국방부 감찰단은 이미 국민의 신뢰를 잃었다""며 ""이제 국방부는 조사의 주체가 아니라 수사 대상이 돼야 한다""고 덧붙였다. 박 원내대표는 아울러 2023 새만금 세계스카우트 잼버리 대회 파행 논란에 대해 ""책임 있는 자리에 있는 모든 사람들은 남 탓하기에 바쁘다""며 ""국민의힘에 촉구한다. 최소한 이 정부 들어서 있었던 준비 부족에 대해 인정하기를 바란다""고 촉구했다. 그는 ""감사원을 동원해 본질을 흐리려는 시도를 포기하기를 바란다""면서 ""민주당이 무한 책임을 갖고 잼버리 부실 사태에 대해 제대로 된 백서를 기록하고 교훈을 남기도록 하겠다""고 도 했다. 박 원내대표는 ""명성이 자자한 맛집을 인수한 주인이 음식 맛이 없어졌다고 항의하는, 그리고 실망하는 고객들에게 맛집의 전 주인을 탓한다고 해서 지금 주인의 책임이 없어지지 않는다""며 여권이 제기하는 전(前) 정부 책임론을 비판했다. ","{'쏠쏠정보': 5, '흥미진진': '0', '공감백배': 15, '분석탁월': 1, '후속강추': 4}"
2023-08-14 10:44:00,연예,긴급 기자회견하는 유시춘 EBS 이사장,  유시춘 EBS 이사장이 14일 오전 정부과천청사에서 긴급기자회견을 하고 있다. 이날 방송통신위원회는 전체회의를 열고 남영진 KBS 이사장과 정미정 EBS 이사에 대한 해임 의결안을 처리할 예정이다.  ,"{'좋아요': '0', '응원해요': '0', '축하해요': '0', '기대해요': '0', '놀랐어요': '0', '슬퍼요': '0'}"
2023-08-14 10:44:00,연예,긴급기자회견하는 권태선 방문진 이사장,  권태선 방송문화진흥회 이사장이 14일 오전 정부과천청사에서 긴급기자회견을 하고 있다. 이날 방송통신위원회는 전체회의를 열고 남영진 KBS 이사장과 정미정 EBS 이사에 대한 해임 의결안을 처리할 예정이다.  ,"{'좋아요': '0', '응원해요': '0', '축하해요': '0', '기대해요': '0', '놀랐어요': '0', '슬퍼요': '0'}"
2023-08-14 10:44:00,연예,긴급 기자회견하는 남영진 KBS 이사장,  남영진 KBS 이사장이 14일 오전 정부과천청사에서 긴급기자회견을 하고 있다. 이날 방송통신위원회는 전체회의를 열고 남영진 KBS 이사장과 정미정 EBS 이사에 대한 해임 의결안을 처리할 예정이다.  ,"{'좋아요': '0', '응원해요': '0', '축하해요': '0', '기대해요': '0', '놀랐어요': '0', '슬퍼요': '0'}"
2023-08-14 10:44:00,연예,긴급기자회견 하는 공영방송 이사장들,"  남영진 KBS 이사장(왼쪽부터), 권태선 방송문화진흥회 이사장, 유시춘 EBS 이사장 및 공영방송 이사들이 14일 오전 정부과천청사에서 긴급기자회견을 하고 있다. 이날 방송통신위원회는 전체회의를 열고 남영진 KBS 이사장과 정미정 EBS 이사에 대한 해임 의결안을 처리할 예정이다.  ","{'좋아요': '0', '응원해요': '0', '축하해요': '0', '기대해요': '0', '놀랐어요': '0', '슬퍼요': '0'}"
2023-08-14 10:44:00,연예,긴급기자회견 하는 공영방송 이사장들,"  남영진 KBS 이사장(앞줄 왼쪽부터), 권태선 방송문화진흥회 이사장, 유시춘 EBS 이사장 및 공영방송 이사들이 14일 오전 정부과천청사에서 긴급기자회견을 하고 있다. 이날 방송통신위원회는 전체회의를 열고 남영진 KBS 이사장과 정미정 EBS 이사에 대한 해임 의결안을 처리할 예정이다.  ","{'좋아요': '0', '응원해요': '0', '축하해요': '0', '기대해요': '0', '놀랐어요': '0', '슬퍼요': '0'}"
