date,category,title,content,reaction
2023-08-13 05:03:00,정치,"국민 52% ""한반도 미래, 자유왕래 2국가 선호""…""단일국"" 29%","민주평통 2분기 통일여론조사…""北, 적대·경계대상"" 18분기만 최고 ""북한인권보고서 공개, 실태개선에 도움 안 돼"" 51%   국민 대부분이 통일 필요성을 인정한다면서도 과반이 한반도 미래상으로 왕래가 자유로운 2국가 체제를 단일국가보다 더 선호하는 것으로 나타났다. 13일 민주평화통일자문회의(이하 민주평통)가 공개한 올해 2분기 국민 통일여론조사 결과에 따르면 일반 국민 응답자의 52.0%가 남북의 바람직한 미래상으로 '자유로운 왕래가 가능한 2국가'를 택했다. '단일국가' 응답자는 그 절반 수준인 28.5%였으며 '1국가 2체제'와 '현재와 같은 2국가'가 각각 9.8%와 7.9%로 조사됐다. 민주평통의 정기 통일여론조사에 유사 질문이 2021년 3분기에 처음 반영된 이래 지난 1분기까지 응답 비율은 대체로 '유럽연합처럼 경제교류협력이 자유로운 상태'(33.6~40.1%), '동서독처럼 통일된 상태'(33.2~38.8%), '미국과 캐나다처럼 좋은 이웃 상태'(23.8~25.7%) 순이었다. 지난 1분기에는 독일형(38.8%), EU형(33.6%). 미국·캐나다형(24.6%) 순으로 조사됐지만 이번 2분기 조사에서 답변 형태를 국가·체제 수를 기준으로 변형하자 2국가 체제 선호 경향이 더욱 또렷해졌다. 반면에 통일의 필요성에 대해서는 73.4%(매우 필요 38.4%, 어느 정도 필요 35.4%)가 동의했으며, 필요하지 않다는 답은 25.4%에 그쳤다. 민주평통은은 ""통일이 필요하다고 응답한 집단에서도 바람직한 남북 미래상으로 왕래가 자유로운 2국가 선호도가 과반에 육박해(48.6%) 전체적으로 2국가 선호 비율이 높게 나왔다""며 ""이는 통일에 대한 우리 국민의 인식이 변화하고 있음을 보여주는 결과""라고 분석했다. 통일을 해야 하는 이유로는 '경제 발전'(30.9%), '전쟁 위협의 해소'(25.8%), '민족의 동질성 회복'(17.8%), '국제적 위상 강화'(12.4%), '자유와 인권 실현'(11.2%) 순으로 꼽았다. 북한에 대한 인식은 적대·경계 대상으로 보는 국민이 42.1%로 협력·지원 대상으로 인식하는 국민(47.1%)보다 적었지만 2017년 4분기(42.5%) 후 처음으로 40%를 넘어섰다. 국민 절대다수(88.0%)는 북한인권 상황을 심각하다고 인식하고 있었으며, 북한인권 개선을 위한 우선 추진과제는 '남북 대화를 통한 개선 촉구'(32.8%)를 꼽은 비율이 '국제사회 공조를 통한 압박'(27.1%) 비율을 오차범위 내에서 앞섰다. '북한인권 실태 기록 및 공개'와 '인도적 대북지원'을 택한 응답자는 각각 18.3%와 14.2%를 기록했다. 정부가 북한인권 공론화을 위해 역점을 두어 추진한 북한인권보고서 공개 발간이 북한인권 문제 개선에 미칠 영향에 관해 국민 50.8%(별로 34.5%, 전혀 16.3%)는 도움이 되지 않을 것으로 봤다. 도움이 될 것이라는 답은 40.2%(매우 10.2%, 어느 정도 31.9%)였다. 지난 4월 한미정상회담에서 도출된 워싱턴 선언이 대북 억지력을 강화했다는 응답 비율이 47.1%로 약화했다는 응답(36.0%)보다 높았다. 또 국민 53.2%는 주요 7개국(G7) 정상회의에서 합의한 한미일 전략공조 강화가 한반도 정세에 미칠 영향을 '긍정적'으로 기대했다. 이번 조사는 지난 6월 9~11일 전국 19세 이상 성인남녀 1천명을 대상으로 전화설문조사 방식(휴대전화 80%)으로 진행됐다. 95% 신뢰수준에 표본오차는 ±3.1%포인트(p)다. 민주평통은 분기마다 현안·추이 분석 문항으로 구성된 통일여론조사를 실시해, 전문가·민주평통자문위원 조사 결과와 비교·분석하고 있다. ","{'쏠쏠정보': 5, '흥미진진': 1, '공감백배': 0, '분석탁월': '0', '후속강추': 2}"
2023-08-13 05:28:00,사회,낮 최고 33도 무더위 속 곳곳 소나기,"  일요일인 13일 전국이 대체로 무더운 가운데 곳곳에 소나기가 내리겠다. 수도권과 강원도는 대체로 흐리고 그 밖의 지역은 구름이 많겠다. 수도권과 강원 북부, 충남 북부 서해안에는 아침까지 0.1㎜의 빗방울이 떨어지는 곳이 있겠다. 오후부터 저녁 사이 강원 중·남부 산지, 대전·충청 남부 내륙, 전북 동부, 전남권, 경북권, 경남 내륙, 제주도에 소나기가 예보됐다. 소나기에 의한 예상 강수량은 5∼20㎜다. 소나기가 내리는 지역에서는 돌풍이 불고 천둥·번개가 치는 곳이 있겠으니 시설물 관리와 안전사고에 유의해야 한다. 이날 오전 5시 현재 기온은 서울 23.1도, 인천 23.3도, 수원 23.4도, 춘천 22.1도, 강릉 23.1도, 청주 24.3도, 대전 22.8도, 전주 23.5도, 광주 23.9도, 제주 26.4도, 대구 23.1도, 부산 23.7도, 울산 22.2도, 창원 23.6도 등이다. 낮 최고기온은 27∼33도로 예보됐다. 미세먼지 농도는 원활한 대기 확산으로 전국이 '좋음'∼'보통' 수준으로 예상된다. 바다의 물결은 동해 앞바다에서 0.5∼1.5m, 서해·남해 앞바다에서 0.5∼1.0m로 일겠다. 안쪽 먼바다(해안선에서 약 200㎞ 내의 먼바다)의 파고는 동해·서해 0.5∼2.0m, 남해 0.5∼1.5m로 예상된다. ","{'쏠쏠정보': 1, '흥미진진': 1, '공감백배': 1, '분석탁월': '0', '후속강추': 1}"
2023-08-13 05:31:00,정치,"'4% 어렵다'…정부 예산안, 3%대 지출증가율·660조 안팎 편성","기재부, 與에 ""세수 덜 들어와 증가폭 줄여야""…고강도 지출 구조조정 文정부 '3분의1 수준' 증가율…긴축 준하는 재정관리 전망  이준서  정부가 내년도 예산안 편성과 관련해 3%대 지출 증가율로 가닥을 잡았다. 올해 증가율인 5.1%에서 상당폭 떨어뜨린 것으로, 사실상 긴축재정에 준하는 수준으로 지출을 조이겠다는 의미다. 13일 정부와 여권에 따르면 기획재정부는 지난 11일 국민의힘 원내지도부에 이런 내용의 내년도 예산안을 보고했다. 국민의힘 측 예결위, 당 정책위 라인도 배석한 자리에서 기재부는 3%대 총지출 증가율을 기준으로 막바지 편성 작업을 진행 중이라고 설명한 것으로 알려졌다. 이렇게 되면 내년도 총지출은 올해 638조7천억원에서 3%대 늘어난 658조~663조원 범위에서 편성된다. 소수점 수치까지 보고되지는 않았지만, 3%대 초반까지 떨어진다면 660조에도 못 미치게 된다. 앞서 '2022∼2026년 국가재정운용계획' 중기 재정지출 계획에서 내년 예산으로 전망된 약 670조원보다 10조원 안팎 적은 규모이기도 하다. 최종 수치는 변동될 수 있지만, 이달 중하순 예산안이 확정되는 일정을 고려하면 큰 틀의 흐름은 잡힌 것으로 보인다. 기재부는 국민의힘 측에 ""세수가 덜 들어와서 (지출 증가율을) 줄여야 한다""며 ""경제활력 때문에 너무 줄일 수는 없고, 3%선은 넘겨야 하는데 어디까지 가능할지는 고민""이라고 언급한 것으로 전해졌다. 갈수록 악화하는 세수 부족 상황에서 지출 증가율을 최대한 낮게 가져갈 수밖에 없지만, 경기의 마중물 격인 재정집행 역할을 고려할 때 2%대까지 떨어뜨리지는 않겠다는 취지로 보인다. 이는 2016년 2.9%이나 2017년 3.6% 이후 7~8년 만에 가장 낮은 증가율을 의미한다. 지난 6월 말 재정전략회의에서 보고된 '4%대 중반'보다도 1%포인트(p) 안팎 낮은 수치다. 세수 부담 속에서 4% 수치를 지켜내기 어려워졌다는 뜻이다. 확장재정을 이어갔던 문재인 정부와 비교하면 증가폭이 3분의 1 수준이다. 2018~2022년 예산안상 총지출 증가율은 연 7~9%대였다. 2020~2022년은 코로나19 사태 때문에 9% 안팎 지출 증가율을 기록했고, 코로나19 이전인 2019년에도 총지출 증가율은 9.5%에 달했다. 여권 핵심 관계자는 ""딱 세수 상황만 고려하면 지출 증가율을 오히려 마이너스로 가져가야 하지만 마이너스는 현실적으로 어렵다 보니 최대한 낮출 수밖에 없다""며 ""일정 부분 긴축이 불가피하다는 데 대해서는 다들 인식을 같이하고 있다""고 말했다. 지출이 빠듯한 상황에서 민생 관련 신규 예산을 확보하기 위해 지출 구조조정 작업도 강도 높게 진행되고 있다. 지난해 정부는 올해 예산을 편성하면서 역대 최대인 24조원대 구조조정을 단행한 바 있다. 10조~12조원 안팎인 평년의 두배 수준에 달하는 지출 구조조정을 진행한 것이다. 올해 역시 고강도 구조조정을 이어가면서 역대 최대 규모를 또다시 경신할 가능성이 있다. 각 사업별 예산의 결과론적인 총합인 지출 증가율과 별개로, 쟁점 사업별로는 상당한 손바뀜이 이뤄질 것으로 보인다. ","{'쏠쏠정보': 6, '흥미진진': 2, '공감백배': 59, '분석탁월': 2, '후속강추': 12}"
2023-08-13 05:31:00,경제,세수 딜레마에 지출 조이기 나선 정부…지출 구조조정 주력,"세수 펑크에 내년 세수 하향 전망 불가피…예산 증가율 3%대로 감속 강도 높은 구조조정으로 재원 마련…약자 복지에 집중 계획  이준서  내년 예산 지출 증가율이 3%대에 그친 것은 정부가 '세수 펑크'에 직면한 데 따른 결과다. 올해 세수 부진에 내년 세수도 기존 전망보다 못 미칠 것으로 예상되는 상황에서 필요한 최소 수준만큼만 지출을 늘린다는 것이다. 정부는 강도 높은 지출 구조조정을 통해 확보한 예산을 약자 복지 등에 집중한다는 계획이다. 13일 정부와 여권에 따르면 기획재정부는 내년 예산 총지출 증가율을 3%대로 잡고 예산 편성을 진행하고 있다. 3%대 증가율은 2016년 2.9%나 2017년 3.6% 이후 7∼8년 만에 가장 낮다. 정부가 하반기 경제정책방향에서 예상한 내년 경상 성장률(4.9%)보다 작은 증가율이다. 생산 증가, 물가 상승 등의 영향으로 경제 규모가 커지는 정도에도 미치지 못한다는 의미다. 예산을 전해보다 줄일 수 없다는 점을 고려하면, 이는 실질적인 긴축이라고 볼 수 있다. 정부가 이처럼 지출 조이기에 나선 배경에는 세수 부진이 우선 꼽힌다. 올해 상반기까지 국세 수입은 178조5천억원으로 작년 같은 시점보다 39조7천억원(18.2%) 적다. 올해 남은 기간 작년과 같은 수준으로 세금을 걷는다고 하면 연간 세수는 356조원가량이 된다. 올해 세입 예산(400조5천억원) 대비 44조원 이상 부족한 것으로 4년 만에 세수 결손이 확실시되고 있다. 이는 정부가 당초 예상한 것보다 내년 세수를 하향 조정하는 것이 불가피하다는 의미다. 2022∼2026년 국가재정운용계획에 따르면 정부가 예상한 내년 국세 수입은 418조8천억원이다. 올해 세입 예산보다 4.6% 증가할 것으로 봤다. 올해 세수를 356조원으로 가정하고 재정운용계획상 세수 증가율(4.6%)을 적용하면 내년 세수는 372조원가량이다. 지난해 세수(395조9천억원)에도 못 미치는 규모다. 이와 같은 상황에서 정부는 건전 재정 기조를 지켜간다는 입장이다. 대통령직 인수위원회 시절 제시한 110대 국정 과제에서 재정 정상화가 5번째 과제에 오를 정도로 건전 재정은 윤석열 정부가 출범 때부터 강조한 원칙이다. 경기 활력 제고 등을 이유로 섣불리 빚을 내지 않겠다면, 수입에 맞춰 씀씀이를 줄일 수밖에 없다. 정부는 2022∼2026년 재정운용계획에서 내년 예산을 올해(638조7천억원)보다 4.9% 증가한 669조7천억원으로 제시했다. 세입에 근거한다면 세출 증가율은 이보다 낮춰야 한다. 정부는 그러면서도 필요한 과제에 예산을 집중한다는 계획이다. 여당은 약자복지·안전·미래세대·일자리 등 4대 분야에 초점을 둔다는 기본 청사진을 제시했다. 최근 이상 기후에 따른 집중호우 등을 고려해 수해 복구와 국가 하천에도 재원을 집중 투입할 예정이다. 이를 위해 강도 높은 지출 구조조정이 이뤄지고 있다. 필요 사업에 투입할 재원을 구조조정을 통해 확보하는 작업이다. 정부는 모든 국고 보조금 사업을 원점에서 재검토하고 있다. 민간 단체·노조의 자체 사업, 성과가 미흡한 사회적 기업에 대한 지원, 지역 화폐, 전 정부의 핵심 사업이었던 뉴딜·태양광 관련 사업 등에 대한 지출을 줄일 예정이다. 연구개발(R&D) 예산도 전면 재검토에 들어갔다. 윤석열 대통령이 '나눠먹기식' R&D 예산이라는 문제를 제기하고 국제협력 관련 R&D 예산은 늘리라는 지시에 따른 조치다. 경제인문사회연구회 등 산하에 있는 정부출연연구기관들의 일부 사업도 삭감 대상에 오른 것으로 알려졌다. 이러한 지출 억제에도 재정 악화라는 문제는 남아 있다. 올해 세수가 당초 예산안을 짤 때보다 부족하고 내년 세수도 그만큼 줄어드는 상황에서, 내년 예산은 올해보다 늘었다. 국세 수입보다 부족한 지출분을 다른 재원으로 충당해야 한다는 의미다. 정부는 추가경정예산(추경)을 편성하지 않고 세계 잉여금, 기금 여유자금, 불용(不用) 예산 등으로 올해 세수 부족을 메운다는 계획이다. 내년의 경우 기금 수입 조정, 국채 발행 등이 동원될 것으로 예상된다. 국채 발행 규모가 예년 수준을 넘어선다면, 국가채무도 그만큼 늘어난다. ","{'쏠쏠정보': 3, '흥미진진': 1, '공감백배': 18, '분석탁월': 1, '후속강추': '0'}"
2023-08-13 05:35:00,세계,트럼프 네 번째 기소되나…15일 조지아주 대배심 소집,"  2020년 미국 대선 이후 조지아주(州) 투표 결과를 뒤집기 위해 압력을 행사한 혐의를 받고 있는 도널드 트럼프 전 대통령의 기소 여부가 다음 주 초에 결정될 것으로 보인다. 뉴욕타임스(NYT)는 12일(현지시간) 이번 사건과 관련한 증인인 제프 던컨 전 조지아주 부지사와 언론인 조지 치디가 오는 15일 대배심 소환장을 발부받았다고 보도했다. 미국 형사법의 특징 중 하나인 대배심은 검찰이 중대한 범죄에 대해 공소를 제기할 경우 거쳐야 하는 단계다. 트럼프 전 대통령은 조지아주 선거에서 간발의 차로 패배하자, 2021년 1월 초 브래드 래펜스퍼거 조지아주 국무장관에게 전화를 걸어 '선거 결과를 뒤집기 위한 1만1천780표를 찾아내라'고 압력을 가했다는 의혹을 받고 있다. 대배심은 15일 이 같은 의혹에 대한 조지아주 풀턴 카운티 검찰의 수사 자료 등을 검토하고 증인을 신문할 예정이다. 대법원이 기소를 결정할 경우 트럼프 전 대통령은 조지아주 법원에서 열릴 기소인부절차에 직접 출석해 유죄 인정 여부를 밝혀야 한다. 트럼프 전 대통령은 퇴임 후 세 차례 기소됐다. 뉴욕에서는 2016년 대선 직전 성인영화 배우 스토미 대니얼스에게 성관계를 폭로하지 말라며 회삿돈으로 입막음 돈을 주고 회사 기록을 조작한 혐의로 기소됐고, 플로리다에선 국가기밀 문건을 퇴임 후 자택으로 불법 반출해 보관한 혐의로 기소됐다. 또한 이번 달 초에는 워싱턴DC에서 사기 모의, 선거 방해 모의, 투표권 방해 및 사기 등의 혐의로 기소됐다. 트럼프 전 대통령은 모두 무죄를 주장했다. ","{'쏠쏠정보': '0', '흥미진진': 1, '공감백배': 1, '분석탁월': '0', '후속강추': '0'}"
2023-08-13 05:40:00,경제,"대출규제 우회?…50년 만기 주담대, 한달 만에 1조2천억원 몰려","국민·신한·하나·농협 등 지난달부터 취급…우리·카뱅도 출시 60대 고객에 50년 만기 대출 내주기도…당국 ""영업행태 점검""  신호경 박대한  주요 은행의 '50년 만기' 주택담보대출 상품 취급액이 출시 한 달 만에 1조2천억원을 넘어선 것으로 나타났다. 금융당국은 최근 가계대출이 늘어나는 과정에서 50년 만기 주담대가 차주별 총부채원리금상환비율(DSR) 규제의 우회 수단으로 활용된 것은 아닌지 들여다볼 방침이다. 은행권, 지난달부터 50년 만기 상품 출시…""월 상환액 적어"" 13일 은행권에 따르면 KB국민·신한·하나·NH농협은행의 50년 만기 주담대 취급액은 지난 10일 기준 약 1조2천379억원으로 집계됐다. 한 시중은행에서는 상품 출시 이후 취급된 전체 주담대 중 금액 기준으로 절반 가까운 48%가 50년 만기인 것으로 파악됐다. 시중은행 관계자는 ""주담대 상담 과정에서 50년 만기 시 예상 원리금을 확인하는 경우가 빈번하며 실제 실행까지 이어지는 경우도 상당하다""고 밝혔다. 다른 관계자도 ""만기를 50년으로 하면 기존에 대출이 안 나오던 분들도 가능해져 많이들 취급한다""며 ""어차피 3년이 지나면 중도상환 수수료가 부과되지 않기 때문에 일단 월 상환금액이 적은 50년으로 대출을 많이 받는다""고 전했다. 주요 은행들은 지난달부터 본격적으로 50년 만기 주담대 상품을 내놨다. 구체적으로 농협은행이 지난달 5일, 하나은행이 7일, 국민은행이 14일, 신한은행이 26일부터 판매를 시작했다. 5대 은행 중 50년 만기 상품을 취급하지 않았던 우리은행 역시 오는 14일부터 주담대 만기를 최장 40년에서 50년으로 확대할 계획으로 알려졌다. 인터넷전문은행 중에는 카카오뱅크가 지난 10일부터 주담대 만기를 최장 45년에서 50년으로 늘렸다. 은행들이 50년 만기 주담대 상품을 앞다퉈 내놓는 이유는 차주별 DSR 규제 하에서 초장기 주담대 수요가 늘어나고 있기 때문이다. 대출 만기가 늘어나면 대출자 입장에서는 매달 내야 하는 원리금이 줄어든다. 월 상환액이 줄어들면 차주별 DSR 규제 하에서 대출 한도가 늘어나는 효과가 있다. 다만 월 상환액이 줄어들더라도 상환기간이 길어지면 총 상환금에서 차지하는 이자 규모는 커진다. 은행 입장에서도 초장기 상품을 판매하는 것이 이익인 셈이다. 당국 ""DSR 완화 수단 활용 가능성…제도 개선 필요"" 금융당국은 최근 가계부채가 재차 증가세를 보이자 주담대 관리를 강화하겠다고 밝히면서 그중에서도 50년 만기 주담대를 언급했다. 50년 만기 주담대가 DSR 규제 우회 수단으로 활용되고 있는지 점검하겠다는 것이다. 금융당국 관계자는 ""50년 만기 주담대가 있어서는 안 될 상품이라는 것은 아니지만, 현실적으로 상환하기 어려운 만기의 대출을 내주는 것은 적정한 영업행태로 보이지 않는다""고 말했다. 은행들이 나이 제한 등을 두지 않고 50∼60대 고객에게도 50년 만기 주담대를 판매하는 것을 지적한 발언으로 해석된다. 시중은행 관계자는 ""고객들이 실제로 50년 동안 대출금을 나눠 갚아야겠다는 생각보다 더 많은 대출금을 받기 위해 DSR 적용에 유리한 50년 만기로 신규대출을 받고 있다""고 전했다. 일부 은행에서는 60대 후반 고객이 50년 만기로 대출받은 경우도 있었다. 금융당국 관계자는 ""은행들이 나이 제한 같은 안전장치 없이 무분별하게 초장기 만기 대출을 내주는 것을 확인할 필요가 있다고 판단했다""며 ""제대로 돼 있지 않다면 지도나 제도개선이 이뤄져야 할 것""이라고 말했다. , , ","{'쏠쏠정보': '0', '흥미진진': '0', '공감백배': 2, '분석탁월': 1, '후속강추': 2}"
2023-08-13 05:40:00,경제,우리은행도 주담대 대출기간 최장 50년으로 확대,"14일부터 시행…5년 변동·코픽스 금리 중 선택 가능   우리은행이 5대 은행(KB국민·신한·하나·우리·NH농협) 중 마지막으로 50년 만기 주택담보대출 상품 취급에 들어간다. 13일 금융권에 따르면 우리은행은 오는 14일부터 최장 40년인 주택담보대출의 대출 기간을 50년으로 확대해 시행하기로 했다. 우리아파트론과 우리부동산론(주택 담보에 한정), 우리WON주택대출, 주거용집단대출(분양아파트 입주자금대출, 구입자금대출) 등이 대상이다. 우리은행은 원리금균등분할상환방식과 원금균등분할상환방식에 한해 만기를 최장 50년까지 선택할 수 있도록 할 예정이다. 예를 들어 원금균등분할상환 방식으로 만기를 43년 6개월, 45년 6개월 등도 선택할 수 있다. 만기 35년을 초과한 주담대의 기준금리는 5년 변동금리, 코픽스(신규, 신잔액) 금리만 선택할 수 있다. 우리은행은 서민 주거안정 차원에서 고객 선택권을 확대하기로 결정했다고 설명했다. 앞서 주요 은행들은 지난달부터 본격적으로 50년 만기 주담대 상품을 내놨다. 구체적으로 농협은행이 지난달 5일, 하나은행이 7일, 국민은행이 14일, 신한은행이 26일부터 판매하기 시작했다. ","{'쏠쏠정보': 1, '흥미진진': 1, '공감백배': 2, '분석탁월': '0', '후속강추': 3}"
