date,category,title,content,reaction
2023-08-14 16:00:00,세계,Dodgers' Asian scouting director sold on S. Korean prospect's competitiveness,"Dodgers scout-S Korean pitcher Dodgers' Asian scouting director sold on S. Korean prospect's competitiveness By Yoo Jee-ho SEOUL, Aug. 14 (Yonhap) -- When Jon Deeble, the director of Pacific Rim scouting for the Los Angeles Dodgers, first saw South Korean high school pitcher Jang Hyun-seok in action, it wasn't just the teenager's size or velocity that stood out. As noticeable as those attributes were, Deeble, a longtime minor league manager and talent evaluator, was able to see things past the numbers on his radar gun. ""The one thing that really stuck out in my mind was his competitiveness,"" Deeble said of Jang during the Korean player's introductory press conference in Seoul on Monday. ""I think that's off the charts, his ability to want to win. I've watched him in a lot of games and he competes his rear off. I think if you want to pitch in the majors, you've got to be competitive, you've got to want to win. That was probably the biggest thing I saw. He has a desire to be good and desire to win, and he's very competitive."" Jang is a perfect 3-0 this season for Masan Yongma High School. He has struck out a whopping 52 batters in only 29 innings while walking 14. Opponents have only managed nine hits against the 19-year-old right-hander this year. ""He's got four pitches, he throws for strikes. He pounds the strike zone,"" Deeble said. ""He doesn't walk hitters."" Deeble said the Dodgers had been following him since 2020, and they signed him to an international signing bonus of US$900,000 last week. Each year, Major League Baseball (MLB) clubs receive a designated amount of pool money that they can spend on signing international free agents. As recently as June, the Dodgers only had $6,500 left for this year. They traded two minor league prospects to the Chicago White Sox in exchange for a reported sum of $1 million in pool money, and then used that sum to sign Jang. ""When this opportunity came up for the money, it was viewed by everybody that Jang was the guy we wanted,"" Deeble said. ""Obviously, we had a lot of reports and video on him. And it was basically a no-brainer in the end when there was money available. We're just so excited."" Deeble, who managed in the Miami Marlins' minor leagues in the late 1990s, said Jang reminded him of former Marlin ace Josh Beckett, also a hulking right-hander who won the 2003 World Series MVP award. Whether Jang will carve out a successful big league career like Beckett -- who also won the American League Championship Series MVP for the Boston Red Sox in 2007 and pitched in 14 major league seasons -- remains to be seen. ""He'll start out in spring training. His ability will determine where he goes. There's a chance he may jump Rookie ball. That hasn't been even discussed yet,"" Deeble said of Jang's immediate future in the Dodgers system. ""We need to get him over and get him evaluated. The one thing that we want to make sure is he's in the best possible shape he can be before we push him up to higher levels."" Deeble said the Dodgers have already designed a specialized strengthening and conditioning program for Jang, and the organization hopes to have him in early February for pitchers' camp. Deeble also said Jang will be in good hands in the Dodgers' minor leagues, given their strong history of developing big league-caliber pitchers. ""I think it's no secret that we develop pitchers as well, if not better than anybody in the world,"" Deeble said. ""People that run our pitching programs are so talented that we're really comfortable putting any of our players in their hands. We know they will be able to get their best out of the players. We presented Jang with a lot of video, which showed him some of the stuff we do in our player development. I think he was pretty much blown away by what we showed him.""  (END)","{'쏠쏠정보': '0', '흥미진진': '0', '공감백배': '0', '분석탁월': '0', '후속강추': '0'}"
2023-08-14 16:00:00,사회,강원 라이즈 간담회 찾은 이주호 부총리,  14일 오후 이주호 부총리 겸 교육부 장관이 강원특별자치도청 신관 회의실에서 열린 강원지역 지역혁신중심 대학지원체계(라이즈) 간담회에 참석해 인사말을 하고 있다.  ,"{'쏠쏠정보': '0', '흥미진진': '0', '공감백배': '0', '분석탁월': '0', '후속강추': '0'}"
2023-08-14 16:01:00,세계,在日韓国大使館にも爆破予告メール　警察が警備強化,【ソウル聯合ニュース】在日本韓国大使館は１４日、日本人の名前を名乗る人物から先週、大使館を爆破するという内容のメールが届き、現地の警察に通報したと明らかにした。警察は大使館周辺の警備を強化している。 メールでは日本の政界と世界平和統一家庭連合（旧統一教会）の関係や日本の軍国化などを取り上げ、「現状況を憂慮する」「私は日本人だ。爆破を予告する」などと韓国語で書かれていた。翻訳ソフトを使ったことも記された。ただ、爆破の予告日時は書かれていないという。 大使館はいたずらの可能性があるとみているが、念のため警察に約１カ月間の警備強化を要請した。 一方、先週から韓国でも爆破を予告するメールが日本人名などで相次いで届き、韓国警察が捜査を進めている。７日にはソウル市公務員らに「李在明代表を殺害しろ。８月９日１５時３４分までに殺害しなければ時限爆弾を爆発させる」とのメールが送られ、９日には同じアカウントで「国立中央博物館、日本大使館、南山タワー、日本人学校を爆破する」という内容のメールが届いたとの通報があった。１３日にはソウル市庁を爆破すると予告するメールが報道機関などに届いた。 ,"{'쏠쏠정보': '0', '흥미진진': '0', '공감백배': '0', '분석탁월': '0', '후속강추': '0'}"
2023-08-14 16:01:00,IT,세계 최고 데프콘 해킹대회서 한국팀 2년 연속 1위,"과기정통부 차세대 보안리더 양성 프로그램 출신 'MMM팀' 2연패   과학기술정보통신부와 한국정보기술연구원(KITRI)은 '차세대 보안 리더 양성 프로그램(BoB)' 멘토와 수료생으로 구성된 'MMM(Maple Mallard Magistrates)팀'이 미국에서 열린 올해 데프콘 국제해킹대회에서 1위를 차지했다고 14일 밝혔다. 이 대회는 사이버 보안 콘퍼런스인 데프콘 행사 기간에 열리는 세계 최고 해킹대회로 지난 11일부터 미국 라스베이거스에서 본선 진출 12팀이 겨루는 대회가 열렸다. 세계 해커들과 보안 전문가들이 겨루는 대회인 만큼 데프콘 국제해킹대회 우승팀은 세계 최고의 해커로서 위상을 갖는다고 과기정통부는 설명했다. 우리나라에서는 차세대 보안 리더 양성 프로그램과 관련한 3개 팀이 본선에 진출해 MMM팀이 2년 연속 우승을 차지하는 쾌거를 올렸다. 이 팀은 국내 사이버 보안 회사 티오리 관계자와 미국 카네기멜런대 해킹 동아리 재학생, 캐나다 브리티시 콜롬비아대 사이버 보안 동아리 재학생 등이 구성한 연합팀이다. 최고급 화이트해커 양성을 목표로 하는 차세대 보안 리더 양성 프로그램은 2012년 운영이 시작된 이후 1천600명의 화이트해커를 배출했다. ","{'쏠쏠정보': '0', '흥미진진': 1, '공감백배': '0', '분석탁월': '0', '후속강추': '0'}"
2023-08-14 16:01:00,스포츠,"'K리그 출범 40주년 기념' 인터내셔널 유스컵, 9월 3일 개막","  한국프로축구연맹이 K리그 출범 40주년을 맞아 9월 3∼9일 인천광역시 일대에서 'K리그 인터내셔널 유스컵 인천 2023'을 개최한다고 14일 밝혔다. 이번 유스컵은 K리그 40주년을 기념하고, K리그 유스팀의 경쟁력 향상과 국제교류 활성화를 위해 마련됐다. 한국프로축구연맹과 인천광역시축구협회가 주최 및 주관하고, 인천광역시·문화체육관광부·국민체육진흥공단이 후원한다. K리그에서는 FC서울, 수원 삼성, 인천 유나이티드, 전북 현대, 포항 스틸러스 구단의 유스팀이 출전한다. 유럽에서는 울버햄프턴(잉글랜드), 안더레흐트(벨기에), 발렌시아, 레알 소시에다드(이상 스페인)의 유스팀이 참가하고, 아시아에서는 도쿄 베르디(일본), 촌부리FC(태국)의 유스팀이 나선다. 이밖에 인천광역시축구협회 초청으로 부평고까지 합쳐 총 12개 팀이 우승 트로피를 놓고 경쟁한다. 2006년 1월 1일 이후 태어난 만 17세 이하 선수들이 참가하는 이번 대회는 6개 팀씩 A조(발렌시아·안더레흐트·촌부리·전북·포항·인천)와 B조(레알 소시에다드·울버햄프턴·도쿄 베르디·수원·서울·부평고)로 나뉘어 팀당 조별리그 5경기를 치른 뒤 각 조 같은 순위 팀끼리 최종 순위결정전을 벌인다. 조별리그는 9월 3∼8일 인천문학경기장 보조구장, 인천아시아드 보조구장, 남동아시아드 럭비경기장 등에서 치러지고, 조별리그 1위 팀끼리 맞붙는 결승전은 9월 9일 인천축구전용경기장에서 펼쳐진다. 대회 기간에는 지도자 세미나를 통해 훈련 방법 등을 교류하고, 해외 초청팀을 대상으로는 한국 문화 체험 행사도 진행된다. ","{'좋아요': 17, '슬퍼요': 1, '화나요': 11, '팬이에요': 2, '후속기사 원해요': 3}"
2023-08-14 16:02:00,경제,"원/달러 환율 1,330원대로","  14일 서울 중구 하나은행 본점 딜링룸 현황판에 원/달러 환율이 표시돼 있다. 이날 원/달러 환율은 전장 대비 6.0원 올라 1,330.9원으로 마쳤다.  ","{'쏠쏠정보': '0', '흥미진진': '0', '공감백배': '0', '분석탁월': '0', '후속강추': '0'}"
2023-08-14 16:02:00,경제,"'택배없는날'…택배단체 ""쿠팡 동참해야"" vs 쿠팡 ""선동 멈춰야""(종합)","택배대리점 대표자단체 ""쿠팡 불참으로 제도취지 몰각…경쟁질서 어지럽혀"" 쿠팡 ""민주노총이 만든 휴무일, 소비자·판매자·택배기사 불편 초래""   한국생활물류택배서비스협회는 14일 쿠팡의 택배 전문 자회사인 쿠팡로지스틱스서비스(CLS)를 향해 '택배 없는 날' 동참을 촉구하고 나섰다. 한국생활물류택배서비스협회는 CJ대한통운과 한진, 롯데글로벌로지스, 로젠택배 등 택배대리점 대표자들로 구성된 단체다. 협회는 이날 ""쿠팡CLS는 1년 365일이 택배 없는 날이라는 주장을 펴며 참여하지 않고 있다""며 ""특정 업체 불참으로 자칫 제도 취지가 몰각되고 택배업계의 경쟁 질서를 어지럽힐 우려가 있다""고 주장했다. 이어 쿠팡CLS가 다른 택배사 기사들에 대해 휴무가 없고 쉬려면 대체 배송을 위해 본인 비용으로 외부 기사를 투입해야 한다고 폄훼했다고 지적하면서 ""쿠팡 기사들은 진정으로 며칠이나 휴무할지 의문""이라고 비판했다. 협회는 또 쿠팡CLS의 '클렌징'(배송구역 회수) 제도에 대해서도 바람직하지 않다고 지적했다. 협회는 ""생활물류서비스법에는 대리점마다 위탁 구역을 지정하도록 명시하고 있다""며 ""그러나 쿠팡CLS는 위탁 구역을 지정하지 않거나 범위를 넓혀 복수 대리점 간 경합을 유도하고 기준을 달성하지 못하면 구역을 회수하는 클렌징을 시행하고 있다""고 언급했다. 그러면서 ""쿠팡CLS의 부속합의서에는 계약을 즉시 해제할 수 있는 근거가 마련돼 있어 생활물류서비스법의 취지와는 동떨어진다""며 개선돼야 한다고 강조했다. 쿠팡은 이날 각계의 택배 없는 날 동참 요구에 대해 ""쿠팡과 달리 원할 때 쉴 수 없는 대기업 택배기사들을 위해 민주노총이 주도해 만든 산업계 유일한 휴무일""이라고 반박했다. 이어 ""쿠팡친구는 주5일 근무와 함께 연중 130일 쉬고 싶을 때 언제든 쉴 수 있으며, 쿠팡CLS 역시 택배 없는 날이 아니어도 대체 기사 비용 부담 없이 쉬고 싶을 때 쉴 수 있다""고 강조했다. 또 ""민주노총은 일할 때 일하고 쉴 때 쉴 수 있는 택배 기사의 선택권을 빼앗고 소비자와 판매자, 택배기사 모두의 불편을 초래하는 선동을 멈춰달라""고 비판했다. ","{'쏠쏠정보': 1, '흥미진진': '0', '공감백배': '0', '분석탁월': '0', '후속강추': '0'}"
2023-08-14 16:03:00,사회,"[동정] 이주호, 거점 국립대 협력 강화 협약식 참석"," 이주호 부총리 겸 교육부 장관은 16일 서울대학교에서 열리는 국가 거점 국립대학교 간 협력을 위한 협약식에 참석한다고 교육부가 14일 밝혔다. 이번 협약으로 서울대를 포함해 부산대, 전북대 등 10개 거점 국립대는 국가 균형 발전을 위해 협력하고 국가적 난제 극복을 위한 교육·연구 네트워크를 구축하는 데 힘을 모으기로 했다. ","{'쏠쏠정보': '0', '흥미진진': '0', '공감백배': '0', '분석탁월': '0', '후속강추': '0'}"
2023-08-14 16:03:00,사회,쿠팡 노동자 투쟁 결의대회,  14일 오후 서울 쿠팡 잠실 본사 앞에서 휴게 시간 보장 등을 촉구하는 쿠팡 노동자 투쟁 결의대회가 열리고 있다.  ,"{'쏠쏠정보': '0', '흥미진진': '0', '공감백배': '0', '분석탁월': '0', '후속강추': '0'}"
2023-08-14 16:03:00,사회,"대한항공 뉴욕행 여객기, 기체결함에 인천 회항…7시간 지연(종합)","연료 소모 뒤 5시간40분만에 착륙…""고객 불편에 죄송, 항공편 교체""   인천국제공항에서 출발해 미국 뉴욕으로 향하던 대한항공 여객기가 기체 결함으로 인해 인천공항으로 회항하며 승객들이 불편을 겪었다. 14일 대한항공에 따르면 이날 오전 10시 승객 400명을 태우고 인천공항에서 이륙한 대한항공 KE081편(A380)의 랜딩기어(착륙장치)에 문제가 발생했다. 이는 이륙 후 약 30분 뒤 경고 메시지가 표시되면서 발견됐다. 대한항공은 도착지인 뉴욕에서 정비할 경우 추가 지연이 발생할 것을 우려, 인천공항으로 회항 조치한 뒤 항공기를 교체하고 정비하기로 했다. 이에 따라 이 여객기는 일본 근처까지 갔다가 이날 오후 3시 40분 인천공항에 다시 착륙했다. 여객기는 즉각 인천공항에 내리지 못하고 안전한 착륙을 위해 한반도 상공을 선회하며 연료를 소모했다. 대한항공은 동일 기종의 교체 여객기를 준비해 이날 오후 5시께 다시 뉴욕으로 출발할 계획이다. 대한항공 관계자는 ""승객 안전을 위한 조치로 불편하게 해 드려 죄송하다""며 ""최대한 빨리 안전하게 교체항공편으로 모실 수 있도록 최선을 다하겠다""고 말했다. ","{'쏠쏠정보': 1, '흥미진진': '0', '공감백배': 1, '분석탁월': 1, '후속강추': 1}"
2023-08-14 16:03:00,사회,"울진해경, 연안사고 경보 20일까지 연장…""이안류 발생 우려""","  경북 울진해양경찰서는 이안류와 너울성 파도 우려에 따라 연안사고 위험예보제 '경보' 단계를 20일까지 연장한다고 14일 밝혔다. 울진해경과 기상청에 따르면 제7호 태풍 '란'의 간접 영향으로 14일 오후부터 동해안을 중심으로 이안류가 점차 강하게 발생하고 바람이 강해져 너울파도가 발생할 것으로 예상된다. 이안류는 바다에서 해안으로 밀려 들어오는 파도와 달리 해안에서 바다 방향으로 빠져나가는 파도로 역파도라고도 부른다. 울진해경은 주말까지 이안류가 지속될 것으로 예측됨에 따라 13일까지 발령한 연안사고 위험예보제 경보를 20일까지 연장하기로 했다. 울진해경 관계자는 ""태풍 영향으로 너울 휩쓸림이나 물놀이 중 이안류 사고를 당할 수 있으니 위험예보제 기간에는 해안가 출입을 자제하고 물놀이 중에는 구명조끼를 착용해야 한다""고 말했다. ","{'쏠쏠정보': '0', '흥미진진': '0', '공감백배': 1, '분석탁월': '0', '후속강추': '0'}"
2023-08-14 16:03:00,사회,"""휴게 시간 보장!""",  14일 오후 서울 쿠팡 잠실 본사 앞에서 열린 쿠팡 노동자 투쟁 결의대회에서 참가자들이 물풍선을 던지는 퍼포먼스를 하고 있다.  ,"{'쏠쏠정보': '0', '흥미진진': '0', '공감백배': '0', '분석탁월': '0', '후속강추': '0'}"
2023-08-14 16:05:00,경제,"코스피·코스닥 지수 하락, 원/달러 환율 상승","  14일 서울 중구 하나은행 본점 딜링룸 현황판에 코스피, 원/달러 환율, 코스닥 지수가 표시돼 있다. 이날 코스피는 전 거래일보다 20.39포인트(0.79%) 하락한 2,570.87로, 코스닥 지수는 10.52포인트(1.15%) 하락한 901.68로 마감했다. 원/달러 환율은 전장 대비 6.0원 올라 1,330.9원으로 마쳤다.  ","{'쏠쏠정보': '0', '흥미진진': '0', '공감백배': '0', '분석탁월': '0', '후속강추': '0'}"
2023-08-14 16:05:00,사회,강원 라이즈 간담회 찾은 이주호 부총리,  14일 오후 이주호 부총리 겸 교육부 장관이 강원특별자치도청 신관 회의실에서 열린 강원지역 지역혁신중심 대학지원체계(라이즈) 간담회에 참석해 인사말을 하고 있다.  ,"{'쏠쏠정보': 1, '흥미진진': '0', '공감백배': '0', '분석탁월': '0', '후속강추': '0'}"
2023-08-14 16:07:00,사회,"""휴게 시간 보장!""",  14일 오후 서울 쿠팡 잠실 본사 앞에서 열린 쿠팡 노동자 투쟁 결의대회에서 참가자들이 물풍선을 던지는 퍼포먼스를 하고 있다.  ,"{'쏠쏠정보': '0', '흥미진진': '0', '공감백배': '0', '분석탁월': '0', '후속강추': '0'}"
2023-08-14 16:07:00,세계,[영상] 헤르손에 하루 17차례 포격…생후 23일 영아 등 일가족 참변," 우크라이나에서 러시아의 공격으로 생후 23일 된 영아와 12살 난 어린이가 부모와 함께 목숨을 잃는 사건이 벌어졌습니다. 13일(현지시간) 미국 일간 뉴욕타임스(NYT)와 독일 dpa 통신 등에 따르면 우크라이나 남부 헤르손주 군정 당국은 이날 러시아군의 포격으로 최소 7명의 주민이 숨지고 13명이 다쳤다고 밝혔습니다. 시로카 발카라는 마을에서는 오전 10시쯤 러시아군이 쏜 포탄이 마당에 떨어지면서 소피아란 이름의 생후 23일 된 여아가 부모와 함께 그 자리에서 목숨을 잃었습니다. 소피아의 오빠 12살 아르템은 중상을 입고 의료시설로 옮겨졌으나 치료 중 사망했습니다. 시로카 발카 마을에선 현지 성직자를 비롯한 다른 성인 남성 두 명도 포탄에 맞아 숨진 것으로 전해졌습니다. 러시아가 점령 중인 우크라이나 남동부 항구도시 마리우폴 인근에선 러시아군 병사 간에 벌어진 총격전에 휘말려 미성년자를 비롯한 우크라이나 민간인 여럿이 사상했다는 주장도 나왔습니다. 현재는 러시아군에 점령되지 않은 다른 지역에서 활동 중인 페트로 안드류센코 마리우폴 시장 보좌관은 이날 텔레그램을 통해 마리우폴 인근 마을에서 체첸군 병사와 현지 사령관 휘하 병력이 말다툼 끝에 총격전을 벌였고, 이로 인해 10대 소녀 두 명과 젊은이 4명, 여성 한 명이 숨졌다고 말했습니다. 제작: 공병설·변혜정 영상: 로이터·미국 뉴욕타임스 홈페이지·텔레그램 러시아 국방부·olexandrprokudin·Klymenko_MVS","{'쏠쏠정보': '0', '흥미진진': '0', '공감백배': '0', '분석탁월': '0', '후속강추': '0'}"
2023-08-14 16:08:00,사회,"""휴게 시간 보장!""",  14일 오후 서울 쿠팡 잠실 본사 앞에서 열린 쿠팡 노동자 투쟁 결의대회에서 참가자들이 물풍선을 던지는 퍼포먼스를 하고 있다.  ,"{'쏠쏠정보': '0', '흥미진진': '0', '공감백배': '0', '분석탁월': '0', '후속강추': '0'}"
2023-08-14 16:09:00,경제,5년 넘게 농지규제에 발목 잡힌 오송 3산단 조성 사업 속도붙나,"충북도·농식품부, 산단 규모 6.7㎢→4.1㎢로 축소하고 3.8㎢ 규제 해제   5년 넘게 농지규제로 인해 발목잡혔던 오송 제3생명과학 국가산업단지 조성 사업이 속도를 낼 전망이다. 충북도는 14일 농림축산식품부와의 협의를 통해 오송 제3국가산단 규모를 6.7㎢에서 4.1㎢로 축소하는 조건으로 농업진흥지역 6.3㎢ 중 3.8㎢를 해제하기로 했다고 밝혔다. 오송읍 일원 6.7㎢는 2018년 8월 국가산단 후보지로 결정됐다. 이듬해에는 예비타당성 조사도 통과했다. 도는 이곳에 한국과학기술원(KAIST) 오송 바이오메디컬 캠퍼스타운을 조성할 계획이었다. 하지만 농림축산식품부가 부정적 입장을 보이면서 사업은 어려움에 빠졌다. 산단 전체면적의 93.6%가 농식품부의 지정해제 처분이 필요한 농업진흥지역이기 때문이다. 사업이 교착상태에 빠지자 김영환 지사는 지난 1월 자신의 페이스북에 글을 올려 규제 개선을 호소했다. 지난 7일 도의 건의에 따라 전국 최초로 농지전용과 관련한 관계기관 통합조정 회의도 열렸다. 통합조정회의에서 농식품부는 정책적으로 필요한 밭작물 지역을 제외한 농업진흥지역 대부분을 해제하는데 합의했다. 도 관계자는 ""산단 규모가 축소돼 아쉽지만, 중요 과제인 K-바이오 스퀘어 사업의 신속한 추진을 위해 정책적 선택을 한 것""이라고 말했다. k-바이오 스퀘어는 오송을 세계적 바이오클러스터로 육성하겠다는 사업이다. 도는 내년에 국가산단 계획 승인이 이뤄지면 2026년 착공해 4년 뒤인 2030년 완공할 계획이다. 현재 산단에는 바이오의약, 화장품 분야 등 200개 가까운 기업들이 입주 의사를 밝힌 것으로 알려졌다. ","{'쏠쏠정보': '0', '흥미진진': '0', '공감백배': '0', '분석탁월': '0', '후속강추': '0'}"
2023-08-14 16:10:00,사회,양양서 서핑 중 안전줄 끊겨…50대 심정지 이송,  14일 오후 3시께 강원 양양군 현남면 한 해수욕장에서 서핑하던 50대 A씨가 바다에 빠졌다. 이 사고로 A씨가 심정지 상태에서 병원으로 옮겨졌다. 해경은 서핑 중 안전줄이 끊어지면서 사고가 난 것으로 보고 자세한 사건 경위를 조사하고 있다. ,"{'쏠쏠정보': '0', '흥미진진': '0', '공감백배': '0', '분석탁월': '0', '후속강추': '0'}"
2023-08-14 16:10:00,경제,"현대차그룹·NaaS, 중국 전기차 충전 서비스 업무 협약", 현대차그룹은 중국 전기차 충전 정보 서비스 업체 NaaS와 14일 중국 베이징에 위치한 NaaS 사옥에서 중국 전기차 충전 서비스 협력을 위한 업무협약을 체결했다고 밝혔다. 사진은 헙약서에 서명하고 있는 양사 관계자들 모습.   ,"{'쏠쏠정보': '0', '흥미진진': '0', '공감백배': '0', '분석탁월': '0', '후속강추': '0'}"
2023-08-14 16:11:00,경제,"코스피는 하락, 원/달러 환율은 6원 상승","  14일 서울 중구 하나은행 본점 딜링룸 현황판에 코스피, 원/달러 환율이 표시돼 있다. 이날 원/달러 환율은 전장 대비 6.0원 올라 1,330.9원으로 마쳤다. 코스피는 전 거래일보다 20.39포인트(0.79%) 하락한 2,570.87로 마감했다.  ","{'쏠쏠정보': '0', '흥미진진': '0', '공감백배': '0', '분석탁월': '0', '후속강추': '0'}"
2023-08-14 16:11:00,경제,"원/달러 환율 6원 올라 1,330원대로","  14일 서울 중구 하나은행 본점 딜링룸 현황판에 원/달러 환율이 표시돼 있다. 이날 원/달러 환율은 전장 대비 6.0원 올라 1,330.9원으로 마쳤다.  ","{'쏠쏠정보': '0', '흥미진진': '0', '공감백배': '0', '분석탁월': '0', '후속강추': '0'}"
