date,category,title,content,reaction
2023-08-03 16:53:00,사회,"백원국 2차관, GTX 현장 찾아 공사 현황·안전관리 실태 점검", 백원국 국토교통부 제2차관이 3일 GTX-A노선(수서~동탄) 수서역 건설현장을 방문해 GTX-A 수서~동탄 구간 공사추진 현황을 점검하고 있다.   ,"{'쏠쏠정보': '0', '흥미진진': '0', '공감백배': '0', '분석탁월': '0', '후속강추': '0'}"
2023-08-03 16:53:00,사회,"백원국 2차관, GTX 현장 찾아 공사 현황·안전관리 실태 점검", 백원국 국토교통부 제2차관이 3일 GTX-A노선(수서~동탄) 수서역 건설현장을 방문해 GTX-A 수서~동탄 구간 공사추진 현황을 점검하고 있다.   ,"{'쏠쏠정보': '0', '흥미진진': '0', '공감백배': 1, '분석탁월': '0', '후속강추': '0'}"
2023-08-03 16:54:00,세계,"日정부, '위안부 사죄' 고노 담화 30주년에 ""계승 변함없어""(종합2보)","관방장관 ""고노 담화는 '위안부 문제'를 반복하지 않겠다는 결의""  박상현 특파원  일본 정부는 일제강점기 위안부 문제에 대해 사죄와 반성의 뜻을 나타낸 이른바 '고노 담화' 발표 30주년을 하루 앞둔 3일 기시다 후미오 내각도 담화를 전체적으로 계승한다는 것에 변함이 없다고 밝혔다. 일본 정부 대변인인 마쓰노 히로카즈 관방장관은 이날 기자회견에서 '기시다 내각은 현재 고노 담화를 계승하고 있는가'라는 질문에 ""위안부 문제에 관한 정부의 기본적 방침은 1993년 8월 4일 내각 관방장관 담화를 계승한다는 것""이라며 ""기시다 내각도 변경은 없다""고 답했다. 고노 담화는 고노 요헤이 당시 관방장관이 발표했다. 위안부 문제와 관련해 군의 관여 아래에 다수 여성의 명예와 존엄에 상처를 입혔다는 역사 인식을 드러내고 깊은 상처를 입은 분을 대상으로 마음으로부터의 사죄와 반성의 뜻을 밝혔다. 일본군이 강제적으로 위안부를 모집했다는 점을 인정해 높은 평가를 받았으나, 배상에 대한 언급이 없는 점은 한계라는 지적이 제기되기도 했다. 마쓰노 장관은 '고노 담화에서 역사교육을 통해 위안부 문제를 오랫동안 기억하겠다고 했던 부분에 구체적인 진전이 있었는가'라는 질문에 대해서는 ""고노 담화의 취지는 구체적인 연구와 교육을 염두에 둔 것이 아니며, 위안부 문제를 오래 기억해 반복하지 않겠다는 결의를 표명한 것""이라고 설명했다. 기시다 총리도 2021년 12월 국회에서 일본 정부의 기본적 입장은 고노 담화를 계승하는 것이라며 ""이 담화를 재검토할 생각은 없다""고 말한 바 있다. 이에 앞서 스가 요시히데 내각도 고노 담화를 정부 공식 견해로 결정했다. 하지만 일본 정부는 최근 교과서 검정 과정에서 고노 담화에 사용된 용어인 '종군 위안부' 대신 '위안부'를 쓰도록 하는 등 강제성을 희석해 왔다. 일본 정부는 2021년 4월 각의(국무회의)에서 오해를 초래할 우려가 있다는 이유로 '종군 위안부'가 아니라 '위안부'가 적절하다는 방침을 정했다. 마쓰노 장관도 이날 기자회견에서 '종군'을 빼고 '위안부'라고만 언급했다. 이와 관련해 전날 한국과 일본 연구자들이 참가한 온라인 심포지엄에서는 ""담화가 '형해화'하고 있다""는 우려가 나왔다고 교도통신이 전했다. 형해화는 형식만 남고 가치나 의미가 없게 되는 것을 뜻한다. 한국 외교부 당국자는 이날 기자들과 만나 일본 정부의 고노 담화 계승 발표와 관련해 ""역대 내각에서 표명된 입장을 계승한다는 기시다 총리의 입장도 있었기 때문에 이의 일환으로 생각된다""고 평가했다. 기시다 총리는 그간 역사 인식에 관한 역대 내각의 입장을 계승하겠다는 방침을 밝혀왔으며, 고노 담화도 그 대상에 포함된다는 취지로 해석된다. (취재보조: 김지수 통신원) ","{'쏠쏠정보': '0', '흥미진진': '0', '공감백배': '0', '분석탁월': '0', '후속강추': '0'}"
2023-08-03 16:54:00,세계,韓国のスカウト世界大会開営式で１０８人が熱中症に　プログラム一部中止,【扶安聯合ニュース】韓国南西部の全羅北道・セマングムで２日に開幕したボーイスカウト・ガールスカウトの世界大会「世界スカウトジャンボリー」の開営式で発生した熱中症患者が１０８人に達したことが、３日分かった。 大会組織委員会は同日の会見で「前日の開営式で発生した熱中症患者は１０８人」として、頭痛、腹痛、けがなども含めると１３９人の患者が発生したと明らかにした。 ２日午後１０時の時点で集計された大会全体の負傷者は９９２人で、このうち熱中症患者は２０７人、残りは虫刺され、消化器障害、骨折などだった。３日午前０時時点の集計では患者はさらに増えるとみられる。 大会組織委は、熱中症予防と対応のために医師３０人、看護師６０人を新たに確保する計画だと述べた。病床も現在の７０床から最大２２０床まで増やす方針だ。 開営式当日に熱中症患者が続出したため大会組織委は消防当局から行事を中止するよう要請を受けたが、重大な事態ではないと判断し、プログラムを一部省略するにとどめて行事を終えた。 今後は猛暑を考慮して会場内のプログラムの一部を中止するが、全羅北道内の１４市・郡で行われる観光プログラムは予定通り行うという。 大会組織委は、会場内の冷房設備を増やすとした上で、重症の熱中症患者が発生した場合は周辺の五つの協力病院に搬送すると説明した。 また、開営式で多くの熱中症患者が発生した理由を問う質問には、「Ｋ―ＰＯＰイベント」を挙げた。参加者が遠方から来たことに加え、天候などに適応できなかったことから多数の患者が発生したのではないかとの認識を示した。 さらにＫ―ＰＯＰイベントにより若者たちが体力を消耗したと指摘。熱中症患者の数は予想を大きく超える水準ではないと強調した。 ,"{'쏠쏠정보': '0', '흥미진진': '0', '공감백배': '0', '분석탁월': '0', '후속강추': '0'}"
2023-08-03 16:55:00,사회,중앙분리대 쓰러뜨린 '대프리카' 폭염…낮 최고 37.7도(종합),"사흘 전에도 중앙분리대 쓰러져…수성구, 점검 계획   찜통더위가 기승을 부리면서 대구의 도로 중앙분리대가 열기를 이기지 못하고 쓰러져 당국이 철거하는 일이 발생했다. 3일 오후 2시께 수성구 파동행정복지센터 앞에 설치된 도로 중앙분리대는 한쪽으로 쓰러져 있었다. 폭염에 달아오른 아스팔트 열기가 전달되면서 폴리우레탄 재질인 중앙분리대 하단이 무너졌다. 수성구는 ""중앙분리대 하단이 폭염으로 인한 열기를 견디지 못 한 것으로 보인다""고 밝혔다. 중앙분리대가 쓰러진 구간은 50여ｍ에 달했다. 버티고 있는 중앙분리대들 또한 금방이라도 녹아내릴 듯 아스팔트 열기는 뜨거웠다. 수성구에서 투입한 작업자들은 내리쬐는 햇볕을 맞으며 중앙분리대 철거하느라 연신 땀을 흘렸다. 폭염경보가 발효된 대구의 이날 낮 기온은 37.7도까지 치솟았다. 대구기상청에 따르면 올해 대구에서 가장 무더운 날이었다. 작업자들은 이 일대 150ｍ 구간에 남아 있는 중앙분리대를 사전에 철거하는 작업을 이어갔다. 몇몇 중앙분리대는 별다른 힘을 들이지 않아도 쉽게 쓰러질 만큼 강도가 약해져 있었다. 이 작업은 추가적인 피해를 예방하기 위한 조치라고 작업자들은 설명했다. 실제로 무더위가 연일 이어지면서 최근 수성구 신매시장 일대 중앙분리대가 쓰러지기도 했다. 국토교통부 지침에 따르면 중앙분리대는 교통사고 충격을 견딜 수 있는 소재를 사용해야 한다. 통상 폴리우레탄 재질이 사용된다. 업계에 따르면 최대 5년이 지나면 강도가 약해져 교체해야 하지만 비용 문제로 곧장 이뤄지지 않는 실정이다. 수성구에 따르면 쓰러진 중앙분리대들도 지난 2016년 설치됐다. 이날 중앙분리대가 편도 2차로 중 1차로 일부를 덮쳤지만, 다행히 다친 사람은 없었다. 차량 흐름에 별다른 영향을 주지도 않았다. 다만 수성구는 비슷한 사례가 연달아 발생하자 안전사고 예방을 위해 일제 점검을 계획하고 있다고 밝혔다. ","{'쏠쏠정보': 4, '흥미진진': 6, '공감백배': 1, '분석탁월': 1, '후속강추': 10}"
2023-08-03 16:56:00,경제,"식약처 차장, 수산물 안전관리 현장 방문", 권오상 식품의약품안전처 차장이 3일 서울 구로구 소재의 대형마트를 방문해 국내 수산물의 안전관리 현황을 점검하고 있다.   ,"{'쏠쏠정보': '0', '흥미진진': '0', '공감백배': '0', '분석탁월': '0', '후속강추': '0'}"
2023-08-03 16:57:00,경제,"권오상 차장, 수산물 안전관리 현장 방문", 권오상 식품의약품안전처 차장이 3일 서울 구로구 소재의 대형마트를 방문해 국내 수산물의 안전관리 현황을 점검하고 있다.   ,"{'쏠쏠정보': '0', '흥미진진': '0', '공감백배': '0', '분석탁월': '0', '후속강추': '0'}"
2023-08-03 16:57:00,경제,"식약처 차장, 수산물 안전관리 현장 방문", 권오상 식품의약품안전처 차장이 3일 서울 구로구 소재의 대형마트를 방문해 국내 수산물의 안전관리 현황을 점검하고 있다.   ,"{'쏠쏠정보': '0', '흥미진진': '0', '공감백배': '0', '분석탁월': '0', '후속강추': '0'}"
2023-08-03 17:03:00,경제,"[대구소식] 대구은행, 온라인쇼핑몰 판매자 위한 특별대출"," DGB대구은행은 온라인 쇼핑몰 물품 판매 사업자를 위한 맞춤형 특별대출상품 'DGB e-커머스 리딩론'을 출시했다고 3일 밝혔다. 기본 1.00%포인트의 금리감면이 적용된다. 또 판매·은행거래 실적에 따라 최대 1.00%포인트 추가 금리를 깎아준다. 대구은행 관계자는 ""판매대금 정산 기간 일시적으로 부족한 운영자금 지원을 위해 이 상품을 출시했다""고 말했다.","{'쏠쏠정보': '0', '흥미진진': '0', '공감백배': '0', '분석탁월': '0', '후속강추': '0'}"
2023-08-03 17:03:00,사회,"전남서부보훈지청, 6·25 참전 영웅 초청행사","  지난 2일 전남 영암군 해군 제3함대사령부에서 국가보훈부 전남서부보훈지청 주관 '6·25 참전 영웅 초청행사'가 열리고 있다. 행사에는 목포 문태고등학교 학생, 금강어린이집 원생들이 참여했다. 이향숙 전남서부보훈지청장은 ""참전용사의 헌신과 희생에 대해 알릴 수 있도록 행사를 계획했다""고 말했다.   ","{'쏠쏠정보': '0', '흥미진진': '0', '공감백배': '0', '분석탁월': '0', '후속강추': '0'}"
2023-08-03 17:03:00,스포츠,[구미·도드람컵 배구전적] GS칼텍스 3-0 흥국생명,2023 구미·도드람컵 프로배구대회 여자부 조별리그 B조 3차전(3일·구미 박정희체육관) GS칼텍스(2승 1패) 25 25 25 - 3 흥국생명(1승 2패) 19 19 17 - 0 ,"{'좋아요': 2, '슬퍼요': '0', '화나요': 2, '팬이에요': 1, '후속기사 원해요': '0'}"
2023-08-03 17:05:00,사회,개발도상국 청소년들 평창서 구슬땀…강원동계올림픽 메달 도전,"레소토 등 6개국 14명 10일까지 훈련…""2018 대회 유산 빛내주길""   개발도상국 청소년들이 2024강원동계청소년올림픽대회(이하 2024올림픽) 출전과 메달 도전을 위해 평창을 찾아 구슬땀을 흘리고 있다. 3일 평창군에 따르면 '2023 개발도상국 동계스포츠 선수 육성사업'의 하나로 선발된 청소년 선수단 14명이 이날부터 대관령면 알펜시아 슬라이딩센터에서 하계 훈련에 나섰다. 2022·2023 시즌 국제대회 참가자 중 대만, 몽골, 레소토, 튀니지, 콜롬비아, 브라질 등 6개국에서 선발된 청소년들이다. 2018평창기념재단과 평창군이 공동 지원하는 이 사업은 개발도상국 청소년 선수들을 선발·육성해 2024올림픽 대회에 출전시키기 위해 추진됐다. 참가 선수들은 하계 훈련을 위해 지난달 입국했으며 오는 10일까지 훈련을 이어간다. 하계 훈련 이후에는 각국으로 복귀해 현지 훈련을 지속한 뒤 오는 10월 다시 평창과 유럽에서 동계 훈련과 각종 국제대회에 참가한다. 앞서 지난 3월에도 전임 지도자 김준현(전 스켈레톤 국가대표 출신) 선수의 온라인 트레이닝과 훈련 점검을 받았다. 참가 청소년들의 목표는 2024올림픽 출전과 메달권 진입이다. 김재봉 올림픽 체육과장은 ""선수들이 2024올림픽에서 좋은 성적을 거둬 2018평창동계올림픽의 유산을 빛내 주기를 바란다""고 말했다. ","{'쏠쏠정보': '0', '흥미진진': '0', '공감백배': 1, '분석탁월': '0', '후속강추': '0'}"
2023-08-03 17:06:00,사회,"호남권생물자원관, 전남도립도서관서 기후 캠페인 전시회","  국립호남권생물자원관은 전남도립도서관 1층 남도화랑에서 14일까지 '자원순환으로 함께하는 기후행동실천 캠페인' 전시를 연다고 3일 밝혔다. 이번 전시에서는 메타버스, 대체불가토큰(Non-Fungible Token·NFT) 등 최신 정보통신 기술을 활용해 기후변화 지표생물과 메타버스 플랫폼에서 체험하는 자원순환 실천 사례를 소개한다. 섬·연안에 서식했지만, 기후변화로 인해 내륙 혹은 북쪽으로 분포지나 서식지가 변화되고 있는 동박새, 도깨비쇠고비 등 다양한 기후변화 지표생물을 실제 박제로 만나볼 수 있다. 도서관을 찾는 방문객이라면 누구나 무료로 관람할 수 있다. ","{'쏠쏠정보': '0', '흥미진진': '0', '공감백배': '0', '분석탁월': '0', '후속강추': '0'}"
2023-08-03 17:06:00,경제,강원 친환경 황기 생산자협회 출범식 개최," 3일 강원 춘천시 강원특별자치도농업기술원에서 열린 친환경 황기 생산자협회 출범식에서 임상현 원장과 황기 재배 농민, 삼척·홍천·정선·인제 등 4개 시군농업기술센터 관계자 등이 기념 촬영하고 있다.   ","{'쏠쏠정보': 3, '흥미진진': '0', '공감백배': '0', '분석탁월': '0', '후속강추': '0'}"
2023-08-03 17:07:00,세계,"니제르 쿠데타 수장 ""굴복안해""…미·영 대사관직원 부분 철수(종합)","군사개입 경고·제재·서방 압박에 '내정간섭 말라' 콧방귀 세계은행 재정지원 중단…유럽 등 서방국 자국민 대피 추진  장재은  니제르의 군사정변(쿠데타) 수장이 민주주의 정권 전복을 멈추라는 주변국 요청을 공개적으로 일축했다. AFP통신 등에 따르면 압두라흐마네 티아니 대통령 경호실장은 2일(현지시간) 텔레비전 연설을 통해 ""그 어디에서 오더라도 그 어떠한 위협에도 굴복하지 않을 것""이라고 말했다. 티아니 실장은 니제르 독립기념일을 하루 앞두고 한 이날 연설에서 ""니제르 내정에 대한 어떠한 간섭도 거부한다""고 입장을 밝혔다. 서아프리카 15개국 연합체인 서아프리카경제공동체(ECOWAS)는 일주일 내에 모하메드 바줌 정권을 복원하지 않으면 무력 사용을 승인하겠다고 지난달 30일 경고한 바 있다. 회원국 국방장관들은 무력 사용 결의 시한이 임박한 이달 2∼4일 나이지리아 아부자에 총집결해 대책 수립에 들어간다. 미국과 프랑스 등 서방국들은 ECOWAS의 입장을 전폭적으로 지지하고 있다. 티아니 실장은 ECOWAS가 쿠데타에 책임을 물어 부과한 제재에도 콧방귀를 뀌었다. 쿠데타 주체인 이른바 '조국수호국민회의'(CNSP)를 이끄는 티아니 실장은 ""CNSP는 제재를 전반적으로 거부한다""고 밝혔다. 그는 ""제재가 냉소적이고 대단히 부당하다""며 니제르 국방·치안력에 굴욕감을 주고 나라를 통치불능에 빠뜨리려고 설계된 것이라고 비판했다. ECOWAS는 무력 사용 등 개입을 결정하기 전에 외교적 해법을 찾으려고 니제르에 사절을 보내 이번 사태의 돌파구를 모색하고 있다. 저개발국의 빈곤 퇴치와 경제성장을 돕는 국제기구인 세계은행도 니제르 쿠데타 세력에 대한 압박에 나섰다. 세계은행은 추가 통보가 있을 때까지 민간협력 부분을 제외한 부문에 지출을 중단한다고 밝혔다. 니제르는 아프리카에서 세계은행의 최대 수혜국 가운데 하나로 작년과 재작년 예산에 직접 들어간 자금만 6억 달러(약 8천억원)에 달한다. 세계은행은 ""민주적으로 선출된 정부를 타도하려는 시도에 경악했다""며 ""평화, 안정, 법치는 빈곤 없는 세계를 만드는 기초""라고 지적했다. 티아니 실장이 이끄는 니제르 군부는 지난달 26일 마호메드 바줌 대통령 정권을 축출했다고 선언했다. 그는 선거를 통해 집권한 바줌 대통령을 감금하고 스스로를 국가원수로 자처했다. 서아프리카에서는 최근 2년 동안 부르키나파소, 말리, 기니에서 쿠데타로 친(親)러시아 군사정권이 잇따라 들어섰다. 서방은 권위주의 체제의 확산과 함께 극단주의 무장세력 소탕의 거점이 사라진다는 점 때문에 이런 추세에 상당한 불안을 느낀다. 미국과 프랑스 등은 ECOWAS의 외교적 해결을 기대하면서 만일 사태를 대비해 니제르 내 자국민 안전에 신경을 곤두세우고 있다. 프랑스, 스페인, 독일 등 일부 유럽 국가들은 니제르에 있는 자국민의 대피를 서두르고 있다. 미국 국무부는 이날 니제르 수도 니아메에 있는 자국 대사관에서 비상 인력이 아닌 직원과 가족을 출국하도록 하는 부분 대피령을 내렸다. 미국 매체 폴리티코에 따르면 니제르 주재 미국 대사관은 당장 폐쇄하지는 않을 계획이나, 핵심 인원만 남기기로 했다. 대사관은 ""일상적인 업무를 중단했고, 니제르내 미국 시민들에 대한 긴급 지원 제공만 할 수 있다""고 밝혔다. 최근 민주주의로 전환한데다, 미국의 대테러 대응 과정에서 핵심적인 파트너 역할을 해온 니제르에서 외교관을 빼는 일은 조 바이든 대통령에게 정치적으로 어려운 결정이라고 폴리티코는 짚었다. 특히 군부의 쿠데타로 축출당한 모하메드 바줌 대통령에 대한 바이든 행정부의 지지 선언에 진정성이 결여됐다는 비판에 직면할 여지가 있어 보인다. 하지만 내년 대선을 앞둔 바이든 대통령 입장에서 정정이 극도로 불안한 험지에 미국 외교관을 방치했다는 국내적 비판 역시 상당한 정치적 리스크가 될 수 있다는 점에서 딜레마에 직면한 양상이다. 이런 가운데, 영국 외무부도 현지 안전 상황을 고려해 니제르 주재 대사관의 근무 인원을 잠정적으로 줄이고 있다고 AFP통신이 보도했다. ","{'쏠쏠정보': '0', '흥미진진': '0', '공감백배': '0', '분석탁월': '0', '후속강추': 1}"
2023-08-03 17:08:00,사회,"도축장서 뛰쳐나온 소, 도심 도로 질주", 3일 오후 광주 광산구 소촌산업단지 주변 도로에서 소가 달리고 있다. 인근 도축업체에서 탈출한 소는 산단 창고 건물 안까지 도망쳤으나 약 20분 만에 붙잡혀 끌려갔다.   ,"{'쏠쏠정보': '0', '흥미진진': '0', '공감백배': '0', '분석탁월': '0', '후속강추': '0'}"
2023-08-03 17:08:00,사회,강원 치유농업시설 운영자 교육 수료식 열려, 3일 강원 춘천시 강원특별자치도농업기술원에서 열린 치유농업시설 운영자 교육 수료식에서 임상현 원장과 교육생들이 기념 촬영하고 있다.   ,"{'쏠쏠정보': 1, '흥미진진': '0', '공감백배': '0', '분석탁월': '0', '후속강추': '0'}"
2023-08-03 17:09:00,사회,"[속보] 행안부, 전북에 잼버리 행사 폭염 저감시설 등 30억원 지원",,"{'쏠쏠정보': '0', '흥미진진': 1, '공감백배': '0', '분석탁월': '0', '후속강추': '0'}"
2023-08-03 17:13:00,사회,P2P 펀딩 투자금 161억원 페이퍼컴퍼니로,"시소펀딩 전·현직 대표 기소…검찰 ""P2P 금융 아닌 '폰지사기'""   서울남부지검 형사4부(조만래 부장검사)는 3일 사업자금이 필요한 회사와 개인 투자자를 연결해준다며 크라우드 펀딩을 띄운 뒤 투자금만 가로챈 혐의로 시소펀딩 이모 전 대표를 구속기소했다. 이모 현 대표와 페이퍼컴퍼니 명의 제공자 등 6명도 함께 재판에 넘겨졌다. 검찰에 따르면 이들은 2020년 4월부터 8월까지 마스크 제조업체 등에 투자한다며 허위 P2P 대출상품을 시소펀딩에 올려 약 161억원을 챙긴 혐의(사기)를 받는다. 896명이 펀딩에 참여했다가 최소 10만원에서 최대 3억4천932만원의 피해를 본 것으로 조사됐다. 검찰은 이들의 범행을 ""P2P 금융의 외관만 갖췄을 뿐 실제로는 서민을 현혹해 가짜 대출상품으로 자금을 편취하고 돌려막기로 범행을 지속한 '폰지 사기'""라고 규정했다. 투자금은 유망 업체 아닌 45개 페이퍼컴퍼니로 흘러 들어갔다. 이 전 대표는 페이퍼컴퍼니 계좌들을 관리하며 개인에게 받은 투자금으로 '돌려막기'를 하거나 개인적으로 써버렸다. 이들은 있지도 않은 담보로 원금에 연 15%의 고수익을 얹어 돌려주겠다고 허위사실로 홍보하며 투자금을 끌어모았다. 실체 없는 사업을 내세워 투자금을 돌려막는 과정에서 시소펀딩의 누적 대출액이 3천905억원까지 늘었다. 피해자들은 현재까지도 463억원을 돌려받지 못했다고 검찰은 전했다. ","{'쏠쏠정보': '0', '흥미진진': '0', '공감백배': '0', '분석탁월': '0', '후속강추': 2}"
2023-08-03 17:13:00,스포츠,미소짓는 이강인,  3일 오후 부산아시아드주경기장에서 열린 '쿠팡플레이 시리즈 3차전' 파리 생제르맹(PSG) 대 K리그1 전북 현대 경기에서 PSG 이강인이 벤치에서 미소를 짓고 있다.  ,"{'좋아요': '0', '슬퍼요': '0', '화나요': '0', '팬이에요': 1, '후속기사 원해요': '0'}"
2023-08-03 17:13:00,스포츠,이강인 '벤치에서 시작',  3일 오후 부산아시아드주경기장에서 열린 '쿠팡플레이 시리즈 3차전' 파리 생제르맹(PSG) 대 K리그1 전북 현대 경기에서 PSG 이강인이 벤치에서 손짓하고 있다.  ,"{'좋아요': '0', '슬퍼요': '0', '화나요': '0', '팬이에요': '0', '후속기사 원해요': '0'}"
2023-08-03 17:13:00,스포츠,PSG 유니폼 입고 경기장 들어선 이강인,  3일 오후 부산아시아드주경기장에서 열린 '쿠팡플레이 시리즈 3차전' 파리 생제르맹(PSG) 대 K리그1 전북 현대 경기에서 PSG 이강인이 경기장에 들어서고 있다.  ,"{'좋아요': '0', '슬퍼요': '0', '화나요': '0', '팬이에요': '0', '후속기사 원해요': '0'}"
2023-08-03 17:14:00,세계,[영상] 손쓸 틈 없이 비행기 곤두박질 '쾅'…조종사는 멀쩡히 걸어나와," 나이지리아에서 경비행기 한 대가 도심 한복판에 추락했지만, 다친 사람은 없었습니다. 로이터 등 외신에 따르면 사고는 1일(현지시간) 남서부 항구도시 라고스 중심가에서 발생했습니다. CCTV에 포착된 영상에는 빠른 속도로 추락하던 경비행기가 손쓸 새도 없이 도로 위로 곤두박질치더니 곧 시뻘건 화염에 휩싸이는 모습이 담겼습니다. 경비행기가 추락한 인근에는 주유소가 있어 하마터면 큰 사고로 번질 뻔했습니다. 사고기에는 조종사 등 2명이 탑승했는데 다행히 모두 무사히 빠져나온 것으로 확인됐습니다. 앞서 지난달 29일에는 미국 뉴햄프셔주 햄프턴 비치 해안에서 경비행기 추락사고가 발생했습니다. 해변으로 날아오던 경비행기가 피서객들로부터 불과 20여m 거리에서 바다로 곤두박질친 건데, 조종사는 무사히 빠져나왔으며 피서객들의 피해도 없는 것으로 알려졌습니다. 제작: 진혜숙·박종혁 영상: 로이터·인디펜던트·트위터 FL360aero·트위터 NoComment·트위터 Bode Moore","{'쏠쏠정보': '0', '흥미진진': '0', '공감백배': '0', '분석탁월': '0', '후속강추': '0'}"
