date,category,title,content,reaction
2023-08-31 16:03:00,정치,'같이 갑시다',  한미연합연습 '을지 자유의 방패'(UFS·을지프리덤실드)가 진행 중인 가운데 31일 강원도 철원군 도하훈련장에서 수도기계화보병사단 K30비호복합이 미2사단/한미연합사단 11공병대대 문교를 이용해 도하하고 있다.  ,"{'쏠쏠정보': '0', '흥미진진': '0', '공감백배': '0', '분석탁월': '0', '후속강추': '0'}"
2023-08-31 16:04:00,사회,"서초구 교사 유족, 순직 신청…""감당할 수준 벗어난 업무 맡아""(종합)","서울시교육청 ""순직 인정되도록 최대한 도울 것""   서울 서초구 서이초등학교에서 목숨을 끊은 교사의 유족 측이 고인이 학교 업무로 극심한 스트레스를 받았다며 순직을 인정해달라고 교육청에 요청했다. 유족 측은 31일 서울 강남서초교육지원청에 고인에 대한 '순직 유족 급여' 청구서를 제출했다. 순직 유족 급여는 공무원이 공무상 부상 또는 질병으로 재직 중 사망했거나 퇴직 후 그 질병 또는 부상으로 사망했을 때 유족에게 지급하는 급여다. 유족 측 대리인인 문유진 변호사는 강남서초교육지원청 앞에서 기자회견을 열고 ""문제 학생 지도와 교육행정정보시스템(나이스·NEIS) 업무로 고인이 맡은 업무는 일반 교사가 홀로 감당할 수 있는 수준을 벗어나 있었다""며 ""고인의 업무 스트레스가 극한에 이른 순간 '연필 사건'이 발생했고 그 과정에서 학부모의 민원 등이 계속되자 고인은 이를 감당할 수 없었다""고 밝혔다. 이어 ""고인이 연필 사건으로 느낀 두려움은 개인용 휴대전화로 오는 학부모 민원에 '소름끼친다'라는 반응을 보이며 안절부절못하는 행동에도 드러난다""라며 ""그 결과 고인은 연필 사건 발생일로부터 5일이 지난 7월 17일 오후 9시경 퇴근도 하지 못한 채 교실에서 사망했다""고 지적했다. 유족 측이 청구서를 접수함에 따라 공무원연금공단과 인사혁신처는 사실관계를 확인하고, 인사혁신처는 심의위원회에서 순직 처리 여부를 최종 판단하게 된다. 최종 판단까지는 통상 수개월이 걸린다. 서이초 교사뿐 아니라, 2년 전 극단적 선택으로 숨진 경기 의정부시의 한 초등학교 교사 2명, 최근 신림동 등산로로 출근하다 성폭행을 당해 숨진 초등학교 교사에 대해서도 순직을 인정해야 한다는 목소리가 교육계에서 나오면서 이들의 순직 처리 여부에도 관심이 쏠릴 전망이다. 과거 사례를 보면 극단적 선택을 한 교사에 대해 공무상 스트레스로 인한 사망 인과 관계가 확인된 경우 순직으로 인정된 사례가 드물게 있었다. 2017년 제자를 성추행한 의혹을 받다가 경찰에서 무혐의 처분을 받은 부안의 한 교사는 자택에서 극단적 선택을 했는데, 유족이 인사혁신처장을 상대로 순직 유족 급여를 지급하라고 소송했고 2020년 법원은 승소 판결을 냈다. 한 초등학교 교사도 2017년 담임을 맡던 학생과의 갈등 여파로 극단적 선택을 했는데, 유족이 법정 다툼 끝에 2019년에 순직을 인정받았다. 다만 2014년 세월호 참사의 부담감으로 극단적 선택을 한 단원고 교감의 경우 순직으로 볼 수 없다는 대법원 판결이 2016년 나오기도 했다. 서이초 교사의 경우 아직 경찰 수사가 진행 중인데, 경찰은 이 교사에게 '갑질'했다는 의혹을 받은 학부모들에 대해 아직 범죄 혐의를 찾지 못했다고 밝혔다. 반면 유족 측은 극심한 업무 스트레스가 정상적인 인식능력을 현저히 떨어뜨려 자해에 이르게 됐을 때도 순직을 인정받을 수 있으므로 학부모에 대한 범죄 혐의가 순직 인정과는 별개라는 입장이다. 문 변호사는 이날 기자들과 만난 자리에서 ""개인적인 사정이 있다면 굳이 출근 장소인 교실을 (사망 장소로) 택하지 않았을 것""이라며 ""자살하기 전에 무엇 때문에 자살한다는 문서가 없으면 순직으로 인정되지 않는다는 말인가""라고 되물었다. 서울시교육청 관계자는 ""신림동과 서이초 교사의 경우 순직으로 인정받을 수 있게 최대한 노력하겠다. 입증 자료를 준비할 것이 있으면 최대한 돕겠다""고 말했다. ","{'쏠쏠정보': 2, '흥미진진': '0', '공감백배': 21, '분석탁월': '0', '후속강추': 13}"
2023-08-31 16:04:00,세계,"혹독한 8월 끝?…中증시 투자자, '9월 랠리' 기대 속 매수 타진","최근 바닥 찍고 반등 조짐…주가 저평가 판단에 부양책 기대감 8월 아시아 증시 6개월 만에 '최악의 한달' 기록   중국 증시가 부동산 위기와 경기 침체 우려 속에 '혹독한 8월'을 보낸 가운데 일부 중국 투자자들은 9월 강세장 도래에 기대를 걸고 있는 것으로 분석됐다. 중국 주식 가치가 저평가됐다는 판단과 함께 당국의 추가 부양책에 대한 기대감으로 인해 매수 타진 분위기가 형성되는 조짐이다. 31일 블룸버그통신에 따르면 중국 상하이·선전증시 시가총액 상위 300개 종목으로 구성된 CSI300지수는 이달 들어 31일까지 5.8% 빠졌다. 홍콩 항셍지수의 이달 하락 폭도 8%에 달한다. 하지만 이런 하락 추세는 지난 며칠 동안 상당히 완화된 상태다. CSI300지수와 항셍지수는 지난주 초에는 각각 월초 대비 7.5%, 11.9%까지 하락하기도 했다. 이들 중화권 증시는 지난 27일 중국 당국의 주식거래 인지세 인하 발표 후 탄력을 받고 있다. 중국 국내 투자자들은 지난 21일부터 8일 연속으로 홍콩에 상장된 주식을 순매수한 상태다. 당국은 또 기업공개(IPO) 속도 완화, 대형 뮤추얼 펀드사에 대한 자산 매각 제한 지시 등 여러 경기 부양책을 내놨다. 판궁성 인민은행 총재는 전날 부동산 개발업체, 제조업체 등 기업과 은행 대표들을 만나 중소기업 등 민간 기업에 더 많은 자금을 직접 지원하겠다고 약속하기도 했다. 선전 선라이즈 자산관리의 왕단 최고투자책임자는 ""8월의 경우 펀더멘털과는 완전하게 동떨어진 비관 심리로 인해 엄청난 과매도가 발생했다""며 ""최근 발표된 여러 조치로 인해 주가는 내달부터 4분기(10∼12월)까지 상승할 것으로 예상된다""고 말했다. 전문가들은 특히 CSI300지수의 올해 지표가 다른 아시아 증시보다 6%포인트(p) 이상 저조하다며 중국 주식의 가치가 저렴해졌다는 점에 주목하고 있다. 또 폭발적으로 이어지던 외국인 자금 유출도 이번 주 들어 둔화하는 것으로 알려졌다. 이달 들어 중국에 초점을 맞춘 상장지수펀드(ETF)에 대한 매수세도 이어지는 상황이다. 한편, 8월 아시아 전체 증시는 6개월 만에 최악의 한 달이 될 것이라는 평가가 나온다. 블룸버그통신에 따르면 아시아 대형주로 구성된 모건스탠리캐피털인터내셔널(MSCI) APEX50 지수의 경우 이달 들어 7.2% 하락, 지난 2월(-9.71%) 이후 가장 크게 떨어졌다. 일본 닛케이225 지수와 한국 코스피 지수의 이번 달 하락 폭도 각각 2.6%, 3.4%에 달한다. ","{'쏠쏠정보': 1, '흥미진진': '0', '공감백배': '0', '분석탁월': '0', '후속강추': '0'}"
2023-08-31 16:04:00,생활,뚝섬공원에 전시된 다양한 조각들,"  31일 서울 광진구 뚝섬 한강공원 음악분수광장에서 열린 2023 한강조각 프로젝트 '한강을 걷다'에서 작품들이 전시돼 있다. '2023 한강조각 프로젝트'는 크라운해태제과와 K-스컬프처 조직위원회, 서울시가 함께 K-조각의 우수성을 알리기 위한 프로젝트로 다음 달 1일부터 10월 15일까지 초대형 작품 100여점을 전시한다.  ","{'쏠쏠정보': '0', '흥미진진': '0', '공감백배': '0', '분석탁월': '0', '후속강추': '0'}"
2023-08-31 16:04:00,경제,"[게시판] 롯데바이오로직스, ESG경영 선포식 개최", 롯데바이오로직스는 서울 잠실 롯데월드타워에서 'ESG(환경·사회·지배구조)경영 선포식'을 열었다고 31일 밝혔다. 선포식에서 회사는 2027년까지 주요 사업장의 환경 및 안전보건 경영시스템 인증을 확보하고 탈탄소 계획을 마련하겠다는 내용의 연도별 전략을 발표했다. 이에 따라 국내에 짓기로 한 메가 플랜트의 설립 단계부터 향후 발생할 수 있는 온실가스에 대한 저감 계획을 세울 예정이다. ,"{'쏠쏠정보': '0', '흥미진진': '0', '공감백배': 2, '분석탁월': '0', '후속강추': '0'}"
2023-08-31 16:04:00,사회,"[르포] ""니하오!"" 2359일 끊긴 중국 크루즈 관광 재개 신호탄 쐈다","중국 첫 관광객 ""모두 해외여행 가고 싶어해…쇼핑, 먹방 투어 욕구 상당"" 선사 측 ""제주는 모든 연령대가 좋아하는 곳, 계속해서 입항 추가할 것""   ""니하오∼ 환잉!"" 31일 오후 제주시 건입동 제주항 국제여객선터미널. 중국발 크루즈선 블루드림스타호(2만5천t급)에서 내린 크루즈 관광객 669명이 입국 절차를 마무리하고 쏟아져 나오자 '안녕하세요. 환영합니다!'를 의미하는 중국말이 곳곳에서 터져 나왔다. 지난 2017년 3월 16일 사드(THADD·고고도미사일방어체계) 사태로 중국발 마지막 크루즈인 코스타 아틀란티카호(8만5천t급)가 제주항을 떠난 뒤 2천359일 만이다. 비교적 작은 규모의 크루즈지만, 블루드림스타호의 입항은 그 의미가 크다. 6년 5개월가량 끊긴 중국 크루즈 관광 재개의 신호탄을 쏜 것이나 마찬가지기 때문이다. 제주도와 제주도관광공사, 제주도관광협회 등은 오랜만에 제주를 찾은 중국 크루즈 관광객을 대상으로 환영 행사를 열었다. 환영 현수막을 내걸고, 한복을 입은 도우미들이 꽃다발과 환영 기념품 등을 전달하며 환영 분위기를 한껏 북돋웠다. 이날 가장 먼저 제주에 들어온 중국인 관광객 마자쥔(40·상하이)씨는 ""6년 반 만에 처음으로 크루즈를 타고 제주를 방문하게 돼 기쁘고 영광스럽게 생각한다""며 ""한참 전에 제주에 왔었는데 그동안 새롭게 바뀐 이색 카페라든지 인플루언서들이 많이 다니는 맛집 투어 등 여러 가지 체험을 기대한다""고 말했다. 이어 ""중국의 많은 사람이 해외여행을 하고 싶어 한다. (제가 사는) 상하이 지역은 제주와 가깝고 크루즈, 항공편이 많기 때문에 (제주에) 많은 관심을 가지고 있다""며 ""면세점 쇼핑, 먹방 투어 이런 욕구가 상당하다""고 강조했다. 가족과 함께 처음으로 제주를 찾은 나나(상하이·36)씨는 제주의 문화와 한류에 대한 깊은 관심을 드러내기도 했다. 나나씨는 ""풍물패부터 시작해 저희를 진심으로 환대해주셔서 정말 기쁘다. 인터넷으로 제주 해녀 스토리를 많이 봤는데 이번에 해녀와 관련한 부분을 체험해보고 싶다""고 말했다. 그는 ""평상시 한국 드라마나 K팝 등의 영향을 많이 받아서 원래 한국을 꼭 와보고 싶었다. 이번에 크루즈 관광이 재개돼 제주를 찾게 됐다""고 설명했다. 블루드림스타호의 선사 샹위청 드림스타크루즈 부사장은 ""제주도는 모든 연령대에 맞는 다양한 테마를 가지고 있고, 모두가 좋아하는 관광지이기 때문에 여행 상품이 정말 많다. 앞으로 계속해서 입항을 추가할 예정""이라고 말했다. 이번 중국발 크루즈 관광 행사를 맡은 뉴화청국제여행사의 우영매 대표는 ""6년 5개월 만에 우리나라를 처음 찾는 크루즈 손님을 도맡아 관광 행사를 진행하게 돼 매우 기쁘다""며 ""앞으로 더 큰 규모 있는 크루즈들이 들어올 계획인 만큼 방문객들이 체류시간 내 충분히 지역 먹거리나 쇼핑 등을 즐기며 씀씀이를 키울 수 있도록 다양한 기항지 맞춤 프로그램을 준비하는 데 노력하겠다""고 밝혔다. 이날 중국 관광객들은 10여대의 대형버스에 나눠 타고 제주 관광을 시작했다. 이날 비가 내릴 것이란 기상청의 예보와 달리 잠시 날씨가 개면서 푸른 하늘과 제주바다가 중국 관광객들을 반갑게 맞았다. 제주 대표 관광코스인 용두암과 도두무지개해안도로에서 중국인들은 포즈를 취하며 사진을 찍고 아름다운 제주의 자연을 만끽했다. 이들은 8시간가량 쇼핑과 관광을 마무리한 뒤 오후 10시께 제주항을 통해 일본 나가사키로 이동한다. 중국발 크루즈선은 이날 이후에도 계속해서 제주를 찾는다. 31일 블루드림스타호를 시작으로 드림호(7만7천t급), 메디테라니아호(8만5천t급) 등 '중국발 크루즈선'은 앞으로 12월까지 47차례 제주항과 서귀포 강정항에 기항할 예정이다. 올 한해 중국과 일본 등 16개 선사의 크루즈 18척이 82차례(제주항 59차례, 강정항 23차례)에 걸쳐 선석 배정을 신청했다. 이 중 현재까지 크루즈선이 28차례 기항하면서 4만7천여명의 관광객이 제주를 찾았으며, 앞으로 중국발 등 모두 54차례 기항을 통해 관광객 6만여명이 더 올 것으로 예상하고 있다. 특히 내년도 제주항과 강정항에 입항 의사를 신청한 크루즈선은 현재 334여 건이 넘는 것으로 집계됐다. 이 중 약 80％가 중국발 크루즈선이며, 이를 통해 약 90만명의 관광객이 제주를 찾을 예정이다. ","{'쏠쏠정보': 2, '흥미진진': 1, '공감백배': 2, '분석탁월': '0', '후속강추': 1}"
2023-08-31 16:05:00,생활,한강조각 프로젝트 '한강을 걷다',"  31일 서울 광진구 뚝섬 한강공원 음악분수광장에서 열린 2023 한강조각 프로젝트 '한강을 걷다'에서 작품들이 전시돼 있다. '2023 한강조각 프로젝트'는 크라운해태제과와 K-스컬프처 조직위원회, 서울시가 함께 K-조각의 우수성을 알리기 위한 프로젝트로 다음 달 1일부터 10월 15일까지 초대형 작품 100여점을 전시한다.  ","{'쏠쏠정보': '0', '흥미진진': '0', '공감백배': '0', '분석탁월': '0', '후속강추': '0'}"
2023-08-31 16:06:00,생활,한강조각 프로젝트 '한강을 걷다',"  31일 서울 광진구 뚝섬 한강공원 음악분수광장에서 열린 2023 한강조각 프로젝트 '한강을 걷다'에서 작품들이 전시돼 있다. '2023 한강조각 프로젝트'는 크라운해태제과와 K-스컬프처 조직위원회, 서울시가 함께 K-조각의 우수성을 알리기 위한 프로젝트로 다음 달 1일부터 10월 15일까지 초대형 작품 100여점을 전시한다.  ","{'쏠쏠정보': '0', '흥미진진': '0', '공감백배': '0', '분석탁월': '0', '후속강추': '0'}"
2023-08-31 16:06:00,생활,뚝섬한강공원에서 열린 한강조각 프로젝트,"  31일 서울 광진구 뚝섬 한강공원 음악분수광장에서 열린 2023 한강조각 프로젝트 '한강을 걷다'에서 작품들이 전시돼 있다. '2023 한강조각 프로젝트'는 크라운해태제과와 K-스컬프처 조직위원회, 서울시가 함께 K-조각의 우수성을 알리기 위한 프로젝트로 다음 달 1일부터 10월 15일까지 초대형 작품 100여점을 전시한다.  ","{'쏠쏠정보': '0', '흥미진진': '0', '공감백배': '0', '분석탁월': '0', '후속강추': '0'}"
2023-08-31 16:06:00,정치,"한미일 북핵대표, 북한 '심야 탄도미사일' 발사에 전화 협의","""강력 규탄…주요 기념일 등 계기 추가 도발 가능성도 예의주시""   한미일 3국의 북핵 수석대표가 지난 30일 북한의 심야 단거리 탄도미사일 기습 발사에 대응해 전화 협의를 했다고 외교부가 밝혔다. 임수석 외교부 대변인은 31일 정례브리핑에서 ""북한의 탄도미사일 도발 직후 김건 한반도평화교섭본부장은 성 김 미국 대북특별대표, 나마즈 히로유키 일본 북핵 수석대표와 유선 협의를 가진 바 있다""고 전했다. 3국 수석대표는 북한이 지난주 소위 '우주 발사체' 재발사에 실패하고서 또다시 탄도미사일 발사를 감행하며 역내 평화와 안정을 저해하고 있는 것을 강력히 규탄하고, 도발 즉각 중단을 촉구했다. 3국 수석대표는 북한이 향후 주요 기념일 등을 기회로 추가 도발할 가능성도 예의주시하기로 했다. 다음 달 9일 북한 정권수립일 등을 염두에 둔 것으로 보인다. 아울러 한미일 캠프 데이비드 정상회의 이후 더욱 긴밀해진 3국 공조를 바탕으로 어떤 도발도 국제사회와 함께 단호히 대응해 나가겠다고 밝혔다. 북한은 전날 오후 11시 40분부터 10분간 순안 일대에서 동해상으로 단거리 탄도미사일 2발을 발사했으며, 이후 '인민군 총참모부 보도'를 통해 미국의 전략폭격기 B-1B가 한반도에 전개된 데 대응한 전술핵타격훈련이었다고 주장했다. 아울러 북한은 한미 연합 '을지 자유의 방패'(UFS) 연습에 대응해 남한 점령을 목표로 한 전군지휘훈련을 지난 29일부터 실시하고 있다고 공개했다. 이에 대해 임 대변인은 ""한미연합훈련은 북한의 고도화된 핵미사일 공격 위협에 대응해 우리 국민을 보호하기 위한 정당한 방어적 훈련""이라며 ""북한의 위협과 도발을 통한 의도적인 긴장 조성 행위를 즉각 중단할 것을 촉구한다""고 밝혔다. ","{'쏠쏠정보': '0', '흥미진진': '0', '공감백배': 1, '분석탁월': '0', '후속강추': '0'}"
2023-08-31 16:08:00,사회,"농촌진흥청 ""못난이 사과 맛, 일반 사과와 똑같아요""","홍로 200개 대상, 기울기 따른 당도·산도·당산비 조사   ""못났지만, 맛은 좋아요."" 농촌진흥청은 이른바 '못난이 사과'로 불리는 비정형 사과와 일반 정형 사과 사이 맛 차이가 없다는 사실을 연구로 증명했다고 31일 밝혔다. 농진청은 1988년 개발한 추석용 국산 사과 '홍로' 200개를 대상으로 기울기 정도에 따른 품질을 비교·분석했다. 먼저 홍로의 기울기는 0∼15도로 다양했다. 0∼5도로 기울어진 사과 비율은 76.4%, 6도 이상 심하게 기울어진 사과 비율은 23.5%였다. 기울기에 따라 0∼1도는 당도 13.6브릭스(±1.7), 2∼3도는 12.7브릭스(±0.6), 11∼14도는 13.7브릭스(±0.9), 15도 이상은 13.8브릭스(±0.6)로 유의미한 차이가 없었다. 신맛을 나타내는 산도, 당도와 산도의 비율을 뜻하는 당산비도 마찬가지라고 농진청은 전했다. 이러한 연구 결과를 종합하면 정형 사과와 비정형 사과는 모양의 차이가 있지만 맛과 품질이 유사하다는 것이다. 홍윤표 농촌진흥청 국립원예특작과학원 저장유통과장은 ""이번 추석에 홍로를 구입할 때 비뚤배뚤한 사과와 예쁜 사과의 맛을 비교해보면 흥미로울 것""이라며 ""소비자의 인식이 바뀌어 비정형 과일류에 대한 소비가 늘어나길 기대한다""고 말했다. ","{'쏠쏠정보': 1, '흥미진진': '0', '공감백배': '0', '분석탁월': '0', '후속강추': '0'}"
2023-08-31 16:08:00,경제,코스닥지수 상승 마감,"  31일 오후 서울 중구 하나은행 본점 딜링룸에서 딜러들이 업무를 보고 있다. 이날 코스피는 전 거래일보다 4.95p(0.19%) 내린 2,556.27로 마감했다. 원/달러 환율은 1.6원 내린 1,321.8원, 코스닥지수는 4.59p(0.50%) 오른 928.40으로 장을 마쳤다.  ","{'쏠쏠정보': '0', '흥미진진': '0', '공감백배': '0', '분석탁월': '0', '후속강추': '0'}"
2023-08-31 16:08:00,경제,"코스피·원/달러 환율 하락, 코스닥지수 상승 마감","  31일 오후 서울 중구 하나은행 본점 딜링룸에서 딜러들이 업무를 보고 있다. 이날 코스피는 전 거래일보다 4.95p(0.19%) 내린 2,556.27로 마감했다. 원/달러 환율은 1.6원 내린 1,321.8원, 코스닥지수는 4.59p(0.50%) 오른 928.40으로 장을 마쳤다.  ","{'쏠쏠정보': '0', '흥미진진': '0', '공감백배': '0', '분석탁월': '0', '후속강추': '0'}"
2023-08-31 16:08:00,경제,"""쇼핑몰 사장됐어요""…여중생들이 '광양 감성' 문구 제작","  전남 광양의 여중생들이 고향 감성을 담은 문구를 제작, 판매하는 쇼핑몰 사장님이 됐다. 31일 전남도교육청에 따르면 광양여중 2학년 학생 6명으로 구성된 창업동아리 B.C.L이 최근 네이버 스마트스토어 입점에 성공했다. 스토어에는 광양 서천 스프링 줄 노트, 광양 절경을 담은 떡 메모지, 매실매화 요정 스티커 등 지역의 명소와 특산물을 소개하는 6종의 '광양굿즈문구세트'를 선보였다. 학생들은 광양 매실과 다양한 동물 캐릭터들을 직접 디자인했고 명소 사진은 작가에게 저작권 사용 허락을 받아 상품으로 개발했다. 이들은 창업을 위한 상품 디자인 개발·포장·상표등록과 수익 관련 세금 문제까지 전 과정을 공부하며 이번 '광양굿즈문구세트'를 기획했다. 지난 5월 결성한 B.C.L은 개의 품종 가운데 하나인 '보더콜리'(Border Colie)에서 따왔다. 다른 개와 달리 지능이 높은 개로 알려진 품종이다. B.C.L은 전남교육청의 '청소년미래도전프로젝트'에 선정된 데 이어 쇼핑몰도 창업했다. 이지해 B.C.L 회장은 ""친구들과 머리를 맞대고 기획한 상품이 실제 온라인 시장에서 판매가 되니 가슴 뿌듯하다""며 ""내 고향 광양의 이미지를 담은 우리의 상품이 많이 팔려, 지역도 알리고 기부도 하는 착한 브랜드로 키우고 싶다""고 말했다. ","{'쏠쏠정보': 2, '흥미진진': 1, '공감백배': 14, '분석탁월': '0', '후속강추': '0'}"
2023-08-31 16:08:00,스포츠,제37회 전국시도대항장사씨름대회," 31일 경상남도 창녕군 창녕국민체육센터에서 열린 '제37회 전국시도대항장사씨름대회' 고등부 단체전에서 우승한 경남정보고(경상남도) 선수들과 김진영감독(오른쪽 첫 번째), 박삼윤부장(왼쪽 첫 번째)이 기념 촬영하고 있다.   ","{'좋아요': '0', '슬퍼요': '0', '화나요': '0', '팬이에요': '0', '후속기사 원해요': '0'}"
2023-08-31 16:08:00,스포츠,제37회 전국시도대항장사씨름대회, 31일 경상남도 창녕군 창녕국민체육센터에서 열린 '제37회 전국시도대항장사씨름대회' 고등부 단체전에서 우승한 경남정보고(경상남도) 김진영 감독(오른쪽)이 설창현 대한씨름협회 부회장에게 우수지도자상을 받고 기념 촬영하고 있다.   ,"{'좋아요': '0', '슬퍼요': '0', '화나요': '0', '팬이에요': '0', '후속기사 원해요': '0'}"
2023-08-31 16:09:00,생활,용두암 찾은 중국 단체관광객, 중국 단체관광객을 태운 크루즈 상하이 블루드림스타호(2만4천782t)가 31일 오후 제주항에 입항했다. 중국 단체관광객들이 제주시 용두암을 찾아 경치를 즐기고 있다.  [제주도사진기자회] ,"{'쏠쏠정보': '0', '흥미진진': '0', '공감백배': '0', '분석탁월': '0', '후속강추': '0'}"
